"video_id","min_timecode","max_timecode","text.user","text.auto"
"f8BLlSvqrVc","00:00:00","00:00:01","- Okay, we're in Detroit.","okay we're in detroit and we're"
"f8BLlSvqrVc","00:00:01","00:00:02","- And we're doing carrots.","doing carrots"
"f8BLlSvqrVc","00:00:03","00:00:04","- This was Adam's idea.","this was adam's idea"
"f8BLlSvqrVc","00:00:05","00:00:06","(xylophone music)","[Music]"
"f8BLlSvqrVc","00:00:14","00:00:15","♪ Worth it ♪","carrots"
"f8BLlSvqrVc","00:00:16","00:00:16","- So we filmed most of this episode","we filmed most of this"
"f8BLlSvqrVc","00:00:17","00:00:19","at the beginning of this year but we had to pause production","episode at the beginning of this year but we had to pause production because of cover"
"f8BLlSvqrVc","00:00:19","00:00:20","because of COVID-19.","19."
"f8BLlSvqrVc","00:00:21","00:00:21","- So we weren't able to finish","so we weren't able to finish"
"f8BLlSvqrVc","00:00:22","00:00:23","the episode like we normally do,","the episode like we normally do"
"f8BLlSvqrVc","00:00:24","00:00:25","so you'll notice some scenes are","so you'll notice some scenes are filmed here"
"f8BLlSvqrVc","00:00:25","00:00:26","filmed here in the Highlander,","in the highlander"
"f8BLlSvqrVc","00:00:27","00:00:28","while we're still practicing social distancing.","while we're still practicing social distancing"
"f8BLlSvqrVc","00:00:29","00:00:30","- Today on Worth It, we're gonna be trying","today on worth it we're going to be trying"
"f8BLlSvqrVc","00:00:30","00:00:31","three different carrot dishes","three different"
"f8BLlSvqrVc","00:00:32","00:00:34","at three drastically different price points,","carrot dishes at three drastically different price"
"f8BLlSvqrVc","00:00:34","00:00:37","to find out which one is the most worth it at its price.","points to find out which one is the most worth it at its price"
"f8BLlSvqrVc","00:00:37","00:00:40","Adam found a very delectable","adam found a very delectable"
"f8BLlSvqrVc","00:00:41","00:00:44","carrot steak that happens to exist in Detroit.","carrot steak that happens to exist in detroit yeah a very"
"f8BLlSvqrVc","00:00:44","00:00:47","- Yeah a very exciting carrot dish at that last location","exciting carrot dish at that last location"
"f8BLlSvqrVc","00:00:48","00:00:50","and we're not just eating three carrots, it's going to be","and we're not just eating three carrots it's going to be"
"f8BLlSvqrVc","00:00:51","00:00:54","three dishes where carrot is the primary component.","three dishes where carrot is the primary component andrew"
"f8BLlSvqrVc","00:00:55","00:00:56","- Andrew, the whole internet knows","the whole internet knows about"
"f8BLlSvqrVc","00:00:57","00:00:57","about your love for carrot cakes.","your love for"
"f8BLlSvqrVc","00:00:58","00:01:00","It's your birthday cake, whatever you wanna call it.","carrot cakes it's your birthday cake whatever you"
"f8BLlSvqrVc","00:01:01","00:01:01","- Whatever you wanna call it?","want to call it whatever you"
"f8BLlSvqrVc","00:01:02","00:01:04","The cake I eat on my birthday is a birthday cake,","want to call it every day you know my birthday is a birthday"
"f8BLlSvqrVc","00:01:05","00:01:08","that's the only thing you ever call that.","cake that's the only thing you ever call tell me about that cake"
"f8BLlSvqrVc","00:01:09","00:01:10","- Yeah I love carrot cake, I've had it","yeah i love carrot cake i've had"
"f8BLlSvqrVc","00:01:11","00:01:12","every birthday my whole life","it every birthday my whole life and"
"f8BLlSvqrVc","00:01:13","00:01:13","and so the first place we're going to,","so the first place we're going to"
"f8BLlSvqrVc","00:01:14","00:01:15","we're going to have carrot cake.","we're going to have carrot cake"
"f8BLlSvqrVc","00:01:16","00:01:18","We're going to a place called Good Cakes and Bakes.","we're going to a place called good cakes and bakes"
"f8BLlSvqrVc","00:01:19","00:01:20","We're gonna see April, the chef and owner.","we're going to see april the chef and owner"
"f8BLlSvqrVc","00:01:21","00:01:24","- Yeah and we're gonna get one of those nice slices.","yeah we're going to get one of those nice"
"f8BLlSvqrVc","00:01:24","00:01:26","(upbeat music)","slices"
"f8BLlSvqrVc","00:01:27","00:01:28","","good cakes"
"f8BLlSvqrVc","00:01:28","00:01:30","- Good Cakes and Bakes is an organic bakery","and bakes is an organic bakery where everything"
"f8BLlSvqrVc","00:01:30","00:01:32","where everything is made in house from scratch","is made in-house from scratch and we"
"f8BLlSvqrVc","00:01:33","00:01:34","and we do vegan but our baked goods are","do vegan but our bakers are"
"f8BLlSvqrVc","00:01:35","00:01:36","mainly like, Southern-type baked goods.","mainly like southern type baked goods"
"f8BLlSvqrVc","00:01:37","00:01:40","Since 2012, eight years ago, people felt like Detroit was","since 2012 eight years ago people felt like detroit was a food"
"f8BLlSvqrVc","00:01:40","00:01:42","a food desert and now there isn't","desert and now there"
"f8BLlSvqrVc","00:01:43","00:01:44","too much that you can't find.","isn't too much of that you can't find"
"f8BLlSvqrVc","00:01:45","00:01:46","We're situated inside of five neighborhoods:","we're situated inside of five neighborhoods bagley"
"f8BLlSvqrVc","00:01:46","00:01:48","Bagley, Sherwood Forest, Green Acres,","sherwood forest green acres"
"f8BLlSvqrVc","00:01:49","00:01:50","University District and Palmer Woods.","university district and palmer woods"
"f8BLlSvqrVc","00:01:51","00:01:52","Sherwood Forest, that is where Marvin Gaye lived,","sherwood forest that is where marvin gaye"
"f8BLlSvqrVc","00:01:53","00:01:54","Diana Ross lived there, Barry Gordon,","lived diana ross lived there barry"
"f8BLlSvqrVc","00:01:55","00:01:56","all of the Motown stars","gordon all of the motown stars"
"f8BLlSvqrVc","00:01:57","00:01:58","but now, in this two and a half mile radius,","but now in this two and a half mile"
"f8BLlSvqrVc","00:01:59","00:02:01","it is the largest Black-owned building, owners,","radius it is the largest black owned building"
"f8BLlSvqrVc","00:02:02","00:02:05","as well as businesses in the United States right now.","owners as well as businesses as well as businesses in the united states right now so i've been"
"f8BLlSvqrVc","00:02:05","00:02:07","So I've been baking since I was nine years old","baking since i was nine years old"
"f8BLlSvqrVc","00:02:08","00:02:09","but I have an MBA in Corporate Accounting,","but i have an mba in corporate accounting and i worked in"
"f8BLlSvqrVc","00:02:09","00:02:11","I worked in Accounting for 17 years.","accounting for 17 years and"
"f8BLlSvqrVc","00:02:12","00:02:14","One day in 2009, I decided to go back to school","then in 2009 i decided to go back to school to get"
"f8BLlSvqrVc","00:02:14","00:02:15","to get a degree in Pastry Arts.","a degree at pastry arts"
"f8BLlSvqrVc","00:02:16","00:02:18","Brianne, one of our assistants, is going to walk you through","brienne one of our assistants is going to walk you through"
"f8BLlSvqrVc","00:02:19","00:02:20","and show you how we make our carrot cake.","and show you make our carrot"
"f8BLlSvqrVc","00:02:21","00:02:23","Our carrot cake is the best carrot cake you will ever taste,","cake our carrot cake is the best carrot cake you ever taste i"
"f8BLlSvqrVc","00:02:24","00:02:24","I promise you.","promise you really so"
"f8BLlSvqrVc","00:02:24","00:02:25","- Really?","what makes"
"f8BLlSvqrVc","00:02:26","00:02:27","- So what makes our carrot cake so unique?","our carrot cake so unique it"
"f8BLlSvqrVc","00:02:27","00:02:29","It is the different flavors, you will taste orange,","is the different flavors you'll taste orange you'll taste"
"f8BLlSvqrVc","00:02:30","00:02:31","you will taste lemon, you'll taste vanilla,","lemon you'll taste vanilla you'll have"
"f8BLlSvqrVc","00:02:32","00:02:33","you'll have the sweetness of the carrots","the sweetness of the carrots but what"
"f8BLlSvqrVc","00:02:33","00:02:35","but what helps give us the sweetness of it is","helps give us the sweetness of it is how"
"f8BLlSvqrVc","00:02:36","00:02:39","how we allow the raisins to soak in hot water,","we allow the raisins to soak in hot water"
"f8BLlSvqrVc","00:02:39","00:02:42","so by doing that, you don't have to add as much sugar to it.","so by doing that you don't have to add as much sugar to it"
"f8BLlSvqrVc","00:02:42","00:02:45","By adding the flour in last and creaming the oil","by adding the flour in glass and creaming the"
"f8BLlSvqrVc","00:02:45","00:02:49","and the sugar, that's how you get fluffier, tighter crumb","oil and the sugar that's how you get fluffier tighter crumb opposed"
"f8BLlSvqrVc","00:02:50","00:02:51","opposed to a dense cake and then it's topped off","to a dense cake and then it's topped"
"f8BLlSvqrVc","00:02:52","00:02:54","with a sweet and tart cream cheese icing.","off with a sweet and tart cream cheese"
"f8BLlSvqrVc","00:02:55","00:02:57","- I guess I should warn you that I've actually had","icing i guess i should warn you that i've actually had"
"f8BLlSvqrVc","00:02:57","00:03:00","carrot cake every birthday for pretty much my whole life.","carrot cake every birthday for pretty much"
"f8BLlSvqrVc","00:03:01","00:03:02","My mom has always made carrot cake.","my whole life my mom has always made carrot"
"f8BLlSvqrVc","00:03:03","00:03:05","- I can't compete with your mom but I promise you,","cake i can't compete with your mom but i promise you"
"f8BLlSvqrVc","00:03:06","00:03:08","this'll be the second best carrot cake you ever had,","this would be the second best carrot cake you've ever had"
"f8BLlSvqrVc","00:03:08","00:03:09","I promise you.","okay looking forward to"
"f8BLlSvqrVc","00:03:10","00:03:12","(cash register sounds)","it yes okay"
"f8BLlSvqrVc","00:03:12","00:03:14","- Okay before we begin, wanna just give a huge shout out","before we begin i want to just give a huge shout"
"f8BLlSvqrVc","00:03:14","00:03:16","to the Midwest.","out to the midwest"
"f8BLlSvqrVc","00:03:16","00:03:18","Both Adam and me are from Ohio.","both adam and me are from ohio it feels good"
"f8BLlSvqrVc","00:03:19","00:03:19","It feels good to be back.","to be back"
"f8BLlSvqrVc","00:03:20","00:03:20","- Cozy feeling.","cozy feeling cozies"
"f8BLlSvqrVc","00:03:20","00:03:22","- [Steven] Cozies, yes.","yes"
"f8BLlSvqrVc","00:03:22","00:03:23","- Visually beautiful.","visually beautiful"
"f8BLlSvqrVc","00:03:24","00:03:26","It just has that golden hue to it.","you know it just has like that golden hue to"
"f8BLlSvqrVc","00:03:27","00:03:28","- [Steven] Looks very fluffy.","it looks very fluffy it's nice and"
"f8BLlSvqrVc","00:03:29","00:03:29","- Cheers.","firm"
"f8BLlSvqrVc","00:03:30","00:03:32","","cheers oh"
"f8BLlSvqrVc","00:03:33","00:03:33","- It's pretty good.","pretty good the texture is"
"f8BLlSvqrVc","00:03:34","00:03:35","- The texture is very kind, it has","very kind it has"
"f8BLlSvqrVc","00:03:36","00:03:37","the kindness of the Midwest in it.","the kindness of the midwest in it it's"
"f8BLlSvqrVc","00:03:37","00:03:41","It's like soft, forgiving but also a little stern.","like soft forgiving it's like soft forgiving but also you know a little stern forgiving but also you know a little stern"
"f8BLlSvqrVc","00:03:41","00:03:43","- Depending on whose carrot cake it is,","depending on whose carrot cake it is"
"f8BLlSvqrVc","00:03:43","00:03:46","sometimes it can skew a little spice cake.","sometimes it can skew a little spice cake this"
"f8BLlSvqrVc","00:03:46","00:03:47","This one is fruitier.","one is fruitier"
"f8BLlSvqrVc","00:03:47","00:03:51","- It's so bright in flavor, it really lifts my mood up","it's so bright in flavor it really like lifts my mood up when"
"f8BLlSvqrVc","00:03:52","00:03:52","when I eat this.","i eat this"
"f8BLlSvqrVc","00:03:52","00:03:56","- And the cream cheese icing has that tart dairy flavor","and the cream cheese icing has that like tart dairy flavor"
"f8BLlSvqrVc","00:03:56","00:04:00","that strays away from just straightforward sweetness","that strays away from just straightforward sweetness and i"
"f8BLlSvqrVc","00:04:01","00:04:03","and I think is fantastic in cakes.","think is fantastic in cakes how does this compare"
"f8BLlSvqrVc","00:04:03","00:04:04","- How does this compare to your mom's carrot cake?","to your mom's carrot"
"f8BLlSvqrVc","00:04:05","00:04:06","- I think this is a very good carrot cake","cake i think this is a very good carrot cake and if i was"
"f8BLlSvqrVc","00:04:07","00:04:08","and if I was having a craving for carrot cake,","having a craving for carrot cake"
"f8BLlSvqrVc","00:04:09","00:04:10","I would be very happy with this carrot cake.","i would be very happy with this carrot"
"f8BLlSvqrVc","00:04:11","00:04:12","- Are you saying though, that you can't beat","cake are you saying though that you can't beat your"
"f8BLlSvqrVc","00:04:12","00:04:13","your mom's carrot cake?","mom's carrot cake i'm putting the"
"f8BLlSvqrVc","00:04:13","00:04:14","I'm putting you on the spot, Andrew!","spot andrew we got april"
"f8BLlSvqrVc","00:04:15","00:04:16","We've got April right there!","right there"
"f8BLlSvqrVc","00:04:16","00:04:17","- Listening!","listening listen"
"f8BLlSvqrVc","00:04:18","00:04:19","- Listen April, this is an excellent carrot cake.","april this is an excellent carrot cake thank"
"f8BLlSvqrVc","00:04:20","00:04:21","So it's like second to your mom's, right?","you so it's like second to your mom's right"
"f8BLlSvqrVc","00:04:22","00:04:22","- Yeah.","yeah yeah like this"
"f8BLlSvqrVc","00:04:23","00:04:24","- I will say, this is much better than my mom's carrot cake.","i will say this is much better"
"f8BLlSvqrVc","00:04:25","00:04:27","My mom doesn't make carrot cake, so I can say that.","than my mom's carrot cake my mom doesn't make carrot i can say cakes"
"f8BLlSvqrVc","00:04:28","00:04:30","",""
"f8BLlSvqrVc","00:04:30","00:04:31","Carrot quiz time!","quick time adam has"
"f8BLlSvqrVc","00:04:31","00:04:32","Adam has the answer.","the answer how much"
"f8BLlSvqrVc","00:04:33","00:04:36","How much did the world's heaviest carrot weigh?","did the world's heaviest carrot weigh i"
"f8BLlSvqrVc","00:04:36","00:04:37","- I mean carrots are like, a root","mean carrots are like a root"
"f8BLlSvqrVc","00:04:38","00:04:41","and I've seen overgrown roots of trees look pretty massive.","and i've seen overgrown like a root and i've seen overgrown roots of trees look pretty massive so i'm gonna"
"f8BLlSvqrVc","00:04:42","00:04:44","So I'm gonna go with something like, 63 pounds.","go with something like 63 pounds i'm"
"f8BLlSvqrVc","00:04:45","00:04:46","- I'm actually gonna go bigger than that.","actually gonna go bigger than that"
"f8BLlSvqrVc","00:04:47","00:04:50","I'm thinking the size of a regular adult human,","i'm thinking the size of a regular adult"
"f8BLlSvqrVc","00:04:51","00:04:53","so I'm gonna go 135 pounds.","human so i'm gonna go 135 pounds"
"f8BLlSvqrVc","00:04:54","00:04:56","- 22.44 pounds.","22.44 pounds"
"f8BLlSvqrVc","00:04:56","00:04:57","- No!","no i was gonna guess"
"f8BLlSvqrVc","00:04:57","00:04:59","I was gonna guess lower but you threw me","lower but you threw me"
"f8BLlSvqrVc","00:04:59","00:05:00","off the trail, Andrew.","off the trail andrew"
"f8BLlSvqrVc","00:05:01","00:05:03","So when I was born, I came out just under 10 pounds,","so when i was born i came out just under 10 pounds"
"f8BLlSvqrVc","00:05:04","00:05:06","so it's like two of me.","so it's like two of me"
"f8BLlSvqrVc","00:05:07","00:05:08","- That is, yeah, that's a very big carrot.","that is yeah that's a very big carrot"
"f8BLlSvqrVc","00:05:08","00:05:12","Okay, so our next carrot is actually going to be","okay so our next carrot is actually going to be"
"f8BLlSvqrVc","00:05:12","00:05:15","a carrot dog and it's a particular type of dog","a carrot dog and it's a particular type of dog called"
"f8BLlSvqrVc","00:05:15","00:05:16","called a Coney Dog.","a coney"
"f8BLlSvqrVc","00:05:17","00:05:18","So I didn't know this about Detroit","dog so i didn't know this about detroit but coney"
"f8BLlSvqrVc","00:05:18","00:05:22","but Coney Island-style hot dogs are very common here","island style hot dogs are very common here and that's a hot"
"f8BLlSvqrVc","00:05:22","00:05:25","and that's a hot dog with chili, onion and mustard.","dog with chili onion and mustard oh that"
"f8BLlSvqrVc","00:05:25","00:05:26","- Oh, that sounds so good.","sounds so good i'm actually used"
"f8BLlSvqrVc","00:05:26","00:05:28","I'm actually used to them with cheese on top as well.","to them with cheese on top as well"
"f8BLlSvqrVc","00:05:28","00:05:30","I love my Coney Dogs chili cheese style.","i love makoni dog's chili cheese style and so"
"f8BLlSvqrVc","00:05:31","00:05:32","- And so the next place we're going is","the next place we're going is a place called noshpit"
"f8BLlSvqrVc","00:05:32","00:05:33","a place called Nosh Pit,","where"
"f8BLlSvqrVc","00:05:34","00:05:35","where we're gonna see Stefan and Karen","we're going to see stefan and karen and we're going to have"
"f8BLlSvqrVc","00:05:36","00:05:38","their Lady Fantastic Coney Carrot Dog.","their lady fantastic coney carrot dog"
"f8BLlSvqrVc","00:05:39","00:05:41","- Are we gonna say updog there?","are we gonna see up dog there what's up dog"
"f8BLlSvqrVc","00:05:42","00:05:43","","are we gonna see up dog there what's up dog not much"
"f8BLlSvqrVc","00:05:43","00:05:44","- Not much, what's up with you?","what's up with you"
"f8BLlSvqrVc","00:05:45","00:05:47","(upbeat brass music)","[Music]"
"f8BLlSvqrVc","00:05:48","00:05:49","","we"
"f8BLlSvqrVc","00:05:50","00:05:51","- We started out as a food truck doing","started out as a food truck doing"
"f8BLlSvqrVc","00:05:52","00:05:53","vegetarian-vegan soups and sandwiches.","vegetarian vegan soups and sandwiches"
"f8BLlSvqrVc","00:05:54","00:05:57","Here at the restaurant, we are all vegan, all the time,","here at the restaurant we are all vegan all the time"
"f8BLlSvqrVc","00:05:58","00:06:00","so we're trying to do vegan food that is","so we're trying to do vegan food"
"f8BLlSvqrVc","00:06:01","00:06:04","more vegetable based, rather than weird starches and stuff.","that is more vegetable based rather than weird starches and stuff"
"f8BLlSvqrVc","00:06:05","00:06:06","- You know, because this is a carrot episode,","you know because this is a carrot episode"
"f8BLlSvqrVc","00:06:07","00:06:10","I wanna check if either of you have a particular love","i want to check if either of you have a particular love or particular"
"f8BLlSvqrVc","00:06:10","00:06:13","or particular feelings for the carrot.","feelings for a particular love or particular feelings for the carrots"
"f8BLlSvqrVc","00:06:17","00:06:19","- I was raised a lot by my grandmother.","i was raised a lot by my grandmother"
"f8BLlSvqrVc","00:06:20","00:06:21","She was raised in the Depression era,","she was raised in the depression"
"f8BLlSvqrVc","00:06:22","00:06:25","where the vegetables that we stuck to were","era where the vegetables that we stuck to were a lot of the root"
"f8BLlSvqrVc","00:06:25","00:06:28","a lot of the root veggies, potatoes, onions, carrots,","veggies potatoes onions carrots the"
"f8BLlSvqrVc","00:06:28","00:06:29","the things that kept.","things that kept i have a"
"f8BLlSvqrVc","00:06:29","00:06:32","I have a particular love for root vegetables","particular love for root vegetables"
"f8BLlSvqrVc","00:06:33","00:06:34","'cause I find them more sustainable.","because i find them more sustainable vegetables because i find them more sustainable"
"f8BLlSvqrVc","00:06:35","00:06:38","- I noticed that Coney Island dogs are a big thing here.","i noticed that coney island dogs are a big thing here do you know"
"f8BLlSvqrVc","00:06:38","00:06:39","Do you know why that is?","why that is greek"
"f8BLlSvqrVc","00:06:40","00:06:43","- Greek folks moved from Greece to New York originally.","folks moved from greece to new york originally"
"f8BLlSvqrVc","00:06:44","00:06:47","They invented slash perfected the Coney Dog,","they invented slash perfected the pony"
"f8BLlSvqrVc","00:06:48","00:06:51","as they left New York into the rest of the US,","dog as they left in new york into the rest of the u.s"
"f8BLlSvqrVc","00:06:52","00:06:52","they brought it with them and I don't know why","they brought it with them and"
"f8BLlSvqrVc","00:06:53","00:06:55","it took root in Detroit.","i don't know why it took root in detroit"
"f8BLlSvqrVc","00:06:56","00:06:56","- It's a real thing here.","coney county restaurants"
"f8BLlSvqrVc","00:06:57","00:06:58","- Coney restaurants are sort of the Detroit version","are sort of the detroit"
"f8BLlSvqrVc","00:06:59","00:06:59","of a diner.","version of a diner"
"f8BLlSvqrVc","00:07:00","00:07:01","(upbeat music)","so we're having"
"f8BLlSvqrVc","00:07:01","00:07:02","- So we're having a carrot dog","a carrot dog but i thought"
"f8BLlSvqrVc","00:07:02","00:07:05","but I thought we should have a true Detroit Coney Dog first.","we should have a true detroit coney dog first"
"f8BLlSvqrVc","00:07:06","00:07:07","We're at Duly's.","right dualies hot"
"f8BLlSvqrVc","00:07:08","00:07:09","Hot dog, chili, onions, mustard.","dog chili onions mustard"
"f8BLlSvqrVc","00:07:10","00:07:10","- Cheers.","cheers"
"f8BLlSvqrVc","00:07:10","00:07:11","- Steven, yeah.","yeah"
"f8BLlSvqrVc","00:07:12","00:07:13","","the way the"
"f8BLlSvqrVc","00:07:13","00:07:16","The way the bun is steamed, it's like a hot dog donut","bun is steamed it's like a hot dog"
"f8BLlSvqrVc","00:07:17","00:07:18","but instead of jelly, it's chili.","donut but instead of jelly it's chili"
"f8BLlSvqrVc","00:07:19","00:07:21","- It is a Sloppy Joe for hot dogs.","it is a sloppy joe for hot dogs whoever thought that"
"f8BLlSvqrVc","00:07:21","00:07:23","- Whoever thought that the best condiment for meat would be","the best condiment for meat would"
"f8BLlSvqrVc","00:07:24","00:07:25","more meat was a genius.","be more meat was a genius"
"f8BLlSvqrVc","00:07:25","00:07:27","So this Coney Dog is two dollars.","this coney dog is two dollars that's"
"f8BLlSvqrVc","00:07:28","00:07:29","- [Steven] That's wonderful, that's home right there.","wonderful that's home right there"
"f8BLlSvqrVc","00:07:30","00:07:30","",""
"f8BLlSvqrVc","00:07:31","00:07:33","- So tell us about your Coney Carrot Dog.","so tell us about your coney carrot dog"
"f8BLlSvqrVc","00:07:34","00:07:36","- So I wanted something that was hot dog-ish.","so i wanted something that was hot dog-ish"
"f8BLlSvqrVc","00:07:36","00:07:37","The shape is obviously the first thing","the shape is obviously the first"
"f8BLlSvqrVc","00:07:37","00:07:38","(laughing)","idea right"
"f8BLlSvqrVc","00:07:39","00:07:42","but then unlike a regular hot dog, it does have","but then unlike a regular hot dog it does have the sort of"
"f8BLlSvqrVc","00:07:42","00:07:43","the sort of underlying sweetness to it","underlying sweetness to"
"f8BLlSvqrVc","00:07:44","00:07:46","but it also has a savory nature.","it but it also has like a savory nature i peel"
"f8BLlSvqrVc","00:07:46","00:07:50","I peel them and then I take a cuber, which is a little tool","them and then i take a cuber which is a little tool that"
"f8BLlSvqrVc","00:07:51","00:07:52","which has a bunch of little blades in it basically.","has a bunch of little blades in it basically it"
"f8BLlSvqrVc","00:07:53","00:07:56","It just puts small holes into the flesh of the carrot,","just puts small holes into the flesh of the carrot"
"f8BLlSvqrVc","00:07:57","00:07:59","so the marinade can penetrate a little better.","so the marinade can penetrate a little better i"
"f8BLlSvqrVc","00:07:59","00:08:01","I make a marinade and then I soak them","make a marinade and then i soak"
"f8BLlSvqrVc","00:08:02","00:08:03","for a minimum of three days.","them for a minimum of three days we do"
"f8BLlSvqrVc","00:08:03","00:08:05","- [Karen] We do a mixture of grilling","a mixture of grilling"
"f8BLlSvqrVc","00:08:06","00:08:07","and steaming at the same time.","and steaming at the same time"
"f8BLlSvqrVc","00:08:08","00:08:10","- It's never going to be hot dog texture,","it's never going to be hot dog texture"
"f8BLlSvqrVc","00:08:11","00:08:13","it will have enough bite to it","it will have enough bite to"
"f8BLlSvqrVc","00:08:14","00:08:16","that it's not mush in your mouth","it that it's not mush in your mouth but yet"
"f8BLlSvqrVc","00:08:17","00:08:17","but yet it will be cooked enough","it will be cooked enough"
"f8BLlSvqrVc","00:08:18","00:08:20","that it's not like eating a raw carrot.","that it's not like eating a raw carrot and it's a"
"f8BLlSvqrVc","00:08:20","00:08:23","- And it's the timing too because we also have the chili.","timing too because we also have the chili it's lentil-based"
"f8BLlSvqrVc","00:08:23","00:08:25","- [Stefan] It's lentil-based, onions, garlic,","onions garlic tomato"
"f8BLlSvqrVc","00:08:26","00:08:27","tomato paste, veg broth.","paste veg broth"
"f8BLlSvqrVc","00:08:28","00:08:29","- [Karen] Nowadays when people come in","nowadays when people come in and they'll"
"f8BLlSvqrVc","00:08:29","00:08:30","and they'll ask for something unique.","ask for"
"f8BLlSvqrVc","00:08:31","00:08:33","You know, we have quite a few unique things","something unique you know we have quite a few unique things but"
"f8BLlSvqrVc","00:08:33","00:08:35","but this is something that's familiar,","this is something that's familiar they know what the flavors"
"f8BLlSvqrVc","00:08:35","00:08:36","they know what the flavors are.","are"
"f8BLlSvqrVc","00:08:36","00:08:38","(cash register sounds)","familiar they know what the flavors are a delightful"
"f8BLlSvqrVc","00:08:38","00:08:40","- [Steven] A delightful carrot dog.","carrot dog so"
"f8BLlSvqrVc","00:08:41","00:08:42","- So from this view, it looks like a hot dog.","from this view it looks like a hot"
"f8BLlSvqrVc","00:08:43","00:08:44","From this view, you get the center of the carrot.","dog from this view you get the center of the carrot"
