"video_id","min_timecode","max_timecode","text.user","text.auto"
"7uybRvy2sj0","00:09:36","00:09:40","you i sure did oh my years five years it was  good though for me as a makeup artist because  ","didn't you i sure did oh my years five years it was good though for me as a makeup artist"
"7uybRvy2sj0","00:09:41","00:09:41","","because you know"
"7uybRvy2sj0","00:09:42","00:09:45","you know i was obviously more used to  working on myself but say 80 of my clients  ","i was obviously more used to working on myself but say 80 of my clients"
"7uybRvy2sj0","00:09:46","00:09:50","were women of color so guess what [ __ ] you are  learning to do makeup on deep skin today uh-huh  ","were women of color so guess what you are learning to do makeup on deep skin today uh-huh"
"7uybRvy2sj0","00:09:51","00:09:51","","is it"
"7uybRvy2sj0","00:09:52","00:09:57","is it even anything happening no no one knows  you look like a pissed off lomas good that was  ","even anything happening no no one knows you look like a pissed off lomas good that was"
"7uybRvy2sj0","00:09:57","00:10:05","the mood he's watching this he loves my videos  what's up what's going on i'm getting into this  ","the mood he's watching this he loves my videos what's up what's going on i'm getting into this bully with an eye"
"7uybRvy2sj0","00:10:05","00:10:09","bully with an eye done okay where am i going  tonight who knows this orange looks fine but  ","done okay where am i going tonight who knows this orange"
"7uybRvy2sj0","00:10:10","00:10:15","also what is the outfit what am i wearing what am  i you're wearing like a black and white tweed yes  ","looks fine but also what is the outfit what am i wearing what am i you're wearing like a black and white tweed yes"
"7uybRvy2sj0","00:10:16","00:10:16","",""
"7uybRvy2sj0","00:10:17","00:10:22","you're watching okay i knew i would have a  chance to do this one day so here it is this  ","you're watching okay i knew i would have a chance to do this one day so here it is"
"7uybRvy2sj0","00:10:23","00:10:29","is my favorite this is this ebony enchantress nude  sugar mama strictly vinyl lip gloss yes this is  ","this is my favorite this is this ebony enchantress nude sugar mama strictly vinyl lip gloss yes"
"7uybRvy2sj0","00:10:30","00:10:35","the this is the ebony enchantress lip you wear it  all the time i wear it all the time is it smash  ","this is the this is the ebony enchantress lip you wear it all the time i wear it all the time is it smash"
"7uybRvy2sj0","00:10:36","00:10:37","","get a"
"7uybRvy2sj0","00:10:37","00:10:40","get a shot i got too excited look at this  woman's lip gloss i got too excited nyx  ","shot i got too excited look at this woman's lip gloss i got too excited"
"7uybRvy2sj0","00:10:41","00:10:45","will you help this woman please look at this  please have a girl out povert if you can help  ","nyx will you help this woman please look at this please have a girl out povert if you can help a"
"7uybRvy2sj0","00:10:46","00:10:48","a girl out just send me a [ __ ] ton of this  what's your favorite part of doing your makeup  ","girl out just send me a ton of this what's your favorite part of doing your"
"7uybRvy2sj0","00:10:49","00:10:49","","makeup"
"7uybRvy2sj0","00:10:50","00:10:55","um my lips i love my lips i have a  really great lips you know and yeah  ","um my lips i love my lips i have a really great lips you know and really great lips you know and yeah"
"7uybRvy2sj0","00:10:56","00:10:56","",""
"7uybRvy2sj0","00:10:57","00:11:00","and so i love doing that and then i also love  putting on a lash like that's really what really  ","and so i love doing that and then i also love putting on a lash like that's really what really"
"7uybRvy2sj0","00:11:00","00:11:01","","what about you"
"7uybRvy2sj0","00:11:01","00:11:06","what about you uh i like doing the foundation  really i probably take the most time of the  ","uh i like doing the foundation really i probably take the most time of"
"7uybRvy2sj0","00:11:07","00:11:11","foundation yo can i dip into these yeah yeah you  mind this is the total betty palette from hip dot  ","the foundation yo can i dip into these yeah yeah you mind this is the total betty palette from hip dot it's not"
"7uybRvy2sj0","00:11:11","00:11:14","it's not even out yet they sent it  really early actually full monet  ","even out yet they sent it really early actually full monet"
"7uybRvy2sj0","00:11:15","00:11:19","she's like a monet oh because yes it's far away  she's okay but up close she's a big old mess  ","she's like a monet oh because yes it's far away she's okay but up close she's a big old mess"
"7uybRvy2sj0","00:11:19","00:11:20","","just"
"7uybRvy2sj0","00:11:20","00:11:25","just like monet oh that's pretty is that the  krabby patty i love right is she fun sometimes  ","like monet oh that's pretty is that the krabby patty i love right is she fun sometimes"
"7uybRvy2sj0","00:11:26","00:11:29","when you watch tv you can tell that you're in the  person we've friends in real life and when you  ","when you watch tv you can tell that you're in the person we've friends in real life and when you"
"7uybRvy2sj0","00:11:29","00:11:33","work in tv you actually get to meet those people  and a lot of times you're right orville i was like  ","work in tv you actually get to meet those people and a lot of times you're right orville"
"7uybRvy2sj0","00:11:34","00:11:39","we would be best friends what is he like trash  oh who else do you want to meet because him for  ","i was like we would be best friends what is he like trash oh who else do you want to meet because him for a"
"7uybRvy2sj0","00:11:39","00:11:45","a long time i saw it me when at the party oh i was  probably drunk when i said i like to drink i was  ","long time i saw it me when at the party oh i was probably drunk when i said i like to drink"
"7uybRvy2sj0","00:11:46","00:11:53","not kidding my favorite part is i don't want to  put you on blast but you got their turn yeah she  ","i was not kidding when i said i like to drink i was not kidding my favorite part is i don't want to put you on blast but you got their turn yeah she arrived"
"7uybRvy2sj0","00:11:54","00:11:58","arrived all right listen when i'm trying to hit it  i'm trying to hit it babe he just is so talented  ","yeah she arrived all right listen when i'm trying to hit it i'm trying to hit it babe he just is so"
"7uybRvy2sj0","00:11:59","00:12:03","and so nice we have a really good connection and  our our song was on the charts this week so babe  ","talented and so nice we have a really good connection and our our song was on the charts this week so babe"
"7uybRvy2sj0","00:12:04","00:12:06","","[Music]"
"7uybRvy2sj0","00:12:07","00:12:10","you're not in the bald head of brigade  anymore i'm not now that i actually have  ","you're not in the bald head of brigade anymore i'm not now that i actually have"
"7uybRvy2sj0","00:12:11","00:12:15","hair to color and like like i'm enjoying this  moment of my life it's fun for me before it  ","hair to color and like like i'm enjoying this moment of my life it's fun for me before"
"7uybRvy2sj0","00:12:16","00:12:18","was like just too much and now you can kind  of see the roots coming through it's really  ","it was like just too much and now you can kind of see the roots coming"
"7uybRvy2sj0","00:12:19","00:12:21","kind of sending me but well you know you  can't win dragons without losing something","through it's really kind of sending me but well you know you can't win dragons without losing something"
"7uybRvy2sj0","00:12:21","00:12:23","","i'm"
"7uybRvy2sj0","00:12:23","00:12:29","i'm obsessed with this mascara skyhigh mascara  from maybelline the lift the build the length the  ","obsessed with this mascara skyham mascara from maybelline the lift the build the length the volume"
"7uybRvy2sj0","00:12:29","00:12:36","volume the separation it's very lit very little  this is so broken look i'm using a broken mirror  ","the separation it's very lit very little this is so broken look i'm using a broken"
"7uybRvy2sj0","00:12:37","00:12:43","my own company wow what kind of men do you like  i i am not a very because i'm not i'm not a very  ","mirror my own company wow what kind of men do you like i i am not a very because i'm not i'm not a"
"7uybRvy2sj0","00:12:44","00:12:44","","very"
"7uybRvy2sj0","00:12:45","00:12:49","contrary to pop relief i'm not a very  like look centric person like why do's  ","contrary to pop relief i'm not a very like look centric person like why do's tend"
"7uybRvy2sj0","00:12:49","00:12:56","tend to steer older oh really i love this glitter  but also i'm the same can i talk about my glitter  ","to steer older oh really i love this glitter but also i'm the same i love this glitter but also i'm the same can i talk about my glitter"
"7uybRvy2sj0","00:12:56","00:12:57","","it's a white"
"7uybRvy2sj0","00:12:57","00:13:00","it's a white glitter from  barry m cosmetics from the uk  ","glitter from barry m cosmetics from the uk"
"7uybRvy2sj0","00:13:01","00:13:07","you can continue okay wow that was aggressive  silencing women i'm silencing women just  ","you can continue okay wow that was aggressive silencing women i'm silencing women just"
"7uybRvy2sj0","00:13:08","00:13:14","can i use this um is that a chemical skin  enhancer fierce thirty nine dollars a jar  ","can i use this um is that a chemical skin enhancer fierce thirty nine dollars a jar"
"7uybRvy2sj0","00:13:15","00:13:18","oh honey or something and i spent it it was 30  something dollars a drawer and i was like you  ","oh honey or something and i spent it it was 30 something dollars a drawer and"
"7uybRvy2sj0","00:13:19","00:13:24","know what i want to try it and there's expensive  i'm going to do a brownie lip because i'm trying  ","i was like you know what i want to try it and was like you know what i want to try it and there's expensive i'm going to do a brownie lip because i'm trying"
"7uybRvy2sj0","00:13:24","00:13:28","to do clueless like 90s energy so i'm going to  do like a brownie lip i keep i always do this  ","to do clueless like 90s energy so i'm going to do like a brownie lip i keep i always do this in these videos"
"7uybRvy2sj0","00:13:28","00:13:32","in these videos i hold up the mirror like this oh  like in your face yeah i've been doing the whole  ","i hold up the this oh like in your face yeah i've been doing the whole mirror"
"7uybRvy2sj0","00:13:32","00:13:35","mirror you did a great job on your susan but i  mean some of these women didn't even have wigs","you did a great job on your susan but i mean some of these women didn't even have"
"7uybRvy2sj0","00:13:36","00:13:41","","wigs i'm"
"7uybRvy2sj0","00:13:41","00:13:45","i'm trying to get you canceled now that  makeup is beautiful thank you really i  ","trying to get you canceled now that makeup is beautiful thank you really"
"7uybRvy2sj0","00:13:46","00:13:49","don't care what people say about you your makeup  is beautiful thank you do people say that it's not  ","i don't care what people say about you your makeup is beautiful thank you do people say that it's not"
"7uybRvy2sj0","00:13:49","00:13:50","","who got"
"7uybRvy2sj0","00:13:50","00:13:52","who got something just in this house oh  ","something just in this house oh [Applause]"
"7uybRvy2sj0","00:13:52","00:13:54","",""
"7uybRvy2sj0","00:13:54","00:13:59","this is a maybelline color sensational matte  lipstick in more buff yes yes so who's your  ","this is a maybelline color sensational matte lipstick in more buff yes yes so who's your favorite"
"7uybRvy2sj0","00:14:00","00:14:03","favorite drag race crane and why is it tricky  at home um it's always been trixie will forever  ","drag race crane and why is it tricky at home um it's always been trixie"
"7uybRvy2sj0","00:14:04","00:14:08","everybody's trixie i'm not used to seeing  myself in dark lips this is a maybelline  ","will forever everybody's it's always been trixie will forever everybody's trixie i'm not used to seeing myself in dark lips this is a maybelline"
"7uybRvy2sj0","00:14:09","00:14:15","in amber i love these uh lifter glosses because  they have a giant did you love a giant applicator","in amber i love these uh lifter glosses because they have a giant did you love a giant applicator"
"7uybRvy2sj0","00:14:15","00:14:17","",""
"7uybRvy2sj0","00:14:18","00:14:22","i love vagina i love a giant applicator too i  know how it is because i also have full lips  ","i love vagina i love a giant applicator too i know how it is because i also have full"
"7uybRvy2sj0","00:14:23","00:14:23","","lips"
"7uybRvy2sj0","00:14:24","00:14:28","oh yeah you see that that's real this  is not overdrawn this is a real lip  ","oh yeah you see that that's real this is not overdrawn this is a real lip"
"7uybRvy2sj0","00:14:29","00:14:34","babe thanks that smell is lovely whatever i know  the maybelline lip glosses they smell so so good  ","babe thanks that smell is lovely whatever i know the maybelline lip glosses they smell so so"
"7uybRvy2sj0","00:14:35","00:14:42","good i love the charlotte tilbury bronzer i want  to try her [ __ ] so bad it's so i want that i","good good i love the charlotte tilbury bronzer i want to try her so bad it's so i want that"
"7uybRvy2sj0","00:14:43","00:14:44","","i"
"7uybRvy2sj0","00:14:45","00:14:50","gorgeous rich rich look how thin it is the problem  is i love charlotte tilbury i love you mm-hmm  ","gorgeous rich rich look how thin it is the problem is i love charlotte tilbury i love you"
"7uybRvy2sj0","00:14:51","00:14:56","you want to talk priced out oh mama that's why i  haven't never gotten it it's that all over face  ","mm-hmm you want to talk priced out oh mama that's why i haven't never gotten it it's that all over face"
"7uybRvy2sj0","00:14:56","00:15:00","powder that i want that you like when you're  done and you put it all everywhere that's the  ","powder that i want that you like when you're done and you put it all everywhere that's the i want"
"7uybRvy2sj0","00:15:00","00:15:04","[ __ ] i want i want to look blurred but she's  she's a coin yeah it's a quintina aguilera oh","i want to look blurred but she's she's a coin yeah it's a quintina aguilera"
"7uybRvy2sj0","00:15:05","00:15:07","","oh"
"7uybRvy2sj0","00:15:08","00:15:13","oh how close are you to done um i'm not rushing  you okay what kind of blush you got i got this  ","oh how close are you to done um i'm not rushing you okay what kind of blush you got i got"
"7uybRvy2sj0","00:15:14","00:15:14","","this"
"7uybRvy2sj0","00:15:15","00:15:19","it's just the orange one but i also have this  one and then i'll get to this i like this blush  ","it's just the orange one but i also have this one and then i'll get to this i like this blush palette"
"7uybRvy2sj0","00:15:20","00:15:25","palette you have really used her um oh baby can i  say i love it oh i love this palette this palette  ","you have really used her um oh baby can i say i love it oh i love this palette this palette is so"
"7uybRvy2sj0","00:15:25","00:15:29","is so beautiful i have it branded with one of  these you can have two okay thank you so much god  ","beautiful i have it branded with one of these you can have two okay thank you so much god"
"7uybRvy2sj0","00:15:30","00:15:34","you really are a sister why are you living like  this because i forget that i have those things  ","you really are a sister why are you living like this because i forget that i have those things i"
"7uybRvy2sj0","00:15:35","00:15:38","i forget i'm still poor in my head when i  remember that i have money i'm like oh okay  ","forget i'm still poor in my head when i remember that i have money i'm like oh okay yeah this"
"7uybRvy2sj0","00:15:39","00:15:42","yeah this is not a read i don't think enough  people know about hank and henry they don't  ","is not a read i don't think enough people know about hank and henry they don't"
"7uybRvy2sj0","00:15:43","00:15:48","beautiful the blushes especially really turn it  turn it they really turn and the highlighters  ","beautiful the blushes especially really turn it turn it they really turn and the highlighters turn it they really turn and the highlighters"
"7uybRvy2sj0","00:15:48","00:15:54","the highlighter oh [ __ ] girl sorry i used her  well too look at it love it it's amazing yeah  ","the highlighter oh girl sorry i used her well too look at it love it it's amazing yeah so"
"7uybRvy2sj0","00:15:55","00:15:59","so good based on the packaging i was just like oh  okay it's just like a plain little and i swatched  ","good based on the packaging i was just like oh okay it's just like a plain little and i swatched one"
"7uybRvy2sj0","00:16:00","00:16:03","one two this highlighter is not a joke no  she wasn't [ __ ] around in the formula booth  ","two this highlighter is not a joke no she wasn't around in the formula booth"
"7uybRvy2sj0","00:16:04","00:16:05","","who"
"7uybRvy2sj0","00:16:05","00:16:10","who do you talk to the most from the girls um  probably mick but i mean like we have all of us we  ","do you talk to the most from the girls who do you talk to the most from the girls um probably mick but i mean like we have all of us we really do"
"7uybRvy2sj0","00:16:11","00:16:14","really do have like a top four chat that we like  talk [ __ ] about talking [ __ ] about all the  ","have like a top four chat that we like talk about talking"
"7uybRvy2sj0","00:16:14","00:16:21","other girls then so i mean it's real we do love  each other truly oh god what did you see yourself  ","about all the other girls then so i mean it's real we do love each other truly oh god what did you"
"7uybRvy2sj0","00:16:22","00:16:22","","see yourself i"
"7uybRvy2sj0","00:16:22","00:16:25","i just chose the last part of the makeup  to ruin it oh we'll talk about it i don't  ","just chose the last part of the makeup to ruin it oh we'll"
"7uybRvy2sj0","00:16:26","00:16:29","want to talk about it i've learned  that talking about your trauma helps  ","talk about it i don't want to talk about it i've learned that talking about your trauma helps"
"7uybRvy2sj0","00:16:29","00:16:30","","i'm going"
"7uybRvy2sj0","00:16:30","00:16:36","i'm going to power this powder down it's gonna be  fine they're not gonna know iconic london luminous  ","to power this powder down it's gonna be fine they're not gonna know iconic london luminous powder"
"7uybRvy2sj0","00:16:36","00:16:40","powder i don't know where i got this i think i had  a morphe story let's just get into it i don't know  ","i don't know where i got this i think i had a morphe story let's just get into it i don't know if i wear"
"7uybRvy2sj0","00:16:40","00:16:43","if i wear highlighter it's on the big stages  and i'm wearing like basically glitter  ","highlighter it's on the big stages and i'm wearing like basically glitter"
"7uybRvy2sj0","00:16:44","00:16:49","do you use this are you this type of girl uh i'm  that type of girl okay good miss natty miss natty  ","do you use this are you this type of girl uh i'm that type of girl okay good miss natty miss natty you know i know about miss"
"7uybRvy2sj0","00:16:49","00:16:51","you know i know about miss snappy and you like  miss natty are you pretty much it's natty rain  ","snappy and you like miss natty are you pretty much it's"
"7uybRvy2sj0","00:16:52","00:16:56","i killed my white clown you're not supposed to  use hair bonding glue on your eyes but we all do  ","natty rain i killed my white clown you're not supposed to use hair bonding glue on your eyes but we all do"
"7uybRvy2sj0","00:16:57","00:17:01","well we all do it and i ain't blind yet so my  lashes sit in my crease so like that's insane to  ","well we all do it and i ain't blind yet so my lashes sit in my crease so like that's"
"7uybRvy2sj0","00:17:02","00:17:08","me what's gonna look do you wanna see i would love  to watch that's where they go what's in my crease  ","insane to me what's gonna look do you wanna see i would love to watch that's where they go what's in my crease"
"7uybRvy2sj0","00:17:08","00:17:09","",""
"7uybRvy2sj0","00:17:10","00:17:12","that's drag [ __ ] i don't know what  i'm doing what's your go-to numbers  ","that's drag i don't know what i'm doing what's your go-to"
"7uybRvy2sj0","00:17:13","00:17:13","","numbers"
"7uybRvy2sj0","00:17:14","00:17:18","oh as you know i'm a big tina fan uh-huh  and i love tina turner disco inferno","oh as you know i'm a big tina fan uh-huh and i love tina turner disco inferno"
"7uybRvy2sj0","00:17:18","00:17:23","","um"
"7uybRvy2sj0","00:17:24","00:17:28","um dave did you grab that white cloth oh i  thought you grabbed it anyway that [ __ ] is  ","dave did you grab that white cloth oh i thought you grabbed it anyway that is here"
"7uybRvy2sj0","00:17:28","00:17:35","here drinking and making fun of me i would never  do you want to refill from some of those yeah  ","drinking and making fun of me i would never do you want to refill from some of those yeah i don't need"
"7uybRvy2sj0","00:17:35","00:17:39","i don't need this whole fantasy  is this the last one yeah wow","this whole fantasy is this the last one yeah wow"
"7uybRvy2sj0","00:17:39","00:17:41","",""
"7uybRvy2sj0","00:17:42","00:17:46","this is beauty okay i have this i just haven't  wheezed i guess this is so beautiful everybody  ","this is beauty okay i have this i just haven't wheezed i guess this is so beautiful everybody go buy"
"7uybRvy2sj0","00:17:46","00:17:52","go buy this hank and henry palette look at these  anybody could use that all right are you ready  ","this hank and henry palette look at these anybody could use that all right are you ready to put a look"
"7uybRvy2sj0","00:17:52","00:17:56","to put a look on i am ready to put a  highlighter on put on the highlighter let  ","on i am ready to put a highlighter on put on the highlighter let the children know"
"7uybRvy2sj0","00:17:56","00:18:00","the children know all right here i'm gonna  try this i've never tried this it is the  ","all right here i'm gonna try this i've never tried this it is the"
"7uybRvy2sj0","00:18:00","00:18:01","",""
"7uybRvy2sj0","00:18:02","00:18:09","pinify oh that is a name and it's  spelled t-h-o-t-s yes wow you really  ","pinify oh that is a name and it's spelled t-h-o-t-s yes wow you really the girls"
"7uybRvy2sj0","00:18:09","00:18:13","the girls you let the girls have it you let  the girls have which is about this is my new  ","you let the girls have it you let the girls have which is about this is my new this"
"7uybRvy2sj0","00:18:14","00:18:18","this is my new new my mind is just a smattering  of internet memes from the past 10 years it's  ","is my new new my mind is just a smattering of internet memes from the past 10 it's mattering"
"7uybRvy2sj0","00:18:18","00:18:23","mattering yeah i love that term i can't tell you  i'll be alone at home and a vine will pop into  ","yeah i love that term i can't tell you i'll be alone at home and a vine will pop into my"
"7uybRvy2sj0","00:18:24","00:18:28","my head and i have to say it out loud [ __ ] like  that that's how i was spongebob too though like a  ","head and i have to say it out loud like that that's how i was spongebob too though like a lot"
"7uybRvy2sj0","00:18:28","00:18:32","lot of [ __ ] i've seen on spongebob i don't know  why we'll pop it in my head wow should we put on a  ","of i've seen on spongebob i don't know why we'll pop it in my head wow should"
"7uybRvy2sj0","00:18:33","00:18:38","look shirts i'll sit down to do lips i'm sorry  i enjoy we were talking i was enjoying myself","we put on a look shirts i'll sit down to do lips i'm sorry i enjoy we were talking i was enjoying"
"7uybRvy2sj0","00:18:39","00:18:41","","myself this"
"7uybRvy2sj0","00:18:41","00:18:43","this is not much eye shadow i'm not  used to wearing such a little eyeshadow  ","is not much eye shadow i'm not used to wearing such a little eyeshadow"
"7uybRvy2sj0","00:18:44","00:18:44","",""
"7uybRvy2sj0","00:18:45","00:18:52","that's a little eyeshadow girl yes yes  fenty fenty gloss bomb and fenty glow  ","that's a little eyeshadow girl yes yes fenty fenty gloss bomb and fenty glow"
"7uybRvy2sj0","00:18:52","00:18:53","","this is the"
"7uybRvy2sj0","00:18:53","00:18:57","this is the one yeah you're right block the  camera so they can't see it going on you're right  ","one yeah you're right block the camera so they can't see it"
"7uybRvy2sj0","00:18:58","00:19:04","oh oh that's pretty is that gorgeous all right  i think we are gorge here i think we're here  ","going on you're right oh oh that's pretty is that gorgeous all right i think we are gorge right i think we are gorge"
"7uybRvy2sj0","00:19:05","00:19:10","oh you've arrived oh i've arrived mother let's  set it and forget it who said that oh everyone  ","here i think we're here oh you've arrived oh i've arrived mother let's set it and forget it who said that oh"
"7uybRvy2sj0","00:19:11","00:19:16","this is the nyx matte finish spray and this is  the all-nighter ultra matte that's really good","everyone this is the nyx matte finish spray and this is the all-nighter ultra matte that's really"
"7uybRvy2sj0","00:19:17","00:19:18","","good"
"7uybRvy2sj0","00:19:19","00:19:25","so we're gonna go put costumes on and wigs and  we'll be right back he does like to shop share and  ","so we're gonna go put costumes on and wigs and we'll be right back he does like to shop share"
"7uybRvy2sj0","00:19:26","00:19:32","the boy can dress i am totally bugging well she  wishes [ __ ] look at this look at this look at  ","and the boy can dress i am totally bugging well she wishes i am totally bugging well she wishes look at this look at this look at them look"
