"video_id","min_timecode","max_timecode","text.user","text.auto"
"Xngfshnwm9s","00:16:16","00:16:18","It might be better with paper.","be better with paper"
"Xngfshnwm9s","00:16:19","00:16:20","","and now we go"
"Xngfshnwm9s","00:16:20","00:16:21","And now, we go to Keith's, and we're up","to kate's and"
"Xngfshnwm9s","00:16:22","00:16:25","for the ""In-N-Out Eat the Menu Challenge Edition""","we're up for the international menu challenge edition and"
"Xngfshnwm9s","00:16:25","00:16:26","and the secrets of the menu.","the secrets of the menus"
"Xngfshnwm9s","00:16:27","00:16:29","Here we go, vroom, vroom, baby, let's drive.","here we go baby let's drive"
"Xngfshnwm9s","00:16:30","00:16:30","",""
"Xngfshnwm9s","00:16:30","00:16:35","Whoo-hoo! (laughs)","all right we're"
"Xngfshnwm9s","00:16:35","00:16:37","- All right, we're gonna move on to more secret menu items","gonna move on to more secret menu items"
"Xngfshnwm9s","00:16:38","00:16:40","and now, I'm wearing a hat. (laughs)","and now i'm wearing a hat i i"
"Xngfshnwm9s","00:16:40","00:16:41","I meant to put the hat on at the beginning.","meant to put the hat on at the beginning"
"Xngfshnwm9s","00:16:42","00:16:44","Actually, I really meant to buy one of the paper hats,","actually i really meant to buy one of the paper hats if i forgot"
"Xngfshnwm9s","00:16:44","00:16:46","but I forgot, and then, Nick, our producer,","and then nick our producer"
"Xngfshnwm9s","00:16:47","00:16:48","had sent me this hat, and then, I forgot to wear it, as well","had sent me with this hat and then i forgot to wear"
"Xngfshnwm9s","00:16:49","00:16:50","and then, I was gonna have Becky bring it in,","it as well and then i was gonna have becky bringing it and i forgot"
"Xngfshnwm9s","00:16:50","00:16:52","and I forgot, and then I saw it, so I put it on.","and then i saw it so i put it on"
"Xngfshnwm9s","00:16:52","00:16:54","Didn't forget that time.","didn't forget that time so this is"
"Xngfshnwm9s","00:16:54","00:16:55","So this is a lemon up.","a lemon up we're gonna actually"
"Xngfshnwm9s","00:16:56","00:16:58","'cause it's just a pink lemonade and 7-Up.","start with that because it's uh just a pink lemonade and seven up"
"Xngfshnwm9s","00:16:59","00:17:00","Those should go great together.","those should go great together they're"
"Xngfshnwm9s","00:17:00","00:17:03","They're kinda the same. (upbeat music)","kind of the same yeah"
"Xngfshnwm9s","00:17:04","00:17:04","Yeah, that's great. It's sweet.","that's great it's sweet"
"Xngfshnwm9s","00:17:05","00:17:07","It's kind of like a pinkberry 7-Up.","it's kind of like a a pinkberry seven up"
"Xngfshnwm9s","00:17:08","00:17:08","You know that sometimes, there's like a place","you know sometimes there's like a place"
"Xngfshnwm9s","00:17:09","00:17:10","that says, oh yeah, yeah, Pinkberry.","i was like oh yeah you have pinkberry i'm like the [ __ ]"
"Xngfshnwm9s","00:17:10","00:17:11","What the (beeps) is Pinkberry?","is pinkberry it's a whole"
"Xngfshnwm9s","00:17:11","00:17:12","It's a whole yogurt chain, but I had a flavor","yogurt chain but i've had a flavor"
"Xngfshnwm9s","00:17:13","00:17:15","of pinkberry before, and what is the pink berry?","of prince pinkberry before and what is the pink berry"
"Xngfshnwm9s","00:17:15","00:17:17","It's not a cherry, cherries are red.","it's not a cherry cherry's a red i guess sometimes they're pink"
"Xngfshnwm9s","00:17:18","00:17:19","Sometimes they're almost purple.","sometimes they're almost purple"
"Xngfshnwm9s","00:17:20","00:17:20","(upbeat music)","that's the first"
"Xngfshnwm9s","00:17:21","00:17:22","And that's the first flavor combo that I've enjoyed.","flavor combo that i've enjoyed i've"
"Xngfshnwm9s","00:17:23","00:17:24","I've never seen this box before in my life.","never seen this box before in my life what"
"Xngfshnwm9s","00:17:24","00:17:27","What could this be? (humming)","could this be so"
"Xngfshnwm9s","00:17:27","00:17:29","So we've got a lot of different burgers here.","we've got a lot of different burgers"
"Xngfshnwm9s","00:17:30","00:17:33","Some at different donenesses, some cooked different ways.","here some different donenesses some cooked different ways"
"Xngfshnwm9s","00:17:34","00:17:34","So let's start with this one.","so let's start with this one"
"Xngfshnwm9s","00:17:35","00:17:36","Let's just go for it.","let's just let's just go for it this one"
"Xngfshnwm9s","00:17:36","00:17:39","This one, what could it be?","what could it be but it is a hamburger"
"Xngfshnwm9s","00:17:39","00:17:40","But it is a hamburger.","well they're all hamburgers"
"Xngfshnwm9s","00:17:40","00:17:43","Oh, they're all hamburgers. Okay, well. (crunching)","okay well"
"Xngfshnwm9s","00:17:43","00:17:45","The well-done burger, it tastes dry.","the well done burger it tastes dry"
"Xngfshnwm9s","00:17:46","00:17:47","I don't know why you would get it well-done.","i don't know why you would get it well done"
"Xngfshnwm9s","00:17:47","00:17:49","It's already almost always just medium-well,","it's already almost always just medium"
"Xngfshnwm9s","00:17:50","00:17:50","which is close enough.","well which is close enough they"
"Xngfshnwm9s","00:17:50","00:17:51","They all look exactly the same.","all look exactly the same let's"
"Xngfshnwm9s","00:17:52","00:17:52","Well, let's find out.","find out"
"Xngfshnwm9s","00:17:52","00:17:55","Maybe it's the mustard grilled burger.","maybe it's the mustard grilled burger will i be able to"
"Xngfshnwm9s","00:17:55","00:17:56","Will I be able to tell? (whimsical music)","tell what if"
"Xngfshnwm9s","00:17:57","00:17:59","What if I lick the patty? (whimsical music)","i lick the patty"
"Xngfshnwm9s","00:18:00","00:18:01","","i"
"Xngfshnwm9s","00:18:02","00:18:02","I don't know. Maybe it's the mustard melt.","don't know maybe it's the mustard"
"Xngfshnwm9s","00:18:03","00:18:05","Maybe it's the extra salty burger.","bill maybe it's the extra salty burger"
"Xngfshnwm9s","00:18:05","00:18:07","(whimsical music)","basketball's"
"Xngfshnwm9s","00:18:07","00:18:08","Maybe that's the well-done burger.","on burger what"
"Xngfshnwm9s","00:18:08","00:18:09","What is different?","is different"
"Xngfshnwm9s","00:18:10","00:18:10","Let's look at both of these patties.","let's look at both of these patties"
"Xngfshnwm9s","00:18:11","00:18:13","Let's try just the burger patty by itself.","let's try just the burger patty by"
"Xngfshnwm9s","00:18:14","00:18:14","This was the first one.","itself this is the first one"
"Xngfshnwm9s","00:18:15","00:18:17","","[Music] doesn't taste like"
"Xngfshnwm9s","00:18:17","00:18:18","It doesn't taste like anything different","anything different"
"Xngfshnwm9s","00:18:19","00:18:19","is happening on that patty.","is happening on that patty"
"Xngfshnwm9s","00:18:20","00:18:21","This is the next one.","this is the next one"
"Xngfshnwm9s","00:18:23","00:18:25","Saltier, but barely.","saltier but barely i can't tell"
"Xngfshnwm9s","00:18:25","00:18:27","I can't tell the difference between the salty one","the difference between the salty one and the well"
"Xngfshnwm9s","00:18:27","00:18:28","and the well-cooked one, which tells me","cooked one which tells me"
"Xngfshnwm9s","00:18:29","00:18:31","that you shouldn't bother doing either option.","that you shouldn't bother doing either option this one at least i think"
"Xngfshnwm9s","00:18:31","00:18:32","This one, at least, I think I can tell.","i can tell yes"
"Xngfshnwm9s","00:18:33","00:18:35","Yes, this is the extra toasted bun burger,","this is the extra toasted this is the extra toasted bun burger and"
"Xngfshnwm9s","00:18:35","00:18:37","and as we can see, it's quite extra toasted,","as we can see it's quite extra toasted"
"Xngfshnwm9s","00:18:38","00:18:39","almost burned, but it's not burnt.","almost burned but it's not burned"
"Xngfshnwm9s","00:18:40","00:18:40","It's just toasted.","it's just toasted hi"
"Xngfshnwm9s","00:18:40","00:18:44","Hi, I'm extra toasted. (upbeat music)","i'm extra toasted [Music]"
"Xngfshnwm9s","00:18:45","00:18:49","Mm, it definitely has more of a charred taste.","it definitely has more of a charred taste so if"
"Xngfshnwm9s","00:18:49","00:18:50","So if you like that, this is good.","you like that this"
"Xngfshnwm9s","00:18:51","00:18:53","It's a little too charred taste to me.","is good it's a little too charred taste to me"
"Xngfshnwm9s","00:18:54","00:18:56","It also made the bread a little denser,","it also made the bread a little denser a little harder"
"Xngfshnwm9s","00:18:56","00:18:58","a little harder to chew through.","to chew through and i mostly"
"Xngfshnwm9s","00:18:58","00:19:00","And I mostly taste the bun over the burger.","taste the bun over the burger"
"Xngfshnwm9s","00:19:01","00:19:02","What the (beeps) is this one?","and i mostly taste the bun over the burger they all look"
"Xngfshnwm9s","00:19:03","00:19:03","They all look the same. (adventurous music)","the same"
"Xngfshnwm9s","00:19:04","00:19:05","What's different? Are you medium?","what's different are you medium"
"Xngfshnwm9s","00:19:06","00:19:08","I'm gonna try just the patty.","i'm gonna try just the patty"
"Xngfshnwm9s","00:19:09","00:19:09","",""
"Xngfshnwm9s","00:19:10","00:19:11","I can't tell anything.","i can't tell anything let's just say"
"Xngfshnwm9s","00:19:12","00:19:13","Well, let's just say it's the mustard grilled one.","it's a mushroom grilled one so many"
"Xngfshnwm9s","00:19:13","00:19:14","So many burgers.","bergers i guess that"
"Xngfshnwm9s","00:19:15","00:19:16","I guess that patty tastes slightly different?","patty tastes slightly different"
"Xngfshnwm9s","00:19:20","00:19:20","I don't know.","i don't know"
"Xngfshnwm9s","00:19:21","00:19:21","","they taste"
"Xngfshnwm9s","00:19:22","00:19:22","It tastes the same.","the same one of these is supposed"
"Xngfshnwm9s","00:19:22","00:19:23","One of these is supposed to be medium rare.","to be medium"
"Xngfshnwm9s","00:19:24","00:19:26","One of these is supposed to be mustard cooked.","rare one of these is supposed to be mustard cooks"
"Xngfshnwm9s","00:19:26","00:19:29","I can't tell a damn difference on any of them.","i can't tell a damn difference on any of"
"Xngfshnwm9s","00:19:29","00:19:31","I have one more to try, and maybe I will be able","them i have one more to try and maybe i will be able to"
"Xngfshnwm9s","00:19:32","00:19:32","to tell what's different about it,","tell what's different"
"Xngfshnwm9s","00:19:33","00:19:34","and I will be able to tell you","about it and i will be able to tell you"
"Xngfshnwm9s","00:19:34","00:19:35","what that different about it thing is.","what that different about it thing is"
"Xngfshnwm9s","00:19:35","00:19:37","Also, this has got pickles.","also this has got pickles only"
"Xngfshnwm9s","00:19:37","00:19:38","Only one of them's supposed to be animal style,","one of them is supposed to be"
"Xngfshnwm9s","00:19:39","00:19:40","but I got two animal style.","animal style but i got two animal style ones"
"Xngfshnwm9s","00:19:41","00:19:41","So who the (beeps) knows?","so who the [ __ ] knows"
"Xngfshnwm9s","00:19:42","00:19:43","Oh, guys, we did it.","oh guys we did it"
"Xngfshnwm9s","00:19:43","00:19:45","We found the mustard grilled burger.","we found the mustard grilled"
"Xngfshnwm9s","00:19:46","00:19:46","(celebratory music) I pulled up the patty,","burger i pulled up"
"Xngfshnwm9s","00:19:47","00:19:47","it had mustard on it.","the patty it had mustard"
"Xngfshnwm9s","00:19:48","00:19:50","Do you see it? (upbeat music)","on it you see it the patty it had mustard on it you see it let me see the mustard"
"Xngfshnwm9s","00:19:50","00:19:52","Do you see the mustard? See the mustard?","see the mustard"
"Xngfshnwm9s","00:19:53","00:19:53","I can't focus on myself,","i can't rack focus on myself"
"Xngfshnwm9s","00:19:54","00:19:55","but there's mustard grilled into the patty.","but there's mustard grilled into the patty let's just"
"Xngfshnwm9s","00:19:55","00:19:56","Let's just try the mustard patty.","try the mustard"
"Xngfshnwm9s","00:19:57","00:19:58","","patty [Music] tastes"
"Xngfshnwm9s","00:19:58","00:20:01","Mm-hmm, it tastes like mustard and hamburger","like mustard and hamburgers let's see if it tastes"
"Xngfshnwm9s","00:20:01","00:20:02","Let's see if it tastes any different","any different"
"Xngfshnwm9s","00:20:02","00:20:04","in the context of the burger.","in the context of the burger of all the"
"Xngfshnwm9s","00:20:04","00:20:06","Of all the variations, this is the only one I can taste,","variations this is the only one i can taste"
"Xngfshnwm9s","00:20:07","00:20:08","which tells me it's the only one worth doing.","which tells me it's the only one worth doing but"
"Xngfshnwm9s","00:20:08","00:20:12","But I do like the pink 7-Up, lemon-up-ade.","i do like the pink 7up lemon up made"
"Xngfshnwm9s","00:20:13","00:20:14","(slurping) Gorilla!","gorilla"
"Xngfshnwm9s","00:20:15","00:20:18","Gorilla style is a normal animal style burger,","gorilla style is a normal animal style burger and then you"
"Xngfshnwm9s","00:20:19","00:20:19","and then, you add fries to it,","add fries"
"Xngfshnwm9s","00:20:20","00:20:22","just like a gorilla, I guess.","to it just like a gorilla i guess now this"
"Xngfshnwm9s","00:20:23","00:20:24","they don't always do in the stores,","is one of the things they don't always do in stores"
"Xngfshnwm9s","00:20:25","00:20:26","but they always want you to be happy.","but they always want you to be happy"
"Xngfshnwm9s","00:20:26","00:20:29","They come up with a solution, they sent me with some fries.","they come up with a solution they sent me with some fries"
"Xngfshnwm9s","00:20:29","00:20:32","Yum, yum! (upbeat music)","no"
"Xngfshnwm9s","00:20:32","00:20:33","No, that doesn't improve it. (ethereal music)","that doesn't improve"
"Xngfshnwm9s","00:20:34","00:20:35","It just makes you chew more.","that no it just makes you chew more and then there's a bunch"
"Xngfshnwm9s","00:20:35","00:20:36","Now there's a bunch of potato.","of potato"
"Xngfshnwm9s","00:20:37","00:20:38","I don't think the gorillas know what they're doing.","i don't think the gorillas know what they're doing"
"Xngfshnwm9s","00:20:38","00:20:40","Why is it called gorilla style?","why is it called gorilla style they're doing why is it called gorilla style nothing"
"Xngfshnwm9s","00:20:41","00:20:42","Nothing about it seems gorilla-y to me.","about it seems gorilla eat to me"
"Xngfshnwm9s","00:20:43","00:20:44","Maybe it should be spelled guerrilla?","maybe it should just spelled guerrilla"
"Xngfshnwm9s","00:20:46","00:20:46","Like guerrilla warfare?","gorilla warfare"
"Xngfshnwm9s","00:20:47","00:20:48","I'm also noticing these burgers don't come","i'm also noticing these these burgers don't come"
"Xngfshnwm9s","00:20:49","00:20:49","with ketchup on them.","with ketchup on"
"Xngfshnwm9s","00:20:50","00:20:51","They just got their sauce, which is a ketchup/mayo blend,","them i just got their sauce which is like a ketchup mayo blend"
"Xngfshnwm9s","00:20:52","00:20:53","but I thought it could be more.","but i thought it could be more maybe"
"Xngfshnwm9s","00:20:54","00:20:55","Maybe the hat has changed me.","the hat has changed me"
"Xngfshnwm9s","00:20:56","00:20:59","Maybe I'm more discerning now that I'm part of the club.","maybe i'm more discerning now that i'm part of the club also"
"Xngfshnwm9s","00:21:00","00:21:01","Also, I'm gonna interrupt this video right now","i'm going to interrupt this video right now with a"
"Xngfshnwm9s","00:21:01","00:21:02","to plug for myself.","plug for myself that's"
"Xngfshnwm9s","00:21:03","00:21:04","That's right, right now, you can check out","right right now you can check out the lumber"
"Xngfshnwm9s","00:21:04","00:21:05","the Lewberger comedy special.","comedy special it"
"Xngfshnwm9s","00:21:06","00:21:07","It is streaming on Amazon and iTunes,","is streaming on amazon and itunes"
"Xngfshnwm9s","00:21:08","00:21:08","and a lot of other places.","and a lot of other"
"Xngfshnwm9s","00:21:09","00:21:09","There's a link down in the description.","places there's a link down in"
"Xngfshnwm9s","00:21:10","00:21:11","Check it out.","the description check it out it would mean a lot to me"
"Xngfshnwm9s","00:21:11","00:21:12","It would mean a lot to me if you did.","if you did it's"
"Xngfshnwm9s","00:21:12","00:21:14","It's us singing funny songs, doing funny things,","us singing funny songs doing funny"
"Xngfshnwm9s","00:21:15","00:21:16","dancing around, serving people chili.","things dancing around serving people chili it was"
"Xngfshnwm9s","00:21:17","00:21:18","It was shot in 2019, the before times!","shot in 2019 the before times"
"Xngfshnwm9s","00:21:19","00:21:19","Check it out. What's next?","check it out what's"
"Xngfshnwm9s","00:21:35","00:21:35","and I always eat it with little peppers,","it with little"
"Xngfshnwm9s","00:21:36","00:21:39","and then I always get animal style fries,","peppers and then i always get animal style fries um"
"Xngfshnwm9s","00:21:40","00:21:42","but my trick is to get lite well.","but my trick is to get light well um and light"
"Xngfshnwm9s","00:21:42","00:21:45","Lite well is halfway between normal fries","well is like halfway between like"
"Xngfshnwm9s","00:21:46","00:21:48","and well-done fries, and so, this way, good fries,","normal fries and well done fries so this way like"
"Xngfshnwm9s","00:21:49","00:21:52","they're still crispy, but they're not too crunchy crunchy.","the fries are still crispy but they're not too crunchy crunchy"
"Xngfshnwm9s","00:21:53","00:21:53","Cheers.","cheese"
"Xngfshnwm9s","00:21:54","00:21:55","- All right, I took the hat off.","all right i took the hat off"
"Xngfshnwm9s","00:21:56","00:21:58","Okay, so now, we're gonna have","okay so now we're gonna have some different kinds"
"Xngfshnwm9s","00:21:58","00:21:59","some different kinds of burgers.","of burgers"
"Xngfshnwm9s","00:21:59","00:22:01","Last round was really about the burgers","last round was really about the burgers that had different"
"Xngfshnwm9s","00:22:01","00:22:03","that had different things done to the patties.","things done to the patties but this"
"Xngfshnwm9s","00:22:04","00:22:05","But this is just about different presentations","is just about different presentations the burgers"
"Xngfshnwm9s","00:22:06","00:22:07","of the burgers entirely.","entirely different presentations the burgers entirely so many burgers"
"Xngfshnwm9s","00:22:07","00:22:08","So many burgers.","okay"
"Xngfshnwm9s","00:22:09","00:22:09","Okay, we got, (""The Barber of Seville"")","we got oh we're missing"
"Xngfshnwm9s","00:22:10","00:22:11","oh, we're missing one of the burgers, but that's okay.","one of the burgers but that's okay we got this"
"Xngfshnwm9s","00:22:12","00:22:13","We got this burger, this burger, oh, there it is.","burger oh there it is oh"
"Xngfshnwm9s","00:22:14","00:22:15","We're gonna start with this one.","okay let's go where is our this one oh"
"Xngfshnwm9s","00:22:17","00:22:18","The whole grilled onion burger.","it's different the whole grilled onion burger so they"
"Xngfshnwm9s","00:22:19","00:22:19","So they take the onion that would be raw,","take the onion"
"Xngfshnwm9s","00:22:20","00:22:23","and they grill it for you so that it's strings of onion.","that would be raw and they grill it for you so that it's like strings of onion so"
"Xngfshnwm9s","00:22:23","00:22:26","So let's see if that makes any difference whatsoever.","let's see if that makes any difference whatsoever"
"Xngfshnwm9s","00:22:26","00:22:27","","that would"
"Xngfshnwm9s","00:22:28","00:22:28","That one tastes saltier than normal.","taste saltier than normal"
"Xngfshnwm9s","00:22:29","00:22:30","Yeah, there's a lot more grilled onion flavor.","yeah there's a lot more grilled onion flavor"
"Xngfshnwm9s","00:22:31","00:22:32","The tomato on this one's especially red.","the tomato and this one's especially red look"
"Xngfshnwm9s","00:22:33","00:22:34","Look at how vibrant that tomato is.","at how vibrant that tomato isn't"
"Xngfshnwm9s","00:22:35","00:22:36","Red, red.","red it's red i'm going to just"
"Xngfshnwm9s","00:22:37","00:22:37","I wanna just taste the onion real quick.","taste the onion real quick"
"Xngfshnwm9s","00:22:38","00:22:39","It's a great flavor, but again,","it's a great flavor but again"
"Xngfshnwm9s","00:22:40","00:22:41","I think it tastes exactly like all the burgers.","i think it tastes exactly like all the burgers there's not"
"Xngfshnwm9s","00:22:41","00:22:43","Now there's not such a noticeable difference","such a noticeable difference that i think"
"Xngfshnwm9s","00:22:43","00:22:46","that I think it's worth ordering it differently.","it's worth ordering it differently oh"
"Xngfshnwm9s","00:22:47","00:22:47","Oh, yeah, this one looks good.","yeah this one looks good okay"
"Xngfshnwm9s","00:22:48","00:22:50","Okay, this is how I got burgers as a child.","this i this is how i got burgers as a"
"Xngfshnwm9s","00:22:51","00:22:52","And this is just because this is how my parents made them,","child and this is just because it's how my parents made them but"
"Xngfshnwm9s","00:22:53","00:22:56","but doing a burger, but you get a cold slice of cheese.","doing a burger but you get a cold slice of cheese that cheese"
"Xngfshnwm9s","00:22:56","00:22:57","That cheese ain't melted.","but you get a cold slice of cheese that cheese ain't melted"
"Xngfshnwm9s","00:22:58","00:22:59","It's cold cheese in the hot burger.","it's cold cheese in the hot burger"
"Xngfshnwm9s","00:23:00","00:23:01","I love that, a nice contrast","i love that a nice contrast to hot"
"Xngfshnwm9s","00:23:02","00:23:03","to hot and cold with my cheese.","and cold with my cheese the"
"Xngfshnwm9s","00:23:04","00:23:05","The cold cheese pops through.","cold cheese pops through"
"Xngfshnwm9s","00:23:05","00:23:08","You can taste that cheese all by itself.","you can taste that cheese all by itself"
"Xngfshnwm9s","00:23:09","00:23:09","It's got a little bit more","it's got a little more of that gummy"
"Xngfshnwm9s","00:23:10","00:23:10","of that gummy American cheese quality.","american cheese"
"Xngfshnwm9s","00:23:11","00:23:12","Is that a good adjective? Probably not.","quality is that a good adjective probably not"
"Xngfshnwm9s","00:23:13","00:23:15","I can tell the difference in doing this,","i can tell the difference in doing this so i think this is"
"Xngfshnwm9s","00:23:15","00:23:17","so I think this is something worth doing,","a this is something worth doing"
"Xngfshnwm9s","00:23:18","00:23:19","if you like the cold cheese.","if you like the cold cheese"
"Xngfshnwm9s","00:23:20","00:23:20","It will be cold.","it will be cold"
"Xngfshnwm9s","00:23:21","00:23:21","It will be different.","it will be"
"Xngfshnwm9s","00:23:22","00:23:23","You will like it. (clears throat)","different you will like it"
"Xngfshnwm9s","00:23:24","00:23:27","How's my voice? (blows raspberry)","how's my voice"
"Xngfshnwm9s","00:23:28","00:23:30","I'm started to get some real burger fatigue.","i'm starting to get some real burger fatigue"
"Xngfshnwm9s","00:23:31","00:23:33","Oh, Alexandria thought they didn't bring us something,","oh alexander thought they didn't bring something"
"Xngfshnwm9s","00:23:34","00:23:34","but they have it here.","but they have it here i'm"
"Xngfshnwm9s","00:23:35","00:23:35","I'm gonna text her.","an old texter"
"Xngfshnwm9s","00:23:36","00:23:38","Finally, a burger that is going to be totally different,","finally a burger that is going to be totally"
"Xngfshnwm9s","00:23:39","00:23:40","and by totally, I mean, marginally.","different and by totally i mean marginally so"
"Xngfshnwm9s","00:23:41","00:23:42","You can get chopped chilies on your burger","you can get chopped chilies on your burger for"
"Xngfshnwm9s","00:23:42","00:23:43","for a spicy little kick.","a spicy little kick little"
"Xngfshnwm9s","00:23:44","00:23:46","Little peppers, little peppers, little peppers.","peppers peppers and peppers"
"Xngfshnwm9s","00:23:47","00:23:48","They smell like the peppers that you get","they smell like the peppers that you get"
"Xngfshnwm9s","00:23:49","00:23:53","with the Papa John's pizza.","with the papa john's pizza"
"Xngfshnwm9s","00:23:56","00:23:56","Hotter than I thought they'd be.","hotter than i thought they'd"
"Xngfshnwm9s","00:23:57","00:23:59","A little bit hotter than the sport pepper on a Chicago dog,","be a little bit hotter than the sport pepper on a chicago dog"
"Xngfshnwm9s","00:24:00","00:24:01","but around that same heat.","but around that same heat"
"Xngfshnwm9s","00:24:02","00:24:02","","it didn't"
"Xngfshnwm9s","00:24:03","00:24:04","It didn't add that much more flavor.","add that much more flavor i"
"Xngfshnwm9s","00:24:04","00:24:06","I don't remember tasting the burger at all.","don't remember tasting the burger at all i"
"Xngfshnwm9s","00:24:06","00:24:08","I mostly tasted the same flavor I've had all day","mostly tasted the same flavor i've had all day"
"Xngfshnwm9s","00:24:09","00:24:11","and then a little bit of spicy chili and that was it.","and then a little bit of spicy chili and that was it though"
"Xngfshnwm9s","00:24:11","00:24:13","Not all the time, different kind of chili cheeseburger.","also a different kind of chili cheeseburger you know"
"Xngfshnwm9s","00:24:14","00:24:14","You know, sometimes you get","sometimes you get"
"Xngfshnwm9s","00:24:14","00:24:16","chili cheeseburger and it's chili.","cheeseburgers chili these were"
"Xngfshnwm9s","00:24:17","00:24:19","These were chilies, and not the baby back ribs","chilies they're not the baby back ribs kind of chilies but"
"Xngfshnwm9s","00:24:20","00:24:21","kind of Chili's, but individual little peppers.","individual little peppers"
"Xngfshnwm9s","00:24:21","00:24:23","Whoo, that was hotter than I was expecting it to be.","i was hotter than i was expecting"
"Xngfshnwm9s","00:24:24","00:24:28","For the protein burger, for all you keto cats,","it to be for the protein burger for all you keto cats you"
