"video_id","min_timecode","max_timecode","text.user","text.auto"
"b-BMnh4p96w","00:00:00","00:00:01","- Knowing how to sew does not mean you make good outfits.","knowing how to sew does not mean you make good outfits"
"b-BMnh4p96w","00:00:02","00:00:02","- Yes.","yeah same way having money"
"b-BMnh4p96w","00:00:03","00:00:04","- Same way having money doesn't mean you have good taste.","doesn't mean you have good taste"
"b-BMnh4p96w","00:00:05","00:00:05","","exactly"
"b-BMnh4p96w","00:00:06","00:00:06","- Exactly.","this is all stars"
"b-BMnh4p96w","00:00:06","00:00:08","- This is All Stars and we all find women","and we all find women who've"
"b-BMnh4p96w","00:00:08","00:00:09","who've got a little money","got a little money"
"b-BMnh4p96w","00:00:10","00:00:12","and they still commission gross outfits.","and they still commission gross outfits are you"
"b-BMnh4p96w","00:00:12","00:00:14","- Are you talking about me again? (chuckles)","talking about me again"
"b-BMnh4p96w","00:00:15","00:00:17","- And then sometimes they wear them to the Pit Stop.","and then sometimes they wear them to the pit stop"
"b-BMnh4p96w","00:00:17","00:00:19","Hi, it's me Trixie Mattel","hi it's me trixie mattel and welcome back to the"
"b-BMnh4p96w","00:00:19","00:00:20","and welcome back to The Pit Stop,","pit stop"
"b-BMnh4p96w","00:00:20","00:00:23","the show where we recap RuPaul's Drag Race All Stars,","the show where we recap rupaul's drag race all-star season six"
"b-BMnh4p96w","00:00:23","00:00:24","season six.","and"
"b-BMnh4p96w","00:00:24","00:00:27","And today's episode is brought to you by Orbitz.","today's episode is brought to you by orbitz"
"b-BMnh4p96w","00:00:27","00:00:29","Joining me today is a queen we all know and love.","joining me today is a queen we all know and love"
"b-BMnh4p96w","00:00:30","00:00:31","The epitome of a drag race,","the epitome of a drag race"
"b-BMnh4p96w","00:00:31","00:00:36","legend, Manila Luzon today, hello.","legend manila luzon today hello hi"
"b-BMnh4p96w","00:00:36","00:00:37","- Hi, Trixie!","trixies"
"b-BMnh4p96w","00:00:38","00:00:39","- Drag Queens touching, new year.","dry queen's touching new year"
"b-BMnh4p96w","00:00:40","00:00:41","- I know, things have changed so much.","i know things have changed"
"b-BMnh4p96w","00:00:42","00:00:47","","so much [Music] how does it"
"b-BMnh4p96w","00:00:48","00:00:49","- How does it feel to be in drag it head to toe?","feel to be in drag head to toe it"
"b-BMnh4p96w","00:00:50","00:00:53","- It feels as uncomfortable as ever for sure.","feels as uncomfortable toe it feels as uncomfortable as ever for sure"
"b-BMnh4p96w","00:00:54","00:00:55","- You look so beautiful.","you look so beautiful oh"
"b-BMnh4p96w","00:00:55","00:00:57","- Oh, thank you, thank you.","thank you thank you i uh"
"b-BMnh4p96w","00:00:58","00:01:00","I put some makeup on today.","i put some some makeup on today do you"
"b-BMnh4p96w","00:01:01","00:01:02","- Do you love an All Star season?","love an all-star season um"
"b-BMnh4p96w","00:01:02","00:01:04","- Um yes, of course, I've been on two of 'em!","yes of course i've been on two of them that girl"
"b-BMnh4p96w","00:01:06","00:01:07","Which by the way, I have to say during quarantine,","which by the way i have to say during quarantine"
"b-BMnh4p96w","00:01:08","00:01:09","I got to go back and watch All Stars one.","i got to go back and watch all stars"
"b-BMnh4p96w","00:01:10","00:01:11","Watch it again.","one watch it again it's fabulous"
"b-BMnh4p96w","00:01:13","00:01:14","It doesn't get talked about enough.","it doesn't get talked about enough well i mean"
"b-BMnh4p96w","00:01:14","00:01:16","Well, I mean, we did have like the best of the best","we did have like the best"
"b-BMnh4p96w","00:01:17","00:01:19","up until that point on All Stars.","of the best up until that point on all stars"
"b-BMnh4p96w","00:01:20","00:01:22","You did so good on Drag Race.","you did so good on drag race"
"b-BMnh4p96w","00:01:23","00:01:23","- Well, thank you.","well thank you every time"
"b-BMnh4p96w","00:01:24","00:01:25","- Thank you.","thank you does all stars four"
"b-BMnh4p96w","00:01:25","00:01:26","- Does All Stars four seem like a long time ago","seem like a long time ago"
"b-BMnh4p96w","00:01:27","00:01:28","or does it feel fresh?","or does it feel fresh i mean"
"b-BMnh4p96w","00:01:28","00:01:29","- I mean, it was a long time ago.","it was a long time ago"
"b-BMnh4p96w","00:01:30","00:01:30","We had an entire pandemic","we had an entire pandemic"
"b-BMnh4p96w","00:01:31","00:01:33","between when I was on Drag Race All Stars.","between when i was on drag race all-stars and"
"b-BMnh4p96w","00:01:33","00:01:34","And now","now that's how i feel"
"b-BMnh4p96w","00:01:35","00:01:35","- That's how I feel.","i mean i know there"
"b-BMnh4p96w","00:01:35","00:01:36","I mean, I know there was an All Stars last year,","was an all-stars last"
"b-BMnh4p96w","00:01:37","00:01:39","but that feels like five years ago.","year but that feels like five years ago it it"
"b-BMnh4p96w","00:01:39","00:01:41","- It does, especially with, since like there have been","does especially since like there have been like"
"b-BMnh4p96w","00:01:42","00:01:44","like 14 seasons of other franchises","14 seasons of other franchises"
"b-BMnh4p96w","00:01:45","00:01:46","in different countries of Drag Race.","in different countries of drag race every"
"b-BMnh4p96w","00:01:46","00:01:48","- Every country and county of the world has Drag Race.","country and county of the world has drag race"
"b-BMnh4p96w","00:01:49","00:01:50","(Manila laughs)","there's a sonoma"
"b-BMnh4p96w","00:01:50","00:01:51","There's a Sonoma County Drag Race.","county dragon sonoma"
"b-BMnh4p96w","00:01:52","00:01:53","- Sonoma County Drag Race!","county drag race"
"b-BMnh4p96w","00:01:54","00:01:55","I'm here for it!","i'm here for it you win a vineyard"
"b-BMnh4p96w","00:01:56","00:01:57","Now that I would compete for.","now that i would confirm"
"b-BMnh4p96w","00:01:57","00:01:58","- Ooh okay.","okay what does it feel"
"b-BMnh4p96w","00:01:58","00:02:00","- What does it feel like to know that you have been part","like to know that you have been part of an iconic"
"b-BMnh4p96w","00:02:00","00:02:04","of an iconic Drag Race moment when you were shockingly","drag race moment when you were shockingly sent"
"b-BMnh4p96w","00:02:04","00:02:06","sent home by Miss Naomi Smalls?","home by miss naomi smalls i"
"b-BMnh4p96w","00:02:07","00:02:08","- [Manila] I'm really happy and really proud","really i'm really happy and really proud of what i did on the"
"b-BMnh4p96w","00:02:08","00:02:09","of what I did on the show.","show and"
"b-BMnh4p96w","00:02:09","00:02:14","And I actually got so much love","um i actually uh got so much uh love and"
"b-BMnh4p96w","00:02:14","00:02:17","and support from the fans after that moment.","support from the fans after that moment"
"b-BMnh4p96w","00:02:18","00:02:18","- So let's get into this girl,","so let's get into this girl because"
"b-BMnh4p96w","00:02:19","00:02:20","because we have a lot to talk about.","we have a lot to talk about"
"b-BMnh4p96w","00:02:21","00:02:22","We're going to be critiquing a ball today,","we're going to be critiquing a ball today which i don't"
"b-BMnh4p96w","00:02:22","00:02:24","which I don't know if you know, but when Violet was here,","know if you know but when violet was here"
"b-BMnh4p96w","00:02:25","00:02:28","the CDC basically decided that her critiques were inhumane.","the cdc basically decided that her critiques were inhumane she went"
"b-BMnh4p96w","00:02:28","00:02:29","- She went in.","in"
"b-BMnh4p96w","00:02:30","00:02:32","She came through with the comments.","she came through with the comments"
"b-BMnh4p96w","00:02:33","00:02:34","Have you had a lot of experience judging balls?","have you had a lot of experience judging balls"
"b-BMnh4p96w","00:02:35","00:02:36","- Um yes.","um yes how like"
"b-BMnh4p96w","00:02:36","00:02:40","How like, well they hang, what the smell is,","well they hang what the smell is how fuzzy they"
"b-BMnh4p96w","00:02:40","00:02:41","how fuzzy they are.","are"
"b-BMnh4p96w","00:02:42","00:02:42","I love it.","i love it last"
"b-BMnh4p96w","00:02:43","00:02:43","- [Trixie] Last week, the lip-sync assassin,","week the lip sync assassin"
"b-BMnh4p96w","00:02:44","00:02:46","Coco Montrese revealed that sadly Serena ChaCha","kokomontris revealed that sadly serena chacha was the"
"b-BMnh4p96w","00:02:46","00:02:49","was the first queen to sashay away.","first queen to sachet away trinity k"
"b-BMnh4p96w","00:02:49","00:02:51","Trinity K. Bonet is relieved that she survived","bonnet is relieved that she survived"
"b-BMnh4p96w","00:02:52","00:02:53","and that her fellow queens voted for her to stay.","and that her fellow queens voted for her to stay"
"b-BMnh4p96w","00:02:54","00:02:56","But gag, if Yara had won the lip-sync,","but gag if yara had won the lip sync she would"
"b-BMnh4p96w","00:02:56","00:02:57","she would have sent home Trinity.","have sent home trinity"
"b-BMnh4p96w","00:02:58","00:03:00","Do you mean that puts a target on Yara?","do you think that puts a target on yara see"
"b-BMnh4p96w","00:03:01","00:03:01","- See, that what I don't like about","that's what i don't like"
"b-BMnh4p96w","00:03:02","00:03:04","having to reveal your votes.","about having to reveal your votes"
"b-BMnh4p96w","00:03:05","00:03:06","- [Trixie] So you've competed against Yara.","so you've competed against yara"
"b-BMnh4p96w","00:03:07","00:03:08","What is she like as a competitor?","what is she like as a competitor she"
"b-BMnh4p96w","00:03:08","00:03:11","- [Manila] She is like, she's like a wild card.","is like she's like a wild card"
"b-BMnh4p96w","00:03:12","00:03:13","She's a little bit of a dark horse.","she's a little bit of a dark horse"
"b-BMnh4p96w","00:03:14","00:03:16","You don't quite know what she's going to, like pull out.","you don't quite know what she's gonna like pull out"
"b-BMnh4p96w","00:03:17","00:03:17","- [Trixie] Yeah.","yeah she's super"
"b-BMnh4p96w","00:03:17","00:03:19","- [Manila] She's super creative in ways","creative in ways that"
"b-BMnh4p96w","00:03:20","00:03:21","that are so far out of the box","are so far out of the box that you're"
"b-BMnh4p96w","00:03:21","00:03:22","that you're just ba-ger!","just like"
"b-BMnh4p96w","00:03:23","00:03:24","- In your All Star season,","in your all-star season you"
"b-BMnh4p96w","00:03:24","00:03:27","you chose Monet's lipstick instead of Latrice's.","chose monet's lipstick instead of latrice's do you"
"b-BMnh4p96w","00:03:27","00:03:28","Do you think that put a target on you?","think that put a target on your"
"b-BMnh4p96w","00:03:29","00:03:29","- Yes, I think so.","back yes i think"
"b-BMnh4p96w","00:03:30","00:03:34","But I also knew that like, I would not be able to look","so but i also knew that like i would not be able to look at"
"b-BMnh4p96w","00:03:35","00:03:37","at my friend in the eye if I","my friend in the eye if i had"
"b-BMnh4p96w","00:03:38","00:03:41","had chosen her to go home despite that,","chosen her to go home despite that"
"b-BMnh4p96w","00:03:41","00:03:42","they're all saying integrity,","they're all saying integrity"
"b-BMnh4p96w","00:03:43","00:03:46","but like, ultimately like, the game is the game,","but like ultimately like the game is the game but you also have"
"b-BMnh4p96w","00:03:46","00:03:48","but you also have to like, live with yourself afterwards.","to like live with yourself afterwards you also have to like live with yourself afterwards"
"b-BMnh4p96w","00:03:49","00:03:50","- Also there is no rules.","so also there is no"
"b-BMnh4p96w","00:03:51","00:03:53","I'm choosing it based on birthdays.","rules i'm choosing it based on birthdays that's"
"b-BMnh4p96w","00:03:54","00:03:55","- Do you remember anyone's birthday?","valid do you remember anyone's birthday that's valid do you remember anyone's birthday"
"b-BMnh4p96w","00:03:56","00:03:56","- No.","no"
"b-BMnh4p96w","00:03:57","00:03:59","All right, so the next day, the Queen's talk about trade.","all right so the next day the queens talk about trade who do you think"
"b-BMnh4p96w","00:03:59","00:04:02","Who do you think is the trade of this cast?","is the trade of this cast"
"b-BMnh4p96w","00:04:02","00:04:03","",""
"b-BMnh4p96w","00:04:03","00:04:07","- I'm going to say probably Eureka.","i'm gonna say probably eureka i think"
"b-BMnh4p96w","00:04:07","00:04:10","I think Eureka's probably the trade-iest of all of them.","eureka is probably the tradiest of all of them the tradiest"
"b-BMnh4p96w","00:04:10","00:04:11","- The trade-iest of all trade-ism.","of all tradism"
"b-BMnh4p96w","00:04:12","00:04:14","- The trade-iest of the season at least.","the tradies of the season at least i have"
"b-BMnh4p96w","00:04:14","00:04:16","- I have a tie trade.","a i have a tie trade my"
"b-BMnh4p96w","00:04:16","00:04:19","My tie trade is A'Keria.","my thai trade is a curia okay"
"b-BMnh4p96w","00:04:20","00:04:21","- [Manila] Okay, yeah, yeah. I could see that.","yeah yeah i could see that am i"
"b-BMnh4p96w","00:04:21","00:04:24","- Am I, I'm just now realizing that Scarlet Envy","i i'm just now realizing that scarlett envy out"
"b-BMnh4p96w","00:04:24","00:04:25","out of drag is definitely a vibe.","of drag is definitely a vibe"
"b-BMnh4p96w","00:04:26","00:04:28","- Scarlet is a very attractive man","scarlet is a very attractive man"
"b-BMnh4p96w","00:04:29","00:04:30","with that long Fabio hair.","with that long fabio hair"
"b-BMnh4p96w","00:04:31","00:04:32","- I want to listen to like Phil Collins music","i want to listen to like phil collins music and"
"b-BMnh4p96w","00:04:32","00:04:34","and he could carry me through the jungle on our planet.","carry me through the jungle on a"
"b-BMnh4p96w","00:04:35","00:04:36","- [Manila] Yes Tarzan.","yes tarzan carry me through the jungle on a yes tarzan"
"b-BMnh4p96w","00:04:37","00:04:38","- [Trixie] Also, they talked about the meaning of trade","also they talked about the"
"b-BMnh4p96w","00:04:39","00:04:41","which I didn't know that there was multiple interpretations","meaning of trade which i didn't know that there was multiple interpretations of"
"b-BMnh4p96w","00:04:42","00:04:42","of what that meant.","what that meant"
"b-BMnh4p96w","00:04:43","00:04:43","If we're being honest, I think","if we're being honest i think that"
"b-BMnh4p96w","00:04:44","00:04:45","that straight people don't know what it really means.","straight people don't know what it really means"
"b-BMnh4p96w","00:04:46","00:04:47","- I, to be honest, I don't think drag queens","i to be honest i don't think drag"
"b-BMnh4p96w","00:04:48","00:04:48","even know it means.","queens even know what it is that's"
"b-BMnh4p96w","00:04:49","00:04:52","- What I mean, was like, why do you not know what trade,","what i mean i was like why do you not know what trade trade doesn't mean someone"
"b-BMnh4p96w","00:04:52","00:04:53","trade doesn't mean someone hot, period.","hot period that doesn't mean"
"b-BMnh4p96w","00:04:53","00:04:54","That doesn't mean trade.","trade no trade"
"b-BMnh4p96w","00:04:55","00:04:55","- No. trade just means that you","just means that you will"
"b-BMnh4p96w","00:04:56","00:04:56","will have sex with them, I think.","have sex with them i think"
"b-BMnh4p96w","00:04:57","00:04:59","Or maybe there's like some kind of trade involved.","or maybe there's like some kind of trade involved maybe there's like some kind of trade involved that trader"
"b-BMnh4p96w","00:04:59","00:05:00","- That trade means like goods and services.","likes"
"b-BMnh4p96w","00:05:01","00:05:03","- Like you (beep) me and you get free merch.","me and you get a free in free merch"
"b-BMnh4p96w","00:05:04","00:05:05","You know?","you know roo enters"
"b-BMnh4p96w","00:05:06","00:05:06","- [Trixie] Ru enters and announces it","and announces okay for the maxi"
"b-BMnh4p96w","00:05:06","00:05:07","for the Maxi Challenge this week,","challenge this"
"b-BMnh4p96w","00:05:08","00:05:09","the queens are throwing a ball","week the queens are throwing a ball"
"b-BMnh4p96w","00:05:09","00:05:11","and the category is blue, a blue ball.","category is blue a blue"
"b-BMnh4p96w","00:05:12","00:05:13","Manila, do you love a ball?","ball manila do you love a ball i"
"b-BMnh4p96w","00:05:14","00:05:17","- I love a ball, but I hate blue balls.","love a ball but i hate blue balls"
"b-BMnh4p96w","00:05:17","00:05:18","Very uncomfortable.","very uncomfortable and"
"b-BMnh4p96w","00:05:18","00:05:21","And I just feel like time has been wasted.","i just feel like time has been wasted this is the first"
"b-BMnh4p96w","00:05:21","00:05:22","- This is the first time I've been excited","time i've been excited about a"
"b-BMnh4p96w","00:05:22","00:05:23","about a blue ball.","blue ball yes"
"b-BMnh4p96w","00:05:24","00:05:24","- [Manila] Yes, well, I mean,","well i mean"
"b-BMnh4p96w","00:05:25","00:05:27","this is great because this is happening on episode two,","i this is great because this is happening on episode two which means that we"
"b-BMnh4p96w","00:05:27","00:05:28","which means that we are getting looks,","are getting looks"
"b-BMnh4p96w","00:05:28","00:05:30","looks, looks, looks, looks like every girl has come","looks looks like every girl has come with three"
"b-BMnh4p96w","00:05:31","00:05:32","with three looks and there's like 50 girls","looks and there's like 50 girls at this"
"b-BMnh4p96w","00:05:33","00:05:34","- Girl","point girl we're gonna be here forever"
"b-BMnh4p96w","00:05:35","00:05:36","- We're doing 36 looks today.","we're doing 36 looks today have you warmed"
"b-BMnh4p96w","00:05:37","00:05:38","Have you warmed up, are you stretched?","up are you stretched yes"
"b-BMnh4p96w","00:05:38","00:05:39","- Yes, all that talk of trade","all that talk of trade"
"b-BMnh4p96w","00:05:40","00:05:41","made me like do my kegels first.","made me like do my kegels"
"b-BMnh4p96w","00:05:42","00:05:42","- Yeah, all right, so Manila,","yes all right so manila"
"b-BMnh4p96w","00:05:43","00:05:45","you won the Money Ball on season three.","you won the money ball on season three"
"b-BMnh4p96w","00:05:45","00:05:46","- [Manila] Yes.","yes what are your memories"
"b-BMnh4p96w","00:05:47","00:05:48","- [Manila] We not only had","of that we not only had to make an entire"
"b-BMnh4p96w","00:05:48","00:05:49","to make an entire outfit out of money,","outfit out of money then"
"b-BMnh4p96w","00:05:49","00:05:51","then a bathing suit outfit.","a bathing suit outfit"
"b-BMnh4p96w","00:05:52","00:05:54","Then we had to do a choreographed dance first.","then we had to do a choreographed dance first and this"
"b-BMnh4p96w","00:05:54","00:05:55","And this was after like two","was after like"
"b-BMnh4p96w","00:05:56","00:05:58","or three episodes of multiple looks on the runway.","two or three episodes of multiple looks on the runway"
"b-BMnh4p96w","00:05:59","00:06:00","So yeah, it was quite exhausting","so yeah it was quite exhausting"
"b-BMnh4p96w","00:06:01","00:06:03","but I won that challenge and it's one of my favorites.","but i won that challenge and it's one of my favorites but i won that challenge and it's one of my favorites"
"b-BMnh4p96w","00:06:04","00:06:05","- So for the Blue Ball, the categories are:","so for the blue ball the categories are"
"b-BMnh4p96w","00:06:06","00:06:07","Blue Betta Werk, the blue collar look,","blue better work the blue color look blue"
"b-BMnh4p96w","00:06:08","00:06:09","Blue Jean Baby, a denim look,","jean baby a denim look"
"b-BMnh4p96w","00:06:10","00:06:10","and Blue Ball Bonanza,","and blue ball bonanza"
"b-BMnh4p96w","00:06:11","00:06:12","which is a high fashion look the queens have","which is a high fashion look the queens"
"b-BMnh4p96w","00:06:13","00:06:15","to make using unconventional blue objects.","have to make using unconventional look the queens have to make using unconventional blue objects unconventional blue objects"
"b-BMnh4p96w","00:06:15","00:06:16","- [Manila] Yes.","yes what do you think about the theme"
"b-BMnh4p96w","00:06:16","00:06:17","- [Trixie] What do you think about the theme?","objects yes what do you think about the theme i love i"
"b-BMnh4p96w","00:06:18","00:06:20","I love the blue collar look because it's like,","love it i love the blue color look because it's like we're all like"
"b-BMnh4p96w","00:06:20","00:06:22","we're all like working the runway.","working the runway so"
"b-BMnh4p96w","00:06:22","00:06:23","So it's like a little pun there.","it's like a little pun there"
"b-BMnh4p96w","00:06:24","00:06:26","Denim is always a good like material that like,","denim is always a good like material that like"
"b-BMnh4p96w","00:06:27","00:06:29","isn't really like it's so like every day.","yes isn't really like it's so like every day so to like"
"b-BMnh4p96w","00:06:29","00:06:31","So to like to make it fashion is like always fun.","to make it fashion is like always fun what"
"b-BMnh4p96w","00:06:32","00:06:34","- [Trixie] What blue objects would you have gone for?","blue objects would you have gone for oh"
"b-BMnh4p96w","00:06:34","00:06:38","- Ooh, well, I definitely would (earring falls to ground)","gone for oh um well i definitely would"
"b-BMnh4p96w","00:06:40","00:06:43","","well"
"b-BMnh4p96w","00:06:44","00:06:45","- Yeah, and that was The Pit Stop.","and that was the pit stop definitely would have stayed"
"b-BMnh4p96w","00:06:45","00:06:47","- Definitely would've stayed away from most of those.","away from most of those"
"b-BMnh4p96w","00:06:47","00:06:51","Because the trick is to get these unconventional objects","the trick is is to get these unconventional objects"
"b-BMnh4p96w","00:06:52","00:06:56","and then to make something that doesn't look","and then to make something that doesn't"
"b-BMnh4p96w","00:06:57","00:06:58","like it's made with that crap.","look like it's made with that crap that's the big"
"b-BMnh4p96w","00:06:58","00:06:59","- That's the big part of it is like,","part of it is like can"
"b-BMnh4p96w","00:07:00","00:07:02","can you make it not look like what it is?","you make it not look like what it is yeah we"
"b-BMnh4p96w","00:07:03","00:07:04","- [Trixie] We gotta talk about your sister Jiggly Caliente.","gotta talk about your sister jiggly caliente"
"b-BMnh4p96w","00:07:05","00:07:07","She's feeling a bit nervous, considering her experience","she's feeling a bit nervous considering her experience"
"b-BMnh4p96w","00:07:08","00:07:08","on season four.","on season four"
"b-BMnh4p96w","00:07:09","00:07:11","- Yeah, she had one of the most memorable,","yeah she had one of like the most memorable"
"b-BMnh4p96w","00:07:12","00:07:15","terrible making (beep) out of (beep) runways","terrible making out of runways in all"
"b-BMnh4p96w","00:07:15","00:07:16","in all of Drag Race HERstory.","of drag race history like"
"b-BMnh4p96w","00:07:17","00:07:19","Like that big potato post-apocalyptical.","that baked potato post-apocalyptical"
"b-BMnh4p96w","00:07:19","00:07:21","- And that boat?","and that boat and the"
"b-BMnh4p96w","00:07:21","00:07:24","- And the boat, I forgot about how central pay that was.","boat i forgot about how santro pay that was"
"b-BMnh4p96w","00:07:25","00:07:26","Oh my gosh.","oh my gosh do you think you"
"b-BMnh4p96w","00:07:27","00:07:29","in a ball without knowing how to sew?","could do well in a ball without knowing how to sew well in a ball without knowing how to sew yeah i"
"b-BMnh4p96w","00:07:29","00:07:32","- Yeah, I didn't really know how to sew, like.","mean i didn't really know how to sew like you did it"
"b-BMnh4p96w","00:07:33","00:07:33","- No!","no i like i"
"b-BMnh4p96w","00:07:34","00:07:34","I was, most of it was just like,","was afraid"
"b-BMnh4p96w","00:07:35","00:07:38","get this machine to sew like a tube","most of it was just like get this machine to sew like a tube"
"b-BMnh4p96w","00:07:39","00:07:39","and then we'll hot glue the rest.","and then we'll hot glue the rest"
"b-BMnh4p96w","00:07:40","00:07:41","- Meanwhile, Ra'Jah O'Hara is having flashbacks","meanwhile raja o'hara is having flashbacks"
"b-BMnh4p96w","00:07:42","00:07:43","to her ball on season 11,","to her ball on season 11"
"b-BMnh4p96w","00:07:44","00:07:45","which is the challenge she went home on.","which is the challenge she went home on"
"b-BMnh4p96w","00:07:46","00:07:47","Do you ever feel that a challenge you struggle with","do you ever feel that a challenge you struggle with on your original"
"b-BMnh4p96w","00:07:47","00:07:51","on your original season can haunt you on All Stars?","season can haunt you on all stars oh yeah for sure"
"b-BMnh4p96w","00:07:52","00:07:54","Especially if it's the one that you got sent home in.","can haunt you on all stars oh yeah for sure especially if it's the one that you got sent home in it's like"
"b-BMnh4p96w","00:07:55","00:07:56","It's like, you really do want to prove","you really do want to prove"
"b-BMnh4p96w","00:07:57","00:07:58","that you've learned something","that you've"
"b-BMnh4p96w","00:07:59","00:08:00","since you went on the show last time.","learned something since you went on the show last time"
"b-BMnh4p96w","00:08:01","00:08:01","- I think it goes both ways too,","i think it goes both ways too"
"b-BMnh4p96w","00:08:02","00:08:03","because if you do really well","because if you do really well on a particular type of"
"b-BMnh4p96w","00:08:03","00:08:04","on a particular type of challenge,","challenge next"
"b-BMnh4p96w","00:08:04","00:08:06","next time you come to do Snatch Game.","time you come to do snatch game"
"b-BMnh4p96w","00:08:07","00:08:07","- Yeah.","yeah the pressure can"
"b-BMnh4p96w","00:08:07","00:08:08","- The pressure can make it harder 'cause you're like,","make it harder because you're like"
"b-BMnh4p96w","00:08:09","00:08:10","well, you won last time.","well you won last time"
