"video_id","min_timecode","max_timecode","text.user","text.auto"
"EukpxRuDUzA","00:15:29","00:15:30","but I just have to kinda of (indistinct)","just have to kind of let on you know"
"EukpxRuDUzA","00:15:31","00:15:31","- Stop having it all...","stop having it i have"
"EukpxRuDUzA","00:15:32","00:15:35","- [Mom] I have to get some sympathy from the followers.","to like get some sympathy from the followers"
"EukpxRuDUzA","00:15:36","00:15:37","Truth be told you can't wait","so truth be told i can't wait the followers so truth be told i can't wait"
"EukpxRuDUzA","00:15:38","00:15:39","and I think I might be taking my Lavender.","and i think i might be taking lavender we're"
"EukpxRuDUzA","00:15:40","00:15:40","- We're sharing Lavender.","sharing lounges we're"
"EukpxRuDUzA","00:15:41","00:15:41","- [Mom] We're sharing yes.","sharing this"
"EukpxRuDUzA","00:15:42","00:15:43","- She's got a new favorite game","she's got a new favorite we're jumping in and"
"EukpxRuDUzA","00:15:44","00:15:44","jumping in and out of the baskets.","out of the baskets"
"EukpxRuDUzA","00:15:45","00:15:45","Cats are crazy.","cats are"
"EukpxRuDUzA","00:15:46","00:15:48","So I've done as much of the bathroom as I can at this point.","crazy so i've done as much of the bathroom as i can at this point and then"
"EukpxRuDUzA","00:15:48","00:15:50","And then before the reveal to him on Saturday,","before the reveal to him"
"EukpxRuDUzA","00:15:51","00:15:53","I'll show you guys everything,","on saturday i'll show you guys everything like as it finally"
"EukpxRuDUzA","00:15:53","00:15:56","as it finally is laid out in the bathtub, under the sink,","is laid out in the bathtub under the sink in the storage"
"EukpxRuDUzA","00:15:56","00:15:58","in the storage, in the closet,","in the closet like i'll"
"EukpxRuDUzA","00:15:59","00:16:00","I'll show the full reveal at the end to you guys","show it the full reveal at the end to"
"EukpxRuDUzA","00:16:01","00:16:02","before I reveal it to him.","you guys before i reveal it to him don't worry"
"EukpxRuDUzA","00:16:03","00:16:03","Don't worry.","it's a work"
"EukpxRuDUzA","00:16:03","00:16:04","It's a work in progress.","in progress can you"
"EukpxRuDUzA","00:16:05","00:16:06","Can you what this cat did on my lips mom?","sell this car on my lips mom oh"
"EukpxRuDUzA","00:16:06","00:16:08","- [Mom] Oh yeah.","yeah yeah gloves are kind of shiny"
"EukpxRuDUzA","00:16:08","00:16:09","- Club's shiny.","what happens"
"EukpxRuDUzA","00:16:09","00:16:11","- [Mom] What happened?","oh my disgusting she bounced"
"EukpxRuDUzA","00:16:12","00:16:13","She bounced into the basket","into the basket and like"
"EukpxRuDUzA","00:16:14","00:16:15","and like brushed her whole body against me","brushed her whole body against"
"EukpxRuDUzA","00:16:15","00:16:16","and I'm wearing lip gloss.","me and i'm wearing lip gloss"
"EukpxRuDUzA","00:16:17","00:16:19","Like half her coat came off onto my mouth.","and like half her coat came off onto my mouth okay so"
"EukpxRuDUzA","00:16:19","00:16:23","So in this basket I have this J.Crew wallet that I got him","in this basket i have this j crew wallet that i got him like a little"
"EukpxRuDUzA","00:16:24","00:16:24","","slip"
"EukpxRuDUzA","00:16:25","00:16:26","'cause currently his wallet is one of those","wallet because currently his wallet is one of those like phone"
"EukpxRuDUzA","00:16:27","00:16:28","phone-case wallets, but the phone case broke.","case wallets but the phone case broke"
"EukpxRuDUzA","00:16:29","00:16:30","So I have a new phone case coming for him,","so i have a new phone case coming for him but hasn't"
"EukpxRuDUzA","00:16:31","00:16:31","but it hasn't come in yet.","come in yet"
"EukpxRuDUzA","00:16:32","00:16:34","And then I got him these sunny's from J.Crew","and then i got him these sunnies from j.crew"
"EukpxRuDUzA","00:16:35","00:16:36","which I thought were really nice.","which i thought were really nice he has a pair of sunnies"
"EukpxRuDUzA","00:16:36","00:16:39","He has a pair of sunnies, but sometimes he loses them.","but you know sometimes he loses them so it's always"
"EukpxRuDUzA","00:16:40","00:16:40","So it's always good to have two.","good to have two"
"EukpxRuDUzA","00:16:40","00:16:42","Don't we all lose things when we have only one?","don't we all lose things when we only have one then i got him a brown"
"EukpxRuDUzA","00:16:43","00:16:43","Then I got him a brown and a black belt.","and a black belt"
"EukpxRuDUzA","00:16:44","00:16:46","And then I got him a nice gray baseball hat","and then i got him a nice gray baseball hat"
"EukpxRuDUzA","00:16:47","00:16:49","and a blue colored baseball hat.","a nice blue colored baseball hat so i'm"
"EukpxRuDUzA","00:16:49","00:16:52","So I'm just kind of displaying these in this bin","just kind of displaying these in this bin for"
"EukpxRuDUzA","00:16:52","00:16:54","for the sake of the reveal.","the sake of the reveal and then"
"EukpxRuDUzA","00:16:54","00:16:57","And then this bin all from J.Crew.","this bin all from j crew i'm upset because the"
"EukpxRuDUzA","00:16:57","00:16:58","","top man stuff so"
"EukpxRuDUzA","00:16:58","00:17:01","So these are two pairs of socks, low socks.","these are two pairs of socks low socks but"
"EukpxRuDUzA","00:17:02","00:17:03","But I also got him from Topshop,","i also got him from topshop"
"EukpxRuDUzA","00:17:04","00:17:05","no show socks and high socks.","no show socks and high socks so"
"EukpxRuDUzA","00:17:05","00:17:06","So those haven't come in yet.","those haven't"
"EukpxRuDUzA","00:17:07","00:17:10","And then I also got a more boxers from Topshop,","come in yet and then i also got them more boxers from top not top shop top man top"
"EukpxRuDUzA","00:17:10","00:17:11","Topman same thing.","shop top man same thing so more"
"EukpxRuDUzA","00:17:11","00:17:13","So more socks coming from Topman.","socks coming from topman and then i got them"
"EukpxRuDUzA","00:17:13","00:17:15","And then I got on three pairs of boxers in here,","three pairs of boxers in here which ones"
"EukpxRuDUzA","00:17:16","00:17:16","which ones are these?","are these the lobster"
"EukpxRuDUzA","00:17:16","00:17:17","- [Mom] The Lobster? - Oh good, the Lobster ones.","oh good the lobster"
"EukpxRuDUzA","00:17:18","00:17:20","So of course, friends, Lobsters?","one so of course you know friends lobsters you"
"EukpxRuDUzA","00:17:21","00:17:21","You guys know if you know.","guys know if you know"
"EukpxRuDUzA","00:17:22","00:17:23","And then these ones and these ones.","and then these ones and these ones so"
"EukpxRuDUzA","00:17:24","00:17:24","So I got them these three","i got them these"
"EukpxRuDUzA","00:17:25","00:17:27","and then I have another set of boxers,","three and then i have another set of boxers three more"
"EukpxRuDUzA","00:17:27","00:17:29","three more boxers coming from Topman.","boxers coming from topman funny story"
"EukpxRuDUzA","00:17:29","00:17:32","It's good that I'm getting him a belt because I do owe him,","it's good that i'm getting him a belt because i do owe him the"
"EukpxRuDUzA","00:17:33","00:17:34","the first time he came over and met my mom,","first time he came over and met my mom"
"EukpxRuDUzA","00:17:35","00:17:37","Gallop broke his belt. - [Mom] As he came in the door","gallop broke his belt and he came in the door"
"EukpxRuDUzA","00:17:38","00:17:39","As he came in the door Gallop got so excited to see him","as he came in the door gal got so excited to see"
"EukpxRuDUzA","00:17:40","00:17:41","that I broke his belt.","him that he broke his belt and so"
"EukpxRuDUzA","00:17:41","00:17:43","And so then he's standing there meeting my mom","then he's standing there meeting my mom with his belt"
"EukpxRuDUzA","00:17:43","00:17:45","with his belt, (laughing) the he was like,","like and he was like oh my"
"EukpxRuDUzA","00:17:46","00:17:47","""Oh my God, this is so embarrassing.""","god this is so embarrassing i swear to"
"EukpxRuDUzA","00:17:47","00:17:48","I sort of had, to take my belt up","god i did my belt up and then"
"EukpxRuDUzA","00:17:48","00:17:50","and then it turns out Gallop broken it.","i turned that gallop and broken it"
"EukpxRuDUzA","00:17:50","00:17:53","So he deserves a new fixed black belt.","so he deserves a new fixed black belt"
"EukpxRuDUzA","00:17:53","00:17:54","(air whooshing)","getting my"
"EukpxRuDUzA","00:17:54","00:17:57","Getting my queen energy on (indistinct)","queen energy on my red over"
"EukpxRuDUzA","00:17:58","00:17:59","","hmm getting my queen energy on my red over hmm"
"EukpxRuDUzA","00:18:03","00:18:04","- It's fine.","so today"
"EukpxRuDUzA","00:18:05","00:18:05","So, today is Thursday.","is thursday"
"EukpxRuDUzA","00:18:06","00:18:08","We initially thought my mom's moving day with Saturday,","we initially thought my mom's move-in day was saturday"
"EukpxRuDUzA","00:18:08","00:18:09","the same day my boyfriend's moving in.","the same day my boyfriend's"
"EukpxRuDUzA","00:18:10","00:18:12","And then, we thought it was Friday,","moving in and then even though it was friday which"
"EukpxRuDUzA","00:18:12","00:18:14","which we're like, ""Oh yeah it buys us an extra day.","were like oh yeah he buys us an extra day she can move"
"EukpxRuDUzA","00:18:14","00:18:16","""She could move out on Saturday, oh it's Friday.","out on saturday he can move in on or on"
"EukpxRuDUzA","00:18:17","00:18:18","He can move in on Saturday"".","friday he can move in on saturday"
"EukpxRuDUzA","00:18:18","00:18:20","And then today, Thursday evening,","and then today thursday evening"
"EukpxRuDUzA","00:18:21","00:18:22","she goes down to the office and was like,","she goes down to the office and it's like hey can"
"EukpxRuDUzA","00:18:22","00:18:24","""Hey, can I get the keys pretty early in the morning,","i get the keys like pretty early in the morning"
"EukpxRuDUzA","00:18:24","00:18:25","""start moving in tomorrow?""","to start moving in tomorrow they're"
"EukpxRuDUzA","00:18:26","00:18:27","And they were like, ""Your moving day's today.""","like your move-in days today"
"EukpxRuDUzA","00:18:27","00:18:31","So she raced upstairs and this is her new apartment,","so she raced upstairs and this is her new apartment"
"EukpxRuDUzA","00:18:31","00:18:33","(cheering)","very exciting"
"EukpxRuDUzA","00:18:33","00:18:36","very exciting, it's in the same building.","she's in the same building and i love it"
"EukpxRuDUzA","00:18:36","00:18:37","- [Mom] And I love it.","she's not"
"EukpxRuDUzA","00:18:37","00:18:38","- She's not leaving us.","leaving us you know"
"EukpxRuDUzA","00:18:39","00:18:39","You know, that's strange.","astray looks great"
"EukpxRuDUzA","00:18:40","00:18:40","- [Mom] It's quite like yours.","like yours"
"EukpxRuDUzA","00:18:41","00:18:41","- Shocker if it is.","shocker name"
"EukpxRuDUzA","00:18:42","00:18:43","But it's a one bedroom not a two","but it's a one bedroom not a two"
"EukpxRuDUzA","00:18:44","00:18:44","and it's not a coronary unit,","and it's not a corner unit"
"EukpxRuDUzA","00:18:45","00:18:46","but we're literally just like toting everything","but we're literally just like toting everything"
"EukpxRuDUzA","00:18:47","00:18:48","down the hall, like a caravan.","down hall like a caravan so"
"EukpxRuDUzA","00:18:49","00:18:50","So that's been what we've been up to for the move today.","that's been what we've been up to for the move"
"EukpxRuDUzA","00:18:51","00:18:53","I brought one roll of toilet paper,","today i brought one roll of toilet paper a"
"EukpxRuDUzA","00:18:53","00:18:56","a LaCroix and my phone to listen to a podcast","lacroix and my phone to listen to a podcast"
"EukpxRuDUzA","00:18:57","00:18:58","while I'm hanging up clothes.","while i start hanging up clothes"
"EukpxRuDUzA","00:18:59","00:19:01","And then I found this jacket and I was like, ""Oh, fabulous.""","and then i found this jacket and i was like oh fabulous"
"EukpxRuDUzA","00:19:02","00:19:02","(air whooshing)","so we've been literally"
"EukpxRuDUzA","00:19:02","00:19:04","So, we've been literally just scooping clothes and moving","just scooping clothes and moving"
"EukpxRuDUzA","00:19:05","00:19:07","them from one apartment to another down the hall.","them from one apartment to another down the hall and"
"EukpxRuDUzA","00:19:07","00:19:10","And I'm working on organizing the closet","i'm working on organizing the closet"
"EukpxRuDUzA","00:19:11","00:19:13","because organization is where I shine,","because organization is where i shine and"
"EukpxRuDUzA","00:19:13","00:19:14","and moving, I do not.","moving i do not"
"EukpxRuDUzA","00:19:15","00:19:19","So that's my role in this, sorting out this pile","so that's my role in this is sorting out this pile into"
"EukpxRuDUzA","00:19:19","00:19:20","into this tiny...","this tidy i never"
"EukpxRuDUzA","00:19:20","00:19:23","- [Mom] I never realized it this what it looks.","realized it too many clothes"
"EukpxRuDUzA","00:19:24","00:19:25","- The way you have it all organized","[Music]"
"EukpxRuDUzA","00:19:36","00:19:37","It's fun. - [Mom] I feel such relief","knowing that i have you"
"EukpxRuDUzA","00:19:37","00:19:38","knowing that I have you helping me.","helping me"
"EukpxRuDUzA","00:19:39","00:19:40","Thank you.","thank you"
"EukpxRuDUzA","00:19:41","00:19:42","(laughing)","thanks"
"EukpxRuDUzA","00:19:43","00:19:43","- [Mom] Thanks so much Molly.","so much"
"EukpxRuDUzA","00:19:44","00:19:44","- It's now dark out.","it's now dark out"
"EukpxRuDUzA","00:19:45","00:19:46","(laughing)","it's"
"EukpxRuDUzA","00:19:46","00:19:47","Dark","dark dark dark"
"EukpxRuDUzA","00:19:48","00:19:49","It's 8:40 at night.","it's 8 40 at night we've"
"EukpxRuDUzA","00:19:50","00:19:51","We've been moving since 4:30.","been moving since 4 30."
"EukpxRuDUzA","00:19:52","00:19:54","I've been here the whole time (laughing)","i've been here the whole time in this room"
"EukpxRuDUzA","00:19:55","00:19:56","in was sitting with the clothes and the hangers","sitting with the clothes and the hangers and"
"EukpxRuDUzA","00:19:56","00:19:59","and the closet, and I've made great headway...","the closet and i've made great headway we're"
"EukpxRuDUzA","00:20:00","00:20:01","- [Mom} That's amazing.","all that's amazing like i am"
"EukpxRuDUzA","00:20:01","00:20:03","I am thrilled.","amazing like i am real fully organized"
"EukpxRuDUzA","00:20:03","00:20:04","- Fully organized.","it's"
"EukpxRuDUzA","00:20:04","00:20:05","It's looking good.","looking good it's feeling"
"EukpxRuDUzA","00:20:06","00:20:06","It's feeling good.","good i'm exhausted"
"EukpxRuDUzA","00:20:08","00:20:10","We've got tomorrow to finish moving my mom's big furniture,","we've got tomorrow to finish moving my mom's big furniture"
"EukpxRuDUzA","00:20:11","00:20:13","the bedside tables, dresser drawers, all that stuff.","the bed side tables dresser drawers all that stuff"
"EukpxRuDUzA","00:20:14","00:20:16","And then Saturday will be my boyfriend","and then saturday will be my boyfriend moving in"
"EukpxRuDUzA","00:20:17","00:20:18","moving in his clothes.","his clothes"
"EukpxRuDUzA","00:20:19","00:20:21","So he live in a fully furnished apartment.","so he lived in a fully furnished apartment so he doesn't"
"EukpxRuDUzA","00:20:21","00:20:22","So he doesn't have furniture to move.","have furniture to move thank"
"EukpxRuDUzA","00:20:22","00:20:24","- [Mom] Thank the Lord.","the lord yeah so he has no furniture"
"EukpxRuDUzA","00:20:24","00:20:25","- So he has no furniture.","he lived in"
"EukpxRuDUzA","00:20:25","00:20:26","'Cause he's been a vagabond.","because he's been a vagabond"
"EukpxRuDUzA","00:20:27","00:20:28","You'll hear his story when you meet him.","you'll hear his story when you meet"
"EukpxRuDUzA","00:20:29","00:20:31","But he's been traveling the world because he's so cool.","him but he's been traveling the world because he's so cool so"
"EukpxRuDUzA","00:20:31","00:20:34","So he's been traveling the world often past four years.","he's been traveling the world a lot for the past four years um and"
"EukpxRuDUzA","00:20:34","00:20:35","And before that he was in college.","before that he was in college so"
"EukpxRuDUzA","00:20:36","00:20:37","So he doesn't really like have a ton of stuff,","he doesn't really like have a ton of stuff"
"EukpxRuDUzA","00:20:38","00:20:39","which is partly why I wanted to just spoil him.","which is like partly why i wanted to just spoil him a few"
"EukpxRuDUzA","00:20:40","00:20:41","A few months back he had a suitcase stolen,","months back he had a suitcase stolen with"
"EukpxRuDUzA","00:20:42","00:20:42","with lot of his clothes,","a lot of his clothes"
"EukpxRuDUzA","00:20:43","00:20:44","which is why I wanted to spoil him","which is why i wanted to just like spoil him and"
"EukpxRuDUzA","00:20:45","00:20:45","and get him a bunch of new clothes.","get him a bunch of new clothes"
"EukpxRuDUzA","00:20:46","00:20:48","By the way, I want to mention, I'll show you tomorrow","by the way i want to mention i'll show you tomorrow like"
"EukpxRuDUzA","00:20:49","00:20:51","the closet put together for him and show","the closet put together for him and stuff and like show you"
"EukpxRuDUzA","00:20:52","00:20:53","you each piece that I've gotten him.","each piece that i've gotten him but it looks like i"
"EukpxRuDUzA","00:20:53","00:20:54","But it looks like I got them a lot of stuff,","got him a lot of stuff which i mean"
"EukpxRuDUzA","00:20:54","00:20:57","which I mean I did, but majority of it is J.Crew","i did but majority of it is j crew and"
"EukpxRuDUzA","00:20:58","00:20:59","and we got you guys crazy deals.","we got you guys crazy deals"
"EukpxRuDUzA","00:21:00","00:21:01","There was a huge sale section.","there was a huge sales section so everything"
"EukpxRuDUzA","00:21:01","00:21:03","So everything was already marked out.","was already marked down and then it was 70 percent"
"EukpxRuDUzA","00:21:03","00:21:04","And then it was 70% off the mark down.","off the markdown i was"
"EukpxRuDUzA","00:21:05","00:21:06","I was getting J.Crew stuff for like $5.","getting j crew stuff for like five dollars"
"EukpxRuDUzA","00:21:07","00:21:07","It was insane (clapping).","it was insane so"
"EukpxRuDUzA","00:21:08","00:21:10","So I got like such great deals that I couldn't help,","i got like such great steals that i couldn't help but like buy a bunch of"
"EukpxRuDUzA","00:21:10","00:21:13","but buy a bunch of stuff 'cause it was so absurdly cheap.","stuff because it was so absurdly cheap and you have to"
"EukpxRuDUzA","00:21:13","00:21:15","- [Mom] At times you have to sit down (indistinct) feet.","sit down my poor feet were"
"EukpxRuDUzA","00:21:16","00:21:16","(laughing)","exhausted"
"EukpxRuDUzA","00:21:17","00:21:17","- We are exhausted.","it's been a lot"
"EukpxRuDUzA","00:21:17","00:21:18","It's been a lot.","it's been a lot what"
"EukpxRuDUzA","00:21:19","00:21:19","What else?","else oh i know again"
"EukpxRuDUzA","00:21:19","00:21:21","Oh, I know a lot of you are going to be like, ""Oh my God,","i know a lot of you are going to be like oh my god"
"EukpxRuDUzA","00:21:22","00:21:23","""They're moving so fast.""","they're moving so fast but the thing"
"EukpxRuDUzA","00:21:23","00:21:24","But the thing is it's like when you find the person","is it's like when you find"
"EukpxRuDUzA","00:21:25","00:21:26","that you believe you want to spend your life with,","the person that you believe you want to spend your life with"
"EukpxRuDUzA","00:21:27","00:21:27","it's like, okay.","it's like okay"
"EukpxRuDUzA","00:21:28","00:21:29","Well, why don't we just test it?","well why don't we just test it right because"
"EukpxRuDUzA","00:21:30","00:21:33","Because my mom and dad lived together","we would you know my mom and dad live together before"
"EukpxRuDUzA","00:21:33","00:21:34","before they were married or engaged,","they were married or engaged"
"EukpxRuDUzA","00:21:35","00:21:36","I believe his parents did as well.","i believe his parents did as well so"
"EukpxRuDUzA","00:21:36","00:21:39","So I really feel if we believe we're","i really feel like it's kind of like if we believe we're meant to be together"
"EukpxRuDUzA","00:21:39","00:21:40","meant to be together,","we"
"EukpxRuDUzA","00:21:40","00:21:42","we should just fully immerse ourselves,","should just fully immerse ourselves live together"
"EukpxRuDUzA","00:21:42","00:21:43","live together,","experience"
"EukpxRuDUzA","00:21:43","00:21:44","experience it, commit.","it commit really"
"EukpxRuDUzA","00:21:45","00:21:46","We feel like this is like our marriage.","we feel like this is like our marriage you know"
"EukpxRuDUzA","00:21:47","00:21:48","It is a huge commitment moving in with a partner.","it is a huge commitment moving in with a partner like"
"EukpxRuDUzA","00:21:49","00:21:49","Like this is huge.","this is huge"
"EukpxRuDUzA","00:21:50","00:21:52","But we're ready to make that commitment.","but we're ready to make that commitment and i mean"
"EukpxRuDUzA","00:21:53","00:21:55","We committed to being with each other a week after we met.","we committed to being with each other a week after we met so"
"EukpxRuDUzA","00:21:56","00:21:56","So we're pretty committed.","we're pretty committed we don't"
"EukpxRuDUzA","00:21:56","00:21:57","We dove right in.","write in and you"
"EukpxRuDUzA","00:21:58","00:21:59","- [Mom] When you know, you know.","know you know when you know you know my mom"
"EukpxRuDUzA","00:21:59","00:22:00","- My mom always told me that","always told me that"
"EukpxRuDUzA","00:22:00","00:22:02","and honestly like every other relationship I've had","honestly like every other relationship i've had"
"EukpxRuDUzA","00:22:03","00:22:05","and it's not to like the little those relationships,","and it's not to like belittle those relationships but i would always be like"
"EukpxRuDUzA","00:22:06","00:22:07","""Is this what it feels like to know?","is this what it feels like to know do"
"EukpxRuDUzA","00:22:08","00:22:08","""Do I know?","i know is this knowing"
"EukpxRuDUzA","00:22:08","00:22:09","""is this knowing?""","and if"
"EukpxRuDUzA","00:22:09","00:22:11","And if you have to ask yourself, you don't know.","you have to ask yourself you don't know and then i"
"EukpxRuDUzA","00:22:12","00:22:14","And then I met my partner now and I was like, ""Oh,""","met my partner now and i was like oh"
"EukpxRuDUzA","00:22:15","00:22:15","(claps)","it's like"
"EukpxRuDUzA","00:22:15","00:22:16","it hits you like a ton of bricks.","it hits you like a ton of bricks"
"EukpxRuDUzA","00:22:17","00:22:18","This is what it's like to know.","this is what it's like to know you have"
"EukpxRuDUzA","00:22:18","00:22:19","You have no questions.","no questions this is"
"EukpxRuDUzA","00:22:19","00:22:20","This is it.","it and so"
"EukpxRuDUzA","00:22:20","00:22:23","And so might as well dive right in and not waste time","might as well dive right in and not waste time and like"
"EukpxRuDUzA","00:22:23","00:22:24","and test it out.","test it"
"EukpxRuDUzA","00:22:25","00:22:26","Can we make this work for our future?","out can we make this work for our future"
"EukpxRuDUzA","00:22:27","00:22:27","So that's what we're doing.","so that's"
"EukpxRuDUzA","00:22:28","00:22:29","And I really hope you guys,","what we're doing and i really hope you guys even if you don't"
"EukpxRuDUzA","00:22:29","00:22:31","even if you don't agree with how fast we're moving","agree with how fast we're moving or"
"EukpxRuDUzA","00:22:32","00:22:33","or agree with living together before marriage","agree with living together before marriage or"
"EukpxRuDUzA","00:22:33","00:22:34","or whatever your belief system is,","whatever your belief system is"
"EukpxRuDUzA","00:22:35","00:22:37","I hope you can at least support me and believe that I'm","i hope you can at least support me and believe that i'm doing what i"
"EukpxRuDUzA","00:22:37","00:22:39","doing what I think is best for me right now.","think is best for me right now"
"EukpxRuDUzA","00:22:40","00:22:40","(air whooshing)","okay"
"EukpxRuDUzA","00:22:41","00:22:42","(laughing)","so it's the big"
"EukpxRuDUzA","00:22:42","00:22:43","- So it's the big move in day.","move-in day it is"
"EukpxRuDUzA","00:22:43","00:22:44","- It is Saturday.","saturday"
"EukpxRuDUzA","00:22:44","00:22:46","It is 11:40.","it is 11 40. his friend"
"EukpxRuDUzA","00:22:46","00:22:47","His friend is picking him up","is picking him up and he"
"EukpxRuDUzA","00:22:48","00:22:49","and he lives like five minutes away.","lives like five minutes away his friend is picking"
"EukpxRuDUzA","00:22:49","00:22:51","His friend is picking him up at like noon,","him up at like noon"
"EukpxRuDUzA","00:22:51","00:22:53","so we're really tight on time.","so we're really tight on time i'm trying to look cute"
"EukpxRuDUzA","00:22:53","00:22:54","I'm trying to look cute today for him.","today for him"
"EukpxRuDUzA","00:22:54","00:22:56","It's moving day, I want to remind him","you know it's like move-in day i want to remind him of why he fell"
"EukpxRuDUzA","00:22:56","00:22:59","of why he fell in love with me and chose to move in.","in love with me and chose to move in so the second morning"
"EukpxRuDUzA","00:22:59","00:23:01","So it's like a morning getting ready, shaving my legs,","getting ready shaving my legs all"
"EukpxRuDUzA","00:23:02","00:23:02","all the things.","the things feeling nervous"
"EukpxRuDUzA","00:23:02","00:23:03","- [Mom] Getting nervous?","of course"
"EukpxRuDUzA","00:23:03","00:23:05","- Of course, I'm like anxious, am excited.","i'm like anxious i'm excited i hope"
"EukpxRuDUzA","00:23:06","00:23:07","I hope like the surprise goes well,","like the surprise goes well we"
"EukpxRuDUzA","00:23:07","00:23:10","we need to finish putting this desk together.","have to finish putting this desk together it's actually very"
"EukpxRuDUzA","00:23:10","00:23:11","- [Mom] It's actually very easy.","easy thankfully"
"EukpxRuDUzA","00:23:12","00:23:13","","there's"
