"video_id","min_timecode","max_timecode","text.user","text.auto"
"Xq45598A7Vc","00:17:53","00:17:56","Safe from contagious diseases and motorcycle accidents,","contagious diseases and motorcycle safe from contagious diseases and motorcycle accidents from thunderstorms"
"Xq45598A7Vc","00:17:56","00:17:57","from thunderstorms and rogue baseballs,","and rogue"
"Xq45598A7Vc","00:17:58","00:18:00","I think I might be invincible.","baseballs i think i might be invincible theory"
"Xq45598A7Vc","00:18:00","00:18:03","Siri, cancel my doctor's appointment tomorrow.","cancel my doctor's appointment tomorrow"
"Xq45598A7Vc","00:18:03","00:18:04","I don't need it anymore.","i don't need it anymore"
"Xq45598A7Vc","00:18:05","00:18:07","I deserve to be rewarded for this moment of clarity.","i deserve to be rewarded for this moment of clarity"
"Xq45598A7Vc","00:18:08","00:18:10","I deserve a snack.","i deserve a deserve a"
"Xq45598A7Vc","00:18:10","00:18:13","(package opening)","snack"
"Xq45598A7Vc","00:18:13","00:18:14","",""
"Xq45598A7Vc","00:18:16","00:18:17","So I guess there is one down side.","so i guess there is one downside"
"Xq45598A7Vc","00:18:18","00:18:20","So to organize my final thoughts on all these products,","so to organize my final thoughts on all these products i'm going to"
"Xq45598A7Vc","00:18:20","00:18:22","I'm gonna be putting letter grades","be putting letter grades into a tier"
"Xq45598A7Vc","00:18:22","00:18:24","into a tier list because my brain is broken,","list because my brain is broken"
"Xq45598A7Vc","00:18:25","00:18:27","and that's the only way it knows how to assess things.","and that's the only way it knows how to assess things right"
"Xq45598A7Vc","00:18:28","00:18:29","Right off the bat, moon pod, straight up F.","off the bat moonpod straight up"
"Xq45598A7Vc","00:18:30","00:18:32","I wouldn't say it's an F tier product.","f i wouldn't say it's an f tier product if i got"
"Xq45598A7Vc","00:18:32","00:18:35","If I got it for free, I'd say it's like C at the best,","it for free i'd say it's like c at the best"
"Xq45598A7Vc","00:18:36","00:18:39","but I spent like 340 bucks I think for this thing.","but i spent like 340 bucks i think for this thing it"
"Xq45598A7Vc","00:18:40","00:18:42","It feels super cheap. It's not that comfortable.","feels super cheap it's not that comfortable it's"
"Xq45598A7Vc","00:18:43","00:18:44","It's very noisy, every time you move,","very noisy every time you move"
"Xq45598A7Vc","00:18:45","00:18:47","I feel like my wife can hear me from across the house.","i feel like my wife can hear me from across the house"
"Xq45598A7Vc","00:18:47","00:18:51","It feels like a $50 beanbag chair at the most.","it feels like a 50 beanbag chair at the most the"
"Xq45598A7Vc","00:18:52","00:18:53","The pillow cube was actually pretty comfortable.","pillow cube was actually pretty comfortable if"
"Xq45598A7Vc","00:18:53","00:18:56","If the moon pod was made out of the memory foam","the moon pod was made out of the memory foam that the pillow"
"Xq45598A7Vc","00:18:56","00:18:57","that the pillow cube was made out of,","key was made out of"
"Xq45598A7Vc","00:18:57","00:19:00","it would be the most comfortable fucking chair in the world.","it would be the most comfortable chair in the world my only"
"Xq45598A7Vc","00:19:00","00:19:01","My only thing with the pillow is that","thing with the pillow is that i"
"Xq45598A7Vc","00:19:01","00:19:04","I wish I had just went ahead and bought the bigger one.","wish i had just went ahead and bought the bigger one it's"
"Xq45598A7Vc","00:19:04","00:19:05","It's not very wide.","not very wide"
"Xq45598A7Vc","00:19:06","00:19:07","And if you move around in your sleep at all","and if you move around in your sleep"
"Xq45598A7Vc","00:19:08","00:19:10","which everybody does for the most part,","at all which everybody does for the most part you're gonna"
"Xq45598A7Vc","00:19:10","00:19:12","you're gonna wake up in some weird positions,","wake up in some weird positions which kind of"
"Xq45598A7Vc","00:19:13","00:19:13","which kind of defeats the purpose","defeats the purpose"
"Xq45598A7Vc","00:19:14","00:19:15","of having something that's supposed to like","of having something that's supposed to like"
"Xq45598A7Vc","00:19:16","00:19:17","keep you from waking up with neck pain.","keep you from waking up with neck pain the pants definitely"
"Xq45598A7Vc","00:19:17","00:19:18","The pants definitely grew on me as time went on.","grew on me as"
"Xq45598A7Vc","00:19:19","00:19:20","Really the only thing with these is that you","time went on really the only thing with these is that you"
"Xq45598A7Vc","00:19:21","00:19:24","cannot possibly justify the $89 price tag.","cannot possibly justify the 89 price tag"
"Xq45598A7Vc","00:19:24","00:19:26","I would say like 40 bucks at the most.","i would say like 40 bucks at the most"
"Xq45598A7Vc","00:19:27","00:19:28","This could go in either B or C.","this could go in either b or c"
"Xq45598A7Vc","00:19:29","00:19:31","I'm gonna put it in C just because of the price,","i'm gonna put it in c just because of the price um but"
"Xq45598A7Vc","00:19:31","00:19:33","but they are decent pants.","they're decent pants i'm also going to put the chili"
"Xq45598A7Vc","00:19:33","00:19:34","I'm also just going to put the chili chews in the C tier.","chews in"
"Xq45598A7Vc","00:19:35","00:19:37","Obviously I didn't personally like them,","the c tier obviously i didn't personally like them"
"Xq45598A7Vc","00:19:37","00:19:39","but I've never had spicy candy before.","but i've never had spicy candy before that's not"
"Xq45598A7Vc","00:19:40","00:19:40","That's not really my thing.","really my thing"
"Xq45598A7Vc","00:19:41","00:19:43","Probably the product that is most accurately priced","probably the product that is most accurately priced out"
"Xq45598A7Vc","00:19:43","00:19:44","out of everything on this list.","of everything on this list"
"Xq45598A7Vc","00:19:44","00:19:47","The MicroClimate mass is going straight to S tier.","the microclimate mass is going straight to s tier"
"Xq45598A7Vc","00:19:48","00:19:49","My only regret with it is I wish","my only regret with it is i"
"Xq45598A7Vc","00:19:50","00:19:51","I had spent more money on it.","wish i had spent more money on it i wish it cost"
"Xq45598A7Vc","00:19:51","00:19:53","I wish it costs twice as much.","twice as much and then the bidet"
"Xq45598A7Vc","00:19:53","00:19:55","And then the bidet, I think I'm gonna put that in A tier.","i think i'm gonna put that in a tier uh it"
"Xq45598A7Vc","00:19:56","00:19:56","It works pretty well.","works pretty"
"Xq45598A7Vc","00:19:57","00:19:58","It's the only thing on this list","well it's the only thing on this list"
"Xq45598A7Vc","00:19:59","00:20:01","that I probably would have bought anyway,","that i probably would have bought anyway but it was"
"Xq45598A7Vc","00:20:01","00:20:03","but it was pretty easy to hook up.","pretty easy to hook up and it's"
"Xq45598A7Vc","00:20:03","00:20:04","And it's the kind of thing that","the kind of thing that i'm gonna"
"Xq45598A7Vc","00:20:04","00:20:06","I'm gonna use pretty much every day.","use pretty much every"
"Xq45598A7Vc","00:20:07","00:20:09","If I were to take anything away from this video","day if i were to take anything away from this video it would probably"
"Xq45598A7Vc","00:20:09","00:20:10","it would probably be that","be that uh if you"
"Xq45598A7Vc","00:20:10","00:20:13","if you see something advertised to you on Instagram,","see something advertised to you on instagram"
"Xq45598A7Vc","00:20:13","00:20:15","it probably costs twice as much as it should.","it probably costs twice as much as it"
"Xq45598A7Vc","00:20:16","00:20:17","It's probably not as good of a product","should it's probably not as good of a product"
"Xq45598A7Vc","00:20:18","00:20:19","as you think it will be.","as you think it will be and the"
"Xq45598A7Vc","00:20:19","00:20:20","And the reviews can be misleading.","reviews can be misleading"
"Xq45598A7Vc","00:20:21","00:20:23","I guess the last thing I'm curious about is","i guess the last thing i'm curious about is after"
"Xq45598A7Vc","00:20:23","00:20:26","after engaging so much with the Instagram algorithm,","engaging so much with the instagram algorithm what"
"Xq45598A7Vc","00:20:26","00:20:28","what it thinks of me as a consumer.","it thinks of me as a consumer"
"Xq45598A7Vc","00:20:29","00:20:29","Now that they've identified me","now that they've identified"
"Xq45598A7Vc","00:20:30","00:20:32","as someone who literally buys everything,","me as someone who literally buys everything what are they"
"Xq45598A7Vc","00:20:32","00:20:33","what are they gonna advertise to me next?","going to advertise to me next"
"Xq45598A7Vc","00:20:34","00:20:36","Is it just going to be crazy expensive stuff?","is it just going to be crazy expensive stuff are they going to try to"
"Xq45598A7Vc","00:20:36","00:20:37","Or are they going to try and get me to buy a car?","get me to buy a car i'm"
"Xq45598A7Vc","00:20:38","00:20:39","I'm actually kind of curious.","actually kind of curious get through some stories"
"Xq45598A7Vc","00:20:39","00:20:41","Get through some stories and they think I'm depressed.","and they think i'm depressed"
"Xq45598A7Vc","00:20:42","00:20:43","(chuckling) God dammit.","goddammit depressed goddammit"
"Xq45598A7Vc","00:20:44","00:20:44","(Tune of ""I Wanna Dance With Somebody"")","[Music]"
"Xq45598A7Vc","00:20:45","00:20:47","♪ Oh, I be gone off that Molly ♪","a lot of people"
"Xq45598A7Vc","00:20:48","00:20:49","A lot of people say that breakfast","say that breakfast is the most"
"Xq45598A7Vc","00:20:49","00:20:50","is the most important meal of the day,","important meal of the day but i"
"Xq45598A7Vc","00:20:51","00:20:53","but I think that dinner is easily in the top three.","think that dinner is easily in the top three when you've just"
"Xq45598A7Vc","00:20:54","00:20:55","When you've just spent all day at work, though,","spent all day at work though it can be"
"Xq45598A7Vc","00:20:55","00:20:57","it can be daunting to think of what meal to make.","daunting to think of what meal to make do i even"
"Xq45598A7Vc","00:20:58","00:20:59","Do I even have the right ingredients?","have the right ingredients is"
"Xq45598A7Vc","00:20:59","00:21:01","Is my fridge plugged in?","my fridge plugged in why did"
"Xq45598A7Vc","00:21:01","00:21:02","Why did I unplug my fridge?","i unplug my fridge"
"Xq45598A7Vc","00:21:03","00:21:04","These are the kinds of questions we ask ourselves","these are the kind of questions we ask ourselves that lead"
"Xq45598A7Vc","00:21:05","00:21:07","that lead to getting fast food six times a week.","to getting fast food six times a week but it doesn't have"
"Xq45598A7Vc","00:21:07","00:21:08","But it doesn't have to be that way.","to be that way"
"Xq45598A7Vc","00:21:08","00:21:10","With Hello Fresh, you get three delicious meals,","with hellofresh you get three delicious meals easy"
"Xq45598A7Vc","00:21:11","00:21:13","easy to follow recipe cards, pre-portioned ingredients,","to follow recipe cards pre-portioned ingredients so there's less"
"Xq45598A7Vc","00:21:14","00:21:15","so there's less prep and nothing goes to waste,","prep and nothing goes to"
"Xq45598A7Vc","00:21:15","00:21:17","and the excitement and satisfaction that comes with","waste and the excitement and satisfaction that comes"
"Xq45598A7Vc","00:21:18","00:21:20","getting a package delivered to your house every week.","with getting a package delivered to your house every week and that's my"
"Xq45598A7Vc","00:21:20","00:21:21","And that's my favorite part.","favorite part worried you"
"Xq45598A7Vc","00:21:21","00:21:23","Worried you might end up with a meal you won't like?","might end up with a meal you won't like then pick a different"
"Xq45598A7Vc","00:21:23","00:21:25","Then pick a different one. I do it all the time.","one i do it all the time the"
"Xq45598A7Vc","00:21:26","00:21:27","Their app makes it super easy to swap something out","rat makes it super easy to swap something"
"Xq45598A7Vc","00:21:27","00:21:28","in a matter of seconds.","out in a matter of seconds"
"Xq45598A7Vc","00:21:29","00:21:30","You can even throw in fun extras","you can even throw in fun extras like cinnamon"
"Xq45598A7Vc","00:21:30","00:21:33","like cinnamon rolls, garlic bread, a big bucket of tar.","rolls garlic bread a big bucket of tar"
"Xq45598A7Vc","00:21:34","00:21:34","Oh, what's that?","what's that"
"Xq45598A7Vc","00:21:35","00:21:36","Oh, they don't do the tar?","oh they don't do the tar"
"Xq45598A7Vc","00:21:37","00:21:37","Okay. Got it.","okay got it cookies"
"Xq45598A7Vc","00:21:38","00:21:38","Cookies.","even if"
"Xq45598A7Vc","00:21:38","00:21:40","You're someone with specific dietary preferences.","you're someone with specific dietary preferences"
"Xq45598A7Vc","00:21:41","00:21:41","Hello Fresh still has you covered.","hellofresh still has you"
"Xq45598A7Vc","00:21:42","00:21:43","They've got low calorie, low carb,","covered they've got low calorie low carb"
"Xq45598A7Vc","00:21:44","00:21:46","vegetarian, and pescatarian meals to choose from","vegetarian and pescatarian meals to choose from every week"
"Xq45598A7Vc","00:21:46","00:21:48","every week, sourced directly from farmers.","sourced directly from farmers listen"
"Xq45598A7Vc","00:21:49","00:21:49","Listen, I'm gonna be real with you chief.","i'm gonna be real with you chief i'm"
"Xq45598A7Vc","00:21:50","00:21:52","I'm not just a spokes guy for Hello Fresh.","not just a spokes guy for hellofresh i'm also a customer"
"Xq45598A7Vc","00:21:52","00:21:55","I'm also a customer and I wouldn't spend my own money","and i wouldn't spend my own money on something i"
"Xq45598A7Vc","00:21:55","00:21:56","on something I didn't like.","didn't like"
"Xq45598A7Vc","00:21:57","00:21:59","Except for all this stuff from this video, ignore that.","except for all the stuff from this video ignore"
"Xq45598A7Vc","00:22:00","00:22:01","Hello Fresh is legitimately delicious.","that hellofresh is legitimately delicious i'm so"
"Xq45598A7Vc","00:22:02","00:22:02","I'm so glad my wife and I","glad my wife and"
"Xq45598A7Vc","00:22:02","00:22:04","started ordering them a few years ago.","i started ordering them a few years ago we've gotten"
"Xq45598A7Vc","00:22:05","00:22:06","We've gotten them almost every week since then","them almost every week since then and"
"Xq45598A7Vc","00:22:07","00:22:08","If you're interested in trying out Hello Fresh","we love it if you're interested in trying out hellofresh with a free meal"
"Xq45598A7Vc","00:22:08","00:22:10","with a free meal, I'll do you 11 better.","i'll do you 11 better that's"
"Xq45598A7Vc","00:22:11","00:22:11","That's right.","right 12 free meals"
"Xq45598A7Vc","00:22:11","00:22:12","12 free meals, including free shipping.","including"
"Xq45598A7Vc","00:22:13","00:22:13","And all you have to do is go to hellofresh.com","free shipping and all you have to"
"Xq45598A7Vc","00:22:14","00:22:16","and use my promo code ImALittleStinker12.","do is go to hellofresh.com shipping and all you have to do is go to hellofresh.com and use my promo code i'm a little stinker"
"Xq45598A7Vc","00:22:17","00:22:19","It sounds fake, but it's legit, I promise.","12. it sounds fake but it's legit i promise"
"Xq45598A7Vc","00:22:20","00:22:21","Thank you to Hello Fresh for sponsoring today's video.","thank you to hella fresh response today's video"
"Xq45598A7Vc","00:22:22","00:22:24","Now, back to me doing an outro that I haven't filmed yet.","now back to me doing an outro that i haven't filmed"
"Xq45598A7Vc","00:22:25","00:22:27","Okay, well, I'm filming it now. Jeez.","yet okay well i'm filming it now geez uh"
"Xq45598A7Vc","00:22:27","00:22:29","Thank you guys so much for watching today's video","thank you guys so much for watching today's video"
"Xq45598A7Vc","00:22:30","00:22:31","all the way up until the end,","all the way up until the end or"
"Xq45598A7Vc","00:22:31","00:22:33","or for some reason clicking on it","for some reason clicking on it and skipping directly"
"Xq45598A7Vc","00:22:34","00:22:34","and skipping directly to this part.","to this"
"Xq45598A7Vc","00:22:35","00:22:36","I hope you all learned something today.","part i hope you all learned something today i know"
"Xq45598A7Vc","00:22:36","00:22:37","I know I sure did.","i sure did"
"Xq45598A7Vc","00:22:38","00:22:41","I learned not to buy stuff online cause most of it sucks.","i learned not to buy stuff online because most of it"
"Xq45598A7Vc","00:22:42","00:22:43","Or you know what? Maybe that's not what I learned.","sucks or you know what maybe that's not what i learned because i had a"
"Xq45598A7Vc","00:22:43","00:22:45","Cause I had a lot of fun making this video","lot of fun making this video and i might do"
"Xq45598A7Vc","00:22:45","00:22:46","and I might do a part two somewhere down the road.","a part two somewhere down the road"
"Xq45598A7Vc","00:22:47","00:22:49","That depression clinic isn't gonna research itself.","that depression clinic isn't gonna research itself anyway"
"Xq45598A7Vc","00:22:50","00:22:50","Anyway, thank you again for watching.","thank you again"
"Xq45598A7Vc","00:22:51","00:22:52","I will see all of you tomorrow","for watching i will see all of you tomorrow for our big"
"Xq45598A7Vc","00:22:52","00:22:53","for our big date at Olive Garden.","date at"
"Xq45598A7Vc","00:22:54","00:22:54","",""
"Xq45598A7Vc","00:22:54","00:22:54","Bye.","olive garden bye"
