"video_id","min_timecode","max_timecode","text.user","text.auto"
"E2d-fbZVezU","00:08:01","00:08:01","I had people that had worked hard on it,","that worked hard on it but"
"E2d-fbZVezU","00:08:02","00:08:02","but I remember there was a moment","i remember there was a moment"
"E2d-fbZVezU","00:08:03","00:08:03","I was standing there with Drama.","i was standing there with drama"
"E2d-fbZVezU","00:08:04","00:08:05","And I was kinda thinking about the album","and i was kind of thinking about the album and i was"
"E2d-fbZVezU","00:08:05","00:08:07","And I was thinking about his album,","thinking about his out i wasn't really there"
"E2d-fbZVezU","00:08:07","00:08:09","I wasn't really there and he tapped me on the shoulder","and he he tapped me on the shoulder he's"
"E2d-fbZVezU","00:08:09","00:08:11","he's like, ""how does it feel?"" I was like, ""what?""","like how does it feel i was like what he's like you're here"
"E2d-fbZVezU","00:08:12","00:08:13","And I was like, ""you think so?""","and i was like you think so"
"E2d-fbZVezU","00:08:13","00:08:16","And I knew he wasn't just saying it in a loose way.","and i knew he wasn't just saying it in a loose way he was"
"E2d-fbZVezU","00:08:16","00:08:18","He was saying any minute I'm here.","saying any minute i'm here moments like that have"
"E2d-fbZVezU","00:08:18","00:08:20","Moments like that have, you know, given me the confirmation,","you know given me the confirmation"
"E2d-fbZVezU","00:08:20","00:08:22","I'm here to stay. I'm not going anywhere.","i'm here to stay i'm not going anywhere city"
"E2d-fbZVezU","00:08:23","00:08:26","","talking we taking notes telling them all to keep making posts wish he could but he can't get"
"E2d-fbZVezU","00:08:27","00:08:29","Being from Louisville, Kentucky.","close being from louisville kentucky i get"
"E2d-fbZVezU","00:08:29","00:08:30","I get a lot of love out of there,","a lot of love out of there"
"E2d-fbZVezU","00:08:31","00:08:32","but there's also plenty of hate.","but there's also plenty of hate i keep"
"E2d-fbZVezU","00:08:32","00:08:33","I keep up. You know what I mean?","up you know what i mean i see"
"E2d-fbZVezU","00:08:33","00:08:35","I see things. Probably more than I need to.","things probably more than i need to sometimes"
"E2d-fbZVezU","00:08:35","00:08:37","Sometimes I think the place you're from","i think the place you're from has more"
"E2d-fbZVezU","00:08:37","00:08:39","has more hate and envy than other places.","hate and envy than other places"
"E2d-fbZVezU","00:08:39","00:08:42","I've seen people I grew up with, old classmates,","i've seen people i grew up with old classmates"
"E2d-fbZVezU","00:08:43","00:08:46","people I knew, switched to crucifying me online","people i knew switched to um crucifying me online"
"E2d-fbZVezU","00:08:47","00:08:48","when some people have my number.","when some people have my number og"
"E2d-fbZVezU","00:08:49","00:08:51","","is so proud of me that he choking up while he making toast i"
"E2d-fbZVezU","00:08:52","00:08:54","I love that line because I think every time I hear that line","love that line because i think every time i hear that"
"E2d-fbZVezU","00:08:55","00:08:56","I think of that line. It paints a picture.","line or think of that line it paints a picture"
"E2d-fbZVezU","00:08:56","00:08:58","You see it happening. You see the dinner,","you see it happening you see the dinner you see the you"
"E2d-fbZVezU","00:08:58","00:09:00","you see, you don't even have to know who it is.","see you don't even have to know who"
"E2d-fbZVezU","00:09:01","00:09:01","You just know somebody that's an OG to me,","it is you just know somebody"
"E2d-fbZVezU","00:09:02","00:09:02","You just know somebody that's an OG to me,","that's og"
"E2d-fbZVezU","00:09:03","00:09:05","holding up a toast saying they're proud and choking up.","to me holding up a toast and saying they're proud and choking up is"
"E2d-fbZVezU","00:09:05","00:09:06","It's beautiful.","beautiful i'm"
"E2d-fbZVezU","00:09:06","00:09:09","","the type that you can't control said i would then i made it so"
"E2d-fbZVezU","00:09:10","00:09:13","I genuinely feel like anything I want I can make happen.","i genuinely said i would then i made it so i genuinely feel like anything i want i can make happen"
"E2d-fbZVezU","00:09:14","00:09:15","Out of pure will and determination.","out of pure will and determination it's a cliche"
"E2d-fbZVezU","00:09:15","00:09:17","It's a cliche to tell you as a kid,","to tell you as a kid if you want it you"
"E2d-fbZVezU","00:09:17","00:09:18","if you want it, you can have it, but you can","can have it but you can you know"
"E2d-fbZVezU","00:09:19","00:09:20","You know what it is, I'm a control freak.","what it is i'm a control freak it's"
"E2d-fbZVezU","00:09:20","00:09:22","It's something I'm actually trying to learn how to balance,","something i'm actually trying to learn how to balance"
"E2d-fbZVezU","00:09:22","00:09:24","but I'm a control freak. I try to control so much.","but i'm a control freak i try to control so much it's"
"E2d-fbZVezU","00:09:25","00:09:25","It's really hard for me to let go.","really hard for me"
"E2d-fbZVezU","00:09:26","00:09:27","In that, I'm so extreme.","to let go in that i'm so extreme and i"
"E2d-fbZVezU","00:09:27","00:09:29","And I think a lot of people that are ambitious could relate.","think a lot of people that are ambitious can"
"E2d-fbZVezU","00:09:30","00:09:31","I feel like I can control my destiny.","relate i feel like i can control my destiny i"
"E2d-fbZVezU","00:09:32","00:09:33","I feel like I can choke hold out of this life what I want.","feel like i can chokehold out as this"
"E2d-fbZVezU","00:09:34","00:09:34","I feel like I can get what I want outta this life","life what i want i feel like"
"E2d-fbZVezU","00:09:35","00:09:36","I feel like I can get what I want outta this life","i can get what i want out of his life"
"E2d-fbZVezU","00:09:37","00:09:39","by pure will and determination.","by pure will and determination i don't clear up rumors"
"E2d-fbZVezU","00:09:39","00:09:41","","will and determination i don't clear up rumors where's your sense of humor it's different"
"E2d-fbZVezU","00:09:41","00:09:42","It's different. You get to this level","you get to this"
"E2d-fbZVezU","00:09:43","00:09:44","and you have to like have this moment where you","level and you have to like have this moment where you kind of just"
"E2d-fbZVezU","00:09:44","00:09:46","kind of just let go and you realize","let go and you realize you can't control"
"E2d-fbZVezU","00:09:46","00:09:47","you can't control what they're saying about you.","what they're saying about you"
"E2d-fbZVezU","00:09:48","00:09:49","You don't have any control over what the narrative is.","you don't have any control over what the narrative"
"E2d-fbZVezU","00:09:50","00:09:51","So, for me, it's been, over the last couple of years,","is so for me it's been over the last couple years a real"
"E2d-fbZVezU","00:09:51","00:09:53","a real process of stepping into the limelight a little more","process of stepping into the limelight a"
"E2d-fbZVezU","00:09:54","00:09:56","and realizing that some of these stories are going to run","little more and realizing that some of these stories are gonna run"
"E2d-fbZVezU","00:09:57","00:09:57","and I don't need to address everything.","and i don't need"
"E2d-fbZVezU","00:09:58","00:09:59","and I don't need to address everything.","to address everything people"
"E2d-fbZVezU","00:10:00","00:10:00","People think this and that,","think this and that"
"E2d-fbZVezU","00:10:01","00:10:04","and it's a real freeing thing for me to step back and say,","and it's a real freeing thing for me to step back and say"
"E2d-fbZVezU","00:10:05","00:10:08","whatever you want, whatever you want. Think it.","whatever you want whatever you want think it"
"E2d-fbZVezU","00:10:09","00:10:10","I'm at peace.","i'm at peace i'm done making"
"E2d-fbZVezU","00:10:10","00:10:12","","jokes cause they got old like baby boomers i don't"
"E2d-fbZVezU","00:10:12","00:10:14","I don't feel pressure to joke all the time.","feel pressure to joke all the time people"
"E2d-fbZVezU","00:10:14","00:10:16","People love when I joke, they want me to joke.","love when i joke they want me to joke you"
"E2d-fbZVezU","00:10:17","00:10:19","You know, last time I was on here, I had some jokes,","know last time i was on here i had some jokes but i don't feel"
"E2d-fbZVezU","00:10:19","00:10:21","but I don't feel no pressure","no pressure i got to make him laugh"
"E2d-fbZVezU","00:10:21","00:10:22","I've gotta make 'em laugh, I've gotta make 'em laugh.","i got to make him laugh because i'm a"
"E2d-fbZVezU","00:10:23","00:10:23","I'm not a two dimensional character.","human being i'm not a two-dimensional"
"E2d-fbZVezU","00:10:24","00:10:24","I'm not a two dimensional character.","character"
"E2d-fbZVezU","00:10:25","00:10:25","I'm not somebody that feels like,","i'm not somebody that feels"
"E2d-fbZVezU","00:10:26","00:10:27","""Ooh, gotta stick to the script. They need to love me""","like ooh gotta stick to the script they need to"
"E2d-fbZVezU","00:10:28","00:10:28","When I wanna be serious I'm gonna be serious.","love me when i want to be serious"
"E2d-fbZVezU","00:10:29","00:10:29","When I wanna be funny, I'm gonna be funny.","i'm gonna be serious when i want to be funny"
"E2d-fbZVezU","00:10:30","00:10:31","When I wanna be funny, I'm gonna be funny.","i'm gonna be funny when i want to be"
"E2d-fbZVezU","00:10:31","00:10:32","When I wanna be outgoing, I'm gonna be outgoing.","outgoing i'm gonna be outgoing"
"E2d-fbZVezU","00:10:32","00:10:34","When I wanna be shy, I'm gonna be shy.","when i want to be shy and we'll be shy we'll see if"
"E2d-fbZVezU","00:10:34","00:10:35","We'll see if I'm really done making jokes.","i'm really done making jokes"
"E2d-fbZVezU","00:10:36","00:10:38","I just want people to know that I'm real about this.","i just want people to know that i'm i'm real about this"
"E2d-fbZVezU","00:10:39","00:10:40","And I like bounce bouncing in and out.","and i like bounce bouncing in and out nobody can"
"E2d-fbZVezU","00:10:40","00:10:42","Nobody can tell me what I am. I can't be put in a box.","tell me what i am i can't be put in a box i"
"E2d-fbZVezU","00:10:42","00:10:43","I can't be pigeonholed.","can't be pigeonholed turn"
"E2d-fbZVezU","00:10:44","00:10:46","","my haters to consumers i make vets feel like they're juniors"
"E2d-fbZVezU","00:10:47","00:10:48","I've experienced that my whole life.","i've experienced that my whole life"
"E2d-fbZVezU","00:10:48","00:10:50","Seeing skeptics turn into, ""you know what? He's pretty hard""","seeing skeptics turn it you know what he's pretty hard"
"E2d-fbZVezU","00:10:51","00:10:52","I've seen a lot of people on the fence","i've seen a lot of people on the fence come over"
"E2d-fbZVezU","00:10:52","00:10:53","come over to my side. So I've experienced that.","to my side so i've experienced"
"E2d-fbZVezU","00:10:54","00:10:54","I think I meet, sometimes, people that are older than me","that i think"
"E2d-fbZVezU","00:10:55","00:10:56","I think I meet, sometimes, people that are older than me","i meet sometimes people that are older than me in the game"
"E2d-fbZVezU","00:10:56","00:10:57","in the game and like, they learn,","and like they learn as"
"E2d-fbZVezU","00:10:58","00:10:59","as much as I can take from them,","much as i can take from them they could learn something from"
"E2d-fbZVezU","00:10:59","00:11:00","they can learn something from me.","me say your time is coming"
"E2d-fbZVezU","00:11:00","00:11:04","","soon but just like oklahoma mine is coming sooner i'm competitive"
"E2d-fbZVezU","00:11:04","00:11:06","I'm competitive and I see my peers.","and i see my peers"
"E2d-fbZVezU","00:11:07","00:11:08","I see the people that are in my class and my generation.","i see the people that are in my class and my"
"E2d-fbZVezU","00:11:09","00:11:11","It's like, ""oh, you think you're the one?","generation it's like oh you think you think you're the one you think you're"
"E2d-fbZVezU","00:11:11","00:11:13","You think you're the one that everyone wants to raise up?","the one that everyone wants to raise up you think"
"E2d-fbZVezU","00:11:13","00:11:16","You think you're that guy?"" You're not that guy pal.","you're that guy you're not that guy pal"
"E2d-fbZVezU","00:11:17","00:11:18","That's how I feel though. That's how you're not that guy pal","that's how i feel though that's how you're not that guy pal"
"E2d-fbZVezU","00:11:19","00:11:20","You think it's coming soon for you? It might be.","you think it's coming soon for you it might"
"E2d-fbZVezU","00:11:21","00:11:21","But mine, my time is coming sooner.","be but mine my time"
"E2d-fbZVezU","00:11:22","00:11:22","But mine, my time is coming sooner.","is covered"
"E2d-fbZVezU","00:11:23","00:11:24","I'm 'bout to take over this whole shit,","sooner i'm about to take over this whole [ __ ] the"
"E2d-fbZVezU","00:11:25","00:11:27","The Oklahoma Sooners, University of Oklahoma's mascot,","oklahoma sooners oklahoma university oklahoma's mascot is"
"E2d-fbZVezU","00:11:28","00:11:28","is the Sooners.","sooners i'm just a late"
"E2d-fbZVezU","00:11:29","00:11:32","","bloomer i didn't peek in high school i'm still out here getting cuter in high school"
"E2d-fbZVezU","00:11:32","00:11:34","In high school I couldn't dress that well,","couldn't i couldn't dress that well i don't"
"E2d-fbZVezU","00:11:35","00:11:36","I don't think I was cuttin' my hair","think i was cutting my hair the"
"E2d-fbZVezU","00:11:36","00:11:37","the way I would cut it now.","way i would cut it now"
"E2d-fbZVezU","00:11:38","00:11:39","You figure out how you want to look along the way.","you figure out how you want to look along the way but i was figuring"
"E2d-fbZVezU","00:11:39","00:11:40","But I was figuring out who I was first.","out who"
"E2d-fbZVezU","00:11:41","00:11:41","I wasn't masking myself with appearance. I was being me.","i was first i wasn't"
"E2d-fbZVezU","00:11:42","00:11:45","I wasn't masking myself with appearance. I was being me.","masking myself with appearance i was being me i just think"
"E2d-fbZVezU","00:11:45","00:11:46","I just think as I got into this and I realized","as i got into this and i realized"
"E2d-fbZVezU","00:11:47","00:11:49","""oh, you gotta look a certain way."" I started cleaning up.","oh you got to look a certain way i started cleaning up i started paying attention"
"E2d-fbZVezU","00:11:49","00:11:50","I started paying attention to how I wanna look.","to how i want to"
"E2d-fbZVezU","00:11:51","00:11:52","I don't think I, you know, I switched it up.","look i don't think i you know i switched it up i just think"
"E2d-fbZVezU","00:11:52","00:11:55","I just think I grew into myself a little bit.","i i grew into myself a little bit all these social"
"E2d-fbZVezU","00:11:56","00:11:59","","networks and computers got these [ __ ] walking around like damn losers what am i saying"
"E2d-fbZVezU","00:11:59","00:12:03","What am I seeing online? Ratio, ratio, ratio.","online ratio ratio ratio ll young"
"E2d-fbZVezU","00:12:03","00:12:05","L, L, Young Boy better.","boy better the computers"
"E2d-fbZVezU","00:12:05","00:12:08","The Computers by Rowdy Rebel. His very first line,","by rowdy rebel his very first line all"
"E2d-fbZVezU","00:12:08","00:12:12","""all these social networks and these computers.""","these social networks in these computers um that's kind"
"E2d-fbZVezU","00:12:12","00:12:15","That's kinda what I wanted to pay homage to.","of what i wanted to pay homage to"
"E2d-fbZVezU","00:12:16","00:12:17","","i'm in the street baby i'm that [ __ ]"
"E2d-fbZVezU","00:12:17","00:12:19","I'm that motherfucker that's grown up watching everything","that's that's growing up watching"
"E2d-fbZVezU","00:12:20","00:12:21","watching everything, how it plays out.","everything watching everything how it plays out i've"
"E2d-fbZVezU","00:12:22","00:12:25","I've learned the fall downs of artists, the risings","learned the the fall downs of artists the risings"
"E2d-fbZVezU","00:12:26","00:12:27","and what happened and why it happened.","and what happened and why it happened"
"E2d-fbZVezU","00:12:28","00:12:29","And I'm acquiring that knowledge for myself.","and i'm acquiring that knowledge"
"E2d-fbZVezU","00:12:30","00:12:32","","for myself all right"
"E2d-fbZVezU","00:12:32","00:12:34","All right, let me look like I'm not anxious or anything.","let me look like i'm not anxious or anything impostor"
"E2d-fbZVezU","00:12:36","00:12:39","","[Laughter] anxious or anything impostor [Laughter]"
"E2d-fbZVezU","00:12:40","00:12:41","- Aw man this is great, this is great","oh man this is great this is great it might"
"E2d-fbZVezU","00:12:42","00:12:42","might be the first time I'm doing this.","be the first time"
"E2d-fbZVezU","00:12:44","00:12:45","the entire interview.","i'm gonna do like this the entire interview"
"E2d-fbZVezU","00:12:45","00:12:45","",""
