"video_id","min_timecode","max_timecode","text.user","text.auto"
"K_q-xnYRugQ","00:19:41","00:19:45","Which frankly makes sense because that’s beyond what a circuit breaker is designed to manage.","makes sense because that's beyond what a circuit breaker is designed to manage"
"K_q-xnYRugQ","00:19:45","00:19:48","The only conclusion I feel comfortable making here","the only conclusion i feel comfortable making here"
"K_q-xnYRugQ","00:19:49","00:19:52","is that I don’t have enough information to come to a meaningful conclusion.","is that i don't have enough information to come to a meaningful conclusion information to come to a meaningful conclusion i don't think"
"K_q-xnYRugQ","00:19:52","00:19:54","I don’t think this isn’t a problem,","this isn't a problem"
"K_q-xnYRugQ","00:19:55","00:19:58","especially since 20A circuits are so common these days,","especially since 20 amp circuits are so common these days but in all"
"K_q-xnYRugQ","00:19:58","00:20:01","but in all likelihood it’s probably still a small one.","likelihood it's probably still a small one"
"K_q-xnYRugQ","00:20:02","00:20:06","People are well-trained to be leery of overloading stuff, for the most part.","people are well trained to be leery of overloading stuff for the most part"
"K_q-xnYRugQ","00:20:07","00:20:11","As it is, electrical problems are by no means the leading cause of house fires,","as it is electrical problems are by no means the leading cause of house fires"
"K_q-xnYRugQ","00:20:11","00:20:14","accounting for only 13% in the US.","accounting for only 13 in the us"
"K_q-xnYRugQ","00:20:15","00:20:19","But I do think it’s telling that the NEC is making us put outlets everywhere","but i do think it's telling that the nec is making us put outlets everywhere"
"K_q-xnYRugQ","00:20:20","00:20:25","so that we don’t need to - or shouldn’t need to - use extension cords.","so that we don't need to or shouldn't need to use extension cords it seems"
"K_q-xnYRugQ","00:20:25","00:20:28","It seems we know that they’re dangerous","we know that they're dangerous but are addressing"
"K_q-xnYRugQ","00:20:28","00:20:33","but are addressing that danger in what I would call an insufficient way.","that danger in what i would call an insufficient way i understand the"
"K_q-xnYRugQ","00:20:33","00:20:36","I understand the impulse to eliminate the need for extension cords","impulse to eliminate the need for extension cords which"
"K_q-xnYRugQ","00:20:37","00:20:39","which would in theory nip the problem in the bud.","would in theory nip the problem in the bud"
"K_q-xnYRugQ","00:20:40","00:20:45","But as I said, extension cords are often used not because there’s no outlet within reach,","but as i said extension cords are often used not because there's no outlet within reach but"
"K_q-xnYRugQ","00:20:45","00:20:48","but because it’s a cheap and convenient splitter.","because it's a cheap and convenient splitter"
"K_q-xnYRugQ","00:20:49","00:20:52","I think the problem at hand is imagined incorrectly,","i think the problem at hand is imagined incorrectly i think the problem at hand is imagined incorrectly"
"K_q-xnYRugQ","00:20:53","00:20:54","so the solution doesn’t fit.","so the solution doesn't fit"
"K_q-xnYRugQ","00:20:55","00:21:00","I would say we should consider addressing the danger of the thing itself,","i would say we should consider addressing the danger of the thing itself and not try"
"K_q-xnYRugQ","00:21:00","00:21:03","and not try to reduce the need for the thing.","to reduce the need for the thing and not try to reduce the need for the thing we could"
"K_q-xnYRugQ","00:21:03","00:21:09","We could mitigate much of the danger quite easily with a ten cent fuse in the plug.","mitigate much of the danger quite easily with a 10 cent fuse in the plug our electrical"
"K_q-xnYRugQ","00:21:09","00:21:13","Our electrical safety isn’t exactly… great.","safety isn't exactly great"
"K_q-xnYRugQ","00:21:14","00:21:15","I don’t think it’s awful by any means","i don't think it's awful by any means"
"K_q-xnYRugQ","00:21:16","00:21:18","and it does continue to get better year over year,","and it does continue to get better year over year"
"K_q-xnYRugQ","00:21:19","00:21:22","but we could do with an examination of all these items.","but we could do with an examination of all these items"
"K_q-xnYRugQ","00:21:23","00:21:26","If you’re smart about how you use extension cords,","if you're smart about how you use extension cords you don't really need"
"K_q-xnYRugQ","00:21:26","00:21:27","you really don’t need to worry.","to worry"
"K_q-xnYRugQ","00:21:27","00:21:33","But it still makes me uncomfortable how we’re OK with stepping the wire gauge down twice","but it still makes me uncomfortable how we're okay with stepping the wire gauge down twice"
"K_q-xnYRugQ","00:21:34","00:21:38","once it leaves the wall and not doing anything to prevent overloading it.","down twice once it leaves the wall and not doing anything to prevent overloading it and frankly"
"K_q-xnYRugQ","00:21:38","00:21:40","And frankly, this isn’t even limited to extension cords.","this isn't even limited to extension cords"
"K_q-xnYRugQ","00:21:41","00:21:45","As far as I’m concerned everything should be protected by a user-replaceable fuse","as far as i'm concerned everything should be protected by a user replaceable fuse"
"K_q-xnYRugQ","00:21:46","00:21:48","sized for its cord set and purpose.","sized for its cord set and purpose"
"K_q-xnYRugQ","00:21:49","00:21:49","You know.","you know reasonable"
"K_q-xnYRugQ","00:21:49","00:21:50","Reasonable precaution.","precaution"
"K_q-xnYRugQ","00:21:51","00:21:52","What a concept!","what a concept anyway"
"K_q-xnYRugQ","00:21:52","00:21:53","Anyway, for now,","for now just"
"K_q-xnYRugQ","00:21:53","00:21:56","just be smart with extension cords and power strips.","be smart with extension cords and power strips"
"K_q-xnYRugQ","00:21:57","00:22:00","Be sure to use one that’s appropriate for whatever you need to do with it.","be sure to use one that's appropriate for whatever you need to do with it"
"K_q-xnYRugQ","00:22:01","00:22:02","And to be clear,","and to be clear i"
"K_q-xnYRugQ","00:22:02","00:22:05","I use these cheap ones all the time,","use these cheap ones all the time"
"K_q-xnYRugQ","00:22:06","00:22:10","it’s not like I have anything against them or consider them terrifyingly dangerous","it's not like i have anything against them or consider them terrifyingly dangerous"
"K_q-xnYRugQ","00:22:11","00:22:14","It’s just… there’s a component of risk to their use","it's just there's a component of risk to their use that i"
"K_q-xnYRugQ","00:22:15","00:22:19","that I feel should be more widely known and, hopefully one day, addressed.","feel should be more widely known and hopefully one day addressed"
"K_q-xnYRugQ","00:22:19","00:22:21","","to close"
"K_q-xnYRugQ","00:22:21","00:22:24","To close out, here’s that language quirk I mentioned in the beginning.","out here's that language quirk i mentioned in the beginning"
"K_q-xnYRugQ","00:22:24","00:22:26","It has to do with the word “safer.”","it has to do with the word safer"
"K_q-xnYRugQ","00:22:27","00:22:29","See, here’s what I said in that original video.","see here's what i said in that original video in"
"K_q-xnYRugQ","00:22:30","00:22:33","In any given scenario where one is receiving an electric shock,","any given scenario where one is receiving an electric shock"
"K_q-xnYRugQ","00:22:34","00:22:38","a lower voltage is safer than a higher one when all other factors are the same.","a lower voltage is safer than a higher one when all other factors are the same"
"K_q-xnYRugQ","00:22:39","00:22:47","Therefore, 120V could (and I would say should) be considered safer than 240V.","therefore 120 volts could and i would say should be considered safer than 240 volts"
"K_q-xnYRugQ","00:22:47","00:22:48","Now, here’s where things get wonky.","now here's where things get wonky"
"K_q-xnYRugQ","00:22:49","00:22:54","I use the word “safer” synonymously with “less dangerous.”","i use the word safer synonymously with less dangerous"
"K_q-xnYRugQ","00:22:54","00:22:59","Just as how I think extension cords would be safer if they had fuses.","just as how i think extension cords would be safer if they had fuses"
"K_q-xnYRugQ","00:23:00","00:23:04","But that doesn’t necessarily mean that they would be 100% safe.","but that doesn't necessarily mean that they would be 100 safe but i"
"K_q-xnYRugQ","00:23:04","00:23:11","But I found that a lot of people interpret the word “safer” as implying some amount of baseline safety.","found that a lot of people interpret the word safer as implying some amount of baseline safety"
"K_q-xnYRugQ","00:23:11","00:23:13","I found out because people told me!","i found out because people told me"
"K_q-xnYRugQ","00:23:14","00:23:18","And the thing is, that’s just not at all how that word functions for me!","and the thing is that's just not at all how that word functions for me"
"K_q-xnYRugQ","00:23:19","00:23:19","",""
"K_q-xnYRugQ","00:23:19","00:23:22","I use it literally as a stand-in for “less dangerous.”","i use it literally as a stand-in for less dangerous"
"K_q-xnYRugQ","00:23:23","00:23:25","Or perhaps ""less risky.""","or perhaps less risky like"
"K_q-xnYRugQ","00:23:25","00:23:28","Like how driving 100 miles an hour with your headlights on","how driving a hundred miles an hour with your headlights on is"
"K_q-xnYRugQ","00:23:29","00:23:32","is safer than driving the same speed in the dark.","safer than driving the same speed in the dark"
"K_q-xnYRugQ","00:23:33","00:23:37","That statement doesn’t suggest to me that driving 100 miles an hour is a safe activity.","that statement doesn't suggest to me that driving 100 miles an hour is a safe activity it's"
"K_q-xnYRugQ","00:23:37","00:23:40","It’s just safer than doing 100 by moonlight.","just safer than doing 100 by moonlight"
"K_q-xnYRugQ","00:23:41","00:23:46","To me “safer” is always a comparator alone, and doesn’t bring its own implication of any safety.","to me safer is always a comparator alone and doesn't bring its own implication of any safety"
"K_q-xnYRugQ","00:23:47","00:23:48","So… yeah.","so yeah i"
"K_q-xnYRugQ","00:23:48","00:23:51","I actually was genuinely delighted to hear this explanation","actually was genuinely delighted to hear this explanation because"
"K_q-xnYRugQ","00:23:52","00:23:55","because I was starting to lose my mind thinking Ohm’s law was a trick or something.","i was starting to lose my mind thinking ohm's law was a trick or something"
"K_q-xnYRugQ","00:23:55","00:24:01","And I am absolutely in agreement that the shock-mitigation efforts in 240V countries","and i am absolutely in agreement that the shock mitigation efforts in 240 volt"
"K_q-xnYRugQ","00:24:02","00:24:05","are by and large much better than ours.","countries are by and large much better than ours it's"
"K_q-xnYRugQ","00:24:05","00:24:08","It’s stupidly easy to get a shock here.","stupidly easy to get a shock here seriously"
"K_q-xnYRugQ","00:24:08","00:24:11","Seriously. Just hold a plug wrong and you’ll get a tingle.","just hold the plug wrong and you'll get a tingle"
"K_q-xnYRugQ","00:24:12","00:24:17","So I’m not saying that our electrical system is safer than your electrical system.","so i'm not saying that our electrical system i'm not saying that our electrical system is safer than your electrical system because"
"K_q-xnYRugQ","00:24:17","00:24:19","Because it’s undeniably not.","it's undeniably not"
"K_q-xnYRugQ","00:24:20","00:24:23","But I am saying that, because the voltage is lower,","but i am saying that because the voltage is lower electric"
"K_q-xnYRugQ","00:24:23","00:24:26","electric shocks are less likely to be fatal over here.","shocks are less likely to be fatal over here"
"K_q-xnYRugQ","00:24:27","00:24:31","And that’s why our efforts to prevent them are half-assed.","and that's why our efforts to prevent them are half-assed"
"K_q-xnYRugQ","00:24:32","00:24:35","The voltage itself is safer, as in less dangerous.","the voltage itself is safer as in less dangerous the electrical"
"K_q-xnYRugQ","00:24:35","00:24:39","The electrical system as a whole though sure isn’t.","system as a whole though sure isn't anyway"
"K_q-xnYRugQ","00:24:39","00:24:41","Anyway, toodles!","toodles [Music]"
"K_q-xnYRugQ","00:24:41","00:24:41","",""
"K_q-xnYRugQ","00:24:42","00:24:44","♫ overloadedly smooth jazz ♫","sure isn't anyway toodles [Music]"
"K_q-xnYRugQ","00:24:44","00:24:44","",""
"K_q-xnYRugQ","00:24:45","00:24:47","It couldn’t care less about you and your..","it couldn't care less about you and shoot"
"K_q-xnYRugQ","00:24:47","00:24:48","Shoot!","circuit breakers"
"K_q-xnYRugQ","00:24:48","00:24:52","Circuit breakers like these are over- [thud]","like these are over [Music]"
"K_q-xnYRugQ","00:24:52","00:24:52","",""
"K_q-xnYRugQ","00:24:53","00:24:54","Well, that wasn’t nice.","well that wasn't"
"K_q-xnYRugQ","00:24:55","00:24:56","...igniting a wall stud or whatever,","nice igniting a wall stud or whatever"
"K_q-xnYRugQ","00:24:57","00:24:59","but that’s a … blpppt.","but that's"
"K_q-xnYRugQ","00:24:59","00:25:02","","would"
"K_q-xnYRugQ","00:25:02","00:25:04","Would you please stop doing that?","you please stop doing that this"
"K_q-xnYRugQ","00:25:04","00:25:07","This is a NEMA 5-20R receptacle,","is a nema 520r receptacle i'm"
"K_q-xnYRugQ","00:25:08","00:25:08","and I’m holding it upside down.","holding it upside down"
"K_q-xnYRugQ","00:25:09","00:25:11","","you can tell that"
"K_q-xnYRugQ","00:25:11","00:25:14","You can tell that I start every shoot with everything I need.","i start every shoot with everything i need"
"K_q-xnYRugQ","00:25:15","00:25:15","",""
"K_q-xnYRugQ","00:25:16","00:25:16","Right?","right"
"K_q-xnYRugQ","00:25:17","00:25:18","I don’t think it’s awful by any means,","i don't think it's awful by any"
"K_q-xnYRugQ","00:25:19","00:25:21","and it does continue to de get de be de de de de bu debba du","means and it does continue to get better"
"K_q-xnYRugQ","00:25:22","00:25:25","And especially… these.","and especially these"
"K_q-xnYRugQ","00:25:25","00:25:26","","and i only got"
"K_q-xnYRugQ","00:25:26","00:25:27","And I only got the one.","the one"
"K_q-xnYRugQ","00:25:28","00:25:29","Oh well.","oh"
"K_q-xnYRugQ","00:25:29","00:25:30","",""
"K_q-xnYRugQ","00:25:40","00:25:45","Maybe click on the little (i) doohickey and see the other videos of mine that I referenced?","well [Applause]"
"K_q-xnYRugQ","00:25:47","00:25:47","",""
