"video_id","min_timecode","max_timecode","text.user","text.auto"
"Xq45598A7Vc","00:08:37","00:08:39","I was one day from retirement, dammit.","i was one day from retirement damn it well"
"Xq45598A7Vc","00:08:40","00:08:40","Well, let's check it out.","let's check it out"
"Xq45598A7Vc","00:08:40","00:08:43","So a company called MicroClimate","so a company called microclimate"
"Xq45598A7Vc","00:08:43","00:08:45","is making this protective space helmet","is making this protective space helmet"
"Xq45598A7Vc","00:08:46","00:08:48","with a built-in fan and filtration system.","with a built-in fan and filtration system"
"Xq45598A7Vc","00:08:49","00:08:50","And it costs $300.","and it costs 300 this"
"Xq45598A7Vc","00:08:50","00:08:52","This is obviously supposed to be an advanced","is obviously supposed to be an advanced and"
"Xq45598A7Vc","00:08:53","00:08:56","and very expensive alternative to wearing a mask.","very expensive alternative advanced and very expensive alternative to wearing a mask the transparent"
"Xq45598A7Vc","00:08:56","00:08:58","The transparent acrylic dome allows the wearer","alternative to wearing a mask the transparent acrylic dome allows the wearer"
"Xq45598A7Vc","00:08:59","00:09:00","full peripheral vision.","full peripheral vision this"
"Xq45598A7Vc","00:09:01","00:09:02","This helps the device quickly fade","helps the device quickly fade"
"Xq45598A7Vc","00:09:02","00:09:04","into the background after being put on.","into the background after being put on you know"
"Xq45598A7Vc","00:09:05","00:09:06","You know, I'm not so sure that's true.","i'm not so sure that's true"
"Xq45598A7Vc","00:09:07","00:09:08","Maybe for you, you'll forget about it.","maybe for you you'll forget"
"Xq45598A7Vc","00:09:09","00:09:12","But for the people staring at you in the grocery store,","about it but for the people staring at you in the grocery store i don't think they're"
"Xq45598A7Vc","00:09:13","00:09:15","""What the hell is- Oh wait.","gonna be like what the hell is oh wait no he has"
"Xq45598A7Vc","00:09:15","00:09:16","No, he has full peripheral vision?","full peripheral vision"
"Xq45598A7Vc","00:09:16","00:09:17","Okay. Nothing to see here.""","okay nothing to see they've"
"Xq45598A7Vc","00:09:18","00:09:20","They've got a fair amount of testimonials.","got a fair amount of testimonials reggie"
"Xq45598A7Vc","00:09:21","00:09:22","Reggie Watts is one of them.","watts is one of them it"
"Xq45598A7Vc","00:09:22","00:09:24","- If it dies, do you lose oxygen?","dies do you lose oxygen"
"Xq45598A7Vc","00:09:25","00:09:26","(Reggie laughing)","that"
"Xq45598A7Vc","00:09:27","00:09:29","- Hey if Reggie Watts likes it, I'll give it a shot.","would be crazy hey if reggie watts likes it i'll give it a shot"
"Xq45598A7Vc","00:09:30","00:09:30","- You dumbass.","dumbass i also like"
"Xq45598A7Vc","00:09:31","00:09:31","- I also like how they're also trying to","how they're"
"Xq45598A7Vc","00:09:32","00:09:34","make it seem like it serves multiple purposes.","also trying to make it seem like it serves multiple purposes"
"Xq45598A7Vc","00:09:34","00:09:35","It's not just for the pandemic.","it's not just for the pandemic"
"Xq45598A7Vc","00:09:36","00:09:38","It's also for seasonal allergies.","it's also for seasonal allergies"
"Xq45598A7Vc","00:09:42","00:09:42","",""
"Xq45598A7Vc","00:09:43","00:09:44","Now I'm sold.","now i'm so i'll be sure to"
"Xq45598A7Vc","00:09:44","00:09:45","I'll be sure to wear this out in my garden","wear this out in my garden"
"Xq45598A7Vc","00:09:46","00:09:47","and see how long it takes","and see how long it takes for my neighbors"
"Xq45598A7Vc","00:09:47","00:09:49","for neighbors to stop talking to me.","to stop talking to me all right let's go"
"Xq45598A7Vc","00:09:49","00:09:50","All right, let's go ahead and buy it.","ahead and buy it honestly"
"Xq45598A7Vc","00:09:51","00:09:52","Honestly, this is a pretty good haul here.","this is a pretty good haul here i'm excited"
"Xq45598A7Vc","00:09:52","00:09:54","I'm excited for everything, not just for the helmet.","for everything not just for the helmet"
"Xq45598A7Vc","00:09:55","00:09:58","Our total came in at just under a thousand dollars.","our total came in at just under a thousand dollars"
"Xq45598A7Vc","00:09:59","00:10:02","Which is not great, but I guess it could be worse.","which is not great but i guess it could be worse now all i gotta do"
"Xq45598A7Vc","00:10:02","00:10:04","Now all I gotta do is wait for everything to show up.","is wait for everything to show up"
"Xq45598A7Vc","00:10:05","00:10:06","",""
"Xq45598A7Vc","00:10:06","00:10:07","Oh, there it is.","oh there it is"
"Xq45598A7Vc","00:10:12","00:10:15","","mail's"
"Xq45598A7Vc","00:10:16","00:10:16","Mail's here.","here"
"Xq45598A7Vc","00:10:16","00:10:18","I'm gonna go ahead and open the moon pod first","i'm gonna go ahead and open the moon pod first"
"Xq45598A7Vc","00:10:19","00:10:20","because it's the thing I'm most excited about.","because it's the thing i'm most excited"
"Xq45598A7Vc","00:10:21","00:10:23","And also, so I have somewhere to sit","about and also uh so i have somewhere to"
"Xq45598A7Vc","00:10:24","00:10:25","for this part of the video.","sit for this part of the video"
"Xq45598A7Vc","00:10:26","00:10:27","","excuse"
"Xq45598A7Vc","00:10:28","00:10:28","Excuse me.","me it"
"Xq45598A7Vc","00:10:28","00:10:31","It says not to open it with a sharp object,","says not to open it with a sharp object so i'll try my"
"Xq45598A7Vc","00:10:31","00:10:32","so I'll try my best.","best"
"Xq45598A7Vc","00:10:32","00:10:33","I'm a sucker for instructions.","i'm a sucker for instructions"
"Xq45598A7Vc","00:10:34","00:10:35","I will always follow them.","i will always follow them"
"Xq45598A7Vc","00:10:35","00:10:39","",""
"Xq45598A7Vc","00:10:40","00:10:41","Did I get the white one?","did i get the white one"
"Xq45598A7Vc","00:10:41","00:10:42","","smell test"
"Xq45598A7Vc","00:10:43","00:10:44","(sniffing)","you know how"
"Xq45598A7Vc","00:10:45","00:10:46","Know how when you go to like Dick's Sporting Goods,","when you go to like dick's sporting goods"
"Xq45598A7Vc","00:10:47","00:10:49","the whole store just smells like baseball gloves?","the whole store just smells like baseball gloves"
"Xq45598A7Vc","00:10:49","00:10:50","That's what this smells like.","that's what this smells"
"Xq45598A7Vc","00:10:51","00:10:52","Ah, the cover.","like ah the cover"
"Xq45598A7Vc","00:10:52","00:10:53","",""
"Xq45598A7Vc","00:10:54","00:10:55","- [Announcer] Hole in one! (cheering)","pulling what no that's fine"
"Xq45598A7Vc","00:10:56","00:10:58","You don't need to help. Just keep sitting there.","you don't need to help just keep sitting there jeez"
"Xq45598A7Vc","00:10:59","00:11:01","Jeez. (calming jazz music)","need to help just keep sitting there jeez"
"Xq45598A7Vc","00:11:02","00:11:03","Having little bit of trouble here.","having a little bit of trouble here maybe"
"Xq45598A7Vc","00:11:04","00:11:04","Maybe I should have done this last.","i should have done this last"
"Xq45598A7Vc","00:11:05","00:11:06","I'm already sweating.","i'm already sweating"
"Xq45598A7Vc","00:11:07","00:11:11","","oh my"
"Xq45598A7Vc","00:11:11","00:11:14","Oh, my God. This is kind of a nightmare, honestly.","god this is kind of a nightmare honestly i did it"
"Xq45598A7Vc","00:11:14","00:11:15","I did it! (clapping sound effect)","and"
"Xq45598A7Vc","00:11:16","00:11:17","And it only took nine minutes.","it only took nine minutes"
"Xq45598A7Vc","00:11:18","00:11:20","It's more rectangular than I was expecting.","it's more rectangular than i was expecting i guess i"
"Xq45598A7Vc","00:11:20","00:11:21","I guess I thought it would look more","thought it would look more like a"
"Xq45598A7Vc","00:11:21","00:11:26","like a beanbag chair and not a giant pill.","beanbag chair and not a giant pill honestly"
"Xq45598A7Vc","00:11:27","00:11:28","Honestly, (chuckling)","uh i'm a little"
"Xq45598A7Vc","00:11:28","00:11:30","I'm a little underwhelmed.","underwhelmed as far as comfort"
"Xq45598A7Vc","00:11:30","00:11:33","As far as comfort goes, this is like bare minimum.","goes this is like bare minimum"
"Xq45598A7Vc","00:11:34","00:11:35","It just feels like I'm sitting on beads.","it just feels like i'm sitting on beads"
"Xq45598A7Vc","00:11:36","00:11:37","the way they advertise it on the website,","the way they advertise it on the website"
"Xq45598A7Vc","00:11:38","00:11:41","I thought it would have some kind of special material inside","i thought it would have some kind of special material inside that"
"Xq45598A7Vc","00:11:41","00:11:43","that would be unlike anything I've ever felt before.","would be unlike anything i've ever felt before it's"
"Xq45598A7Vc","00:11:44","00:11:47","It's the moon pod, it's supposed to be out of this world.","the moon pod it's supposed to be out of this world i don't"
"Xq45598A7Vc","00:11:47","00:11:50","I don't know, for $300, I'm just not that impressed.","know for 300 i'm just not that impressed"
"Xq45598A7Vc","00:11:51","00:11:55","It's definitely better than sitting on the floor","it's definitely better than sitting on the floor uh like"
"Xq45598A7Vc","00:11:56","00:11:57","like outside in the rain.","outside in the rain all"
"Xq45598A7Vc","00:11:57","00:11:58","All right, let's get these pants out of the way.","right let's get these pants out of"
"Xq45598A7Vc","00:11:59","00:11:59","Just a reminder guys.","the way just a reminder"
"Xq45598A7Vc","00:12:00","00:12:02","I spent $89 on these","guys i spent 89 on these so they"
"Xq45598A7Vc","00:12:02","00:12:04","so they really are gonna have to blow me away here.","really are gonna have to blow me away here i mean"
"Xq45598A7Vc","00:12:06","00:12:06","","they're definitely"
"Xq45598A7Vc","00:12:06","00:12:07","(chiming) they're definitely pants.","pants"
"Xq45598A7Vc","00:12:08","00:12:10","They're a little baggier that I thought they'd be.","they're a little baggier than i thought they'd be uh that is"
"Xq45598A7Vc","00:12:10","00:12:11","That is what the one review said.","what the one review"
"Xq45598A7Vc","00:12:12","00:12:13","They're very warm.","said they're very warm like"
"Xq45598A7Vc","00:12:14","00:12:16","Like I've only had these on for about 30 seconds","i've only had these on for about 30 seconds and i"
"Xq45598A7Vc","00:12:16","00:12:17","and I can already tell I am gonna","can already tell i'm"
"Xq45598A7Vc","00:12:18","00:12:19","sweat up a storm in these.","gonna sweat up a storm in these when"
"Xq45598A7Vc","00:12:20","00:12:22","When I take these off, they're gonna be just","i take these off they're gonna be just soaking wet"
"Xq45598A7Vc","00:12:22","00:12:23","soaking wet on the inside.","on the inside"
"Xq45598A7Vc","00:12:23","00:12:24","But.","but"
"Xq45598A7Vc","00:12:25","00:12:25","",""
"Xq45598A7Vc","00:12:26","00:12:26","Pocket. (""Ohh"" sound effect)","pocket this"
"Xq45598A7Vc","00:12:26","00:12:27","This is where I can hold all of the money","is where i can hold all"
"Xq45598A7Vc","00:12:28","00:12:29","that I would still have","of the money that i would still have if i didn't"
"Xq45598A7Vc","00:12:29","00:12:31","if I didn't use it to buy these pants.","use it to buy these pants so i'm"
"Xq45598A7Vc","00:12:50","00:12:50","Obviously I haven't gotten a chance to sleep on this yet.","on this yet i'm going to sleep on"
"Xq45598A7Vc","00:12:50","00:12:51","I'm gonna sleep on it tonight","it tonight"
"Xq45598A7Vc","00:12:51","00:12:52","and let you know what I think.","and let you know what i think"
"Xq45598A7Vc","00:12:53","00:12:56","But first impression as with everything so far is","but first impression as with everything so far is i can't believe"
"Xq45598A7Vc","00:12:56","00:12:59","I can't believe I spent as much money on this as I did.","i spent as much money on this as i did so i've slept on this a"
"Xq45598A7Vc","00:12:59","00:13:00","So I slept on this a couple of times now.","couple times now and"
"Xq45598A7Vc","00:13:01","00:13:01","And I think I like it.","i think i"
"Xq45598A7Vc","00:13:02","00:13:03","I kind of alternate between this and my other pillow","like it i kind of alternate between this and my other"
"Xq45598A7Vc","00:13:04","00:13:05","but I'll definitely get some use out of this.","pillow but i'll definitely get some use out of this"
"Xq45598A7Vc","00:13:06","00:13:07","It is definitely as soft as advertised, but","it is definitely as soft as advertised"
"Xq45598A7Vc","00:13:08","00:13:10","in hindsight I probably should have gone with a wider one.","but in hindsight i probably should have gone with a wider one"
"Xq45598A7Vc","00:13:11","00:13:13","Also I woke up my cat, sorry!","uh also i woke up my cat sorry time for the"
"Xq45598A7Vc","00:13:13","00:13:14","Time for the bidet.","uh also i woke up my cat sorry time for the"
"Xq45598A7Vc","00:13:14","00:13:19","","bidet"
"Xq45598A7Vc","00:13:20","00:13:20","Is it breaking?","is it breaking"
"Xq45598A7Vc","00:13:21","00:13:23","Let me tell you guys a little story about how crafty I am.","let me tell you guys a little story about how crafty i"
"Xq45598A7Vc","00:13:24","00:13:26","So I wanted to install this in our second bathroom,","am so i wanted to install this in our second bathroom just in case i messed"
"Xq45598A7Vc","00:13:26","00:13:27","just in case I messed up really bad","up really bad"
"Xq45598A7Vc","00:13:28","00:13:28","and like, broke the toilet.","and like broke the toilet but"
"Xq45598A7Vc","00:13:29","00:13:30","But then I realized I needed a Flathead screwdriver","then i realized i needed a flathead screwdriver"
"Xq45598A7Vc","00:13:31","00:13:32","to take off the seat and couldn't","to take off the seat and couldn't for the life"
"Xq45598A7Vc","00:13:32","00:13:33","for the life of me find mine.","of me find"
"Xq45598A7Vc","00:13:34","00:13:35","So I went out and bought another one.","my so i went out and bought another one then i tried to"
"Xq45598A7Vc","00:13:35","00:13:37","Then I tried to unscrew the seat and I kept turning","unscrew the seat and i kept turning and"
"Xq45598A7Vc","00:13:37","00:13:39","and turning and turning and nothing would happen.","turning and nothing would happen"
"Xq45598A7Vc","00:13:40","00:13:41","So I gave up and went to our other bathroom.","so i gave up and went to our other bathroom the same"
"Xq45598A7Vc","00:13:42","00:13:42","The same thing was happening there.","thing was happening there and then"
"Xq45598A7Vc","00:13:43","00:13:44","And then I realized, Oh, you also have to unscrew","i realized oh you also have to"
"Xq45598A7Vc","00:13:45","00:13:47","the lug nuts on the bottom, you fucking moron.","unscrew the lug nuts on the bottom you"
"Xq45598A7Vc","00:13:48","00:13:50","So then I successfully removed the seat, inserted the bidet,","so then i successfully removed the seat inserted the bidet"
"Xq45598A7Vc","00:13:50","00:13:51","and that only took a couple of minutes.","and that only took a couple minutes"
"Xq45598A7Vc","00:13:52","00:13:53","And all I had to do is hook it into the water line,","now all i had to do was hook it into the water line which"
"Xq45598A7Vc","00:13:53","00:13:56","which I managed to loosen all the way, until I realized","i managed to loosen all the way until i realized i needed to replace"
"Xq45598A7Vc","00:13:56","00:13:58","I needed to replace that pipe with a more flexible one","that pipe with a more flexible one"
"Xq45598A7Vc","00:13:59","00:14:00","so the bidet attachment would actually fit.","so the bidet attachment would actually fit i didn't realize"
"Xq45598A7Vc","00:14:00","00:14:02","I didn't realize I could have just ordered this part","i could have just ordered this part from"
"Xq45598A7Vc","00:14:02","00:14:03","from Hello Tushy when I bought the bidet,","hello tushy when i bought the"
"Xq45598A7Vc","00:14:04","00:14:06","but I'm not exactly the most forward thinking person.","bidet but i'm not exactly the most forward-thinking person"
"Xq45598A7Vc","00:14:07","00:14:08","Anyway, I had to go out and buy one from Home Depot,","anyway i had to go out and buy one from home depot"
"Xq45598A7Vc","00:14:09","00:14:10","and from there I had no issues.","and from there i had no issues if i'd actually"
"Xq45598A7Vc","00:14:10","00:14:11","If I had actually been prepared ahead of time,","been prepared ahead"
"Xq45598A7Vc","00:14:12","00:14:13","this whole process would have taken about 10 minutes.","of time this whole process would have taken about 10 minutes"
"Xq45598A7Vc","00:14:14","00:14:15","But instead I turned it into a two day project.","but instead i turned it into a two-day"
"Xq45598A7Vc","00:14:16","00:14:18","Now, if you'll, excuse me, I've got a butt to spray.","project now if you'll excuse me i've got a butt to spray"
"Xq45598A7Vc","00:14:19","00:14:20","(toilet flushing)","[Applause] to spray [Applause]"
"Xq45598A7Vc","00:14:20","00:14:25","- [Announcer] Hole in one! (cheering)","[Music] here they are"
"Xq45598A7Vc","00:14:26","00:14:28","I've smelled a lot of smells in this video so far,","i've smelled a lot of smells in this video so far and"
"Xq45598A7Vc","00:14:29","00:14:31","and the smell I'm going to experience","the smell i'm going to experience when i open"
"Xq45598A7Vc","00:14:31","00:14:33","when I open this sealed pack of spicy candy","the sealed pack of spicy"
"Xq45598A7Vc","00:14:34","00:14:36","is something I'm not excited for.","candy is something i'm not excited for"
"Xq45598A7Vc","00:14:36","00:14:39","",""
"Xq45598A7Vc","00:14:40","00:14:42","First impression, like all candy that gets delivered","first impression like all candy that gets delivered to your mailbox"
"Xq45598A7Vc","00:14:42","00:14:45","to your mailbox and just kind of sits there for a while,","and just kind of sits there for a while"
"Xq45598A7Vc","00:14:46","00:14:49","this has all congealed into one solid object.","this is all congealed into one solid object like one of"
"Xq45598A7Vc","00:14:49","00:14:51","Like one of the commentors said, it's basically just","the commenters said it's basically just"
"Xq45598A7Vc","00:14:52","00:14:55","like regular candy that they put red chili flakes on.","like regular candy that they put red chili flakes on all"
"Xq45598A7Vc","00:14:56","00:14:56","All right here goes nothing.","right here goes"
"Xq45598A7Vc","00:14:57","00:14:59","(calming jazz music)","nothing [Music]"
"Xq45598A7Vc","00:15:00","00:15:04","","let me try one with"
"Xq45598A7Vc","00:15:04","00:15:05","Let me try one with more spice on it.","more spice"
"Xq45598A7Vc","00:15:06","00:15:07","I feel like there wasn't a lot of spice.","on it i feel like there wasn't a lot of spice uh here's a"
"Xq45598A7Vc","00:15:08","00:15:09","Oh, here's a nice closeup for you guys.","nice close-up for you"
"Xq45598A7Vc","00:15:09","00:15:16","","guys [Music]"
"Xq45598A7Vc","00:15:17","00:15:17","No.","no the candy"
"Xq45598A7Vc","00:15:18","00:15:19","The candy itself is good.","itself is good i'm a"
"Xq45598A7Vc","00:15:19","00:15:21","I'm a sucker for sour candy.","sucker for sour candy i just"
"Xq45598A7Vc","00:15:22","00:15:23","I just wouldn't put these two things together.","wouldn't put these two things together"
"Xq45598A7Vc","00:15:23","00:15:24","I'll have one more.","i'll have one more"
"Xq45598A7Vc","00:15:25","00:15:26","","it's just"
"Xq45598A7Vc","00:15:26","00:15:27","It's just weird.","weird it's not for me"
"Xq45598A7Vc","00:15:28","00:15:28","It's not for me.","my final"
"Xq45598A7Vc","00:15:28","00:15:30","My final thoughts on chili chews is","thoughts on chili chews is"
"Xq45598A7Vc","00:15:31","00:15:34","that they are not sitting very well in my stomach.","that they are not sitting very well in my stomach and it's a good"
"Xq45598A7Vc","00:15:35","00:15:36","And it's a good thing that I already installed that bidet.","thing that i already installed that bidet"
"Xq45598A7Vc","00:15:38","00:15:41","Boy oh boy, am I excited for this one.","boy oh boy am i excited for this one [Music] boy oh boy am i excited for this one [Music]"
"Xq45598A7Vc","00:15:42","00:15:43","","here it is"
"Xq45598A7Vc","00:15:44","00:15:45","Some accessories in here.","some accessories in here you've"
"Xq45598A7Vc","00:15:45","00:15:47","You've got like a microfiber cloth.","got like a microfiber cloth looks"
"Xq45598A7Vc","00:15:48","00:15:49","It looks like the charging cable.","like the charging cable uh"
"Xq45598A7Vc","00:15:49","00:15:51","Also a flight fact card.","also a flight looks like the charging cable uh also a flight fact car"
"Xq45598A7Vc","00:15:52","00:15:54","I believe that is what you show to like the","i believe that is what you show to like the"
"Xq45598A7Vc","00:15:55","00:15:56","flight attendant when you want to wear this on a plane.","flight attendant when you you want to wear this on a plane"
"Xq45598A7Vc","00:15:57","00:15:59","To show them like, look, this is legit.","show them like look this is this is legit i don't"
"Xq45598A7Vc","00:15:59","00:16:02","I don't know if that would actually work","know if that would actually work"
"Xq45598A7Vc","00:16:03","00:16:05","because according to the CEO of the company,","because according to the ceo of the company"
"Xq45598A7Vc","00:16:06","00:16:08","he was like, yeah they still made me put on a mask.","he was like yeah they still made me put on a mask um i"
"Xq45598A7Vc","00:16:09","00:16:12","- I started to explain what the device was that I had on","started to explain um what the device was that i had on"
"Xq45598A7Vc","00:16:13","00:16:14","but they weren't having any of it","but they weren't having any of"
"Xq45598A7Vc","00:16:15","00:16:16","and were about to take me off the flight.","it and were about to take me off the flight you"
"Xq45598A7Vc","00:16:17","00:16:17","- You know, it's funny.","know it's funny"
"Xq45598A7Vc","00:16:18","00:16:20","The whole point of this is so you can have this on","the the whole point of this is so you can have this"
"Xq45598A7Vc","00:16:21","00:16:23","without having to wear a mask, but I have never","on without having to wear a mask have this on without having to wear a mask but i"
"Xq45598A7Vc","00:16:24","00:16:27","wanted to cover my face more than I do right now.","have never wanted to cover my face more than i do right now the"
"Xq45598A7Vc","00:16:28","00:16:30","The only thing I really hear is the fan.","only thing i really hear is the fans"
"Xq45598A7Vc","00:16:31","00:16:33","I feel like if someone was talking to me outside","um i feel like if someone was talking to me outside"
"Xq45598A7Vc","00:16:34","00:16:35","I would not be able to hear them at all.","i would not be able to hear them at all"
"Xq45598A7Vc","00:16:36","00:16:39","There almost needs to be like a microphone on the outside","there almost needs to be like a microphone on the outside and then speakers"
"Xq45598A7Vc","00:16:39","00:16:40","and then speakers on the inside.","on the inside"
"Xq45598A7Vc","00:16:41","00:16:43","(burping)","oh wait"
"Xq45598A7Vc","00:16:43","00:16:45","Oh wait, they didn't say anything about burps.","they didn't say anything about burps it's"
"Xq45598A7Vc","00:16:46","00:16:46","It's very loose.","very loose"
"Xq45598A7Vc","00:16:47","00:16:47","Oh wait. I think I figured it out.","oh wait i think i figured"
"Xq45598A7Vc","00:16:47","00:16:49","Okay, and then that goes...","it out okay and then that goes"
"Xq45598A7Vc","00:16:49","00:16:50","I think I figured out the strap.","i think i figured out"
"Xq45598A7Vc","00:16:51","00:16:52","","the strat"
"Xq45598A7Vc","00:16:52","00:16:54","And then I think I just broke it.","and then i think i just broke oh god"
"Xq45598A7Vc","00:16:55","00:16:55","Oh God dammit.","damn it"
"Xq45598A7Vc","00:16:56","00:16:58","All right. Nice solid fit.","all right nice solid fit uh my"
"Xq45598A7Vc","00:16:58","00:17:00","My hair is very much in my eyes now.","hair is very much in my eyes now not much i can"
"Xq45598A7Vc","00:17:00","00:17:01","Not much I can do about that.","do about that"
"Xq45598A7Vc","00:17:02","00:17:02","(video game sounds) Drink test.","drink test i"
"Xq45598A7Vc","00:17:03","00:17:03","I just gotta...","just gotta"
"Xq45598A7Vc","00:17:04","00:17:17","","and it's that"
"Xq45598A7Vc","00:17:17","00:17:18","And it's that easy.","easy yeah"
"Xq45598A7Vc","00:17:19","00:17:20","Yeah, definitely shouldn't have worn glasses with this.","definitely shouldn't have worn glasses with this it's pushing"
"Xq45598A7Vc","00:17:20","00:17:23","It's pushing down on my glasses and instinctively,","down on my glasses and instinctively i"
"Xq45598A7Vc","00:17:24","00:17:25","I want to like push them back up,","want to like push them back up"
"Xq45598A7Vc","00:17:26","00:17:29","but there seems to be a glass dome in my way.","but there seems to be a glass dome in my way i would say"
"Xq45598A7Vc","00:17:29","00:17:33","I would say overall, the theme today has been overpriced","overall the theme today has been uh overpriced"
"Xq45598A7Vc","00:17:34","00:17:37","and disappointing, but it's not fair for me to judge this","and disappointing but it's not fair for me to judge this"
"Xq45598A7Vc","00:17:37","00:17:39","just sitting here in my house.","just sitting here in my house i shouldn't"
"Xq45598A7Vc","00:17:40","00:17:41","I shouldn't have to wear this sitting right here.","have to wear this sitting right here"
"Xq45598A7Vc","00:17:41","00:17:44","What I need to do is take this out for a test drive.","what i need to do is take this out for a test"
"Xq45598A7Vc","00:17:45","00:17:48","Within minutes, I couldn't believe how wrong I was.","drive within minutes i couldn't believe how wrong i was this"
"Xq45598A7Vc","00:17:49","00:17:50","This thing is incredible.","thing is incredible"
"Xq45598A7Vc","00:17:50","00:17:52","I've never felt more safe in my life.","i've never felt more safe in my life safe from"
