"video_id","min_timecode","max_timecode","text.user","text.auto"
"Rm9t94mpkjo","00:16:44","00:16:45","- Also, that's not my name anymore!","also that's not"
"Rm9t94mpkjo","00:16:46","00:16:47","Hatshepsut, what does that even mean?","my name anymore hot chocolate what does that even mean"
"Rm9t94mpkjo","00:16:48","00:16:49","My name's Maatkare now.","my name's ma'at"
"Rm9t94mpkjo","00:16:55","00:16:56","Re, the sun god.","[Music]"
"Rm9t94mpkjo","00:16:58","00:16:59","Maatkare!","well that's"
"Rm9t94mpkjo","00:17:00","00:17:01","- Well, that's nonsense.","that's nonsense that won't"
"Rm9t94mpkjo","00:17:01","00:17:02","Won't that just confuse-","that just confuse also"
"Rm9t94mpkjo","00:17:03","00:17:06","- Also, from now on, I'm to be depicted as a man.","from now on i'm to be depicted as a man"
"Rm9t94mpkjo","00:17:07","00:17:09","- Maatkare, you have a vision.","ma atkari you have a vision wait"
"Rm9t94mpkjo","00:17:13","00:17:14","A trick question.","above a trick question so it's d all of the above a trick question"
"Rm9t94mpkjo","00:17:16","00:17:17","Wow, crazy, all of the above.","wow crazy all of the above we"
"Rm9t94mpkjo","00:17:17","00:17:19","We haven't had one of those before, huh?","haven't had one of those before huh who knew"
"Rm9t94mpkjo","00:17:19","00:17:21","- Who knew that this was even a possibility, though?","that this was even a possibility though yeah"
"Rm9t94mpkjo","00:17:22","00:17:23","- Well, this guy doesn't like to play by the rules.","i feel like this guy doesn't like to play by the"
"Rm9t94mpkjo","00:17:24","00:17:25","- I'm bit of a bad boy.","rules i'm a bit of a bad boy you know that's what you want"
"Rm9t94mpkjo","00:17:25","00:17:26","- If that's what you want to call it.","to call it"
"Rm9t94mpkjo","00:17:27","00:17:28","- I'll call it that.","yeah i'm a bad boy yeah so"
"Rm9t94mpkjo","00:17:29","00:17:31","Yeah, so unfortunately, no history points for either of you.","unfortunately no history points for either of you"
"Rm9t94mpkjo","00:17:33","00:17:34","- Yeah, I'm sorry, it's all right.","yeah i'm sorry it's all right it's hard"
"Rm9t94mpkjo","00:17:35","00:17:36","I appreciate the hustle, but yeah,","i appreciate the hustle but uh yeah"
"Rm9t94mpkjo","00:17:37","00:17:38","bit of a curve ball there.","a bit of a curveball there hot"
"Rm9t94mpkjo","00:17:39","00:17:41","Hatshepsut went through quite the transformation.","shep soot went through quite the transformation and while ma"
"Rm9t94mpkjo","00:17:41","00:17:43","And while Maatkare is the name most frequently","khare is the name most frequently"
"Rm9t94mpkjo","00:17:44","00:17:45","found on her monuments, for our story,","found on her monuments for our story i'm going to keep"
"Rm9t94mpkjo","00:17:45","00:17:47","I'm going to keep calling her by the name she had","calling her by the name she had when we first"
"Rm9t94mpkjo","00:17:47","00:17:49","when we first met, Hatshepsut.","met"
"Rm9t94mpkjo","00:17:50","00:17:51","Not that I ever met her, personally.","not that i never met her personally"
"Rm9t94mpkjo","00:17:53","00:17:54","Before continuing, let me explain","before continuing let me explain the gender thing"
"Rm9t94mpkjo","00:17:55","00:17:56","the gender thing real quick.","real quick though in early statues"
"Rm9t94mpkjo","00:17:56","00:17:57","Though in early statues and carvings","and carvings hot chest"
"Rm9t94mpkjo","00:17:58","00:18:00","Hatshepsut was portrayed as a demure woman,","was portrayed as a demure woman eventually"
"Rm9t94mpkjo","00:18:01","00:18:03","eventually she started being portrayed as a bare-chested,","she started being portrayed as a bear-chested flail"
"Rm9t94mpkjo","00:18:04","00:18:05","flail-and-crook-wielding man.","and crook-wielding man now"
"Rm9t94mpkjo","00:18:05","00:18:07","This was not an attempt to trick people into thinking","this was not an attempt to trick people into thinking"
"Rm9t94mpkjo","00:18:07","00:18:09","she was actually a man.","she was actually a man egyptian"
"Rm9t94mpkjo","00:18:09","00:18:12","Egyptian art depicted things not necessarily","art depicted things not necessarily as they really"
"Rm9t94mpkjo","00:18:12","00:18:15","as they really were, but a bit more metaphorical.","were but a bit more metaphorical written references"
"Rm9t94mpkjo","00:18:15","00:18:17","Written references to Hatshepsut still made it clear","to hatchet still made it clear she was"
"Rm9t94mpkjo","00:18:18","00:18:19","she was a woman, just one depicted as a man","a woman just one depicted as"
"Rm9t94mpkjo","00:18:20","00:18:21","wearing a fake beard.","a man wearing a fake beard though"
"Rm9t94mpkjo","00:18:21","00:18:23","Though the full reason for this change remains a mystery,","the full reason for this change remains a mystery"
"Rm9t94mpkjo","00:18:24","00:18:26","theories range from attempting to legitimize her rule","theories range from attempting to legitimize her rule to"
"Rm9t94mpkjo","00:18:27","00:18:28","to taking some of the ancient sting out of the fact","taking some of the ancient sting out of the fact that the co-pharaoh"
"Rm9t94mpkjo","00:18:29","00:18:30","that the co-Pharaoh Thutmose the Third","thought moses iii was sharing"
"Rm9t94mpkjo","00:18:30","00:18:32","was sharing the title with was a woman.","the title with was a woman"
"Rm9t94mpkjo","00:18:33","00:18:33","- Hmm.","so a lot"
"Rm9t94mpkjo","00:18:33","00:18:34","- So lots to chew on there.","of lot to chew on there"
"Rm9t94mpkjo","00:18:35","00:18:36","- What is he doing at this time, her co-Pharaoh?","what is he doing at this time her co-feral"
"Rm9t94mpkjo","00:18:37","00:18:38","- He's a little baby boy.","what is he doing at this time her co-feral he's a little"
"Rm9t94mpkjo","00:18:39","00:18:39","- Oh, he's still a baby at this point?","baby he's still a baby"
"Rm9t94mpkjo","00:18:40","00:18:41","Got it, got it.","got it guys probably probably"
"Rm9t94mpkjo","00:18:41","00:18:42","- He's probably sucking on his thumb.","uh sucking on"
"Rm9t94mpkjo","00:18:43","00:18:45","- Serving up turds like hotcakes.","his thumb maybe uh serving up turds like hotcakes yeah"
"Rm9t94mpkjo","00:18:47","00:18:47","I don't know.","chasing a bumblebee i don't know things"
"Rm9t94mpkjo","00:18:48","00:18:48","- Things kids do.","kids do things baby yeah"
"Rm9t94mpkjo","00:18:49","00:18:49","Things baby do. - Yeah, things kids do.","things kids chasing"
"Rm9t94mpkjo","00:18:50","00:18:50","- Chasing a bumblebee?","a bumblebee"
"Rm9t94mpkjo","00:18:51","00:18:52","- Yeah, you never chased a bumblebee","yeah you never chased a bumblebee as a little"
"Rm9t94mpkjo","00:18:52","00:18:53","as a little boy, Beef Man?","boy beef no no"
"Rm9t94mpkjo","00:18:54","00:18:55","So you're raising spiders for killing.","so you're you're raising spiders for killing"
"Rm9t94mpkjo","00:18:56","00:18:56","- Yeah.","yeah you're chasing"
"Rm9t94mpkjo","00:18:56","00:18:58","- You're chasing around bumblebees, terrorizing them.","around bumblebees terrorizing them"
"Rm9t94mpkjo","00:18:59","00:19:00","What else are you doing in your free time?","what else are you doing in your free time"
"Rm9t94mpkjo","00:19:01","00:19:01","- Just chilling.","just chilling"
"Rm9t94mpkjo","00:19:01","00:19:02","(laughing)","perfect"
"Rm9t94mpkjo","00:19:02","00:19:03","Perfect segue here.","segway here"
"Rm9t94mpkjo","00:19:04","00:19:06","Now, While Hatshepsut was gradually transforming her brand,","now while hot chef soot was gradually transforming her"
"Rm9t94mpkjo","00:19:07","00:19:10","Thutmose the Third was also gradually transforming","brand footmosa iii was also gradually transforming into"
"Rm9t94mpkjo","00:19:10","00:19:14","into a man who would be capable of running Egypt by himself,","a man who would be capable of running egypt by himself thank you very much"
"Rm9t94mpkjo","00:19:15","00:19:17","While Hatshepsut did a good job of making sure","while hot shep soot did a great job of making sure"
"Rm9t94mpkjo","00:19:18","00:19:20","no strongmen with militia and a bone to pick","no strong men with militia and a bone to pick usurped"
"Rm9t94mpkjo","00:19:21","00:19:22","usurped the throne, the biggest threat to her job","the throne the biggest threat to her"
"Rm9t94mpkjo","00:19:23","00:19:27","was in reality her coworker slash stepson slash nephew.","job was in reality her co-worker slash stepson slash nephew so"
"Rm9t94mpkjo","00:19:27","00:19:28","So yeah, you know, she's got to watch out.","yeah you know she's got to watch"
"Rm9t94mpkjo","00:19:29","00:19:31","I know he's a little boy, but little boys can be dangerous.","out i know he's a little boy but uh little boys can be dangerous"
"Rm9t94mpkjo","00:19:32","00:19:34","- I feel like kids are the scariest creatures on the planet.","i feel like kids are the scariest creatures on the planet no that's"
"Rm9t94mpkjo","00:19:35","00:19:37","- They're full of germs and then they also can be murderous.","true they're full of germs and then they also can be murderous"
"Rm9t94mpkjo","00:19:38","00:19:39","Kids are- - That's true.","and i'm like no kids are even if they're"
"Rm9t94mpkjo","00:19:39","00:19:41","- Even if they're not full of germs or murdering,","not full of germs or murdering"
"Rm9t94mpkjo","00:19:42","00:19:42","kids are just plain creepy.","kids are just plain"
"Rm9t94mpkjo","00:19:43","00:19:45","So luckily, by most indications,","creepy so luckily by most indications the two had"
"Rm9t94mpkjo","00:19:45","00:19:47","the two had a great relationship.","a great relationship while hot"
"Rm9t94mpkjo","00:19:47","00:19:48","While Hatshepsut was in charge,","chef was in charge"
"Rm9t94mpkjo","00:19:49","00:19:52","it would have been relatively easy for an accidental death","it would have been relatively easy for an accidental death"
"Rm9t94mpkjo","00:19:53","00:19:53","to befall the boy-king.","to befall the boy"
"Rm9t94mpkjo","00:19:54","00:19:56","Instead, she made sure he would be well-prepared","king instead she made sure he would be well prepared"
"Rm9t94mpkjo","00:19:57","00:20:00","for life as a pharaoh, having him educated as a scribe,","for life as a pharaoh having him educated as a scribe a priest"
"Rm9t94mpkjo","00:20:01","00:20:02","a priest, and a soldier.","and a soldier he excelled"
"Rm9t94mpkjo","00:20:03","00:20:04","He excelled at this latter vocation","at this latter vocation"
"Rm9t94mpkjo","00:20:04","00:20:06","and was eventually promoted to Commander in Chief","and was eventually promoted to commander"
"Rm9t94mpkjo","00:20:07","00:20:07","of the army.","in chief of the army"
"Rm9t94mpkjo","00:20:08","00:20:10","- So she's like, also a great person.","wow so she's like also a great person she's like"
"Rm9t94mpkjo","00:20:10","00:20:11","- Very forward thinking.","very forward thinking"
"Rm9t94mpkjo","00:20:12","00:20:14","- Yeah, she's making sure he's a well-rounded individual.","she's uh making sure he's a well-rounded individual"
"Rm9t94mpkjo","00:20:15","00:20:15","It's pretty cool.","it's pretty cool"
"Rm9t94mpkjo","00:20:16","00:20:17","- Oh, no.","oh no you sound so"
"Rm9t94mpkjo","00:20:18","00:20:19","- Yeah, why are you so sad?","sad yeah why are you is that i"
"Rm9t94mpkjo","00:20:20","00:20:22","- The way history works, I feel like she's doing all","just the way history works i feel like she's doing all these"
"Rm9t94mpkjo","00:20:23","00:20:26","of these amazing things to him and he's gonna use up her.","amazing things to him and he's gonna usurp her like i"
"Rm9t94mpkjo","00:20:26","00:20:27","I feel like once he actually becomes,","feel like once he actually becomes"
"Rm9t94mpkjo","00:20:28","00:20:29","that's why I got sad because history's sad.","that's why i got sad because i'm like history's"
"Rm9t94mpkjo","00:20:29","00:20:32","- History is sad. - You're probably right.","that's why i got sad because i'm like history's sad history you're probably right he's"
"Rm9t94mpkjo","00:20:32","00:20:33","- He's gonna turn out to be a dick.","gonna try to be a dick"
"Rm9t94mpkjo","00:20:34","00:20:35","- All of this was happening during a time","all of this was happening during a time"
"Rm9t94mpkjo","00:20:35","00:20:38","of relative prosperity and peace for Egypt,","of relative prosperity and peace for egypt which"
"Rm9t94mpkjo","00:20:38","00:20:40","which every leader throughout history will tell you","every leader throughout history will tell"
"Rm9t94mpkjo","00:20:41","00:20:44","means one big problem, what to do with the army?","you means one big problem what to do with the army if hatchet"
"Rm9t94mpkjo","00:20:45","00:20:46","If Hatshepsut disbanded the army,","disbanded the army"
"Rm9t94mpkjo","00:20:46","00:20:48","Egypt would be defenseless.","egypt would be defenseless if she sent them"
"Rm9t94mpkjo","00:20:48","00:20:49","If she sent them to war and they lost,","to war and"
"Rm9t94mpkjo","00:20:50","00:20:52","she would be blamed and usurped.","they lost she would be blamed and usurped if she sent"
"Rm9t94mpkjo","00:20:52","00:20:54","If she sent them to war and they won,","them to war and they won well"
"Rm9t94mpkjo","00:20:54","00:20:56","well, then Thutmose the Third would get the credit","then bozo iii would get all the credit and"
"Rm9t94mpkjo","00:20:57","00:20:59","and perhaps diminish his aunt-mom's power.","perhaps diminish his ant-man's power"
"Rm9t94mpkjo","00:21:00","00:21:03","So, what did Hatshepsut do with her army?","so what did hot chaps uh do with her army a she"
"Rm9t94mpkjo","00:21:03","00:21:05","A, she sent them on a military campaign down the Nile","sent them on a military campaign down the nile while"
"Rm9t94mpkjo","00:21:06","00:21:08","while ordering Thutmose the Third to stay home.","ordering moza the third to stay home b"
"Rm9t94mpkjo","00:21:09","00:21:10","B, she sent them on a trade expedition.","she sent them on a trade expedition"
"Rm9t94mpkjo","00:21:11","00:21:14","Or C, she put them to work building a pyramid.","or c she put them to work building a"
"Rm9t94mpkjo","00:21:15","00:21:15","- Oh.","pyramid"
"Rm9t94mpkjo","00:21:15","00:21:17","",""
"Rm9t94mpkjo","00:21:19","00:21:20","- I'm gonna go B, trade.","that seems to"
"Rm9t94mpkjo","00:21:20","00:21:21","That seems to be the most logical","be the most uh"
"Rm9t94mpkjo","00:21:22","00:21:23","and she seems to be fairly logical.","logical and she seems to be fairly"
"Rm9t94mpkjo","00:21:24","00:21:25","- Interesting, interesting.","logical interesting interesting and ryan"
"Rm9t94mpkjo","00:21:26","00:21:26","And Ryann?","uh"
"Rm9t94mpkjo","00:21:26","00:21:28","- C, pyramid, baby! - Love a pyramid.","c pyramid baby i feel like"
"Rm9t94mpkjo","00:21:29","00:21:30","- Because I feel like yeah, we love a good pyramid","yeah we love a good pyramid and i feel"
"Rm9t94mpkjo","00:21:31","00:21:33","and I feel like she wants to keep an eye","like uh she wants to keep then an eye because if you"
"Rm9t94mpkjo","00:21:34","00:21:35","because if you sent them away, something could happen.","send them away something could happen"
"Rm9t94mpkjo","00:21:36","00:21:36","- True.","but if they're in town"
"Rm9t94mpkjo","00:21:37","00:21:37","- But if they're in town and in work,","and in work"
"Rm9t94mpkjo","00:21:38","00:21:39","you see them and you know that they're busy.","you see them and you know that they're busy solid"
"Rm9t94mpkjo","00:21:40","00:21:43","- Solid logic there, but unfortunately, points to Beef Man.","logic there but unfortunately points to beef man"
"Rm9t94mpkjo","00:21:44","00:21:46","Yes, she sent them on a trade expedition.","yes she sent them on a trade expedition so hot"
"Rm9t94mpkjo","00:21:46","00:21:47","So Hatshepsut, the great ruler","chef soot the great ruler"
"Rm9t94mpkjo","00:21:48","00:21:49","that she was turning out to be,","that she was turning out to be turned"
"Rm9t94mpkjo","00:21:49","00:21:52","turned this potential problem into a benefit.","this potential problem into a benefit she sent the army"
"Rm9t94mpkjo","00:21:52","00:21:54","She sent the army on a trading expedition","on a trading expedition to the mysterious"
"Rm9t94mpkjo","00:21:54","00:21:57","to the mysterious and lost land of Punt,","and lost land of punt where no egyptian"
"Rm9t94mpkjo","00:21:57","00:22:00","where no Egyptian had been for over 500 years.","had been for over 500 years now"
"Rm9t94mpkjo","00:22:01","00:22:03","Now, the trade route that opened up was a lucrative one,","the trade route that opened up was a lucrative one bringing"
"Rm9t94mpkjo","00:22:04","00:22:07","bringing ivory, incense, and rare animal skins to Egypt.","ivory incense and rare animal skins to egypt ancient records"
"Rm9t94mpkjo","00:22:07","00:22:10","Ancient records boast, ""Never was brought the like of this","boast quote never was brought the like of this for"
"Rm9t94mpkjo","00:22:11","00:22:13","for any king who has been since the beginning.""","any king who has been since the beginning these"
"Rm9t94mpkjo","00:22:14","00:22:16","These riches garnered further support from the elites,","riches garnered further support from the elites who liked"
"Rm9t94mpkjo","00:22:16","00:22:17","who liked fancy things.","fancy things"
"Rm9t94mpkjo","00:22:18","00:22:20","Consumerism isn't just a modern scourge, folks.","consumerism from the elites who liked fancy things consumerism isn't just a modern scourge folks"
"Rm9t94mpkjo","00:22:21","00:22:23","Which reminds me, click below to buy some","which reminds me click below to buy some of the finest"
"Rm9t94mpkjo","00:22:23","00:22:25","of the finest merch in all of history!","merch in all of history"
"Rm9t94mpkjo","00:22:26","00:22:26","(clearing throat)","wow"
"Rm9t94mpkjo","00:22:26","00:22:27","- Wow.","yeah look i'm a shill"
"Rm9t94mpkjo","00:22:27","00:22:29","- Yeah, look, I'm a shill for my own shit, guys.","for my own my own [ __ ] guys"
"Rm9t94mpkjo","00:22:31","00:22:31","I'm on a t-shirt.","i'm on a t-shirt"
"Rm9t94mpkjo","00:22:32","00:22:32","I'm happy about it.","i'm happy about it"
"Rm9t94mpkjo","00:22:33","00:22:33","Sue me.","sue me"
"Rm9t94mpkjo","00:22:34","00:22:34","- Brutal.","brutal me brutal"
"Rm9t94mpkjo","00:22:35","00:22:35","Brutal.","brutal in"
"Rm9t94mpkjo","00:22:35","00:22:39","- In 1457 B.C.E., after a prosperous 22-year reign,","1457 bce after an uncommonly peaceful and"
"Rm9t94mpkjo","00:22:40","00:22:41","","prosperous 22-year reign hot chipset"
"Rm9t94mpkjo","00:22:41","00:22:44","Hatshepsut died, finally giving Thutmose the Third","died finally giving footbozo the third full control"
"Rm9t94mpkjo","00:22:44","00:22:46","full control over Egypt","over egypt giving him time"
"Rm9t94mpkjo","00:22:46","00:22:48","Giving him time to learn the royal ropes was worth it,","to learn the royal ropes was well worth"
"Rm9t94mpkjo","00:22:49","00:22:50","as he, too, had a successful reign.","it as he too had a successful reign"
"Rm9t94mpkjo","00:22:51","00:22:52","Using his skills as a military leader,","using his skills as a military leader"
"Rm9t94mpkjo","00:22:53","00:22:55","Thutmose the Third expanded Egypt's control by force","but moses iii expanded egypt's control by force"
"Rm9t94mpkjo","00:22:56","00:22:57","and resulted in Egypt's status","and resulted in egypt's status"
"Rm9t94mpkjo","00:22:58","00:23:00","as one of the wealthiest nations on Earth.","as one of the wealthiest nations on earth"
"Rm9t94mpkjo","00:23:00","00:23:01","- Wow. - Wow.","wow see what happens when"
"Rm9t94mpkjo","00:23:01","00:23:02","- See what happens when you teach the childreN?","you teach the children"
"Rm9t94mpkjo","00:23:03","00:23:05","- As for Hatshepsut, thanks to her","wow see what happens when you teach the children as for hot chef thanks to her many infrastructure"
"Rm9t94mpkjo","00:23:05","00:23:06","many infrastructure projects","projects and"
"Rm9t94mpkjo","00:23:06","00:23:08","and the profitable trading partnership with Punt,","the profitable trading partnership with"
"Rm9t94mpkjo","00:23:09","00:23:10","it seemed the Female Pharaoh's name","punt it seemed the female pharaoh's name"
"Rm9t94mpkjo","00:23:11","00:23:12","should've been remembered forever,","should have been remembered forever"
"Rm9t94mpkjo","00:23:12","00:23:15","except until the early 1900s,","except until the early 1900s no one"
"Rm9t94mpkjo","00:23:15","00:23:17","no one really knew she existed.","really knew she existed"
"Rm9t94mpkjo","00:23:18","00:23:21","Why had no one heard of Hatshepsut?","why had no one heard of hot chip soot a hot"
"Rm9t94mpkjo","00:23:21","00:23:24","A, Hatshepsut's hieroglyphic name had been mistranslated","chapstoot's hieroglyphic name had been mistranslated"
"Rm9t94mpkjo","00:23:25","00:23:27","to mean period of no ruler.","to mean period of no ruler b her stepson"
"Rm9t94mpkjo","00:23:27","00:23:29","B, her stepson destroyed almost all records","destroyed almost all"
"Rm9t94mpkjo","00:23:30","00:23:31","of her existence.","records of her existence or"
"Rm9t94mpkjo","00:23:31","00:23:35","Or C, archeologists just weren't very good until the 1900s.","c archaeologists just weren't very good until the 1900s"
"Rm9t94mpkjo","00:23:35","00:23:37","(laughing)","uh"
"Rm9t94mpkjo","00:23:38","00:23:38","- Ah, hmm.","until the 1900s uh hmm"
"Rm9t94mpkjo","00:23:38","00:23:39","","beef"
"Rm9t94mpkjo","00:23:40","00:23:40","- Beef Man, sock it to me.","man suck"
"Rm9t94mpkjo","00:23:41","00:23:41","- I think B, dude's gonna dude.","it to me i think it's b dude's"
"Rm9t94mpkjo","00:23:42","00:23:43","- Dude's gonna dude.","gonna dude dude's gonna dude"
"Rm9t94mpkjo","00:23:43","00:23:44","Okay, Ryann.","okay uh"
"Rm9t94mpkjo","00:23:45","00:23:48","- I put B because history is sad. (laughing)","ryan i put b because history is sad yeah yeah come common"
"Rm9t94mpkjo","00:23:49","00:23:49","- It's the common refrain on this show,","refrain"
"Rm9t94mpkjo","00:23:50","00:23:50","but an accurate one.","on this show but an accurate"
"Rm9t94mpkjo","00:23:51","00:23:54","Points to both of you. - Wow.","one points to both of you wow oh"
"Rm9t94mpkjo","00:23:54","00:23:55","I knew he was gonna be a dick.","i knew he was gonna be a dick"
"Rm9t94mpkjo","00:23:55","00:23:56","Man.","man yeah"
"Rm9t94mpkjo","00:23:57","00:23:58","- Yeah, you called it awhile ago, man.","you called it a while ago man"
"Rm9t94mpkjo","00:23:58","00:23:59","You really did.","you really did and"
"Rm9t94mpkjo","00:24:00","00:24:01","- That's a little heartbreaking.","it's a little heartbreaking you really did and it's a little heartbreaking towards the end"
"Rm9t94mpkjo","00:24:01","00:24:03","Towards the end of Thutmose the Third's reign,","of mozart iii's reign around"
"Rm9t94mpkjo","00:24:03","00:24:06","around 20 years after the death of his predecessor aunt,","20 years after the death of his predecessor aunt hot shep"
"Rm9t94mpkjo","00:24:06","00:24:09","Hatshepsut's many monuments, statues, and carvings","soot's many monuments statues and carvings"
"Rm9t94mpkjo","00:24:09","00:24:12","were all destroyed, replaced with the likeness","were all destroyed replaced with the likeness"
"Rm9t94mpkjo","00:24:13","00:24:14","of her husband, Thutmose the Second.","of her husband the clothes of the second"
"Rm9t94mpkjo","00:24:15","00:24:17","Remember, in ancient Egypt, the consequences of this","remember in ancient egypt the consequence of this wasn't"
"Rm9t94mpkjo","00:24:18","00:24:20","wasn't simply a destroyed legacy,","simply a destroyed legacy but literally cursing"
"Rm9t94mpkjo","00:24:20","00:24:22","but literally cursing her to damnation.","her to damnation with"
"Rm9t94mpkjo","00:24:23","00:24:25","With no statues or recordings of Hatshepsut,","no statues or recordings of hot chef soot she could"
"Rm9t94mpkjo","00:24:26","00:24:27","she could no longer enjoy the eternal life","no longer enjoy the eternal"
"Rm9t94mpkjo","00:24:28","00:24:29","those depictions were meant to promise her.","life those depictions were meant to promise her"
"Rm9t94mpkjo","00:24:30","00:24:30","- Damned her to hell.","damned her to"
"Rm9t94mpkjo","00:24:31","00:24:33","- [Voiceover] Hatshepsut.","hell [Music]"
"Rm9t94mpkjo","00:24:34","00:24:35","- I didn't even think about that.","i didn't even think about that that was at the"
"Rm9t94mpkjo","00:24:36","00:24:37","Oh, my God.","top of this oh my god it's wow"
"Rm9t94mpkjo","00:24:38","00:24:40","That is so messed up!","that is so messed up after all she did"
"Rm9t94mpkjo","00:24:40","00:24:41","- After all she did for him!","for him"
"Rm9t94mpkjo","00:24:42","00:24:43","She could've easily got rid of him when he was a baby.","right she could have easily gotten rid of him when he was a baby"
"Rm9t94mpkjo","00:24:44","00:24:45","- You know how easy it is to kill a baby?","you know how easy it is to kill a baby"
"Rm9t94mpkjo","00:24:46","00:24:46","- Very.","you drop a you"
"Rm9t94mpkjo","00:24:47","00:24:48","- You drop a snake in the crib.","drop a snake in the crib there were"
"Rm9t94mpkjo","00:24:48","00:24:49","There were snakes everywhere.","snakes"
"Rm9t94mpkjo","00:24:50","00:24:51","All you have to do is leave the room","everywhere all you have to do is like leave the room in a snake"
"Rm9t94mpkjo","00:24:51","00:24:52","and a snake will end up in that crib.","will"
"Rm9t94mpkjo","00:24:53","00:24:54","(beeping)","end up in that crib now the reason why footmost"
"Rm9t94mpkjo","00:24:54","00:24:55","Now, the reason why Thutmose the Third","of the third"
"Rm9t94mpkjo","00:24:56","00:24:57","tried to erase Hatshepsut's name from history","tried to erase hatshepsut's name from history is"
"Rm9t94mpkjo","00:24:58","00:25:00","is a mystery that still eludes historians today.","a mystery that still eludes historians today"
"Rm9t94mpkjo","00:25:01","00:25:02","Jealousy, perhaps?","jealousy perhaps or an"
"Rm9t94mpkjo","00:25:02","00:25:05","Or an effort to tidy up the story of his lineage, maybe?","effort to tidy up the story of his lineage maybe no matter"
"Rm9t94mpkjo","00:25:05","00:25:07","No matter the reason, a shitty thing to do.","the reason a shitty thing to"
