"video_id","min_timecode","max_timecode","text.user","text.auto"
"YkmlPaGui5k","00:19:27","00:19:30","The coroner takes a look at  this victim, and had noted that","takes a look at this victim and had noted that"
"YkmlPaGui5k","00:19:30","00:19:34","there was a lack of hesitation marks on the body,","there was a lack of hesitation marks um on the body which"
"YkmlPaGui5k","00:19:35","00:19:39","which made them believe that whoever  had done this was very strong,","made them believe that um on the body which made them believe that whoever had done this was very strong"
"YkmlPaGui5k","00:19:40","00:19:43","but also a very confident killer,  who had to be very familiar","but also a very confident killer who had to be very familiar"
"YkmlPaGui5k","00:19:43","00:19:45","with the human anatomy.","with the human anatomy which is"
"YkmlPaGui5k","00:19:45","00:19:47","Which is really interesting  when you think about it,","really interesting when you think about it that"
"YkmlPaGui5k","00:19:47","00:19:51","that the coroner was able to tell  that the person who had done this,","the coroner was able to tell that the person who had done this didn't"
"YkmlPaGui5k","00:19:51","00:19:54","didn't hesitate when they  were cutting up the body.","hesitate when they were cutting up the body i found that"
"YkmlPaGui5k","00:19:54","00:19:57","I found that really interesting.","really interesting it may sound"
"YkmlPaGui5k","00:19:57","00:20:00","It may sound morbid, welcome  to my channel, I guess.","morbid um welcome to my channel i guess"
"YkmlPaGui5k","00:20:00","00:20:01","","but but wow it's something"
"YkmlPaGui5k","00:20:01","00:20:03","But wow, it's something  you just don't think about,","you just don't think about"
"YkmlPaGui5k","00:20:04","00:20:04","or I didn't, I don't know.","or i didn't i don't"
"YkmlPaGui5k","00:20:05","00:20:08","Anyway, so it was noted that the  victim's head had been cut off","know anyway so it was noted that the victim's head had been cut"
"YkmlPaGui5k","00:20:09","00:20:15","with just like one bold, clean stroke, which  said that is what killed the victim instantly.","off with just like one bold clean stroke which said that is what killed the victim instantly"
"YkmlPaGui5k","00:20:16","00:20:16","","sadly"
"YkmlPaGui5k","00:20:17","00:20:19","Sadly though, they were unable  to identify this victim as well.","though they were unable to identify this victim as"
"YkmlPaGui5k","00:20:20","00:20:25","Now at this point they were, again,  at six killings in just one year,","well now at this point they were again at six killings in just one year"
"YkmlPaGui5k","00:20:25","00:20:28","not even just like normal  killings, which are still awful,","not even just like normal killings which are"
"YkmlPaGui5k","00:20:29","00:20:32","but these were very intense killings, right?","still awful but these were very but these were very intense killings right"
"YkmlPaGui5k","00:20:33","00:20:33","","where are the damn"
"YkmlPaGui5k","00:20:33","00:20:34","Where are the damn heads?","heads"
"YkmlPaGui5k","00:20:34","00:20:39","They had no clues, no  suspects, nothing to go off of.","they had no clues no suspects nothing to go off of the"
"YkmlPaGui5k","00:20:40","00:20:43","The local newspapers were reporting  on the killings almost daily,","local newspapers were reporting on the killings almost daily"
"YkmlPaGui5k","00:20:44","00:20:49","and the fact that they had no suspects  created a lot of tension in the area.","and the fact that they had no suspects uh created a lot of tension in the in the"
"YkmlPaGui5k","00:20:50","00:20:52","Well a lot of tension and  a lot of fear, I would say.","area well a lot of tension and a lot of fear i would say some"
"YkmlPaGui5k","00:20:52","00:20:55","Some sicko is out here just chopping up people","sicko is out here just chopping up people and you guys"
"YkmlPaGui5k","00:20:55","00:20:58","and you guys are lollygagging,  the police, they're lollygagging,","are lollygagging the police they're lollygagging"
"YkmlPaGui5k","00:20:59","00:21:00","like why haven't they got anyone?","like why haven't they got anyone the media"
"YkmlPaGui5k","00:21:00","00:21:04","The media started referring to  whoever was doing this, the killer,","started referring to whoever was doing this the killer"
"YkmlPaGui5k","00:21:05","00:21:06","they were calling him the ""Mad Butcher"",","they were calling him the mad butcher"
"YkmlPaGui5k","00:21:07","00:21:11","and other than calling him the Mad  Butcher, that's really all they had.","and other than calling him the mad butcher that's really all they had they"
"YkmlPaGui5k","00:21:11","00:21:13","They had nothing, nothing.","had nothing nothing"
"YkmlPaGui5k","00:21:14","00:21:16","You know, sometimes I think  back, not even think back,","you know sometimes i think back not even think back i'll"
"YkmlPaGui5k","00:21:17","00:21:18","I’ll be like sitting on a toilet  minding my own business, right?","be like sitting on a toilet minding my own business right"
"YkmlPaGui5k","00:21:19","00:21:23","And I’m like ""How did they  even solve crimes back then?"",","and i'm like how did they even solve crimes back then unless they caught"
"YkmlPaGui5k","00:21:23","00:21:24","unless they caught him right away,","him right away"
"YkmlPaGui5k","00:21:24","00:21:25","","you could"
"YkmlPaGui5k","00:21:26","00:21:27","you could get away with so much though back then,","get away with so much though back then"
"YkmlPaGui5k","00:21:28","00:21:29","not that that's a good thing but it just--","not that that's a good thing but it just"
"YkmlPaGui5k","00:21:30","00:21:31","I don't know how they did it, I really don’t.","i don't know how they did it i really don't"
"YkmlPaGui5k","00:21:32","00:21:36","The mayor steps in, and he  appoints a new safety director","the mayor steps in and he appoints a new safety director named elliot"
"YkmlPaGui5k","00:21:36","00:21:38","named Elliot Ness to get involved into the case,","ness to get involved into the case"
"YkmlPaGui5k","00:21:39","00:21:40","he's gonna be like the lead main investigator guy,","he's gonna be like the lead main investigator"
"YkmlPaGui5k","00:21:41","00:21:43","he's gonna solve the crime.","guy he's gonna he's gonna solve the crime together"
"YkmlPaGui5k","00:21:43","00:21:46","Together, they put this group of people,","they put this group of people"
"YkmlPaGui5k","00:21:47","00:21:49","the police, the coroner, and a bunch of experts,","the police the coroner and a bunch of experts they"
"YkmlPaGui5k","00:21:50","00:21:52","they come together, and they  create some kind of profile","come together and they create some kind of profile to who"
"YkmlPaGui5k","00:21:53","00:21:53","to who they're looking for.","they're looking"
"YkmlPaGui5k","00:21:54","00:21:56","Some of the police also went undercover","for some of the police also went undercover and"
"YkmlPaGui5k","00:21:56","00:21:59","and started hanging around the Roaring Third","started hanging around the roaring third listening"
"YkmlPaGui5k","00:21:59","00:22:02","listening into conversations,  they were talking to people","into conversations they were talking to people"
"YkmlPaGui5k","00:22:03","00:22:04","acting like they're gambling--","acting like they're gambling"
"YkmlPaGui5k","00:22:05","00:22:05","They probably were gambling, like.","they probably were gambling"
"YkmlPaGui5k","00:22:06","00:22:08","But they were just trying to  talk to people and figure out,","like but they were just trying to talk to people and figure out"
"YkmlPaGui5k","00:22:09","00:22:10","you know, what's the inside scoop.","you know what's the inside scoop"
"YkmlPaGui5k","00:22:11","00:22:11","The police would say over time","the police would say over time"
"YkmlPaGui5k","00:22:12","00:22:16","that they had interviewed up to  like almost 5,000 people, okay?","that they had interviewed up to like almost 5 000 people okay they"
"YkmlPaGui5k","00:22:16","00:22:18","They were trying, they were talking to everybody.","were trying they were talking to everybody"
"YkmlPaGui5k","00:22:19","00:22:21","And it would soon become, or at least turn into,","and it would soon become or at least turn into"
"YkmlPaGui5k","00:22:22","00:22:22","",""
"YkmlPaGui5k","00:22:22","00:22:25","the biggest police investigation  in Cleveland history.","the biggest police investigation in cleveland history"
"YkmlPaGui5k","00:22:26","00:22:28","They were questioning any and everybody,","they were questioning any and everybody and"
"YkmlPaGui5k","00:22:28","00:22:31","and they still came up with nothing.","they still came up with nothing i don't think"
"YkmlPaGui5k","00:22:31","00:22:33","I don't think they were  asking the right questions.","they were asking the right questions i mean don't you"
"YkmlPaGui5k","00:22:34","00:22:37","I mean, don't you think somebody  would have said something?","think somebody would have said something people like to"
"YkmlPaGui5k","00:22:37","00:22:39","People like to talk, people love talking,","talk people love talking especially"
"YkmlPaGui5k","00:22:40","00:22:41","especially when they know something.","when they know something i feel"
"YkmlPaGui5k","00:22:41","00:22:44","I feel like somebody would have said something,","like somebody would have said something"
"YkmlPaGui5k","00:22:45","00:22:47","out of 5,000, nothing?","out of 5 000 nothing well"
"YkmlPaGui5k","00:22:47","00:22:51","Well the killings continue,  and in February of 1937","the killians continue and in february of 1937 the killians continue and in february of 1937"
"YkmlPaGui5k","00:22:52","00:22:57","a man finds the upper half of a  woman's torso washed up on the shore,","a man finds the upper half of a woman's torso washed up on the shore"
"YkmlPaGui5k","00:22:58","00:23:00","unlike the previous victims this cause of death,","unlike the previous victims this"
"YkmlPaGui5k","00:23:01","00:23:04","or her cause of death, had not been decapitation.","cause of death or her cause of death had not been decapitation"
"YkmlPaGui5k","00:23:05","00:23:08","It was believed that she was  decapitated after she was dead,","it was believed that she was decapitated after she was dead"
"YkmlPaGui5k","00:23:09","00:23:12","see before it was like the  decapitation is what killed the person,","see before it was like the decapitation is what killed the person"
"YkmlPaGui5k","00:23:12","00:23:17","now it was believed that the killer didn't  chop off her head until after she was dead.","now it was believed that the killer didn't chop off her head until after she was dead so the"
"YkmlPaGui5k","00:23:18","00:23:20","So the torso was found,  and then three months later","torso was found and then three months later"
"YkmlPaGui5k","00:23:21","00:23:21","","the"
"YkmlPaGui5k","00:23:21","00:23:25","the lower half of this victim's  torso had also washed ashore,","the lower half of this victim's torso had also washed ashore"
"YkmlPaGui5k","00:23:26","00:23:29","but again, she was unable to be identified.","but again she was unable to be identified"
"YkmlPaGui5k","00:23:30","00:23:34","June 1937, a teenager, a teenage boy,","june 1937 she was unable to be identified june 1937 a teenager a teenage boy he's out"
"YkmlPaGui5k","00:23:34","00:23:37","he's out walking, and he gets  to like under a bridge area,","walking and he gets to like under a bridge area"
"YkmlPaGui5k","00:23:38","00:23:41","and under this bridge, that's  where he finds a human skull,","and under this bridge that's where he finds a human skull finds a human skull"
"YkmlPaGui5k","00:23:41","00:23:42","","next"
"YkmlPaGui5k","00:23:43","00:23:47","next to the human skull was a burlap  bag containing skeletal remains.","to the human skull was a burlap bag containing burlap bag containing skeletal remains"
"YkmlPaGui5k","00:23:47","00:23:48","","now"
"YkmlPaGui5k","00:23:48","00:23:52","Now police take in the, you know,  the skeletal remains and whatnot,","police take in the you know the skeletal remains and whatnot and they"
"YkmlPaGui5k","00:23:53","00:23:56","and they are able to determine  that this was a 40-year-old woman,","are able to determine that this was a 40 year old woman and her"
"YkmlPaGui5k","00:23:56","00:24:00","and her dental records were able  to identify her as Rose Wallace.","dental records were able to identify her as rose wallace"
"YkmlPaGui5k","00:24:01","00:24:03","'Cause they were able to get  her name, they were able to...","because they were able to get her name um they were able"
"YkmlPaGui5k","00:24:04","00:24:06","Trying to get anything, something, s--t.","to trying to get anything something [ __ ]"
"YkmlPaGui5k","00:24:07","00:24:08","Nothing came from it.","nothing came from it i mean"
"YkmlPaGui5k","00:24:09","00:24:10","I mean there's bodies everywhere.","there's bodies everywhere"
"YkmlPaGui5k","00:24:11","00:24:18","July 1937, a national guardsman saw  the first limb of the next victim","july 1937 a national guardsman saw the first limb of the next victim"
"YkmlPaGui5k","00:24:19","00:24:20","in the wake of a passing tugboat.","in the wake of a passing tugboat"
"YkmlPaGui5k","00:24:21","00:24:26","Over the next few days police recovered  the entire body from the river,","over the next few days police recovered the entire body from the river but once"
"YkmlPaGui5k","00:24:26","00:24:28","but once again the head was never located.","again the head was never located"
"YkmlPaGui5k","00:24:29","00:24:33","With this victim they saw that  the abdomen had been gutted","with this victim they saw that the abdomen had been gutted and the heart"
"YkmlPaGui5k","00:24:33","00:24:34","and the heart was ripped out.","was ripped out also"
"YkmlPaGui5k","00:24:35","00:24:37","Also this victim was never identified.","this victim was never identified i don't know what"
"YkmlPaGui5k","00:24:37","00:24:39","I don't know what kind of  science project was going on,","kind of science project was going on but"
"YkmlPaGui5k","00:24:39","00:24:40","but holy moly, what the hell.","holy moly what the hell"
"YkmlPaGui5k","00:24:41","00:24:41","",""
"YkmlPaGui5k","00:24:42","00:24:43","What was this person doing?","what was this person doing just keeping"
"YkmlPaGui5k","00:24:43","00:24:46","Just keeping a bunch of heads, oh my gosh.","a bunch of heads oh my gosh"
"YkmlPaGui5k","00:24:47","00:24:49","So then for a minute, things  just kind of went quiet,","so then for a minute things just kind of went quiet"
"YkmlPaGui5k","00:24:50","00:24:53","not sure why, but like nothing  happened for almost a year,","not sure why but like nothing happened for almost"
"YkmlPaGui5k","00:24:54","00:24:54","","a year"
"YkmlPaGui5k","00:24:54","00:24:58","no new victims were being found,  which is good, but it was like","no new victims were being found which is good but it was like okay"
"YkmlPaGui5k","00:24:59","00:25:01","""Okay this is finally over.  Did the killer leave town?"".","this is finally over did the killer leave town"
"YkmlPaGui5k","00:25:02","00:25:04","But as the months passed, it seemed like","but as the months passed it seemed like okay"
"YkmlPaGui5k","00:25:05","00:25:08","""Okay, I think, I think it's over"", nae-nae.","i think i think it's over nae-nae"
"YkmlPaGui5k","00:25:08","00:25:09","",""
"YkmlPaGui5k","00:25:10","00:25:13","No of course not, because then in April of 1938,","no of course not because then in april of 1938 that's right"
"YkmlPaGui5k","00:25:13","00:25:16","that's right, maybe the killer like  went out of town for something,","maybe the killer like went out of town for something"
"YkmlPaGui5k","00:25:17","00:25:18","a business meeting or whatever, I don't know,","a business meeting or whatever i don't know"
"YkmlPaGui5k","00:25:19","00:25:21","we don't know but he was back in town,","we don't know but he was back in town and"
"YkmlPaGui5k","00:25:21","00:25:24","and I shouldn't say he, but I have a feeling.","i shouldn't say he but i have a feeling april"
"YkmlPaGui5k","00:25:24","00:25:27","April 1938, a man on his way to work","feeling april 1938 a man on his way"
"YkmlPaGui5k","00:25:28","00:25:31","saw what he thought was a dead  fish along the riverbanks,","to work saw what he thought was a dead fish along the riverbanks"
"YkmlPaGui5k","00:25:32","00:25:33","oh it wasn't a dead fish though.","oh it wasn't a dead fish though he gets up"
"YkmlPaGui5k","00:25:33","00:25:34","He gets up to it, right?","to it right it's not"
"YkmlPaGui5k","00:25:34","00:25:36","It's not dead fish, of  course it's not a dead fish,","dead fish of course it's not a dead fish it was the"
"YkmlPaGui5k","00:25:37","00:25:39","it was the lower half of a woman's  leg, not even the full leg,","lower half of a woman's leg not even the full leg"
"YkmlPaGui5k","00:25:40","00:25:41","just like the shin and the calf and whatnot.","just like the shin and the calf and whatnot"
"YkmlPaGui5k","00:25:41","00:25:42","","jeez"
"YkmlPaGui5k","00:25:43","00:25:43","Jeez.","and the calf and whatnot jeez"
"YkmlPaGui5k","00:25:43","00:25:47","And then about a month later,  police pulled two burlap bags","and then about a month later police pulled two burlap bags"
"YkmlPaGui5k","00:25:48","00:25:51","out of the river containing both parts  of the torso, and most of the legs,","out of the river containing both parts of the torso and most of the legs"
"YkmlPaGui5k","00:25:52","00:25:57","but this time the coroner was able to  detect drugs in the victim's system.","but this time the coroner was able to detect drugs in the victim's system drugs"
"YkmlPaGui5k","00:25:58","00:26:00","So this could provide some answers, okay?","so this could provide some answers okay drugs so this could provide some answers okay"
"YkmlPaGui5k","00:26:01","00:26:02","Because they're thinking like,","because they're thinking like did"
"YkmlPaGui5k","00:26:03","00:26:04","""Did the victim take the drugs themselves?""","the victim take the drugs themselves"
"YkmlPaGui5k","00:26:05","00:26:09","""Were the drugs given to her? Maybe  that could kind of give some clues."".","were the drugs given to her maybe that could kind of give some clues"
"YkmlPaGui5k","00:26:10","00:26:13","The coroner thought if they  could find the victim's arms","the coroner thought if they could find the victim's arms it might"
"YkmlPaGui5k","00:26:13","00:26:17","it might give further answers, but  unfortunately the victim's arms","give further answers but unfortunately the victim's arms were never located"
"YkmlPaGui5k","00:26:17","00:26:19","were never located, and she was never identified.","and she was never identified"
"YkmlPaGui5k","00:26:20","00:26:20","",""
"YkmlPaGui5k","00:26:21","00:26:25","So August 18th, 1938 a victim's torso was found","so august 18th 1938 a victim's torso was found wrapped"
"YkmlPaGui5k","00:26:26","00:26:27","wrapped in a man's blue blazer.","in a man's blue blazer"
"YkmlPaGui5k","00:26:28","00:26:29","It's wrapped in a blue blazer,","it's wrapped in a blue blazer"
"YkmlPaGui5k","00:26:30","00:26:32","and then it's wrapped again in like an old quilt.","and then it's wrapped again in like an old quilt the"
"YkmlPaGui5k","00:26:33","00:26:35","The legs and the arms were  discovered in a makeshift box,","legs and the arms were discovered in a makeshift box"
"YkmlPaGui5k","00:26:36","00:26:37","it was wrapped in like brown butcher paper,","uh it was wrapped in like brown butcher paper"
"YkmlPaGui5k","00:26:37","00:26:38","","uh it was wrapped in like brown butcher paper and"
"YkmlPaGui5k","00:26:39","00:26:41","and it was held together with rubber bands ,","it was held together with rubber bands"
"YkmlPaGui5k","00:26:42","00:26:44","kind of more creative than  the other bodies, right?","kind of more creative than the other bodies"
"YkmlPaGui5k","00:26:45","00:26:46","Or the other victims.","right or the other victims like i wonder"
"YkmlPaGui5k","00:26:46","00:26:48","Like, I wonder what that's about actually.","what that's about actually this"
"YkmlPaGui5k","00:26:49","00:26:50","This victim was also decapitated,","victim was also decapitated"
"YkmlPaGui5k","00:26:51","00:26:53","and the head it was wrapped on its own separately,","and the head it was wrapped on its own separately"
"YkmlPaGui5k","00:26:54","00:26:55","but it was wrapped up in the same way.","but it was wrapped up in the same way now"
"YkmlPaGui5k","00:26:56","00:26:59","Now it was noted on this victim  that some of the parts look like","it was noted on this victim that some of the parts look like as"
"YkmlPaGui5k","00:26:59","00:27:03","as if they had been refrigerated  or put in like a refrigerator.","if they had been refrigerated or put in like a refrigerator"
"YkmlPaGui5k","00:27:03","00:27:04","I don't know why I keep covering my mouth, sorry.","i don't know why i keep covering my mouth sorry"
"YkmlPaGui5k","00:27:05","00:27:06","But while searching for more evidence,","but while searching for more evidence"
"YkmlPaGui5k","00:27:07","00:27:10","that's when police discovered the  remains of another freaking body, yeah.","that's when police discovered the remains of another freaking body yeah"
"YkmlPaGui5k","00:27:11","00:27:12","Bodies, on bodies, on bodies.","bodies on bodies on body like just a lot"
"YkmlPaGui5k","00:27:12","00:27:13","Like just a lot of bodies going on.","of bodies going on"
"YkmlPaGui5k","00:27:14","00:27:16","But there was another body just yards away.","but there was another bar body just yards away now"
"YkmlPaGui5k","00:27:17","00:27:19","Now these two victims were never identified.","these two victims were never identified"
"YkmlPaGui5k","00:27:20","00:27:20","Now do you remember Elliot Ness?","now do you remember elliot ness"
"YkmlPaGui5k","00:27:21","00:27:23","I like mentioned him earlier today.","i like mentioned him earlier today now elliot ness"
"YkmlPaGui5k","00:27:23","00:27:26","Now Elliot Ness was the one  who was like, the main guy,","was the one who was like the main guy the main investigator"
"YkmlPaGui5k","00:27:26","00:27:28","the main investigator on this case.","on this case elliot"
"YkmlPaGui5k","00:27:29","00:27:31","Elliot was famous himself, and he was most famous","was famous himself and he was most famous"
"YkmlPaGui5k","00:27:31","00:27:34","for bringing down Al Capone, yeah.","for bringing down al capone yeah so"
"YkmlPaGui5k","00:27:34","00:27:37","So he was pretty known, especially by criminals.","he was pretty known especially by criminals but"
"YkmlPaGui5k","00:27:37","00:27:42","But it seemed like the killer was  definitely taunting Elliot at this point.","it seemed like the killer was definitely taunting elliot at this point"
"YkmlPaGui5k","00:27:43","00:27:46","It was in plain view, another body.","it was in plain view another body elliot"
"YkmlPaGui5k","00:27:46","00:27:49","Elliot at this point was  like ""Okay, game on b---h."",","at this point was like okay gay mom [ __ ]"
"YkmlPaGui5k","00:27:50","00:27:51","no, I was kidding, he didn't say that.","no i was kidding he didn't say that but elliott"
"YkmlPaGui5k","00:27:51","00:27:52","But Elliott round--","no i was kidding he didn't say that but elliott round yeah"
"YkmlPaGui5k","00:27:53","00:27:54","Yeah, he probably did actually,","he probably did actually because"
"YkmlPaGui5k","00:27:54","00:27:57","because he pulls the douchiest move of all time.","he pulls the douchiest move of all time elliot"
"YkmlPaGui5k","00:27:57","00:27:59","Elliott deserves douche of the year,","deserves douche of the"
"YkmlPaGui5k","00:28:00","00:28:04","because he rounded up about 35  police officers and detectives,","year because he rounded up about 35 police officers and detectives and his plan"
"YkmlPaGui5k","00:28:04","00:28:08","and his plan was for them to go search  for the killer in the hobo jungles,","was for them to go search for the killer in the hobo jungles"
"YkmlPaGui5k","00:28:09","00:28:12","that's what they called this area,  where all the rundown houses were out","that's what they called this area where all the rundown houses were out and all the homeless"
"YkmlPaGui5k","00:28:12","00:28:13","and all the homeless people are living.","people are living he"
"YkmlPaGui5k","00:28:13","00:28:16","He, Elliot was believing that this  is where the killer was living.","elliot was believing that this is where the killer was living"
"YkmlPaGui5k","00:28:17","00:28:21","So all these police officers,  they raided through the Run.","so all these police officers they raided through the run they were going"
"YkmlPaGui5k","00:28:21","00:28:25","They were going from place to  place, arresting around 63 men.","from place to place arresting around 63 men while police"
"YkmlPaGui5k","00:28:25","00:28:30","While police and firemen searched the  deserted shanties for evidence or clues,","and firemen searched the deserted shanties for evidence or clues"
"YkmlPaGui5k","00:28:31","00:28:33","Elliott at this time was seeing  red, whoever this killer was,","elliott at this time was seeing red whoever this killer was"
"YkmlPaGui5k","00:28:34","00:28:39","was taunting him, and his ego is  probably just a little bruised.","was taunting him and his ego is probably just taunting him and his ego is probably just a little bruised"
"YkmlPaGui5k","00:28:40","00:28:41","What does an angry man do?","what does an angry man do well"
"YkmlPaGui5k","00:28:41","00:28:44","Well he's like ""Let me call  police and tell them really quick""","he's like let me call police and tell them really quick"
"YkmlPaGui5k","00:28:45","00:28:49","""to set the shacks on fire and  burn down the town to the ground "".","to set the shacks on fire and burn down the town to the ground"
"YkmlPaGui5k","00:28:50","00:28:54","So Elliot calls for a police  and firemen to go out there","so elliot calls for a police and firemen to go out there and set these"
