"video_id","min_timecode","max_timecode","text.user","text.auto"
"K_q-xnYRugQ","00:09:35","00:09:37","But it’s not OK here.","but it's not okay here"
"K_q-xnYRugQ","00:09:37","00:09:41","Keep a wire overloaded for too long and it will get very hot.","keep a wire overloaded for too long and it will get very hot and"
"K_q-xnYRugQ","00:09:42","00:09:44","And since flammable stuff may be around it,","since flammable stuff may be around it"
"K_q-xnYRugQ","00:09:45","00:09:46","well that can easily start a fire.","well that can easily start a fire"
"K_q-xnYRugQ","00:09:47","00:09:50","In fact, the wire’s insulation itself is often flammable,","in fact the wire's installation itself is often flammable"
"K_q-xnYRugQ","00:09:51","00:09:55","so if you let it get hot enough it will just spontaneously combust.","so if you let it get hot enough it will just spontaneously combust"
"K_q-xnYRugQ","00:09:56","00:10:00","Oh, and even relatively slight overloads can be a problem.","fun oh and even relatively slight overloads can be a problem if"
"K_q-xnYRugQ","00:10:00","00:10:03","If you have a long cord coiled up like this,","you have a long cord coiled up like this the wire"
"K_q-xnYRugQ","00:10:03","00:10:07","the wire at the center of the bundle will get very warm thanks to the lack of airflow","at the center of the bundle will get very warm thanks to the lack"
"K_q-xnYRugQ","00:10:08","00:10:12","(and the fact that it’s surrounded by other warm bits of wire).","of airflow and the fact that it's surrounded by other warm bits of wire this"
"K_q-xnYRugQ","00:10:12","00:10:15","This is a fire hazard that we’ve just decided is…","is a fire hazard that we've just decided this is a fire hazard that we've just decided is"
"K_q-xnYRugQ","00:10:16","00:10:17","fine, I guess.","fine i guess"
"K_q-xnYRugQ","00:10:18","00:10:20","And it’s not limited to these cheap cords.","and it's not limited to these cheap cords go to"
"K_q-xnYRugQ","00:10:20","00:10:24","Go to a hardware store and you’ll find plenty of “heavy-duty” looking cords","a hardware store and you'll find plenty of heavy-duty looking cords that are"
"K_q-xnYRugQ","00:10:24","00:10:26","that are in fact only 16 gauge.","in fact only 16 gauge"
"K_q-xnYRugQ","00:10:27","00:10:32","They cannot safely supply the entire amount that the wiring in the walls can,","they cannot safely supply the entire amount that the wiring in the walls can which means"
"K_q-xnYRugQ","00:10:32","00:10:36","which means it can be overloaded without your circuit breakers intervening.","it can be overloaded without your circuit breakers intervening"
"K_q-xnYRugQ","00:10:37","00:10:38","And this is just…","and this is just normal"
"K_q-xnYRugQ","00:10:39","00:10:39","normal here.","here"
"K_q-xnYRugQ","00:10:39","00:10:43","You’re just expected to know that this cord is only rated for 13 amps,","you're just expected to know that this cord is only rated for 13 amps"
"K_q-xnYRugQ","00:10:44","00:10:47","and that if you really need 15 amps you gotta pony up for the 14 gauge cord.","and that if you really need 15 amps you got to pony up for the 14 gauge cord"
"K_q-xnYRugQ","00:10:48","00:10:50","It’s frankly bonkers.","it's frankly bonkers oh but it's actually"
"K_q-xnYRugQ","00:10:50","00:10:53","Oh, but it’s actually worse now that 20A circuits are so prevalent.","worse now that 20 amp circuits are so prevalent"
"K_q-xnYRugQ","00:10:54","00:10:57","Don’t get me wrong, 20A circuits are largely a great thing.","don't get me wrong 20 amp circuits are largely a great thing"
"K_q-xnYRugQ","00:10:58","00:11:00","They allow for much greater flexibility in individual rooms,","they allow for much greater flexibility in individual rooms"
"K_q-xnYRugQ","00:11:01","00:11:05","especially in the kitchen where nearly everything is a high-power device.","especially in the kitchen where nearly everything is a high power device"
"K_q-xnYRugQ","00:11:05","00:11:08","But consider something like this power strip.","but consider something like this power strip"
"K_q-xnYRugQ","00:11:08","00:11:14","This actually does use 14 gauge wiring and could be used safely on a 15 amp circuit.","this actually does use 14 gauge wiring and could be used safely on a 15 amp circuit its"
"K_q-xnYRugQ","00:11:14","00:11:17","Its limit and the circuit’s limit are the same,","limit and the circuit's limit are the same so"
"K_q-xnYRugQ","00:11:17","00:11:23","so if you’re overloading this thing you’re also overloading the circuit so the breaker will intervene.","if you're overloading this thing you are also overloading the circuit so the breaker will intervene that's"
"K_q-xnYRugQ","00:11:23","00:11:25","That’s ideally how everything should work.","ideally how everything should work"
"K_q-xnYRugQ","00:11:26","00:11:32","But on a 20A circuit you can now severely overload this without the circuit breaker caring.","but on a 20 amp circuit you can now severely overload this without the circuit breaker carrying and"
"K_q-xnYRugQ","00:11:32","00:11:37","And of course that problem still applies to a cord like this which can handle even less.","of course that problem still applies to a cord like this which can handle even less"
"K_q-xnYRugQ","00:11:38","00:11:40","The outlets in this room are on a 20A circuit.","the outlets in this room are on a 20 amp circuit"
"K_q-xnYRugQ","00:11:41","00:11:44","So I could plug a space heater into this.","so i could plug a space heater into this and"
"K_q-xnYRugQ","00:11:45","00:11:48","And also another one on medium.","also another one on medium that is now"
"K_q-xnYRugQ","00:11:48","00:11:52","That is now 20 amps going through a cord which is only rated for 13.","20 amps going through a cord which is only rated for 13."
"K_q-xnYRugQ","00:11:53","00:11:54","It’s a very dangerous situation,","it's a very dangerous situation"
"K_q-xnYRugQ","00:11:55","00:11:58","especially if the cord is near anything flammable like, oh I dunno,","especially it's a very dangerous situation especially if the cord is near anything flammable like oh i don't know"
"K_q-xnYRugQ","00:11:59","00:11:59","curtains.","curtains"
"K_q-xnYRugQ","00:12:00","00:12:00","Carpet.","carpet a sofa"
"K_q-xnYRugQ","00:12:01","00:12:03","Stuff that goes in houses.","stuff that goes in houses"
"K_q-xnYRugQ","00:12:03","00:12:09","And yet we’re not overloading the circuit so as far as this guy is concerned it’s A-OK.","and yet we're not overloading the circuit so as far as this guy is concerned i'd say okay complicating"
"K_q-xnYRugQ","00:12:09","00:12:12","Complicating things further is that you don’t necessarily even know","things further is that you don't necessarily even"
"K_q-xnYRugQ","00:12:13","00:12:15","what circuits are 20 amps and which ones aren’t.","know what circuits are 20 amps and which ones"
"K_q-xnYRugQ","00:12:16","00:12:16","","aren't"
"K_q-xnYRugQ","00:12:17","00:12:19","This is a NEMA 5-15 receptacle.","this is a nema 515 receptacle which ones aren't this is a nema 515 receptacle"
"K_q-xnYRugQ","00:12:20","00:12:22","It’s the normal one you find everywhere here.","it's the normal one you find everywhere here"
"K_q-xnYRugQ","00:12:23","00:12:26","And this is a NEMA 5-20R receptacle.","and this is a nema 520r receptacle"
"K_q-xnYRugQ","00:12:27","00:12:29","You will only find these on 20A circuits.","you will only find these on 20 amp circuits"
"K_q-xnYRugQ","00:12:30","00:12:35","The neutral pin is T-shaped to accommodate a NEMA 5-20 plug which looks like this.","the neutral pin is t-shaped to accommodate a nema 520 plug which looks like this"
"K_q-xnYRugQ","00:12:36","00:12:39","You basically never see this plug outside of commercial settings","you basically never see this plug outside of commercial settings"
"K_q-xnYRugQ","00:12:39","00:12:44","as it’s reserved for devices which actually need more than 15A to operate.","as it's reserved for devices which actually need more than 15 amps to operate but"
"K_q-xnYRugQ","00:12:45","00:12:50","But, you aren’t always required to use NEMA 5-20R receptacles on 20 amp circuits.","you aren't always required to use nema 520r receptacles on 20 amp circuits"
"K_q-xnYRugQ","00:12:51","00:12:54","In fact, if I’m reading things right, you almost never have to.","in fact if i'm reading things right you almost never have to"
"K_q-xnYRugQ","00:12:55","00:13:01","You can just use NEMA 5-15 so long as there’s more than 1 individual plug on a circuit.","you can just use nema 515 so long as there's more than one individual plug on a circuit"
"K_q-xnYRugQ","00:13:02","00:13:07","Which, because duplex receptacles are the norm here, there pretty much always is.","which because duplex receptacles are the norm here there pretty much always is so"
"K_q-xnYRugQ","00:13:08","00:13:12","So anyway, you usually can’t tell by looking at an outlet if it’s a 15 or 20A circuit,","anyway you usually can't tell by looking at an outlet if it's a 15 or 20 amp circuit"
"K_q-xnYRugQ","00:13:12","00:13:15","and we don’t put protection on things like extension cords","and we don't put protection on things like extension cords"
"K_q-xnYRugQ","00:13:15","00:13:16","so really it’s just a mess.","so really it's just a mess"
"K_q-xnYRugQ","00:13:17","00:13:17","It’s terrible.","it's terrible"
"K_q-xnYRugQ","00:13:18","00:13:23","It is way too easy to create a dangerous situation with a power strip or extension cord.","it is way too easy to create a dangerous situation with a power strip or extension cord"
"K_q-xnYRugQ","00:13:24","00:13:26","So, how do we manage with this terribleness?","so how do we manage with this terribleness"
"K_q-xnYRugQ","00:13:27","00:13:27","",""
"K_q-xnYRugQ","00:13:28","00:13:28","Fear.","fear"
"K_q-xnYRugQ","00:13:29","00:13:34","If there’s one aspect of electrical safety that has successfully permeated through American culture,","if there's one aspect of electrical safety that has successfully permeated through american culture it's that"
"K_q-xnYRugQ","00:13:34","00:13:37","it’s that plugging things into other things is dangerous.","plugging things into other things is dangerous"
"K_q-xnYRugQ","00:13:38","00:13:39","It’s practically a trope at this point.","it's practically a trope at this point"
"K_q-xnYRugQ","00:13:40","00:13:42","And frankly, this is almost too effective.","and frankly this is almost too effective"
"K_q-xnYRugQ","00:13:43","00:13:44","When I revealed the details of this set","when i revealed the details of this set i"
"K_q-xnYRugQ","00:13:45","00:13:47","I showed the cabinet of power strips that everything’s plugged into","showed the cabinet of power strips that everything's plugged into and y'all"
"K_q-xnYRugQ","00:13:48","00:13:49","and y’all freaked out!","freaked out now"
"K_q-xnYRugQ","00:13:49","00:13:55","Now I’ve put this set on a power meter, and the entire thing uses 256 watts,","i've put this set on a power meter the entire thing uses 256 watts"
"K_q-xnYRugQ","00:13:55","00:13:57","barely more than 2 amps.","barely more than two amps"
"K_q-xnYRugQ","00:13:57","00:14:01","The whole thing could easily be run through a cheap extension cord like this.","the whole thing could easily be run through a cheap extension cord like this"
"K_q-xnYRugQ","00:14:02","00:14:02","","this"
"K_q-xnYRugQ","00:14:03","00:14:04","This is not actually dangerous.","is not actually dangerous but"
"K_q-xnYRugQ","00:14:04","00:14:09","But lots of people see this and cringe, which frankly is great.","lots of people see this and cringe which frankly is great if we can't"
"K_q-xnYRugQ","00:14:09","00:14:11","If we can’t do things right on the infrastructure side,","do things right on the infrastructure side we"
"K_q-xnYRugQ","00:14:12","00:14:15","we can at least make people leery of doing stuff like this.","can at least make people leery of doing stuff like this and"
"K_q-xnYRugQ","00:14:15","00:14:21","And the National Electrical Code has some rules as far as how you need to build-out an electrical system.","the national electrical code has some rules as far as how you need to build out an electrical system"
"K_q-xnYRugQ","00:14:21","00:14:24","If you’ve ever been in a reasonably modern American home,","if you've ever been in a reasonably modern american"
"K_q-xnYRugQ","00:14:25","00:14:27","you’ll probably have noticed that there are outlets.","home you'll probably have noticed that there are outlets"
"K_q-xnYRugQ","00:14:28","00:14:29","Everywhere.","everywhere"
"K_q-xnYRugQ","00:14:30","00:14:34","The purpose of this is to minimize the need for extension cords in the first place.","the purpose of this is to minimize the need for extension cords in the first place"
"K_q-xnYRugQ","00:14:35","00:14:38","Because the folks at the NEC recognize that these are bad.","because the folks at the nac recognize that these are bad"
"K_q-xnYRugQ","00:14:39","00:14:43","See, the theory is if there’s an outlet within six feet of any point on a wall","see the theory is if there's an outlet within six feet of any point on a wall"
"K_q-xnYRugQ","00:14:44","00:14:50","well you shouldn’t need an extension cord since 6 feet is more or less the standard length of a power cord.","well you shouldn't need an extension cord since 6 feet is more or less the standard length of a power cord"
"K_q-xnYRugQ","00:14:51","00:14:52","But guys.","but guys i gotta"
"K_q-xnYRugQ","00:14:52","00:14:53","I gotta ask.","ask have"
"K_q-xnYRugQ","00:14:54","00:14:58","Have you considered, maybe, making extension cords less bad?","you considered maybe but guys i gotta ask have you considered maybe making extension cords less bad"
"K_q-xnYRugQ","00:14:59","00:15:01","This place follows those outlet-spacing guidelines","this place follows those outlet spacing guidelines"
"K_q-xnYRugQ","00:15:02","00:15:04","but I still use extension cords.","but i still use extension cords"
"K_q-xnYRugQ","00:15:04","00:15:08","In fact the main reason I use them is because, well, they have three plugs on the end.","in fact the main reason i use them is because well they have three plugs on the end"
"K_q-xnYRugQ","00:15:09","00:15:12","It’s nice to be able to plug in a lamp, phone charger, and another thing","it's nice to be able to plug in a lamp phone charger and another"
"K_q-xnYRugQ","00:15:13","00:15:17","while leaving the other outlet free for a laptop or a vacuum cleaner or whatever.","thing while leaving the other outlet free for a laptop or a vacuum cleaner or whatever"
"K_q-xnYRugQ","00:15:18","00:15:19","These aren’t going away, is the point.","these aren't going away is the point"
"K_q-xnYRugQ","00:15:20","00:15:22","They’re just too convenient.","they're just too convenient really"
"K_q-xnYRugQ","00:15:22","00:15:25","Really, we should have been copying the Brits this entire time.","we should have been copying the brits this entire time"
"K_q-xnYRugQ","00:15:25","00:15:31","I mean, honestly, it can't be that difficult to design a plug that contains a fuse.","i mean honestly it can't be that difficult to design a plug that contains a fuse"
"K_q-xnYRugQ","00:15:31","00:15:32","",""
"K_q-xnYRugQ","00:15:33","00:15:35","In fact, we’ve already done that!","in fact we've already done that"
"K_q-xnYRugQ","00:15:36","00:15:36","",""
"K_q-xnYRugQ","00:15:37","00:15:41","These weedy little plugs in our Christmas lights contain fuses.","these weedy little plugs in our christmas lights contain fuses"
"K_q-xnYRugQ","00:15:42","00:15:45","Christmas lights are cost-cut to a ridiculous degree","christmas lights are cost cut to a ridiculous degree and have something"
"K_q-xnYRugQ","00:15:45","00:15:48","and have something absurd like 22 gauge wiring going through them","absurd like 22 gauge wiring going through them so"
"K_q-xnYRugQ","00:15:49","00:15:54","so there needs to be a fuse since you can only safely pull, like, I dunno, 3 amps through here.","there needs to be a fuse since you can only safely pull like i don't know three amps through here"
"K_q-xnYRugQ","00:15:55","00:15:59","That’s why I said Christmas lights are a safer extension cord than most extension cords.","that's why i said christmas lights are a safer extension cord than most extension cords they"
"K_q-xnYRugQ","00:15:59","00:16:02","They actually have overcurrent protection.","actually have over current protection"
"K_q-xnYRugQ","00:16:02","00:16:03","","granted"
"K_q-xnYRugQ","00:16:03","00:16:06","Granted, they don’t work so well as extension cords","have over current protection granted they don't work so well as extension"
"K_q-xnYRugQ","00:16:07","00:16:09","since they’re usually not polarized but hey.","cords since they're usually not polarized but hey"
"K_q-xnYRugQ","00:16:09","00:16:10","",""
"K_q-xnYRugQ","00:16:11","00:16:11","The point remains.","the point remains"
"K_q-xnYRugQ","00:16:12","00:16:12","",""
"K_q-xnYRugQ","00:16:13","00:16:15","Frankly, if we’re gonna keep selling extension cords like this","frankly if we're going to keep selling extension cords"
"K_q-xnYRugQ","00:16:16","00:16:20","that can’t even carry the minimum current of our smallest circuits,","like this that can't even carry the minimum current of our smallest circuits"
"K_q-xnYRugQ","00:16:20","00:16:23","maybe we oughta put fuses in them.","maybe we ought to put fuses in them ideally"
"K_q-xnYRugQ","00:16:23","00:16:26","Ideally it would go here so it protects the length of the wire,","it would go here so it protects the length of the wire"
"K_q-xnYRugQ","00:16:27","00:16:30","but I’ll settle for putting it in the other end if it makes things easier.","but i'll settle for putting it in the other end if it makes things easier sure"
"K_q-xnYRugQ","00:16:31","00:16:34","Sure, if suddenly we were like “extension cords need fuses now!”","if suddenly we were like extension cords need fuses now"
"K_q-xnYRugQ","00:16:34","00:16:37","that would be confusing (heh) and annoying to a lot of folks,","that would be confusing and annoying to a lot"
"K_q-xnYRugQ","00:16:38","00:16:40","but it would be a heckuva lot safer.","of folks but it would be a heck of a lot safer"
"K_q-xnYRugQ","00:16:41","00:16:43","And fuses are very, very cheap.","and fuses are very cheap"
"K_q-xnYRugQ","00:16:43","00:16:45","It wouldn’t add much cost to the cord set,","it wouldn't add much cost to the cord set"
"K_q-xnYRugQ","00:16:46","00:16:50","and if people are using them correctly they’re unlikely to blow in the first place.","and if people are using them correctly they're unlikely to blow in the first place and for what"
"K_q-xnYRugQ","00:16:50","00:16:53","And for what it’s worth, power strips aren’t always terrible.","it's worth power strips aren't always terrible"
"K_q-xnYRugQ","00:16:53","00:16:56","Lots of them - but certainly not all, to be clear -","lots of them but certainly not all to be clear lots of them but certainly not all to be clear"
"K_q-xnYRugQ","00:16:56","00:16:59","actually incorporate circuit breakers of their own.","actually incorporate circuit breakers of their own"
"K_q-xnYRugQ","00:17:00","00:17:04","Ever notice that the switch says “reset” opposite of ""off""? ","ever notice that the switch says reset opposite of off that's because"
"K_q-xnYRugQ","00:17:04","00:17:09","That’s because this toggle is actually a small circuit breaker and not just a simple switch.","this toggle is actually a small circuit breaker and not just a simple switch"
"K_q-xnYRugQ","00:17:10","00:17:10","Look.","look i plug"
"K_q-xnYRugQ","00:17:10","00:17:13","I plug two space heaters into this and it trips.","two space heaters into this and it trips"
"K_q-xnYRugQ","00:17:14","00:17:18","Now, lots of people will say “never plug a space heater into a power strip”","now lots of people will say never plug a space heater into a power strip"
"K_q-xnYRugQ","00:17:19","00:17:21","and honestly that’s not terrible advice.","and honestly that's not terrible advice a lot"
"K_q-xnYRugQ","00:17:21","00:17:23","A lot of these are made quite cheaply and they do get…","of these are made quite cheaply and they do get"
"K_q-xnYRugQ","00:17:24","00:17:25","kinda melty sometimes.","kind of melty sometimes"
"K_q-xnYRugQ","00:17:25","00:17:28","But the effort is at least often made.","but the effort is at least often made now"
"K_q-xnYRugQ","00:17:28","00:17:30","Now here’s where I step back and ask,","here's where i step back and ask"
"K_q-xnYRugQ","00:17:30","00:17:33","how bad is this really?","how bad is this really how many"
"K_q-xnYRugQ","00:17:33","00:17:37","How many house fires are started due to an overloaded cord or power strip?","house fires are started due to an overloaded cord or power strip"
"K_q-xnYRugQ","00:17:38","00:17:38","","in fact"
"K_q-xnYRugQ","00:17:38","00:17:41","In fact, I don’t think we know!","i don't think we know it looks like"
"K_q-xnYRugQ","00:17:41","00:17:43","It looks like it might not be that many.","it might not be that many"
"K_q-xnYRugQ","00:17:44","00:17:47","According to a 2019 report by the National Fire Protection Association,","according to a 2019 report by the national fire protection association only about"
"K_q-xnYRugQ","00:17:47","00:17:51","only about 10% of fires can be blamed on electrical distribution and lighting equipment,","10 of fires can be blamed on electrical distribution and lighting equipment"
"K_q-xnYRugQ","00:17:52","00:17:56","of which only 11% can be blamed on cords or plugs,","electrical distribution and lighting equipment of which only 11 can be blamed on cords or plugs and further"
"K_q-xnYRugQ","00:17:56","00:18:00","and further of that subset only 12% could be blamed on overloaded equipment.","of that subset only 12 percent could be blamed on overloaded equipment"
"K_q-xnYRugQ","00:18:01","00:18:04","So, we’re talking 12% of 11% of 10%.","percent could be blamed on overloaded equipment so we're talking 12 percent of 11 of 10"
"K_q-xnYRugQ","00:18:05","00:18:07","Or about a tenth of a percent of all fires.","or about a tenth of a percent of all fires"
"K_q-xnYRugQ","00:18:08","00:18:11","However, I personally take issue with this particular study because","however i personally take issue with this particular study because"
"K_q-xnYRugQ","00:18:12","00:18:17","“electrical failure and malfunction” is really, really, vague.","electrical failure and malfunction is really vague"
"K_q-xnYRugQ","00:18:17","00:18:22","And that category gets a huge proportion of all the known fires which makes me think","and that category gets a huge proportion of all the known fires which makes me think"
"K_q-xnYRugQ","00:18:23","00:18:24","it may not mean a whole lot.","it may not mean a whole lot"
"K_q-xnYRugQ","00:18:25","00:18:28","Now, I don’t know anything about fire investigation so don’t take my word for this.","now i don't know anything about fire investigation so don't take my word for this but"
"K_q-xnYRugQ","00:18:28","00:18:33","But I do have to say that I feel this category is being used as a catch-all","i do have to say that i feel this category is being used as a catch-all"
"K_q-xnYRugQ","00:18:34","00:18:35","and I don’t know what exactly it can tell us.","and i don't know what exactly it can tell us"
"K_q-xnYRugQ","00:18:36","00:18:40","The report even says 50% of these fires are of unclassified cause so, frankly,","the report even says 50 of these fires are of unclassified cause so frankly"
"K_q-xnYRugQ","00:18:41","00:18:45","I don’t know how useful this study is for this particular discussion.","i don't know how useful this study is for this particular discussion and in fairness"
"K_q-xnYRugQ","00:18:45","00:18:46","And in fairness, I get it.","i get it"
"K_q-xnYRugQ","00:18:47","00:18:49","Investigating the cause of a fire is tricky when","investigating the cause of a fire is tricky when"
"K_q-xnYRugQ","00:18:49","00:18:52","everything was on fire at one point.","everything was on fire at one point this whole"
"K_q-xnYRugQ","00:18:52","00:18:55","This whole “electrical failure, malfunction” category","electrical failure malfunction category"
"K_q-xnYRugQ","00:18:55","00:18:58","also finds its way into this FEMA study where it accounts for","also finds its way into this fema study where it accounts for"
"K_q-xnYRugQ","00:18:59","00:19:01","88% of electrical fires!","88 of electrical fires"
"K_q-xnYRugQ","00:19:02","00:19:03","...what?","what"
"K_q-xnYRugQ","00:19:04","00:19:04","Again.","again"
"K_q-xnYRugQ","00:19:05","00:19:08","I’m gonna stress that I am a person on the internet with a Google.","i'm going to stress that i am a person on the internet with a google"
"K_q-xnYRugQ","00:19:09","00:19:11","This is speculation and conjecture, nothing more.","this is speculation and conjecture nothing more but"
"K_q-xnYRugQ","00:19:11","00:19:15","But this study also says that in almost 31% of electrical fires,","this study also says that in almost 31 of electrical"
"K_q-xnYRugQ","00:19:16","00:19:20","electrical wire or cable insulation was the first thing ignited.","fires electrical wire or cable insulation was the first thing ignited"
"K_q-xnYRugQ","00:19:20","00:19:23","Annoyingly, though, that could mean cable in the walls, or lamp cords.","annoyingly though that could mean cable in the walls or lamp"
"K_q-xnYRugQ","00:19:24","00:19:24","Who knows.","cords who knows"
"K_q-xnYRugQ","00:19:25","00:19:29","However we do see up here that only 8.7% of electrical fires","however we do see up here that only 8.7 of electrical fires"
"K_q-xnYRugQ","00:19:29","00:19:32","start in a wall cavity or concealed space, which,","start in a wall cavity or concealed space which"
"K_q-xnYRugQ","00:19:33","00:19:35","if my grasp of math is at all intact,","if my grasp of math is at all intact which if my grasp of math is at all intact"
"K_q-xnYRugQ","00:19:35","00:19:40","means the majority of cable and wire-related fires occur outside the wall.","means the majority of cable and wire related fires occur outside the wall which frankly"
