"video_id","min_timecode","max_timecode","text.user","text.auto"
"Xngfshnwm9s","00:24:28","00:24:32","you carbphobics, you people who don't like bread.","carb uh phobics you people who don't like bran"
"Xngfshnwm9s","00:24:33","00:24:35","This is just lettuce, tomato, onion, sauce,","this is just lettuce tomato onion sauce and a burger"
"Xngfshnwm9s","00:24:35","00:24:37","and a burger patty, and it's wrapped in the lettuce.","patty and it's wrapped in the lettuce i think this"
"Xngfshnwm9s","00:24:37","00:24:39","I think this is probably delicious.","is probably delicious"
"Xngfshnwm9s","00:24:40","00:24:41","Look at this. (suspenseful music)","look at this tastes like eating"
"Xngfshnwm9s","00:24:41","00:24:44","It tastes like eating a salad, but it's a sandwich.","a salad there's a sandwich i don't like it"
"Xngfshnwm9s","00:24:45","00:24:46","It's too much vegetable.","it's too much vegetable i've learned"
"Xngfshnwm9s","00:24:46","00:24:47","I've learned from today that the bread","from today"
"Xngfshnwm9s","00:24:48","00:24:50","is pretty (beeps) phenomenal here,","that the bread is pretty [ __ ] phenomenal here so i think"
"Xngfshnwm9s","00:24:50","00:24:52","so I think not getting the bun is a huge mistake.","not getting the bun is a huge mistake"
"Xngfshnwm9s","00:24:53","00:24:55","But if you're gluten free, then I get it.","but if you're gluten free then i get it"
"Xngfshnwm9s","00:24:55","00:24:55","",""
"Xngfshnwm9s","00:24:56","00:24:56","You know?","you know you're doing"
"Xngfshnwm9s","00:24:57","00:24:59","You're doing something out of responsibility","something out of responsibility and requirement"
"Xngfshnwm9s","00:24:59","00:25:02","and requirement, not out of your own selfish,","not out of your own selfish"
"Xngfshnwm9s","00:25:03","00:25:05","current, trendy thing. (laughs)","current trendy thing selfish current trendy thing"
"Xngfshnwm9s","00:25:06","00:25:07","All right, this is the scooby snack,","all right this is the scooby snack"
"Xngfshnwm9s","00:25:08","00:25:09","which is a burger patty for your dog.","which is a burger patty for your dog i don't have a"
"Xngfshnwm9s","00:25:09","00:25:10","Now I don't have a dog, I have a cat.","dog i have a"
"Xngfshnwm9s","00:25:11","00:25:11","Wanna see if Alfred wants","cat let's see if alfred"
"Xngfshnwm9s","00:25:12","00:25:14","a teensy, tinesy bit of this burger?","wants a teensy tiny pit of this burger the burger pie is a"
"Xngfshnwm9s","00:25:14","00:25:15","The burger patty is a good burger patty.","good burger pie right"
"Xngfshnwm9s","00:25:16","00:25:17","It's got a lot of flavor.","it's got a lot of flavor so i'm only going to give"
"Xngfshnwm9s","00:25:17","00:25:18","So I'm only giving him a tiny bit.","him a"
"Xngfshnwm9s","00:25:19","00:25:21","(whimsical music) What do you think?","tiny bit what do you think"
"Xngfshnwm9s","00:25:22","00:25:24","Well, I bet that Alfred's probably happy","well i i bet that alfred's"
"Xngfshnwm9s","00:25:25","00:25:27","to recommend that one, huh, buddy?","probably happy to recommend that one huh buddy you want"
"Xngfshnwm9s","00:25:27","00:25:29","You want some more? - Say more burger.","some more yeah more than that no he can't have no"
"Xngfshnwm9s","00:25:29","00:25:30","- No, you can't have more.","more he's a big"
"Xngfshnwm9s","00:25:30","00:25:31","He's a big cat. - He's licking his lips.","guy"
"Xngfshnwm9s","00:25:32","00:25:32","- Yeah, he's like, that was good.","yeah he's like that was good"
"Xngfshnwm9s","00:25:33","00:25:34","The (beeps) was that? That was good.","was that that was good dad"
"Xngfshnwm9s","00:25:35","00:25:35","Dad, more.","more yeah the scooby"
"Xngfshnwm9s","00:25:36","00:25:36","Yeah, the scooby snack is good.","snack was"
"Xngfshnwm9s","00:25:37","00:25:38","Pet loved it, I thought it was good, too.","good pat loved it i thought it was good too it's a good burger"
"Xngfshnwm9s","00:25:38","00:25:39","It's a good burger patty.","patty it's tasty"
"Xngfshnwm9s","00:25:39","00:25:41","It's tasty. He's coming back.","he's coming back he's like"
"Xngfshnwm9s","00:25:41","00:25:42","(Becky laughs) He's like, what's,","what's uh"
"Xngfshnwm9s","00:25:43","00:25:44","you got some more of that over there?","i'm gonna get some more of that over"
"Xngfshnwm9s","00:25:45","00:25:45","I'll take some more.","there i'll take some more"
"Xngfshnwm9s","00:25:45","00:25:47","Okay, so those are all of those burgers,","okay so those are all of those burgers"
"Xngfshnwm9s","00:25:47","00:25:50","but there is one off-menu secret item burger","but there is one off menu secret item burger that"
"Xngfshnwm9s","00:25:50","00:25:54","that has to take the cake in grotesque visual appeal.","has to take the cake in grotesque visual appeal the"
"Xngfshnwm9s","00:25:55","00:25:56","The flying Dutchman. (whimsical music)","flying dutchman"
"Xngfshnwm9s","00:25:57","00:25:57","What is that, Keith?","what is that keith"
"Xngfshnwm9s","00:25:58","00:26:01","Well, it's two burger patties and two slices of cheese","well it's two burger patties and two slices of cheese"
"Xngfshnwm9s","00:26:02","00:26:04","and that's it, and they've nicely put it onto this wax paper","and that's it and they've nicely put it onto this wax"
"Xngfshnwm9s","00:26:05","00:26:09","which is completely transparent from the grease.","paper which is completely transparent from the grease which is completely transparent from the grease see my face"
"Xngfshnwm9s","00:26:09","00:26:10","You can see my face a little bit there.","a little bit there"
"Xngfshnwm9s","00:26:11","00:26:12","It's probably gonna be good.","that's probably gonna be good oh"
"Xngfshnwm9s","00:26:13","00:26:14","Oh my God. That is so heavy.","my god that's so heavy as"
"Xngfshnwm9s","00:26:15","00:26:17","That is salty as shit. Oh my God.","salty as [ __ ] oh my god now"
"Xngfshnwm9s","00:26:18","00:26:20","Now I understand why they have the sweet pickle","i understand why they have the sweet pickle in their"
"Xngfshnwm9s","00:26:21","00:26:22","in their relish, in their sauce,","relish in their sauce"
"Xngfshnwm9s","00:26:23","00:26:24","why everything has such a great, bold flavor,","why everything has such a great bowl"
"Xngfshnwm9s","00:26:25","00:26:25","why they use those fresh ingredients,","flavor why they use those fresh"
"Xngfshnwm9s","00:26:25","00:26:27","because you need fresh stuff to counteract","ingredients because you need fresh stuff to counteract"
"Xngfshnwm9s","00:26:28","00:26:28","the amount of salt that's just here.","the amount of salt that's just"
"Xngfshnwm9s","00:26:29","00:26:30","This is so salty.","here this is so salty"
"Xngfshnwm9s","00:26:30","00:26:32","Whoo! My Lord.","my lord"
"Xngfshnwm9s","00:26:33","00:26:35","Look at this thing. (laughs)","look at this thing you see"
"Xngfshnwm9s","00:26:36","00:26:36","You see what I'm seeing? This is crazy.","what i'm seeing this is crazy"
"Xngfshnwm9s","00:26:37","00:26:39","We've got one more shipment coming through.","we got one more shipment coming through it's time"
"Xngfshnwm9s","00:26:39","00:26:41","It's time for the last few secret items,","for the last few secret items"
"Xngfshnwm9s","00:26:42","00:26:42","and some desserts.","and some desserts"
"Xngfshnwm9s","00:27:01","00:27:02","I love their animal fries.","love their animal fries"
"Xngfshnwm9s","00:27:03","00:27:04","People say In-N-Out has bad fries.","people saying they now have bad fries"
"Xngfshnwm9s","00:27:04","00:27:05","- I don't care if you make them animal style,","i don't even make them animal style"
"Xngfshnwm9s","00:27:06","00:27:06","their fries suck.","the fries suck the animal"
"Xngfshnwm9s","00:27:06","00:27:07","- The animal style fries, I think the sauce","style fries"
"Xngfshnwm9s","00:27:08","00:27:09","goes with the fries very well.","i think the sauce goes with the fries very well it makes"
"Xngfshnwm9s","00:27:10","00:27:10","It makes them nice and soggy,","it nice and"
"Xngfshnwm9s","00:27:11","00:27:13","which I know a lot of people don't like soggy fries,","soggy which i know a lot of people don't like soggy fries but"
"Xngfshnwm9s","00:27:13","00:27:15","but I do, I don't mind them.","i do i don't mind them so i get"
"Xngfshnwm9s","00:27:15","00:27:18","So I get this combo with this Coke drink right here.","this combo with this coke drink right"
"Xngfshnwm9s","00:27:19","00:27:20","(Herbert farting)","here oh my god"
"Xngfshnwm9s","00:27:21","00:27:24","Oh my God, Herbert just farted. (laughs)","just farted"
"Xngfshnwm9s","00:27:24","00:27:25","- Sorry. - This is on camera.","this is on camera"
"Xngfshnwm9s","00:27:26","00:27:27","- No, that wasn't a fart. - That was a fart.","no there wasn't a fart that was a"
"Xngfshnwm9s","00:27:28","00:27:28","- No. - Oh my God.","fart oh my"
"Xngfshnwm9s","00:27:29","00:27:30","I can't believe you farted on camera.","god i can't believe you guarded on"
"Xngfshnwm9s","00:27:31","00:27:35","- No, it was a door. - (laughs) Okay.","camera all right signing"
"Xngfshnwm9s","00:27:35","00:27:38","All right, I'm signing off and I'm sorry for Herbert's fart.","off and sorry for the perfect part"
"Xngfshnwm9s","00:27:39","00:27:42","- Okay, we are at the dessert portion finally, of the day.","okay we are at the dessert portion finally of the day we've eaten"
"Xngfshnwm9s","00:27:42","00:27:44","We've eaten all the different iterations of the burger,","all the different iterations of the burger but"
"Xngfshnwm9s","00:27:44","00:27:47","but we also decided to get ourselves","we also decided to get ourselves a true"
"Xngfshnwm9s","00:27:47","00:27:49","a true grilled cheese.","grilled cheese yb"
"Xngfshnwm9s","00:27:49","00:27:51","YB picked it up, so sweet.","picked it up so sweet i was under the impression"
"Xngfshnwm9s","00:27:51","00:27:53","I was under the impression they did these inside out,","they did these inside"
"Xngfshnwm9s","00:27:54","00:27:54","but maybe they don't.","out but maybe they don't"
"Xngfshnwm9s","00:27:55","00:27:56","Maybe that's just not how they do it anymore.","maybe that's just not how they do it anymore maybe they"
"Xngfshnwm9s","00:27:56","00:27:57","Maybe they just do it like this,","just do it like this because i know they"
"Xngfshnwm9s","00:27:57","00:27:59","because I know they changed how their griddles worked,","changed how their griddles worked"
"Xngfshnwm9s","00:28:00","00:28:02","that they grill some buns on the griddle,","they grilled some buns on the grill and they grilled the"
"Xngfshnwm9s","00:28:02","00:28:03","and they grill the burgers on another one.","burgers on another"
"Xngfshnwm9s","00:28:04","00:28:06","I don't know, but this is just a cheese sandwich.","one i don't know but it's just cheese sandwich it's"
"Xngfshnwm9s","00:28:06","00:28:07","It's good, but I think it would be better","good but i think it would be better if they"
"Xngfshnwm9s","00:28:07","00:28:08","if they just flipped it inside out.","just flipped it inside out"
"Xngfshnwm9s","00:28:09","00:28:10","Also, it's salty too.","also it's salty too maybe the"
"Xngfshnwm9s","00:28:11","00:28:12","Maybe the cheese is really salty,","cheese is really salty because"
"Xngfshnwm9s","00:28:12","00:28:13","'cause like, it's so salty.","like i'm so salty"
"Xngfshnwm9s","00:28:14","00:28:15","Just wanna note, you can get the sport peppers,","just want to know you can get the sport"
"Xngfshnwm9s","00:28:16","00:28:17","the little chilies by themselves.","peppers to little chilies by themselves"
"Xngfshnwm9s","00:28:18","00:28:18","I already ate them on a burger.","i already ate them on a burger"
"Xngfshnwm9s","00:28:19","00:28:19","I don't really wanna eat them by themselves,","i don't really want to eat them by themselves because"
"Xngfshnwm9s","00:28:20","00:28:20","'cause they're gonna ruin my mouth.","they go around my"
"Xngfshnwm9s","00:28:21","00:28:21","But you can get them.","mouth we can get them"
"Xngfshnwm9s","00:28:22","00:28:24","Let's move our way through the milkshakes.","let's move our way through the milkshakes this is"
"Xngfshnwm9s","00:28:24","00:28:26","This is vanilla?","vanilla looks"
"Xngfshnwm9s","00:28:27","00:28:27","It looks like vanilla.","like vanilla"
"Xngfshnwm9s","00:28:28","00:28:30","It smells like ketchup. (chuckles)","smells like ketchup i"
"Xngfshnwm9s","00:28:30","00:28:33","I don't think, I think that maybe that's just my hand?","don't think i think that maybe is my hand"
"Xngfshnwm9s","00:28:33","00:28:35","Okay, this is the vanilla milkshake.","okay this is the vanilla milkshake just"
"Xngfshnwm9s","00:28:35","00:28:37","Just looks like a milkshake.","looks like a milkshake tastes"
"Xngfshnwm9s","00:28:38","00:28:39","Tastes a lot like a McDonald's vanilla cone.","a lot like a mcdonald's vanilla cone tastes a lot like a mcdonald's vanilla cone"
"Xngfshnwm9s","00:28:40","00:28:42","Very thick for a milkshake. Pretty much just ice cream.","very thick for a milkshake pretty much just ice cream i mean it's"
"Xngfshnwm9s","00:28:43","00:28:44","I mean, it's so solid.","it's so solid look it's not"
"Xngfshnwm9s","00:28:45","00:28:46","Look, it's not moving at all on the straw.","moving at all in the straw it's pretty"
"Xngfshnwm9s","00:28:47","00:28:48","Not the best vanilla I'd had in my life,","good not the best vanilla i've had"
"Xngfshnwm9s","00:28:49","00:28:51","but it's sweet, vanilla-y, calming.","my wife but it's a sweet vanilla e calming"
"Xngfshnwm9s","00:28:52","00:28:53","Cute, as they say.","cute as they say"
"Xngfshnwm9s","00:28:54","00:28:57","So let's move on to, is this the chocolate?","so let's move on to this is the chocolate"
"Xngfshnwm9s","00:28:58","00:29:00","These look exactly the same as the vanilla.","these look exactly the same [Music]"
"Xngfshnwm9s","00:29:01","00:29:03","",""
"Xngfshnwm9s","00:29:04","00:29:06","Okay, this is the chocolate shake.","okay this is the chocolate shake i'm"
"Xngfshnwm9s","00:29:07","00:29:07","I'm gonna eat it with a fork.","gonna eat it with a fork is it the"
"Xngfshnwm9s","00:29:07","00:29:10","Is it the chocolate shake? (mysterious music)","chocolate shake it's a very"
"Xngfshnwm9s","00:29:10","00:29:11","It's a very mild chocolate.","mild chocolate"
"Xngfshnwm9s","00:29:12","00:29:13","I mean, look at it.","i mean i mean look at it it's barely"
"Xngfshnwm9s","00:29:14","00:29:17","It's barely chocolate. It's white.","chocolate it's all it's white"
"Xngfshnwm9s","00:29:17","00:29:18","","it doesn't taste"
"Xngfshnwm9s","00:29:19","00:29:19","It doesn't taste like chocolate.","like chocolate"
"Xngfshnwm9s","00:29:20","00:29:20","It doesn't taste like anything.","it doesn't taste like anything like"
"Xngfshnwm9s","00:29:20","00:29:22","I guess it, like eency-weensy bit of chocolate.","i said like eensy weensy"
"Xngfshnwm9s","00:29:23","00:29:23","","bit chocolate"
"Xngfshnwm9s","00:29:24","00:29:26","An eency-weensy bit? A tiny bit?","easy weezy bit a tiny bit not"
"Xngfshnwm9s","00:29:27","00:29:27","Not much.","much this"
"Xngfshnwm9s","00:29:28","00:29:30","This one definitely is a vanilla shake, right?","one definitely is the vanilla shake right"
"Xngfshnwm9s","00:29:31","00:29:32","Look at them in the same light.","look at them in the same light this one's"
"Xngfshnwm9s","00:29:33","00:29:33","This one's wetter.","wetter one of these is"
"Xngfshnwm9s","00:29:33","00:29:34","One of these is a black and white,","a black and white"
"Xngfshnwm9s","00:29:35","00:29:35","which means there would be chocolate somewhere.","which means there would be chocolate somewhere"
"Xngfshnwm9s","00:29:36","00:29:37","Maybe that first one was the black and white,","maybe that first one is the black and white and this"
"Xngfshnwm9s","00:29:38","00:29:38","and this is the vanilla?","is the vanilla"
"Xngfshnwm9s","00:29:39","00:29:40","I don't (beeps) know.","i don't [ __ ] know this looks like"
"Xngfshnwm9s","00:29:40","00:29:41","This looks like it's just vanilla.","it's just vanilla"
"Xngfshnwm9s","00:29:42","00:29:42","",""
"Xngfshnwm9s","00:29:43","00:29:46","Yeah, that's vanilla, this is vanilla,","yeah that's vanilla this is vanilla"
"Xngfshnwm9s","00:29:47","00:29:49","this is chocolate.","this is chocolate maybe i"
"Xngfshnwm9s","00:29:49","00:29:51","Maybe I just didn't get the thing I needed,","just didn't get the thing i needed"
"Xngfshnwm9s","00:29:51","00:29:54","but all of the, the vanillas and the chocolates","but all the vanillas and chocolates all taste"
"Xngfshnwm9s","00:29:54","00:29:55","all taste exactly the same.","exactly the same the strawberry"
"Xngfshnwm9s","00:29:56","00:29:58","The strawberry shake is quite obviously not vanilla.","shake is quite obviously not vanilla"
"Xngfshnwm9s","00:30:01","00:30:03","Oh! It's weird.","oh it's weird oh"
"Xngfshnwm9s","00:30:04","00:30:05","Oh, it's too strawberry.","it's too it's too strawberry"
"Xngfshnwm9s","00:30:06","00:30:07","It looks like they add in the strawberry flavoring","it looks like they add in strawberry flavoring"
"Xngfshnwm9s","00:30:08","00:30:10","to the vanilla, which makes me think","to the vanilla which makes you think they"
"Xngfshnwm9s","00:30:10","00:30:13","they add in the chocolate flavoring to the vanilla,","add in the chocolate flavoring to the vanilla"
"Xngfshnwm9s","00:30:13","00:30:16","which would explain why it just tastes like vanilla.","which would explain why it just tastes like vanilla would explain why it just tastes like vanilla"
"Xngfshnwm9s","00:30:17","00:30:19","It makes it seem like they added in a flavoring","it makes it seem like they added in a flavoring"
"Xngfshnwm9s","00:30:20","00:30:21","and then mixed it up like in this cup,","and then mix it up like in this cup like something"
"Xngfshnwm9s","00:30:22","00:30:23","like somebody went, ugh, okay, you want strawberry,","right now okay you want strawberry okay"
"Xngfshnwm9s","00:30:24","00:30:25","okay, okay, let me get a strawberry one.","okay let me get a strawberry one it's"
"Xngfshnwm9s","00:30:25","00:30:26","It's not a good strawberry milkshake.","not a good strawberry milkshake"
"Xngfshnwm9s","00:30:27","00:30:28","I think everything on the table's vanilla.","i think everything on the table is vanilla okay"
"Xngfshnwm9s","00:30:28","00:30:29","Okay, this is the Neapolitan.","this is the neapolitan"
"Xngfshnwm9s","00:30:30","00:30:32","This is the chocolate, strawberry and vanilla.","this is the chocolate strawberry and vanilla"
"Xngfshnwm9s","00:30:33","00:30:35","I am eating all the shakes with a knife.","i am eating all the shakes with a knife no real"
"Xngfshnwm9s","00:30:36","00:30:36","No real reason for that.","reason for that"
"Xngfshnwm9s","00:30:37","00:30:38","Again, I'm looking for the chocolate.","again i'm looking for the chocolate there's nothing"
"Xngfshnwm9s","00:30:38","00:30:40","There's nothing about this that is chocolate.","about this this chocolate this is"
"Xngfshnwm9s","00:30:41","00:30:41","This is bad.","bad it just tastes like the"
"Xngfshnwm9s","00:30:41","00:30:43","It just tastes like the fake strawberry syrup","fake strawberry syrup they're putting"
"Xngfshnwm9s","00:30:43","00:30:44","they're putting on.","on no uh"
"Xngfshnwm9s","00:30:44","00:30:46","No. Um, no.","no across the board"
"Xngfshnwm9s","00:30:46","00:30:48","Across the board, I don't like these shakes.","i don't like these shakes i don't think they're very"
"Xngfshnwm9s","00:30:49","00:30:50","I think the vanilla is fine.","good i think the vanilla is fine"
"Xngfshnwm9s","00:30:51","00:30:51","But they have a root beer float as well.","but they have a root beer float"
"Xngfshnwm9s","00:30:52","00:30:56","And I, as a child, loved a good old fashioned RBF.","as well and i as a child loved a good old-fashioned rbf but i will"
"Xngfshnwm9s","00:30:56","00:30:57","But I will say that root beer floats","say that root beer floats"
"Xngfshnwm9s","00:30:58","00:30:59","are the ugliest looking drink.","are the ugliest looking drink"
"Xngfshnwm9s","00:30:59","00:31:03","Like the fizz that has fallen, and it's just, ugh.","like the fizz that has fallen is just uh"
"Xngfshnwm9s","00:31:05","00:31:07","","you know what"
"Xngfshnwm9s","00:31:08","00:31:09","If you've had one before, you know what I'm saying.","i'm saying if you've had one before you know what i'm saying"
"Xngfshnwm9s","00:31:10","00:31:12","(upbeat music)","that's what that should taste like"
"Xngfshnwm9s","00:31:13","00:31:14","But you don't go to In-N-Out for the desserts.","but you don't go to in and out for the desserts at least"
"Xngfshnwm9s","00:31:14","00:31:16","At least I hope you don't, because you really go","i hope you don't because you really go"
"Xngfshnwm9s","00:31:17","00:31:18","to In-N-Out to have eight different versions","to in and out to have eight different versions of the same"
"Xngfshnwm9s","00:31:18","00:31:20","of the same thing, and with that,","thing and with that it's now"
"Xngfshnwm9s","00:31:20","00:31:23","it's now time to decide the best and the least best.","time to decide the best and the least best"
"Xngfshnwm9s","00:31:24","00:31:25","Gosh, all the burgers were excellent.","gosh all the burgers were excellent"
"Xngfshnwm9s","00:31:26","00:31:28","I'm gonna tell you the best way to order a burger,","i'm gonna tell you the best way to order a burger"
"Xngfshnwm9s","00:31:28","00:31:31","and the least best way to order your burger,","and the least best way to order your burger"
"Xngfshnwm9s","00:31:32","00:31:33","based off of all the iterations","based off of all the iterations of burgers"
"Xngfshnwm9s","00:31:33","00:31:34","of burgers that I had today.","that i had today but i'm going to"
"Xngfshnwm9s","00:31:34","00:31:37","But I'm gonna suggest a double double animal style.","suggest a double double animal style if you like"
"Xngfshnwm9s","00:31:37","00:31:40","If you like spice, I think add some of those peppers to it.","spice i think add some of those peppers to it i think"
"Xngfshnwm9s","00:31:40","00:31:42","I think the cold cheese is fun, so maybe have","the cold cheese is fun so"
"Xngfshnwm9s","00:31:43","00:31:45","the double double have cold cheese.","maybe have a double double have cold cheese how wild"
"Xngfshnwm9s","00:31:45","00:31:46","How wild would that be?","would that be i don't know"
"Xngfshnwm9s","00:31:47","00:31:47","I don't know.","i you know"
"Xngfshnwm9s","00:31:47","00:31:48","You know, it's hard for me to choose the best burger,","it's hard for me to choose the"
"Xngfshnwm9s","00:31:49","00:31:50","'cause they're all so similar.","best burger because they're all so similar"
"Xngfshnwm9s","00:31:51","00:31:52","I would advise against the protein burger.","i would advise against the protein burger"
"Xngfshnwm9s","00:31:53","00:31:54","I would advise against the flying Dutchman.","i would advise against the flying dutchman the least"
"Xngfshnwm9s","00:31:55","00:31:56","The least best, I was gonna give it to the fries,","best i was going to give it to the fries"
"Xngfshnwm9s","00:31:57","00:31:58","but after having those milkshakes, I have to say,","but after having those milkshakes i have"
"Xngfshnwm9s","00:31:59","00:32:01","I can't recommend those milkshakes at all.","to say i can't recommend those milkshakes at all"
"Xngfshnwm9s","00:32:02","00:32:04","Probably the best thing there are the vegetables.","probably the best thing there are the vegetables and"
"Xngfshnwm9s","00:32:04","00:32:07","And that's it, In-N-Out, the whole menu is so similar,","that's it in and out the whole menu is so similar"
"Xngfshnwm9s","00:32:07","00:32:09","but it is delicious.","but it is delicious"
"Xngfshnwm9s","00:32:10","00:32:13","I just think it's a worthwhile company to support,","i just think it's a worthwhile company to support especially"
"Xngfshnwm9s","00:32:13","00:32:14","especially when you're in California.","when you're in california in"
"Xngfshnwm9s","00:32:15","00:32:17","In fact, let's just get rid of this whole Whataburger","fact let's just get rid of this whole whataburger get rid of this whole whataburger"
"Xngfshnwm9s","00:32:18","00:32:20","versus In-N-Out versus Shake Shack versus McDonald's.","versus in and out for shake shack versus mcdonald's"
"Xngfshnwm9s","00:32:21","00:32:22","They're all great, you know?","they're all great you know"
"Xngfshnwm9s","00:32:23","00:32:25","They all have something worth going to and enjoying.","they're all they all have something worth going to and enjoying"
"Xngfshnwm9s","00:32:26","00:32:26","But I had a great time.","but i had a great time i ate"
"Xngfshnwm9s","00:32:27","00:32:28","I ate lots of good stuff. We had lots of great guests.","lots of good stuff we had lots of great guests"
"Xngfshnwm9s","00:32:29","00:32:31","Becky came by, @Becksmecks2.","becky came by hatback smacks too"
"Xngfshnwm9s","00:32:32","00:32:35","My cat came by, @Bigfriendlycat, and of course, me.","my cat came by at big friendly cat and of course me and follow me"
"Xngfshnwm9s","00:32:35","00:32:36","And follow me on TikTok.","on tick tock"
"Xngfshnwm9s","00:32:37","00:32:39","I eat big spoons full of food. It's fun.","i hate big spoons full of food it's fun thanks to all"
"Xngfshnwm9s","00:32:39","00:32:40","Thanks to all of the Try staff for getting me","of the tri-staff for getting"
"Xngfshnwm9s","00:32:41","00:32:42","the different portions of this menu,","me the different portions of this"
"Xngfshnwm9s","00:32:43","00:32:45","so we could do this today very efficiently.","menu so we can do this today very efficiently and yeah"
"Xngfshnwm9s","00:32:45","00:32:46","And yeah, thanks to me.","thanks to me this"
"Xngfshnwm9s","00:32:46","00:32:48","This is ""Eat the Menu."" We'll see you next time.","is eat the menu we'll see you next time make sure you"
"Xngfshnwm9s","00:32:48","00:32:50","Make sure you get yourself some Keith Habersberger Sauce,","get yourself some keith's happens burger"
"Xngfshnwm9s","00:32:51","00:32:52","and some Keith's Chicken Sauce right now.","sauce and some key chicken sauce right now"
