"video_id","min_timecode","max_timecode","text.user","text.auto"
"b-BMnh4p96w","00:24:15","00:24:15","- There's always some twists","there's always some"
"b-BMnh4p96w","00:24:16","00:24:17","that you can't even prepare for.","twist that you can't even prepare for"
"b-BMnh4p96w","00:24:18","00:24:19","Manila, who are your early front runners","vanilla who are your early front runners for"
"b-BMnh4p96w","00:24:19","00:24:21","for the winner of season six?","the winner of season six"
"b-BMnh4p96w","00:24:22","00:24:24","- Ooh, okay, let's see.","okay let's see i have no"
"b-BMnh4p96w","00:24:24","00:24:25","I have no idea at this point.","idea at this point it's too early"
"b-BMnh4p96w","00:24:25","00:24:26","It's too early to tell.","to tell"
"b-BMnh4p96w","00:24:27","00:24:31","- I'm standing Sonique but I'm also, I really like A'Keria.","i'm standing sonique but i'm also um i really like"
"b-BMnh4p96w","00:24:32","00:24:32","","akira that's"
"b-BMnh4p96w","00:24:33","00:24:33","That's who I am.","who i am mm-hmm"
"b-BMnh4p96w","00:24:34","00:24:35","But it's really hard to tell.","but it's really hard to tell i'm"
"b-BMnh4p96w","00:24:36","00:24:37","Manila Luzon, I'm so happy you were here today.","gonna lose on i'm so happy we're here today"
"b-BMnh4p96w","00:24:38","00:24:38","I love talking to you.","i love talking to"
"b-BMnh4p96w","00:24:39","00:24:40","Thank you so much for joining me.","you thank you so much for joining me thanks"
"b-BMnh4p96w","00:24:40","00:24:42","- Thanks for having me, girl.","for having me girl"
"b-BMnh4p96w","00:24:43","00:24:43","- Where can the children find you?","where can like where can the children find"
"b-BMnh4p96w","00:24:44","00:24:46","- Of course, you can find me everywhere.","you of course you can find me everywhere i'm everywhere"
"b-BMnh4p96w","00:24:46","00:24:47","I'm everywhere.","you can you can catch"
"b-BMnh4p96w","00:24:48","00:24:50","You can catch me on All Stars 7, 8, 9, and 10. (laughs)","me on all stars seven eight nine and ten"
"b-BMnh4p96w","00:24:51","00:24:53","- We all (beep) wish.","we all wish"
"b-BMnh4p96w","00:24:53","00:24:54","","and thank"
"b-BMnh4p96w","00:24:55","00:24:56","And thank you guys for joining me for The Pit Stop.","you guys for joining me for the pit"
"b-BMnh4p96w","00:24:57","00:24:58","Make sure you catch us next week","stop make sure you catch us next week for"
"b-BMnh4p96w","00:24:58","00:25:02","for episode three of All Stars, season six, goodbye.","episode three of all star season six goodbye"
"b-BMnh4p96w","00:25:03","00:25:03","- Bye.","bye"
"b-BMnh4p96w","00:25:03","00:25:08","","[Music] pays to"
"b-BMnh4p96w","00:25:09","00:25:10","- It pays to be fake nice to everyone.","be fake nice to everyone"
"b-BMnh4p96w","00:25:11","00:25:11","- You know why?","you know what sometimes"
"b-BMnh4p96w","00:25:12","00:25:12","Because sometimes it does.","it does"
"b-BMnh4p96w","00:25:13","00:25:13","I mean, we're both getting paid.","i mean we're both getting"
"b-BMnh4p96w","00:25:14","00:25:14","- We hate each other.","paid we hate each other"
"b-BMnh4p96w","00:25:15","00:25:16","- Yes, thanks Orbitz.","yes thanks orbitz"
"b-BMnh4p96w","00:25:17","00:25:17","- Thanks Orbitz.","thanks orbitz"
"b-BMnh4p96w","00:25:18","00:25:33","","do you want everything rupaul's drag race at your fingertips then head over to youtube now and subscribe to the rupaul's drag race channel and you will get all the episodes of everything you ever want including brand new episodes of what you're packing hi"
