"video_id","min_timecode","max_timecode","text.user","text.auto"
"p-q1GTtH4LE","00:16:12","00:16:14","but it would be like gross Yoda stuff.","would be like gross yoda stuff it'd"
"p-q1GTtH4LE","00:16:15","00:16:16","It'd be rootleaf stew out in the woods","be root leaf stew out in the woods in that"
"p-q1GTtH4LE","00:16:17","00:16:18","in the weird island planet where he lives.","weird island planet where he lives i don't"
"p-q1GTtH4LE","00:16:18","00:16:19","I don't think he cares that much about food.","think he cares that much about food i"
"p-q1GTtH4LE","00:16:20","00:16:21","I think food is more of like a survival","think food is more of like a survival like"
"p-q1GTtH4LE","00:16:22","00:16:23","like sustenance thing for him.","like sustenance thing for him"
"p-q1GTtH4LE","00:16:24","00:16:24","Han, no way.","han no way"
"p-q1GTtH4LE","00:16:25","00:16:25","Darth Vader, no.","darth vader no"
"p-q1GTtH4LE","00:16:26","00:16:28","He's getting his nutrients through a tube or some weird.","he's getting his nutrients through a tube or some weird he's"
"p-q1GTtH4LE","00:16:28","00:16:30","He's eating electricity or something.","eating electricity or something chewy"
"p-q1GTtH4LE","00:16:30","00:16:31","Chewie, maybe.","electricity or something chewy maybe i mean he's"
"p-q1GTtH4LE","00:16:31","00:16:33","I mean, he's one of the few people","the one of the few people that has cooked"
"p-q1GTtH4LE","00:16:33","00:16:34","that has cooked in the movies","in the movies like from"
"p-q1GTtH4LE","00:16:34","00:16:36","like from the Star Wars Christmas Special,","the star wars christmas special there"
"p-q1GTtH4LE","00:16:36","00:16:37","there is like a whole cooking segment.","is like a whole cooking segment"
"p-q1GTtH4LE","00:16:38","00:16:41","I think it was stewed bantha or something like that.","i think it was um segment i think it was um stewed bantha or something like that"
"p-q1GTtH4LE","00:16:42","00:16:43","Hey, guys, thank you so much for all the amazing questions.","hey guys thank you so much for all the amazing questions thank"
"p-q1GTtH4LE","00:16:43","00:16:45","Thank you WIRED for having me.","you wired for having me this"
"p-q1GTtH4LE","00:16:45","00:16:46","This has been Cooking Support.","has been cooking"
"p-q1GTtH4LE","00:16:47","00:16:51","","support"
