"video_id","min_timecode","max_timecode","text.user","text.auto"
"Rm9t94mpkjo","00:25:08","00:25:10","Because of him, record of Hatshepsut's accomplishments","do because of him record of hatshepsut's accomplishments"
"Rm9t94mpkjo","00:25:11","00:25:13","had effectively been erased and it would take hundreds","had effectively been erased and it would take hundreds of years"
"Rm9t94mpkjo","00:25:13","00:25:16","of years of archeology to rediscover it.","of archaeology to rediscover it so he must be holding"
"Rm9t94mpkjo","00:25:16","00:25:17","- So he must be holding a grudge, it seems like.","a grudge it seems"
"Rm9t94mpkjo","00:25:18","00:25:19","- Maybe.","like something maybe i mean sometimes"
"Rm9t94mpkjo","00:25:19","00:25:21","- I mean, sometimes, grudges could be long growing.","grudges could be long growing"
"Rm9t94mpkjo","00:25:22","00:25:22","- That's true.","that's true i guess i could have"
"Rm9t94mpkjo","00:25:22","00:25:23","- You could've woken up one day and been like,","woken up one day and been like"
"Rm9t94mpkjo","00:25:24","00:25:24","you know what? Fuck that.","you know what [ __ ]"
"Rm9t94mpkjo","00:25:25","00:25:25","(laughing)","that"
"Rm9t94mpkjo","00:25:26","00:25:26","- Actually.","actually"
"Rm9t94mpkjo","00:25:27","00:25:28","- There's also the possibility that on day one,","there's also the possibility that actually there's also the possibility that you know"
"Rm9t94mpkjo","00:25:29","00:25:32","he's like, all right, Hatshepsut, love that lady,","on day one he's like r.i.p hatshepsut that you know on day one he's like r.i.p hatshepsut loved that lady but i'm"
"Rm9t94mpkjo","00:25:33","00:25:34","but I'm pharaoh now, hooray!","pharaoh now hooray and you know he"
"Rm9t94mpkjo","00:25:34","00:25:36","And he goes to meet with his advisors and they're like,","goes to meet with his advisors and they're"
"Rm9t94mpkjo","00:25:37","00:25:38","hey, nice to have you here.","like hey nice to have you"
"Rm9t94mpkjo","00:25:39","00:25:42","By the way, Hatshepsut, boy, oh boy, she kicked ass.","here by the way hot shop soot boy oh boy she kicked ass uh well you"
"Rm9t94mpkjo","00:25:42","00:25:43","You really better live up to this","really better live up to this"
"Rm9t94mpkjo","00:25:43","00:25:46","and then day by day, it's Hatshepsut this, Hatshepsut that.","and then day by day it's hot chefs hot"
"Rm9t94mpkjo","00:26:11","00:26:11","today known as KV60.","kv-60"
"Rm9t94mpkjo","00:26:12","00:26:13","Inside were some mummified geese,","inside were some mummified geese"
"Rm9t94mpkjo","00:26:14","00:26:16","the mummy of Hatshepsut's royal wet nurse,","the mummy of hot shepherd's royal wet nurse and"
"Rm9t94mpkjo","00:26:16","00:26:19","and the mummy of another unidentified female.","the mummy of another unidentified female"
"Rm9t94mpkjo","00:26:20","00:26:21","Mystery!","mystery"
"Rm9t94mpkjo","00:26:21","00:26:24","Skip ahead another 100 or so years to 2007","skip ahead another 100 or so years to 2007 and"
"Rm9t94mpkjo","00:26:24","00:26:26","and with the help of modern technology,","with the help of modern technology a"
"Rm9t94mpkjo","00:26:27","00:26:30","a CT scan would confirm that the unidentified mummy","ct scan would confirm that the unidentified mummy"
"Rm9t94mpkjo","00:26:30","00:26:32","was likely Hatshepsut after all.","was likely hot cheps"
"Rm9t94mpkjo","00:26:33","00:26:33","- Wow. - Huh.","after all wow"
"Rm9t94mpkjo","00:26:34","00:26:36","- Now with Hatshepsut's body finally accounted for,","now with hot chef soot's body finally accounted for"
"Rm9t94mpkjo","00:26:36","00:26:38","tests were conducted in an attempt","tests were conducted in an attempt"
"Rm9t94mpkjo","00:26:38","00:26:40","to determine the cause of her death.","to determine the cause of her death"
"Rm9t94mpkjo","00:26:41","00:26:42","- So. ♪ Ba da da dum ♪","so what is"
"Rm9t94mpkjo","00:26:42","00:26:45","- What is the leading theory for how Hatshepsut died?","the leading theory for how hot shep soot died a"
"Rm9t94mpkjo","00:26:46","00:26:48","A, she was mauled by a tiger, which presumably came","she was mauled by a tiger which presumably came"
"Rm9t94mpkjo","00:26:49","00:26:50","from her trading partners in Punt.","from her training partners in punt"
"Rm9t94mpkjo","00:26:51","00:26:53","B, she had cancer as a result of her skin cream.","she had cancer as a result of her skin cream"
"Rm9t94mpkjo","00:26:54","00:26:58","Or C, drinking poisoned wine at a banquet held in her honor.","or c drinking poisoned wine at a banquet held in her honor"
"Rm9t94mpkjo","00:26:59","00:27:00","- I don't, either.","i don't know i don't either"
"Rm9t94mpkjo","00:27:01","00:27:02","- Beef Boy. (laughing)","beef beef boy i'm sorry"
"Rm9t94mpkjo","00:27:03","00:27:03","I'm sorry, Beef.","that's banned"
"Rm9t94mpkjo","00:27:04","00:27:04","- That's man to you.","to you i'm"
"Rm9t94mpkjo","00:27:05","00:27:05","I'm Beef Man, not boy.","beef heart you're not born sorry"
"Rm9t94mpkjo","00:27:06","00:27:06","- Sorry, Beef Boy.","beef boy beef man give"
"Rm9t94mpkjo","00:27:07","00:27:07","Beef Man. What do you got?","it a what do you got"
"Rm9t94mpkjo","00:27:07","00:27:08","- B, cancer.","bee cancer"
"Rm9t94mpkjo","00:27:09","00:27:09","- Oh.","no"
"Rm9t94mpkjo","00:27:10","00:27:10","","no"
"Rm9t94mpkjo","00:27:11","00:27:12","- I put A, our tiger queen,","and ryan i put a our"
"Rm9t94mpkjo","00:27:13","00:27:15","just because I would like for her to have-","tiger queen i would just because i would like for her to have god"
"Rm9t94mpkjo","00:27:16","00:27:17","(laughing)","how horrible it's a pretty"
"Rm9t94mpkjo","00:27:17","00:27:18","- It's a pretty metal way to go, yeah.","metal way to go"
"Rm9t94mpkjo","00:27:18","00:27:20","- No, it's not! (laughing)","yeah no it's not"
"Rm9t94mpkjo","00:27:21","00:27:22","It sounds awful.","this sounds awful i"
"Rm9t94mpkjo","00:27:23","00:27:23","I guess cancer's awful, too.","guess cancer is"
"Rm9t94mpkjo","00:27:24","00:27:25","- Yeah, yeah.","awful too yeah yeah well point to the beef"
"Rm9t94mpkjo","00:27:25","00:27:26","- Well, point to the Beef Boy.","boy uh"
"Rm9t94mpkjo","00:27:27","00:27:29","She did have cancer as a result of her skin cream.","she did have cancer as a result of her skin cream"
"Rm9t94mpkjo","00:27:29","00:27:32","CT scans done in 2007 showed Hatshepsut,","ct scans done in 2007 showed hot chipset"
"Rm9t94mpkjo","00:27:33","00:27:35","at the time of her death, to have been in very poor health.","at the time of her death to have been in very poor health"
"Rm9t94mpkjo","00:27:36","00:27:38","According to evidence found in her pelvic region and spine,","according to evidence found in her pelvic region and spine"
"Rm9t94mpkjo","00:27:38","00:27:40","she suffered from cancer.","she suffered from cancer found amongst"
"Rm9t94mpkjo","00:27:40","00:27:42","Found amongst her possessions was a vial","her possessions was a vial that contained"
"Rm9t94mpkjo","00:27:42","00:27:44","that contained skin cream, which made sense,","skin cream which made sense as there"
"Rm9t94mpkjo","00:27:45","00:27:46","as there were known cases of skin disease","were known cases of skin disease in hatshepsut's"
"Rm9t94mpkjo","00:27:46","00:27:47","in Hatshepsut's family.","family in"
"Rm9t94mpkjo","00:27:48","00:27:49","In that skin cream, however, pharmacologists discovered","that skin cream however pharmacologists"
"Rm9t94mpkjo","00:27:50","00:27:54","Benzo(a)pyrene, one of the mostcarcinogenic substances","discovered benzoa pyrene one of the most carcinogenic substances on earth"
"Rm9t94mpkjo","00:27:55","00:27:56","- [Pair] Wow.","wow"
"Rm9t94mpkjo","00:27:57","00:27:58","- So just rubbing skin cancer on herself?","so just rubbing skin cancer on"
"Rm9t94mpkjo","00:27:59","00:28:00","- [Pair] Yeah.","herself yeah yeah though we have"
"Rm9t94mpkjo","00:28:00","00:28:03","- Though we now have a better understanding of how she died,","a better understanding yeah yeah though we have a better understanding of how she died the mystery"
"Rm9t94mpkjo","00:28:03","00:28:07","the mystery as to why her legacy was erased remains","as to why her legacy was erased remains"
"Rm9t94mpkjo","00:28:08","00:28:09","","erased remains"
"Rm9t94mpkjo","00:28:09","00:28:11","(clearing throat) not fully understood.","not fully understood uh still"
"Rm9t94mpkjo","00:28:12","00:28:14","Still, her body was found and we know about her now!","her body was found and we know about her now and she"
"Rm9t94mpkjo","00:28:14","00:28:16","And she did a pretty great job as pharaoh.","did a pretty great job as pharaoh"
"Rm9t94mpkjo","00:28:17","00:28:18","With memory of her reign restored,","with memory of her reign restored"
"Rm9t94mpkjo","00:28:19","00:28:21","her spirit can continue to live on for eternity.","her spirit can continue to live on for eternity"
"Rm9t94mpkjo","00:28:22","00:28:23","(intense classical music)","that concludes"
"Rm9t94mpkjo","00:28:24","00:28:25","Thus concludes our history lesson!","our history lesson i'm going to"
"Rm9t94mpkjo","00:28:25","00:28:26","I'm going to go tally the scores","go tally the"
"Rm9t94mpkjo","00:28:27","00:28:28","to see who receives the Coveted Cup","scores to see who receives the coveted cup"
"Rm9t94mpkjo","00:28:29","00:28:30","and the title of History Master.","and title of history master"
"Rm9t94mpkjo","00:28:31","00:28:33","While I do that, please enjoy this special performance","while i do that please enjoy the special performance"
"Rm9t94mpkjo","00:28:34","00:28:38","from one of the mummified geese found in Hatsheput's tomb.","from one of the mummified geese found in hot chapssot's"
"Rm9t94mpkjo","00:28:38","00:28:40","","tomb the the puppet"
"Rm9t94mpkjo","00:28:40","00:28:42","- The Puppet History of 2020,","history of 2020 that multiple"
"Rm9t94mpkjo","00:28:42","00:28:44","that multiple choice section's gonna be fucking brutal.","choice section is going to be [ __ ] brutal"
"Rm9t94mpkjo","00:28:44","00:28:46","- (laughing) Surely, murder hornets couldn't be the answer.","and surely murder hornets couldn't be the"
"Rm9t94mpkjo","00:28:47","00:28:48","And it's like, but yes.","answer and it's like but yes it"
"Rm9t94mpkjo","00:28:48","00:28:49","It is.","is it's just"
"Rm9t94mpkjo","00:28:49","00:28:50","- It's just awful.","awful"
"Rm9t94mpkjo","00:28:51","00:28:51","- Oh, wow.","oh wow oh she's a"
"Rm9t94mpkjo","00:28:52","00:28:52","Oh, she's a mummy.","mummy yeah"
"Rm9t94mpkjo","00:28:52","00:28:54","- Yeah, I'm a mummified goose.","my yeah i'm a mummified goose looks"
"Rm9t94mpkjo","00:28:55","00:28:55","- Looks like an ostrich.","like an ostrich"
"Rm9t94mpkjo","00:28:55","00:28:56","- No, no, I'm a goose.","no no i'm a goose"
"Rm9t94mpkjo","00:28:57","00:28:59","Very clearly a goose.","very clearly a goose looks like an ostrich"
"Rm9t94mpkjo","00:28:59","00:29:00","- Looks like an ostrich.","hot chips"
"Rm9t94mpkjo","00:29:00","00:29:02","♪ Hatshepsut, she was competent as hell ♪","she was coveted as hell"
"Rm9t94mpkjo","00:29:03","00:29:04","♪ They tried to wipe her from the books ♪","they tried to wipe her from the books"
"Rm9t94mpkjo","00:29:05","00:29:05","♪ As far as we can tell ♪","as far as we can tell"
"Rm9t94mpkjo","00:29:06","00:29:06","♪ A pharaoh you should know ♪","a pharaoh you should"
"Rm9t94mpkjo","00:29:07","00:29:08","♪ She really held it down ♪","know she really held it down"
"Rm9t94mpkjo","00:29:09","00:29:10","♪ Oh, just because she kept the peace ♪","oh just because she kept the peace she don't"
"Rm9t94mpkjo","00:29:10","00:29:11","♪ She don't deserve renown ♪","deserve right now"
"Rm9t94mpkjo","00:29:11","00:29:13","♪ Hatshepsut ♪","oh you"
"Rm9t94mpkjo","00:29:13","00:29:14","♪ Oh, you haven't heard ♪","haven't heard she stepped"
"Rm9t94mpkjo","00:29:14","00:29:15","♪ She stepped up and ruled Egypt ♪","up bad world"
"Rm9t94mpkjo","00:29:16","00:29:17","♪ And raised Thutmose the Third ♪","egypt addressed the moses the third a queen"
"Rm9t94mpkjo","00:29:17","00:29:18","♪ A queen ♪ ♪ A king ♪","a king"
"Rm9t94mpkjo","00:29:19","00:29:20","♪ Depends which glyphs you've seen ♪","depends which glitch you've seen but by and large"
"Rm9t94mpkjo","00:29:21","00:29:21","♪ But, by and large, she sure took charge ♪","he sure took"
"Rm9t94mpkjo","00:29:22","00:29:22","♪ And really nailed the thing ♪","charge and really nailed the thing"
"Rm9t94mpkjo","00:29:25","00:29:25","♪ A funny claim to fame ♪","a funny claim to fame"
"Rm9t94mpkjo","00:29:26","00:29:27","♪ Her husband, dad, and kinda son ♪","her husband dad and kinda son they"
"Rm9t94mpkjo","00:29:27","00:29:28","♪ They all had the same name ♪","all had the same name"
"Rm9t94mpkjo","00:29:28","00:29:29","♪ A pharaoh ♪","a pharaoh"
"Rm9t94mpkjo","00:29:30","00:29:31","♪ Who narrowly missed her chance to rule ♪","who narrowly missed her chance to rule but"
"Rm9t94mpkjo","00:29:31","00:29:34","♪ But luckily, the king-to-be was tied up with preschool ♪","luckily that came to me was tied up with preschool"
"Rm9t94mpkjo","00:29:36","00:29:37","♪ If you're still asking whom ♪","if you're still asking who to show the"
"Rm9t94mpkjo","00:29:38","00:29:38","♪ Just shows a pharaoh's greatness ♪","pharaoh's greatness"
"Rm9t94mpkjo","00:29:39","00:29:39","♪ Can't be measured by their tomb ♪","can't be measured by there"
"Rm9t94mpkjo","00:29:40","00:29:41","♪ A queen ♪","too a queen some"
"Rm9t94mpkjo","00:29:41","00:29:42","♪ Supreme yet surreptitiously interred ♪","previously entered"
"Rm9t94mpkjo","00:29:43","00:29:44","♪ I should know ♪","i should know me and my bro"
"Rm9t94mpkjo","00:29:44","00:29:45","♪ Me and my bro were mummified with her ♪","were mummified with her"
"Rm9t94mpkjo","00:29:47","00:29:47","♪ Hatshepsut ♪","committed"
"Rm9t94mpkjo","00:29:48","00:29:48","♪ Commit the name to memory ♪","and my bro were mummified with her committed memory"
"Rm9t94mpkjo","00:29:49","00:29:50","♪ Because you see, regrettably ♪","because you see regrettably she happens"
"Rm9t94mpkjo","00:29:50","00:29:53","♪ She happens to be dead and we can help her out enormously ♪","to be dead and we can help her out enormously particularly"
"Rm9t94mpkjo","00:29:53","00:29:55","♪ Particularly spiritually ♪","spiritually if every now"
"Rm9t94mpkjo","00:29:56","00:29:57","♪ We could toss a kindly thought ♪","and thenish we could toss a kindly thought to"
"Rm9t94mpkjo","00:29:58","00:29:59","♪ To she who nearly became history ♪","she who merely became history not via egyptology"
"Rm9t94mpkjo","00:30:01","00:30:01","♪ But lost for all eternity ♪","but lost for all eternity"
"Rm9t94mpkjo","00:30:02","00:30:02","♪ Erased, though it's a mystery ♪","arrest though it's a mystery"
"Rm9t94mpkjo","00:30:03","00:30:04","♪ Why anyone would possibly ♪","why anyone could possibly"
"Rm9t94mpkjo","00:30:05","00:30:06","♪ Resort to such vile treachery ♪","resort to such foul treachery and so"
"Rm9t94mpkjo","00:30:06","00:30:07","♪ And so it's with respect that we remember ♪","it's with respect that we remember"
"Rm9t94mpkjo","00:30:08","00:30:09","♪ On occasion she kicked ass ♪","on occasion she kicked out"
"Rm9t94mpkjo","00:30:12","00:30:13","- All right, cool.","all right every"
"Rm9t94mpkjo","00:30:13","00:30:15","Every time one of those songs come up,","time i when those songs come up i feel like"
"Rm9t94mpkjo","00:30:15","00:30:16","I feel like I'm the living manifestation","i'm like the living manifestation"
"Rm9t94mpkjo","00:30:17","00:30:18","of that Jay-Z gif.","of that jay-z gift it's like kind"
"Rm9t94mpkjo","00:30:18","00:30:19","- It's him kind of head nodding around, like.","of like heading out around"
"Rm9t94mpkjo","00:30:20","00:30:22","- Where he just head nod, concerned head nod.","like we just had not [Laughter] around like we just had not [Laughter]"
"Rm9t94mpkjo","00:30:28","00:30:29","Hell of a goose.","hell of a goose"
"Rm9t94mpkjo","00:30:30","00:30:30","- Hell of a goose.","definitely a goose"
"Rm9t94mpkjo","00:30:30","00:30:32","- Definitely a goose, not an ostrich, as far as I can tell.","not an ostrich as far as i can tell"
"Rm9t94mpkjo","00:30:33","00:30:34","Let's see how we did.","uh let's see how we did"
"Rm9t94mpkjo","00:30:35","00:30:38","Oh, knock me down with a mummified goose feather!","whoa knock me down with a mummified goose feather ryan"
"Rm9t94mpkjo","00:30:38","00:30:41","Ryann Graham is our History Master!","graham his hour history"
"Rm9t94mpkjo","00:30:41","00:30:43","","aaron"
"Rm9t94mpkjo","00:30:44","00:30:46","And he has rightfully earned the Coveted Cup!","he has so rightfully earned the coveted cup"
"Rm9t94mpkjo","00:30:47","00:30:47","Beef Boy, thanks for trying.","beef boy thanks for"
"Rm9t94mpkjo","00:30:48","00:30:49","Ryann, go claim your reward.","trying ryan go claim your reward"
"Rm9t94mpkjo","00:30:50","00:30:50","- Okay. (doorbell ringing)","okay oh"
"Rm9t94mpkjo","00:30:51","00:30:51","Oh, okay.","okay"
"Rm9t94mpkjo","00:30:52","00:30:53","All right, recording a video.","all right recording a video once i"
"Rm9t94mpkjo","00:30:54","00:30:55","- Once I can get my hands on that little blue ball sack","can get my hands on that little blue ball"
"Rm9t94mpkjo","00:30:56","00:30:57","of a head that you have--","sack of a head that you have"
"Rm9t94mpkjo","00:30:57","00:30:58","- It's, yes!","yes"
"Rm9t94mpkjo","00:30:58","00:30:59","- Know more. - It's coming off.","no more coming"
"Rm9t94mpkjo","00:31:00","00:31:01","- There's even jelly beans in this!","off there's even jelly beans in this"
"Rm9t94mpkjo","00:31:02","00:31:02","- Try knowing more.","try knowing more"
"Rm9t94mpkjo","00:31:03","00:31:04","- Oh, my God, it's jelly beans!","oh my god you've"
"Rm9t94mpkjo","00:31:04","00:31:06","- You've earned it and we're so thankful","earned it and we're so thankful"
"Rm9t94mpkjo","00:31:07","00:31:08","for you coming by here today.","for you coming by here today thank"
"Rm9t94mpkjo","00:31:09","00:31:09","Thank you, Ryann Graham, for playing.","you ryan graham for"
"Rm9t94mpkjo","00:31:10","00:31:11","I want to thank everybody for watching.","playing i want to thank everybody for watching"
"Rm9t94mpkjo","00:31:12","00:31:14","We'll see you next week on another exciting episode","we'll see you next week on another exciting episode of puppet"
"Rm9t94mpkjo","00:31:14","00:31:15","of Puppet History.","history"
"Rm9t94mpkjo","00:31:17","00:31:17","Oh!","goodbye"
"Rm9t94mpkjo","00:31:17","00:31:18","(slow folk music)","[Applause]"
"Rm9t94mpkjo","00:31:20","00:31:24","(upbeat electronic music)","[Applause]"
"Rm9t94mpkjo","00:31:25","00:31:29","",""
"Rm9t94mpkjo","00:31:30","00:31:30","Hatshepsut!","[Applause]"
"Rm9t94mpkjo","00:31:31","00:31:32","",""
"Rm9t94mpkjo","00:31:33","00:31:33","",""
