"video_id","min_timecode","max_timecode","text.user","text.auto"
"p-q1GTtH4LE","00:00:00","00:00:01","","[Music] hey what's up guys"
"p-q1GTtH4LE","00:00:02","00:00:02","Welcome back to Binging with Babish","welcome back to binging with"
"p-q1GTtH4LE","00:00:03","00:00:04","where this week we're taking, oh, whoa,","babish where this week we're taking the whoa"
"p-q1GTtH4LE","00:00:05","00:00:06","we're taking a look at me I guess.","taking a look at me i guess"
"p-q1GTtH4LE","00:00:07","00:00:07","Oh my.","oh my hello"
"p-q1GTtH4LE","00:00:08","00:00:10","Hello, my name is Andrew Rea aka Binging with Babish","my name is andrew ray aka binging with babish"
"p-q1GTtH4LE","00:00:11","00:00:13","and I'm here to answer your questions via Twitter.","and i'm here to answer your questions via twitter this"
"p-q1GTtH4LE","00:00:13","00:00:15","This is Cooking Support.","is cooking support"
"p-q1GTtH4LE","00:00:16","00:00:18","[calm music]","[Music] this is cooking support [Music]"
"p-q1GTtH4LE","00:00:18","00:00:20","","at ndwelch"
"p-q1GTtH4LE","00:00:22","00:00:24","""why do they always use kosher salt in cooking videos?""","asks why do they always use kosher salt in cooking videos"
"p-q1GTtH4LE","00:00:25","00:00:26","Well, I'll tell you, Nathan.","well i'll tell you nathan there are really"
"p-q1GTtH4LE","00:00:26","00:00:28","There are really three salts that you need to know about.","three salts that you need to know about"
"p-q1GTtH4LE","00:00:29","00:00:29","There is table salt,","there is table salt"
"p-q1GTtH4LE","00:00:30","00:00:31","the one that you're probably most familiar with,","the one that you're probably most familiar with"
"p-q1GTtH4LE","00:00:32","00:00:34","kosher salt and flaky finishing salt.","kosher salt and flaky finishing salt"
"p-q1GTtH4LE","00:00:35","00:00:36","I like to call table salt baking salt","i like to call table salt baking"
"p-q1GTtH4LE","00:00:37","00:00:38","'cause that's really all I use it for","soda because that's really all i use it for because most"
"p-q1GTtH4LE","00:00:38","00:00:41","because most recipes are developed using table salt","recipes are developed using table salt but that"
"p-q1GTtH4LE","00:00:41","00:00:42","but that being said,","being said"
"p-q1GTtH4LE","00:00:43","00:00:45","it's not a great way to season your food when you're cooking","it's not a great way to season your food when you're cooking"
"p-q1GTtH4LE","00:00:46","00:00:46","because you can't pinch it.","because you can't"
"p-q1GTtH4LE","00:00:47","00:00:47","Kosher salt on the other hand,","pinch it kosher salt"
"p-q1GTtH4LE","00:00:48","00:00:49","you have complete control over.","on the other hand you have complete control over"
"p-q1GTtH4LE","00:00:50","00:00:52","So you can see right now I have a big old pinch full of it","so you can see right now i have a big old pinch full of"
"p-q1GTtH4LE","00:00:53","00:00:54","and there's no salt coming out of my fingers","it and there's no salt coming out of"
"p-q1GTtH4LE","00:00:55","00:00:59","until I start to twist my fingers from left to right.","my fingers until i start to twist my fingers from left to right it's also a"
"p-q1GTtH4LE","00:00:59","00:01:01","It's also a more forgiving salt.","more forgiving salt it's a"
"p-q1GTtH4LE","00:01:01","00:01:02","It's a bigger grain of salt.","bigger grain of salt"
"p-q1GTtH4LE","00:01:03","00:01:04","You're less likely to oversalt your food","you're less likely to over salt your food"
"p-q1GTtH4LE","00:01:05","00:01:05","than you would be with table salt","than you would be with table"
"p-q1GTtH4LE","00:01:06","00:01:08","and then this is the totally optional salt.","salt and then this is the totally optional salt these"
"p-q1GTtH4LE","00:01:08","00:01:10","These are very light, flaky.","are very light"
"p-q1GTtH4LE","00:01:11","00:01:11","","flaky"
"p-q1GTtH4LE","00:01:12","00:01:13","Ugh.","look"
"p-q1GTtH4LE","00:01:14","00:01:14","Really all you use it for is finishing.","really all you use it for is finishing"
"p-q1GTtH4LE","00:01:15","00:01:16","That's why it's called finishing salt.","that's why it's called finishing salt these two"
"p-q1GTtH4LE","00:01:16","00:01:18","These two though, absolute necessities.","though absolute necessities just"
"p-q1GTtH4LE","00:01:18","00:01:21","Just know when to use them and why and how.","know when to use them and why and how all"
"p-q1GTtH4LE","00:01:21","00:01:22","Oh, in all caps.","in all caps people don't"
"p-q1GTtH4LE","00:01:22","00:01:24","""People don't keep eggs in the fridge?","keep eggs in the fridge"
"p-q1GTtH4LE","00:01:25","00:01:27","Don't they go bad faster?""","don't they go bad faster as far as"
"p-q1GTtH4LE","00:01:27","00:01:28","As far as I understand","i understand and please"
"p-q1GTtH4LE","00:01:28","00:01:31","and please take what I'm saying with several grains of salt","take what i'm saying with several grains of salt"
"p-q1GTtH4LE","00:01:32","00:01:34","because this is your food safety we're talking about here","because this is your food safety we're talking about here"
"p-q1GTtH4LE","00:01:35","00:01:36","and you shouldn't trust a guy","and you shouldn't trust a guy who"
"p-q1GTtH4LE","00:01:36","00:01:38","who doesn't have food safety certification,","doesn't have food safety certification never"
"p-q1GTtH4LE","00:01:39","00:01:39","never went to culinary school,","went to culinary school went"
"p-q1GTtH4LE","00:01:40","00:01:41","went to film school, got really bad grades","to film school got really bad grades"
"p-q1GTtH4LE","00:01:42","00:01:44","and kinda lucked into his job as a food influencer.","and kind of lucked into his uh job as a food influencer"
"p-q1GTtH4LE","00:01:45","00:01:45","You shouldn't be listening to me.","you shouldn't be listening to me"
"p-q1GTtH4LE","00:01:46","00:01:46","The eggs that you need to refrigerate","the eggs that you need to refrigerate"
"p-q1GTtH4LE","00:01:47","00:01:49","are ones that have been commercially washed.","are ones that have been commercially washed here"
"p-q1GTtH4LE","00:01:49","00:01:52","Here in the States, they wash eggs with great rigor","in the states they wash eggs with great rigor"
"p-q1GTtH4LE","00:01:53","00:01:55","and that strips away the sort of natural protection","and that strips away the sort of natural protection on the"
"p-q1GTtH4LE","00:01:55","00:01:58","on the outside of the shell so they must be refrigerated.","outside of the shell so they must be refrigerated if you got"
"p-q1GTtH4LE","00:01:58","00:01:59","If you got them from the side of the road","them from the side of"
"p-q1GTtH4LE","00:02:00","00:02:00","and they were not in the fridge,","the road and they were not in the fridge"
"p-q1GTtH4LE","00:02:01","00:02:03","chances are, they just came out of a hen's ass","chances are they just came out of a hen's ass and they're"
"p-q1GTtH4LE","00:02:03","00:02:05","and they're ready to stay at room temperature","ready to stay at room temperature"
"p-q1GTtH4LE","00:02:06","00:02:09","in your stylish barn converted backsplash kitchen.","in your stylish to stay at room temperature in your stylish barn converted backsplash"
"p-q1GTtH4LE","00:02:10","00:02:11","Anyway.","kitchen anyway that"
"p-q1GTtH4LE","00:02:11","00:02:15","@ol_daveyboy, ""cooking twitter, what are some good knives","old davey boy uh cooking twitter what are some good knives"
"p-q1GTtH4LE","00:02:16","00:02:17","that won't immediately break the bank?""","that won't immediately break the bank"
"p-q1GTtH4LE","00:02:18","00:02:18","Well, I'll tell ya.","well i'll tell you"
"p-q1GTtH4LE","00:02:19","00:02:20","Sorry.","sorry"
"p-q1GTtH4LE","00:02:20","00:02:20","",""
"p-q1GTtH4LE","00:02:21","00:02:23","I do have a line of cookware out, okay?","i do have a line of cookware out okay it's called the"
"p-q1GTtH4LE","00:02:23","00:02:25","It's called Babish Cookware line, all right?","babish cookware line all right the the"
"p-q1GTtH4LE","00:02:26","00:02:26","Okay?","okay"
"p-q1GTtH4LE","00:02:27","00:02:28","These are German steel knives.","these are german steel knives they're"
"p-q1GTtH4LE","00:02:29","00:02:30","They're full tang blades.","full tang blades they"
"p-q1GTtH4LE","00:02:30","00:02:32","They are 4116 German steel.","are 4116 german steel"
"p-q1GTtH4LE","00:02:33","00:02:33","They come sharp.","they come sharp"
"p-q1GTtH4LE","00:02:33","00:02:37","They keep an edge and they're $25, 25 to $30 per knife.","they keep an edge and they're 25 bucks 25 to 30 dollars per knife that"
"p-q1GTtH4LE","00:02:38","00:02:41","That being said, I'm not here just to huck my cookware.","being said i'm not here just to hook my cookware huck"
"p-q1GTtH4LE","00:02:41","00:02:42","Huck, is that the word?","is that the word i'm not"
"p-q1GTtH4LE","00:02:42","00:02:44","I'm not just here to sling cookware.","just here to sling cookware"
"p-q1GTtH4LE","00:02:45","00:02:46","I'm also gonna be fully honest","i'm also going to be fully honest"
"p-q1GTtH4LE","00:02:47","00:02:48","about other brands that I like.","about other brands that i like"
"p-q1GTtH4LE","00:02:49","00:02:52","Victorinox Fibrox makes a great starter knife.","victoria knox fibrox makes a great starter knife it is stamped not"
"p-q1GTtH4LE","00:02:52","00:02:53","It is stamped, not forged.","forged"
"p-q1GTtH4LE","00:02:54","00:02:56","Likewise, with Wüsthof's Pro line, it's so cheap.","uh likewise with vustoff's pro line it's so"
"p-q1GTtH4LE","00:02:57","00:02:58","It's $20 for a knife.","cheap it's 20 for a knife"
"p-q1GTtH4LE","00:02:58","00:02:59","It's a great learning knife.","it's a great learning knife it's"
"p-q1GTtH4LE","00:02:59","00:03:02","It's a great starter knife but these knives are great too.","a great starter knife but these knives are great too"
"p-q1GTtH4LE","00:03:02","00:03:05","@FollowerOfDole says, ""time to ask a chef.","follower of dole says time to ask a chef"
"p-q1GTtH4LE","00:03:06","00:03:08","When I make fluffy scrambled eggs and cheese,","when i make fluffy scrambled eggs and cheese"
"p-q1GTtH4LE","00:03:09","00:03:11","fluffy is I tried to make an omelet and screwed it up,","fluffy is i tried to make an omelette and screwed it up"
"p-q1GTtH4LE","00:03:12","00:03:13","my dish is oily?","my dish is oily"
"p-q1GTtH4LE","00:03:14","00:03:14","I think it's oil from the cheese","i think it's oil from"
"p-q1GTtH4LE","00:03:15","00:03:17","because the eggs are cooked fully","the cheese because the eggs are cooked fully but it's kind"
"p-q1GTtH4LE","00:03:17","00:03:19","but it's kinda buttery flavor.","of butter buttery flavor it's"
"p-q1GTtH4LE","00:03:19","00:03:20","It's good but how to fix?""","good but how to fix"
"p-q1GTtH4LE","00:03:21","00:03:22","So I'm guessing you're doing is adding the cheese too early","so i'm guessing you're doing is adding the cheese"
"p-q1GTtH4LE","00:03:23","00:03:25","so it's getting too much heat from the pan","too early so it's getting too much heat from the pan"
"p-q1GTtH4LE","00:03:26","00:03:28","so it's going beyond the point of melting and it's breaking.","so it's going beyond the point of melting and it's breaking when it breaks"
"p-q1GTtH4LE","00:03:28","00:03:29","When it breaks, it basically means","this basically means that the"
"p-q1GTtH4LE","00:03:29","00:03:31","that the oil just seeps out of it.","the oil just seeps out"
"p-q1GTtH4LE","00:03:32","00:03:33","What I would do is try to add your cheese","of it what i would do is try to add"
"p-q1GTtH4LE","00:03:34","00:03:35","as late as humanly possible.","your cheese as late as humanly possible just don't"
"p-q1GTtH4LE","00:03:36","00:03:38","and don't use cheeses that are too old.","overheat it and don't use cheeses that are too old you know use a gruyere"
"p-q1GTtH4LE","00:03:38","00:03:42","Use a Gruyere or a not too sharp, pretty mild cheddar","cheeses that are too old you know use a gruyere or a not too sharp chip pretty mild cheddar because"
"p-q1GTtH4LE","00:03:42","00:03:43","'cause they're better melters.","they're better melters they're going to"
"p-q1GTtH4LE","00:03:43","00:03:45","They're gonna stand up to the heat better.","stand up to the heat better tablespoon and"
"p-q1GTtH4LE","00:03:45","00:03:47","Tablespoon and a half of butter in the pan.","a half of butter in the pan"
"p-q1GTtH4LE","00:03:48","00:03:49","Eggs.","eggs always crack on a"
"p-q1GTtH4LE","00:03:49","00:03:50","Always crack on a flat surface","flat surface"
"p-q1GTtH4LE","00:03:51","00:03:52","then throw the pan back on the heat.","then throw the pan back on the heat before"
"p-q1GTtH4LE","00:03:52","00:03:56","Before it gets in the pan, gonna beat these guys up.","it gets in the pan i'm gonna beat these guys up i'm"
"p-q1GTtH4LE","00:03:57","00:03:57","I'm gonna use the tiny whisk.","gonna use a tiny whisk they're"
"p-q1GTtH4LE","00:03:58","00:03:58","They're more homogenous now","more homogeneous now so now"
"p-q1GTtH4LE","00:03:58","00:03:59","so now we're gonna add them to the pan.","we're going to add them to the"
"p-q1GTtH4LE","00:04:00","00:04:00","Keep 'em moving.","pan keep them moving keep"
"p-q1GTtH4LE","00:04:01","00:04:01","Keep the pan moving.","the pan moving"
"p-q1GTtH4LE","00:04:02","00:04:03","Keep the eggs moving.","keep the eggs moving you put"
"p-q1GTtH4LE","00:04:03","00:04:06","You put this on toast and it's almost spreadable.","this on toast and it's almost spreading there we go"
"p-q1GTtH4LE","00:04:06","00:04:07","There we go, that's done.","that's done"
"p-q1GTtH4LE","00:04:08","00:04:09","Irish cheddar.","irish cheddar put a fair amount"
"p-q1GTtH4LE","00:04:10","00:04:12","This is probably two ounces.","in there this is probably two ounces yeah"
"p-q1GTtH4LE","00:04:12","00:04:13","Yeah, two ounces-ish.","two ounces ish we're"
"p-q1GTtH4LE","00:04:14","00:04:15","We're just mixing them in there, keeping 'em moving","just mixing them in there keeping them moving"
"p-q1GTtH4LE","00:04:16","00:04:18","and letting the residual heat in the pan melt the cheese","and letting the residual heat in the pan melt the cheese"
"p-q1GTtH4LE","00:04:19","00:04:21","and incorporate them into the egg.","and incorporate them into the egg this is how i like"
"p-q1GTtH4LE","00:04:21","00:04:22","This is how I like my scrambled eggs.","my scrambled eggs"
"p-q1GTtH4LE","00:04:22","00:04:23","You might not like 'em this way.","you might not like them this way"
"p-q1GTtH4LE","00:04:24","00:04:25","I like 'em creamy, I like 'em spreadable","i like them creamy i like them spreadable"
"p-q1GTtH4LE","00:04:25","00:04:27","and no matter how you like your scrambled eggs,","and no matter how you like your scrambled eggs if you"
"p-q1GTtH4LE","00:04:27","00:04:29","if you add your cheese at the end","add your cheese at the end"
"p-q1GTtH4LE","00:04:30","00:04:31","and don't heat the cheese directly on the stove top,","and don't heat the cheese directly on"
"p-q1GTtH4LE","00:04:32","00:04:35","you will notice that there's not a hint of oil","the stove top you will notice that there is not a hint of oil"
"p-q1GTtH4LE","00:04:36","00:04:36","or grease in this pan.","or grease in this pan it"
"p-q1GTtH4LE","00:04:37","00:04:38","It is just egg and cheese.","is just egg and cheese nothing"
"p-q1GTtH4LE","00:04:39","00:04:39","Nothing has separated","has separated"
"p-q1GTtH4LE","00:04:40","00:04:43","and that's how you prevent cheese from breaking.","and that's how you prevent nothing has separated and that's how you prevent cheese from"
"p-q1GTtH4LE","00:04:59","00:05:00","not so much.","all that stuff not so much before boss nine"
"p-q1GTtH4LE","00:05:00","00:05:03","bforboss9 says, ""people give me all of your advice","says people give me all of your advice on how"
"p-q1GTtH4LE","00:05:03","00:05:07","on how to cook large slabs of meat so it won't dry out.","to cook large slabs of meat so it won't dry out"
"p-q1GTtH4LE","00:05:08","00:05:09","The dog is now getting my three pound pork roast","the dog is now getting my three pound pork roast because"
"p-q1GTtH4LE","00:05:09","00:05:10","'cause I dried it out.""","i dried it"
"p-q1GTtH4LE","00:05:11","00:05:11","A lot of things could be happening here.","out a lot of things could be happening"
"p-q1GTtH4LE","00:05:12","00:05:13","First off, you might be cooking it","here first off you might be cooking it"
"p-q1GTtH4LE","00:05:14","00:05:14","at too high a temperature.","at too high a temperature you might be"
"p-q1GTtH4LE","00:05:14","00:05:15","You might be just cooking it for too long.","just cooking it for too long"
"p-q1GTtH4LE","00:05:16","00:05:18","Pork, you can cook to a rosy 135","pork you can cook to a rosy 135"
"p-q1GTtH4LE","00:05:19","00:05:21","if you know where the pork is from and if you trust it.","if you know where the pork is from and if you trust it otherwise"
"p-q1GTtH4LE","00:05:21","00:05:23","Otherwise, cook it to 145.","cook it to 145 it's still going to"
"p-q1GTtH4LE","00:05:23","00:05:25","It's still gonna be nice and rosy and pink in the middle","be nice and rosy and pink in the middle"
"p-q1GTtH4LE","00:05:26","00:05:27","and it's gonna be super juicy.","and it's going to be super juicy something like"
"p-q1GTtH4LE","00:05:27","00:05:29","Something like a pork loin","a pork loin which"
"p-q1GTtH4LE","00:05:29","00:05:30","which doesn't have much extra muscular fat,","doesn't have much extra muscular"
"p-q1GTtH4LE","00:05:31","00:05:32","you need to be very careful to make sure","fat you need to be very careful to make sure that"
"p-q1GTtH4LE","00:05:32","00:05:33","that you're not overcooking it","you're not overcooking it because that's"
"p-q1GTtH4LE","00:05:33","00:05:35","'cause that's how it dries out very fast.","how it dries out very fast if you overcook"
"p-q1GTtH4LE","00:05:35","00:05:37","If you overcook it by 10 degrees,","it by 10 degrees it's gonna be"
"p-q1GTtH4LE","00:05:37","00:05:38","it's gonna be dry as a bone.","dry as a bone you need to cook"
"p-q1GTtH4LE","00:05:38","00:05:40","You need to cook slowly, gently","slowly gently with big"
"p-q1GTtH4LE","00:05:40","00:05:41","with big, big joints of meat.","big joints of"
"p-q1GTtH4LE","00:05:42","00:05:44","The best way to make prime rib for example","meat the best way to make prime rib for example is"
"p-q1GTtH4LE","00:05:44","00:05:47","is to cook it at like 250 degrees Fahrenheit","to cook it at like 250 degrees fahrenheit for like"
"p-q1GTtH4LE","00:05:47","00:05:48","for like six hours.","six hours also"
"p-q1GTtH4LE","00:05:49","00:05:51","Also, yeah, pull the meat 10 degrees shy","yeah pull the meat 10 degrees shy of"
"p-q1GTtH4LE","00:05:52","00:05:53","of where you want it to end up.","where you want it to end up it will"
"p-q1GTtH4LE","00:05:53","00:05:55","It will come up 10 more degrees","come up 10 more degrees at least"
"p-q1GTtH4LE","00:05:55","00:05:56","at least when it comes out of the oven.","when it comes out of the oven"
"p-q1GTtH4LE","00:05:57","00:05:59","@hawaiianseawich, ""if you're cooking shrimp...","at hawaiian sea witch if you're cooking shrimp dot"
"p-q1GTtH4LE","00:06:00","00:06:01","why do you leave the tails on?","dot dot why do you leave the tails on"
"p-q1GTtH4LE","00:06:01","00:06:02","Why?","why it's so"
"p-q1GTtH4LE","00:06:02","00:06:04","It's so [beep] inconvenient when you're eating","inconvenient when you're eating and"
"p-q1GTtH4LE","00:06:04","00:06:06","and you have to use your hands to pick off the tails","you have to use your hands to pick off the tails to make"
"p-q1GTtH4LE","00:06:07","00:06:08","to make sure you get all the shrimp out.","sure you get all the shrimp out yes"
"p-q1GTtH4LE","00:06:08","00:06:11","Yes, I just recently had shrimp pasta and I'm mad about it.""","i just recently had shrimp pasta and i'm mad about it it is"
"p-q1GTtH4LE","00:06:11","00:06:13","It is absolutely inconvenient.","absolutely inconvenient you're right to be"
"p-q1GTtH4LE","00:06:13","00:06:14","You're right to be mad about it.","mad about it having"
"p-q1GTtH4LE","00:06:14","00:06:17","Having shrimp tails on in pasta is ridiculous","shrimp tails on and pasta is ridiculous because"
"p-q1GTtH4LE","00:06:17","00:06:19","because if you don't wanna eat with your hands,","if you don't want to eat with your hands"
"p-q1GTtH4LE","00:06:20","00:06:20","you're out of luck.","you're out of luck you"
"p-q1GTtH4LE","00:06:20","00:06:22","You have to use your hands in some capacity","have to use your hands in some capacity"
"p-q1GTtH4LE","00:06:23","00:06:23","if you've got shrimp tails on.","if you've got shrimp tails"
"p-q1GTtH4LE","00:06:24","00:06:27","That or you're spitting 'em out like an olive pit","on that or you're or you're spitting them out like an olive pit which i don't think"
"p-q1GTtH4LE","00:06:27","00:06:29","which I don't think you wanna do in a fancy restaurant.","you want to do in a fancy restaurant so"
"p-q1GTtH4LE","00:06:30","00:06:32","So shrimp tails in pasta makes zero sense to me.","shrimp tails and pasta makes zero sense to me"
"p-q1GTtH4LE","00:06:33","00:06:33","I completely agree.","i completely"
"p-q1GTtH4LE","00:06:34","00:06:35","That can really go [beep] itself.","agree that can really go for itself"
"p-q1GTtH4LE","00:06:36","00:06:39","From @JimKuras1, ""are #bayleaves a hoax?","from at gymkuras one are hashtag bay leaves"
"p-q1GTtH4LE","00:06:40","00:06:42","I've been cooking with them for 30 plus years","a hoax i've been cooking with them for 30 plus years and"
"p-q1GTtH4LE","00:06:42","00:06:44","and I'm not sure why.","i'm not sure why the only thing i know about them"
"p-q1GTtH4LE","00:06:45","00:06:47","is that they're not actually supposed to be eaten.","is that they're not actually supposed to be eaten cooking"
"p-q1GTtH4LE","00:06:47","00:06:48","#cookingquestion.""","question"
"p-q1GTtH4LE","00:06:49","00:06:53","I personally don't fully know what they're for either,","i personally don't fully know what they're for either these mysterious bastards"
"p-q1GTtH4LE","00:06:53","00:06:54","these mysterious bastards.","from"
"p-q1GTtH4LE","00:06:54","00:06:55","From what I understand,","what i understand"
"p-q1GTtH4LE","00:06:56","00:06:59","they're supposed to lighten up otherwise very heavy dishes","they're supposed to lighten up otherwise very heavy dishes like stews and"
"p-q1GTtH4LE","00:06:59","00:07:00","like stews and braises.","braises"
"p-q1GTtH4LE","00:07:00","00:07:02","They also play really well with seafood.","they also play really well with seafood"
"p-q1GTtH4LE","00:07:03","00:07:03","You're not supposed to eat them obviously","you're not supposed to eat them"
"p-q1GTtH4LE","00:07:04","00:07:05","but if you wanna see what they taste like,","obviously but if you want to see what they taste like yeah"
"p-q1GTtH4LE","00:07:06","00:07:09","you just gotta, just gotta, mm, yeah.","you just gotta sit down yeah there's"
"p-q1GTtH4LE","00:07:09","00:07:11","It is a minty, almost basily.","a minty almost basily"
"p-q1GTtH4LE","00:07:11","00:07:12","",""
"p-q1GTtH4LE","00:07:13","00:07:14","Yeah, you're not supposed to eat them","yeah you're not supposed to eat them but they do"
"p-q1GTtH4LE","00:07:14","00:07:17","but they do play really well in stews and braises","play really well in stews and braises and if they"
"p-q1GTtH4LE","00:07:17","00:07:18","and if they are a hoax,","are a hoax"
"p-q1GTtH4LE","00:07:18","00:07:20","they're the weirdest hoax I've ever heard of","they're the weirdest hoax i've ever heard of because these things"
"p-q1GTtH4LE","00:07:20","00:07:24","'cause these things cost like 99 cents a ton.","cost like 99 cents a ton jillbean"
"p-q1GTtH4LE","00:07:24","00:07:28","Jill Bean aka @Jili_Bean, ""hardest fruit to cut?","aka at jellybean a ton jillbean aka at jellybean hardest fruit to cut mango"
"p-q1GTtH4LE","00:07:29","00:07:30","Anyone beg to differ?","anyone beg to differ come"
"p-q1GTtH4LE","00:07:30","00:07:31","Come prove me wrong.","prove me wrong hashtag"
"p-q1GTtH4LE","00:07:31","00:07:33","#struggling.""","struggling is there"
"p-q1GTtH4LE","00:07:33","00:07:35","Is there a harder fruit to cut?","a harder fruit to cut"
"p-q1GTtH4LE","00:07:36","00:07:36","Nope, I just ran through the entire list","nope i just ran through the entire"
"p-q1GTtH4LE","00:07:37","00:07:37","of fruits in my head.","list of fruits in my head"
"p-q1GTtH4LE","00:07:38","00:07:39","Mango is a very difficult fruit to cut.","uh mango is a very difficult fruit"
"p-q1GTtH4LE","00:07:40","00:07:42","You could peel it first","to cut you could peel it first"
"p-q1GTtH4LE","00:07:43","00:07:45","but I like to just kinda go at it kinda like an avocado.","but i like to just kind of go at it kind of like an avocado"
"p-q1GTtH4LE","00:07:46","00:07:48","You wanna try to get really as close to the pit as possible.","you want to try to get really as close to the pit as possible it's"
"p-q1GTtH4LE","00:07:48","00:07:49","It's thinner than you think.","thinner than you think same"
"p-q1GTtH4LE","00:07:50","00:07:51","Same thing on the other side.","thing on the other side really"
"p-q1GTtH4LE","00:07:51","00:07:52","Really straddle the pit.","straddle the pit you're going"
"p-q1GTtH4LE","00:07:53","00:07:55","You're gonna wanna very carefully score this guy.","to want to very carefully score this guy you"
"p-q1GTtH4LE","00:07:56","00:07:59","Do you see that sort of spread apart mango action?","see that sort of spread apart mango action and"
"p-q1GTtH4LE","00:07:59","00:08:01","And now that you've spread it open like this,","now that you've spread it open like this you can just kind"
"p-q1GTtH4LE","00:08:02","00:08:02","you can just kinda chop it out.","of chop"
"p-q1GTtH4LE","00:08:03","00:08:03","Try not to take any skin with you","it out try not to take in"
"p-q1GTtH4LE","00:08:04","00:08:06","but you can just sorta slice it off there.","the skin with you but you can just sort of slice it off there if i had to sum"
"p-q1GTtH4LE","00:08:07","00:08:09","it's like a modified avocado.","up the technique it's like a modified avocado with the avocado"
