"video_id","min_timecode","max_timecode","text.user","text.auto"
"1Gxrwh4zGPg","00:00:00","00:00:02","(short upbeat intro)","[Music]"
"1Gxrwh4zGPg","00:00:03","00:00:04","","hello"
"1Gxrwh4zGPg","00:00:04","00:00:05","- Hello, friends.","friends"
"1Gxrwh4zGPg","00:00:06","00:00:08","And welcome to another video.","and welcome to another video"
"1Gxrwh4zGPg","00:00:09","00:00:12","Today, I'm gonna be mixing every hand sanitizer","today i'm gonna be mixing every hand sanitizer"
"1Gxrwh4zGPg","00:00:13","00:00:15","from Bath and Body Works together","from bath and body works together into"
"1Gxrwh4zGPg","00:00:15","00:00:17","into one single frankensanitizer.","one single franken"
"1Gxrwh4zGPg","00:00:18","00:00:18","","sanitizer"
"1Gxrwh4zGPg","00:00:19","00:00:20","Move aside bacteria,","move aside bacteria"
"1Gxrwh4zGPg","00:00:20","00:00:22","there's a new sheriff in town,","there's a new sheriff in town and"
"1Gxrwh4zGPg","00:00:22","00:00:23","and it's a monster.","it's a monster"
"1Gxrwh4zGPg","00:00:24","00:00:25","So previously on our channel,","so previously on our channel"
"1Gxrwh4zGPg","00:00:26","00:00:28","I've mixed together a lot of things,","i've mixed together a lot of things including"
"1Gxrwh4zGPg","00:00:29","00:00:31","including a heckin' lot of lipstick,","i've mixed together a lot of things including a heckin lot of lipstick every"
"1Gxrwh4zGPg","00:00:31","00:00:33","every candle from Bath and Body Works,","candle from bath and body works"
"1Gxrwh4zGPg","00:00:34","00:00:35","every bath bomb from Lush,","every bath bomb from lush and"
"1Gxrwh4zGPg","00:00:36","00:00:37","and every possible wedding cake flavor,","every possible wedding cake flavor"
"1Gxrwh4zGPg","00:00:38","00:00:41","generally to try and figure out what the average,","generally to try and figure out what the average most"
"1Gxrwh4zGPg","00:00:42","00:00:43","most marketable or mode,","marketable or mowed shade"
"1Gxrwh4zGPg","00:00:43","00:00:45","shade, scent, or flavor","scent or flavor of"
"1Gxrwh4zGPg","00:00:46","00:00:46","of those things are.","those things are"
"1Gxrwh4zGPg","00:00:47","00:00:49","Bad makeup science has truly evolved","bad makeup science has truly evolved"
"1Gxrwh4zGPg","00:00:50","00:00:51","into a way of life,","into a way of life or"
"1Gxrwh4zGPg","00:00:52","00:00:54","or rather a way of destruction and rebirth.","rather a way of destruction and rebirth"
"1Gxrwh4zGPg","00:00:55","00:00:56","- [Tyler] Oh yeah.","oh yeah"
"1Gxrwh4zGPg","00:00:57","00:00:57","- Boom.","boom now"
"1Gxrwh4zGPg","00:00:58","00:01:00","Now, many of you are probably familiar","many of you are probably familiar with"
"1Gxrwh4zGPg","00:01:00","00:01:03","with my bestie Bath and Body Works","my bestie bath and body works as a strongly"
"1Gxrwh4zGPg","00:01:03","00:01:06","as a strongly-scented presence in any mall","scented presence in any mall or shopping center"
"1Gxrwh4zGPg","00:01:06","00:01:07","or shopping center,","notorious"
"1Gxrwh4zGPg","00:01:07","00:01:09","notorious for their numerous candles,","for their numerous candles"
"1Gxrwh4zGPg","00:01:10","00:01:11","body sprays, soaps,","body sprays soaps"
"1Gxrwh4zGPg","00:01:12","00:01:12","and lotions,","and lotions as"
"1Gxrwh4zGPg","00:01:13","00:01:16","as well as just general holiday pandemonium.","well as just general holiday pandemonium"
"1Gxrwh4zGPg","00:01:16","00:01:18","This is a madhouse!","this is a bad house and as many"
"1Gxrwh4zGPg","00:01:18","00:01:21","And as many of you might also know,","of you might also know bath body works"
"1Gxrwh4zGPg","00:01:21","00:01:23","Bath and Body Works also makes a huge variety","also makes a huge variety"
"1Gxrwh4zGPg","00:01:24","00:01:25","of different hand sanitizers","of different hand sanitizers"
"1Gxrwh4zGPg","00:01:26","00:01:28","with many of their signature scents.","with many of their signature scents"
"1Gxrwh4zGPg","00:01:28","00:01:31","Now, obviously because of recent worldwide goings on,","now obviously because of recent worldwide goings-on"
"1Gxrwh4zGPg","00:01:32","00:01:34","hand sanitizer has become more and more","obviously because of recent worldwide goings-on hand sanitizer has become more and"
"1Gxrwh4zGPg","00:01:35","00:01:37","an every day item for a lot of us.","more an everyday item for a lot of us"
"1Gxrwh4zGPg","00:01:37","00:01:40","And one day during a routine slathering","and one day during a routine slathering with"
"1Gxrwh4zGPg","00:01:40","00:01:43","with one of my standard clear hand sanitizers,","one of my standard clear hand sanitizers"
"1Gxrwh4zGPg","00:01:44","00:01:46","I thought, couldn't this be more fun?","i thought couldn't this be more fun so"
"1Gxrwh4zGPg","00:01:46","00:01:48","So I figured why not mix together","i figured why not mix together"
"1Gxrwh4zGPg","00:01:49","00:01:51","one of every hand sanitizer","one of every hand sanitizer from bath and"
"1Gxrwh4zGPg","00:01:53","00:01:54","to help me battle germs","body works to help me battle germs in true"
"1Gxrwh4zGPg","00:01:54","00:01:57","in true bad makeup science style.","bad makeup science style i'm not"
"1Gxrwh4zGPg","00:01:58","00:01:59","I'm not sure if mixing a bunch","sure if mixing a bunch of"
"1Gxrwh4zGPg","00:02:00","00:02:01","of hand sanitizers together","hand sanitizers i'm not sure if mixing a bunch of hand sanitizers together"
"1Gxrwh4zGPg","00:02:02","00:02:04","is actually gonna make them more effective,","is actually going to make them more effective is actually going to make them more effective"
"1Gxrwh4zGPg","00:02:04","00:02:07","but it will certainly be more unhinged.","but it will certainly be more unhinged"
"1Gxrwh4zGPg","00:02:07","00:02:09","All right, let's do this.","all right let's do this"
"1Gxrwh4zGPg","00:02:10","00:02:12","To Bath and Body Works we go.","to bath and body works we go so"
"1Gxrwh4zGPg","00:02:12","00:02:13","So our first step here","our first step here"
"1Gxrwh4zGPg","00:02:14","00:02:16","was to gather all of our hand sanitizers,","was to gather all of our hand sanitizers"
"1Gxrwh4zGPg","00:02:17","00:02:18","which we've done over the course","which we've done over the course"
"1Gxrwh4zGPg","00:02:19","00:02:19","of a few months,","of a few months"
"1Gxrwh4zGPg","00:02:20","00:02:22","starting in December in LA.","starting in december in l.a all"
"1Gxrwh4zGPg","00:02:22","00:02:23","All right.","right so we"
"1Gxrwh4zGPg","00:02:24","00:02:25","So we are in the parking lot next","are in the parking lot"
"1Gxrwh4zGPg","00:02:26","00:02:27","to the Bath and Body Works.","next to the bath and body"
"1Gxrwh4zGPg","00:02:28","00:02:29","Usually in this segment,","works usually in this segment"
"1Gxrwh4zGPg","00:02:30","00:02:31","I do a fair amount of filming in the store.","i do a fair amount of filming in the store"
"1Gxrwh4zGPg","00:02:32","00:02:33","We go in, we count,","we go in we"
"1Gxrwh4zGPg","00:02:34","00:02:36","we lament the number of things","count we lament the number"
"1Gxrwh4zGPg","00:02:36","00:02:37","we're about to buy.","of things we're about to buy we tend to say"
"1Gxrwh4zGPg","00:02:38","00:02:40","about how heavy the bag is. - [Safiya] Yeah. (laughs)","things about how heavy the bag is yeah but i feel like"
"1Gxrwh4zGPg","00:02:40","00:02:42","But I feel like just right now,","just right now i don't want"
"1Gxrwh4zGPg","00:02:42","00:02:45","I don't want to harass the shop staff too much.","to harass the shop staff too much i"
"1Gxrwh4zGPg","00:02:45","00:02:47","I feel like they're dealing with enough already.","feel like they're dealing with enough already"
"1Gxrwh4zGPg","00:02:48","00:02:50","So I'm thinking we just do a surgical strike here.","so i'm thinking we just do a surgical strike here"
"1Gxrwh4zGPg","00:02:51","00:02:51","We go in,","we go in we"
"1Gxrwh4zGPg","00:02:51","00:02:52","we get the sanitizers,","get the sanitizers"
"1Gxrwh4zGPg","00:02:53","00:02:53","we leave.","we leave"
"1Gxrwh4zGPg","00:02:54","00:02:55","Cool? - [Tyler] Cool.","cool go in we get the sanitizers we leave cool cute cool"
"1Gxrwh4zGPg","00:02:56","00:02:57","Why did I do it like this?","why did i do"
"1Gxrwh4zGPg","00:02:57","00:02:58","- [Tyler] That was not graceful.","it like that was not graceful why"
"1Gxrwh4zGPg","00:02:59","00:03:01","- (chuckling) Why did I do it like this?","did i do it like this and across a few"
"1Gxrwh4zGPg","00:03:01","00:03:03","Across a few stores in the LA area,","stores in the la area"
"1Gxrwh4zGPg","00:03:04","00:03:07","We found 38 hand sanitizers in total,","we found 38 hand sanitizers in total"
"1Gxrwh4zGPg","00:03:07","00:03:09","which we then brought across the country with us","which we then brought across the country with us"
"1Gxrwh4zGPg","00:03:10","00:03:11","on our cross-country road trip.","on our cross-country road trip"
"1Gxrwh4zGPg","00:03:12","00:03:13","- [Tyler] Sunshine me.","sunshine"
"1Gxrwh4zGPg","00:03:15","00:03:15","(rubbing hands together) That's nice.","we"
"1Gxrwh4zGPg","00:03:16","00:03:17","- [Safiya] We also hit up a couple of stores","also hit up a couple of stores"
"1Gxrwh4zGPg","00:03:18","00:03:19","in Philadelphia in January,","in philadelphia in january"
"1Gxrwh4zGPg","00:03:20","00:03:21","as well as did some shopping","as well as did some shopping in north"
"1Gxrwh4zGPg","00:03:21","00:03:23","in North Carolina this spring.","carolina this spring"
"1Gxrwh4zGPg","00:03:24","00:03:25","And then we filled in the blanks from all","and then we filled in the blanks from"
"1Gxrwh4zGPg","00:03:25","00:03:27","of that with what we found online.","all of that with what we found online"
"1Gxrwh4zGPg","00:03:28","00:03:30","- [Tyler] It's kind of like a heavily scented game","it's kind of like a heavily scented game of whack-a-mole"
"1Gxrwh4zGPg","00:03:31","00:03:32","Which brings us to now.","which brings us to now"
"1Gxrwh4zGPg","00:03:33","00:03:34","Now as we realized","now as we realized in our"
"1Gxrwh4zGPg","00:03:34","00:03:36","in our melting every candle","melting every candle from bath and body works"
"1Gxrwh4zGPg","00:03:36","00:03:37","from Bath and Body Works video,","video"
"1Gxrwh4zGPg","00:03:38","00:03:40","Bath and Body Works is pretty fast and loose","bath and body works is pretty fast"
"1Gxrwh4zGPg","00:03:41","00:03:43","with telling anyone what they stock.","and loose with telling anyone what they stock what they"
"1Gxrwh4zGPg","00:03:43","00:03:45","What they have online does not match","have online does not match"
"1Gxrwh4zGPg","00:03:46","00:03:46","with what's available in the store,","with what's available in the"
"1Gxrwh4zGPg","00:03:47","00:03:49","and different things are available","store and that different things are available in different stores"
"1Gxrwh4zGPg","00:03:49","00:03:50","in different stores.","so"
"1Gxrwh4zGPg","00:03:50","00:03:52","So if you're asking,","if you're asking"
"1Gxrwh4zGPg","00:03:53","00:03:54","how do I know","how do i know that i"
"1Gxrwh4zGPg","00:03:54","00:03:56","that I have all the hand sanitizer flavors?","have all the hand sanitizer flavors the answer"
"1Gxrwh4zGPg","00:03:56","00:03:57","The answer is I don't,","is i"
"1Gxrwh4zGPg","00:03:58","00:04:00","but we have 70,","don't but flavors the answer is i don't but we have 70"
"1Gxrwh4zGPg","00:04:01","00:04:02","which feels like a critical mass.","which feels like a critical mass now"
"1Gxrwh4zGPg","00:04:02","00:04:04","Now as a quick disclaimer,","as a quick disclaimer we are"
"1Gxrwh4zGPg","00:04:04","00:04:06","we are not in any way trying","not in any way trying to"
"1Gxrwh4zGPg","00:04:07","00:04:08","to horde sanitizers.","hoard sanitizers i think at"
"1Gxrwh4zGPg","00:04:08","00:04:10","I think at some point last year,","some point last year hand sanitizer"
"1Gxrwh4zGPg","00:04:10","00:04:12","hand sanitizer was kind of scarce.","was kind of scarce"
"1Gxrwh4zGPg","00:04:13","00:04:14","So I wanted to wait to start this experiment","so i wanted to wait to start this"
"1Gxrwh4zGPg","00:04:15","00:04:18","until it seemed like they were solidly back in stock.","experiment until it seemed like they were solidly back in stock"
"1Gxrwh4zGPg","00:04:19","00:04:21","I also tried to buy the tiny travel size ones","i also tried to buy the tiny travel size ones"
"1Gxrwh4zGPg","00:04:22","00:04:22","when I could,","when i could and"
"1Gxrwh4zGPg","00:04:23","00:04:24","and any extra sanitizers we have","any extra sanitizers"
"1Gxrwh4zGPg","00:04:25","00:04:26","at the end of this experiment,","we have at the end of this experiment"
"1Gxrwh4zGPg","00:04:27","00:04:27","we'll make sure to donate.","we'll make sure to donate"
"1Gxrwh4zGPg","00:04:28","00:04:32","Also we focused just on the gel-like hand sanitizers","also we focused just on the gel-like hand sanitizers"
"1Gxrwh4zGPg","00:04:33","00:04:35","and not on the newer liquid spray ones.","and not on the newer liquid spray ones"
"1Gxrwh4zGPg","00:04:36","00:04:38","So with all of that in mind,","so with all of that in mind let's talk"
"1Gxrwh4zGPg","00:04:38","00:04:41","let's talk about how we're gonna do this.","about how we're gonna do this we've divided"
"1Gxrwh4zGPg","00:04:41","00:04:43","We've divided our 70 sanitizers","our 70 sanitizers"
"1Gxrwh4zGPg","00:04:44","00:04:47","into 10 categories based on scent family.","into ten categories based on scent family they"
"1Gxrwh4zGPg","00:04:48","00:04:49","They do list all of the fragrance notes","do list all of the fragrance notes"
"1Gxrwh4zGPg","00:04:50","00:04:51","that are in each sanitizer","that are in each sanitizer"
"1Gxrwh4zGPg","00:04:51","00:04:52","on their website,","on their website but"
"1Gxrwh4zGPg","00:04:53","00:04:55","but we mainly just focused on the vibes.","we mainly just focused on the vibes"
"1Gxrwh4zGPg","00:04:56","00:04:57","- [Tyler] Names, labels, color.","names labels color"
"1Gxrwh4zGPg","00:04:58","00:04:59","- Exactly, all of the above.","exactly all of the above"
"1Gxrwh4zGPg","00:05:00","00:05:01","And in terms of our method here,","and in terms of our method here"
"1Gxrwh4zGPg","00:05:02","00:05:02","I was thinking,","i was thinking"
"1Gxrwh4zGPg","00:05:03","00:05:05","what we should do is just measure out","what we should do is just measure out"
"1Gxrwh4zGPg","00:05:06","00:05:09","like an equal amount of each hand sanitizer","like an equal amount of each hand sanitizer"
"1Gxrwh4zGPg","00:05:09","00:05:11","into this Pyrex glass bowl,","into this pyrex glass bowl"
"1Gxrwh4zGPg","00:05:12","00:05:14","and then once we have them all in there,","and then once we have them all in there we will mix"
"1Gxrwh4zGPg","00:05:14","00:05:16","we will mix them up, syringe them,","them up syringe them"
"1Gxrwh4zGPg","00:05:17","00:05:21","and squeeze them into our own large hand sanitizer bottle.","and squeeze them into our own large hand sanitizer bottle"
"1Gxrwh4zGPg","00:05:21","00:05:21","",""
"1Gxrwh4zGPg","00:05:22","00:05:23","And that's the idea.","and that's the idea"
"1Gxrwh4zGPg","00:05:23","00:05:24","I'm excited about it.","i'm excited about it"
"1Gxrwh4zGPg","00:05:25","00:05:26","All right, let's do it.","all right let's do it"
"1Gxrwh4zGPg","00:05:27","00:05:30","Now, one thing about our collection of sanitizers","now one thing about our collection of sanitizers now one thing about our collection of sanitizers"
"1Gxrwh4zGPg","00:05:31","00:05:33","is that we purchased them","is that we purchase them in between"
"1Gxrwh4zGPg","00:05:33","00:05:36","in between December and April,","december and april which means we"
"1Gxrwh4zGPg","00:05:37","00:05:40","which means we kind of got like almost the whole spectrum","kind of got like almost the whole spectrum of"
"1Gxrwh4zGPg","00:05:40","00:05:41","of Bath and Body Works scents.","bath and body work sense"
"1Gxrwh4zGPg","00:05:42","00:05:44","We got a taste of all seasons, really.","we got like a taste of all seasons really"
"1Gxrwh4zGPg","00:05:45","00:05:45","So I was thinking what we should do","so i was thinking"
"1Gxrwh4zGPg","00:05:46","00:05:48","is start off with the autumn scents.","what we should do is start off with the autumn"
"1Gxrwh4zGPg","00:05:49","00:05:50","The autumnal scents.","sense the autumnal sense"
"1Gxrwh4zGPg","00:05:51","00:05:51","The fall scents.","the fall"
"1Gxrwh4zGPg","00:05:52","00:05:55","Starting with Sweet Cinnamon Pumpkin.","sense starting with sweet cinnamon pumpkin i"
"1Gxrwh4zGPg","00:05:56","00:05:57","I guess I should probably give it quick sniff.","guess i should probably give it a quick sniff"
"1Gxrwh4zGPg","00:05:58","00:05:59","Oop.","ooh probably give it a quick sniff ooh i guess one thing about sanitizers"
"1Gxrwh4zGPg","00:06:00","00:06:03","is there is like an initial alcohol, right?","is there is like an initial alcohol"
"1Gxrwh4zGPg","00:06:04","00:06:05","Like there's a sting.","right like there's a sting but"
"1Gxrwh4zGPg","00:06:05","00:06:09","But let me try and sniff below the alcohol.","um let me let me try and sniff below the alcohol yeah it's"
"1Gxrwh4zGPg","00:06:09","00:06:11","Yeah, it's given me kind of like,","giving me kind of like arts and craft"
"1Gxrwh4zGPg","00:06:11","00:06:12","arts and crafts store vibes.","store vibes"
"1Gxrwh4zGPg","00:06:13","00:06:14","- [Tyler] Oh.","oh kind of smells like a michaels oh"
"1Gxrwh4zGPg","00:06:15","00:06:17","- [Tyler] Oh! - Or like a pumpkin spice,","or like a pumpkin spice like"
"1Gxrwh4zGPg","00:06:17","00:06:18","like Yankee candle. - [Tyler] Okay.","yankee candle"
"1Gxrwh4zGPg","00:06:19","00:06:20","- Very spicy.","okay very spicy"
"1Gxrwh4zGPg","00:06:21","00:06:21","Pumpkiny, spicy,","pumpkiny spicy"
"1Gxrwh4zGPg","00:06:22","00:06:23","a little bit of alcohol fumes","a little bit of alcohol fumes on"
"1Gxrwh4zGPg","00:06:24","00:06:25","And for each sanitizer,","the top and for each sanitizer i'm"
"1Gxrwh4zGPg","00:06:26","00:06:27","I'm gonna measure out 10 grams.","going to measure out 10 grams"
"1Gxrwh4zGPg","00:06:28","00:06:29","I'm going to throw some,","i'm gonna throw some some g's"
"1Gxrwh4zGPg","00:06:29","00:06:31","some Gs in this bowl using my scale.","in this bowl using my scale oh"
"1Gxrwh4zGPg","00:06:32","00:06:33","Oh, we're going.","we're going oh"
"1Gxrwh4zGPg","00:06:33","00:06:35","Oh, nine.","nine that's ten"
"1Gxrwh4zGPg","00:06:36","00:06:36","- [Tyler] That's 10?","that's ten that's"
"1Gxrwh4zGPg","00:06:36","00:06:38","- [Safiya] That's 10 grams, baby.","ten grams baby that little gloop"
"1Gxrwh4zGPg","00:06:38","00:06:39","- [Tyler] That little gloop right there.","right there yeah"
"1Gxrwh4zGPg","00:06:40","00:06:42","Now, there are eight of these autumnal scents,","now there are eight of these autumnal scents"
"1Gxrwh4zGPg","00:06:43","00:06:44","and they mostly evoke things","and they mostly evoke things"
"1Gxrwh4zGPg","00:06:45","00:06:47","you either drink or eat during the fall,","you either drink or eat during the fall like"
"1Gxrwh4zGPg","00:06:47","00:06:50","like vanilla chais and pumpkin lattes.","vanilla chives and pumpkin lattes oh there"
"1Gxrwh4zGPg","00:06:50","00:06:52","Oh, there is a latte. Latte.","is a latte latte or"
"1Gxrwh4zGPg","00:06:53","00:06:53","Or things you might wear","things you might wear"
"1Gxrwh4zGPg","00:06:54","00:06:55","in the crisp morning air.","in the crisp morning air"
"1Gxrwh4zGPg","00:06:56","00:06:57","This one is Sweta Wetta,","this one is suede"
"1Gxrwh4zGPg","00:06:58","00:07:00","Sweater Weather.","sweater weather sweater weather and these"
"1Gxrwh4zGPg","00:07:00","00:07:03","And these ones either smelled kind of sweet:","ones either smelled kind of sweet this one"
"1Gxrwh4zGPg","00:07:03","00:07:04","This one smells like","smells"
"1Gxrwh4zGPg","00:07:05","00:07:06","a grocery store cheese danish.","like a grocery store cheese danish with notes"
"1Gxrwh4zGPg","00:07:06","00:07:09","With notes like marshmallow and vanilla.","like marshmallow and vanilla this one smells"
"1Gxrwh4zGPg","00:07:09","00:07:11","This one smells like a Victoria Secret.","like a victoria's secret spray"
"1Gxrwh4zGPg","00:07:11","00:07:13","- [Tyler] Spray? Bra?","bra store"
"1Gxrwh4zGPg","00:07:14","00:07:14","Store? - Store.","store okay"
"1Gxrwh4zGPg","00:07:15","00:07:15","- [Tyler] Okay.","like just"
"1Gxrwh4zGPg","00:07:16","00:07:17","a strong vanilla scent. - [Tyler] Right.","a strong vanilla scent right"
"1Gxrwh4zGPg","00:07:18","00:07:20","- [Safiya] Maybe a little musky almost.","maybe a little musky almost alessandra right maybe a little musky almost alessandra"
"1Gxrwh4zGPg","00:07:20","00:07:22","Alessandra Ambrosio's armpit. (Tyler laughs)","ambrosio's armpit"
"1Gxrwh4zGPg","00:07:23","00:07:25","Or they sort of smelled crisp and woody.","or they sort of smelled crisp and woody"
"1Gxrwh4zGPg","00:07:26","00:07:26","Ooh.","ooh with kind of"
"1Gxrwh4zGPg","00:07:26","00:07:28","With kind of like, dudish vibes.","like doudish vibes"
"1Gxrwh4zGPg","00:07:29","00:07:30","Old Spice body wash?","old spice body wash oh"
"1Gxrwh4zGPg","00:07:31","00:07:33","- Or the Axe body wash that's like blue.","yeah or or the axe body wash that's like blue"
"1Gxrwh4zGPg","00:07:34","00:07:35","Ooh, yeah.","oh yeah there we go it"
"1Gxrwh4zGPg","00:07:36","00:07:37","- [Tyler] It is oddly satisfying to look at.","is oddly satisfying to look at the"
"1Gxrwh4zGPg","00:07:38","00:07:39","The little bobas make it look kind of galaxy.","little bobas make it look kind of galaxy"
"1Gxrwh4zGPg","00:07:40","00:07:41","- [Safiya] That is one fun thing","that is one fun thing about the"
"1Gxrwh4zGPg","00:07:41","00:07:43","about the Bath and Body Works sanitizers","bath and bodywork sanitizers is"
"1Gxrwh4zGPg","00:07:44","00:07:45","is they have like moisturizing beads.","they have like moisturizing"
"1Gxrwh4zGPg","00:07:46","00:07:47","- [Tyler] Yes.","beads yes most"
"1Gxrwh4zGPg","00:07:47","00:07:48","- [Safiya] Most of them are blue.","of them are blue right"
"1Gxrwh4zGPg","00:07:48","00:07:49","- [Tyler] Right.","blue right but i'm"
"1Gxrwh4zGPg","00:07:50","00:07:50","- But I'm still excited about them.","so excited about"
"1Gxrwh4zGPg","00:07:51","00:07:52","And then to finish off this category...","them and then to finish off this category"
"1Gxrwh4zGPg","00:07:53","00:07:54","- [Tyler] Yes. - [Safiya] We have a big guy.","we have a big guy crisp"
"1Gxrwh4zGPg","00:07:54","00:07:56","Crisp Morning Air.","morning air i think i have to like"
"1Gxrwh4zGPg","00:07:56","00:07:57","I think I have to like pop it open, right?","pop it open right"
"1Gxrwh4zGPg","00:07:58","00:07:59","- Yeah. (plastic pops)","yeah ooh"
"1Gxrwh4zGPg","00:08:01","00:08:02","- Nailed it.","nailed it oh"
"1Gxrwh4zGPg","00:08:02","00:08:03","Oh yeah, it's crisp.","yeah it's crisp"
"1Gxrwh4zGPg","00:08:04","00:08:05","- [Tyler] That was diving face verse into it, Saf.","that was diving face first into"
"1Gxrwh4zGPg","00:08:06","00:08:06","- Yeah. (Safiya laughs)","it yeah diving face first into it yeah"
"1Gxrwh4zGPg","00:08:07","00:08:09","Well, not the most aesthetically pleasing","well not the most aesthetically pleasing to end"
"1Gxrwh4zGPg","00:08:10","00:08:13","but autumn in the bowl.","the round but autumn in the bowl let's take"
"1Gxrwh4zGPg","00:08:14","00:08:14","Let's take a whiff.","a whiff"
"1Gxrwh4zGPg","00:08:15","00:08:15","Really toothpaste-y.","really toothpastey"
"1Gxrwh4zGPg","00:08:16","00:08:17","(Tyler laughs)","like really"
"1Gxrwh4zGPg","00:08:17","00:08:19","Really, really toothpaste-y.","really toothpastey"
"1Gxrwh4zGPg","00:08:20","00:08:21","I really don't understand where that's coming from,","i really don't understand where that's coming from"
"1Gxrwh4zGPg","00:08:22","00:08:23","'cause there is no mint in here.","because there is no mint in here"
"1Gxrwh4zGPg","00:08:24","00:08:27","Kinda smells like a sweet apple cider toothpaste.","kinda smells like a sweet apple cider toothpaste"
"1Gxrwh4zGPg","00:08:27","00:08:28","- Tyler] Okay.","okay"
"1Gxrwh4zGPg","00:08:29","00:08:29","- That's what I'm getting,","that's what i'm getting but"
"1Gxrwh4zGPg","00:08:30","00:08:30","but we'll see what happens","we'll see what happens"
"1Gxrwh4zGPg","00:08:31","00:08:32","over the next couple of hours.","over the next couple of hours see what happens over the next couple of hours"
"1Gxrwh4zGPg","00:08:33","00:08:33","All right.","all right so that's"
"1Gxrwh4zGPg","00:08:33","00:08:35","So that's one category down.","one category down now"
"1Gxrwh4zGPg","00:08:35","00:08:38","Now let's move on to winter.","let's move on to now let's move on to winter so there"
"1Gxrwh4zGPg","00:08:38","00:08:41","So there are nine winter scented sanitizers,","are nine winter scented sanitizers"
"1Gxrwh4zGPg","00:08:42","00:08:43","which are either literally","which are either literally about"
"1Gxrwh4zGPg","00:08:43","00:08:44","about frozen water,","frozen water"
"1Gxrwh4zGPg","00:08:45","00:08:47","like icicles and snowballs","like icicles and snowballs"
"1Gxrwh4zGPg","00:08:48","00:08:50","and fresh sparkling snow.","and fresh sparkling snow"
"1Gxrwh4zGPg","00:08:51","00:08:51","I don't know why,","i don't know why it was a little"
"1Gxrwh4zGPg","00:08:52","00:08:52","isn't that like Jennifer Coolidge?","jennifer coolidge"
"1Gxrwh4zGPg","00:08:53","00:08:53","(Tyler laughs)","i'm taking"
"1Gxrwh4zGPg","00:08:54","00:08:55","I'm taking the dog, dumb ass.","the dog dumbass"
"1Gxrwh4zGPg","00:08:56","00:08:57","Or some kind of wintery fruit,","or some kind of wintery"
"1Gxrwh4zGPg","00:08:58","00:08:59","like Winter Candy Apple,","fruit like winter candy apple"
"1Gxrwh4zGPg","00:09:00","00:09:01","Frosted Cranberry,","frosted cranberry and"
"1Gxrwh4zGPg","00:09:02","00:09:03","and Snowy Peach Berry.","snowy peach berry"
"1Gxrwh4zGPg","00:09:04","00:09:05","- [Tyler] Do peaches grow when it's snowing?","do peaches grow when it's snowing i would've"
"1Gxrwh4zGPg","00:09:06","00:09:06","I would've said no.","said no"
