"video_id","min_timecode","max_timecode","text.user","text.auto"
"K_q-xnYRugQ","00:00:00","00:00:03","A while ago I made a video on the US electrical system.","a while ago i made a video on the u.s electrical system"
"K_q-xnYRugQ","00:00:04","00:00:08","It was a basic overview designed principally to get those of you in 240 lands to shu—","it was a basic overview designed principally to get those of you in 240 lands to shut"
"K_q-xnYRugQ","00:00:09","00:00:09","",""
"K_q-xnYRugQ","00:00:09","00:00:12","uh, to understand that we are also a 240 land,","to understand that we are also a 240"
"K_q-xnYRugQ","00:00:13","00:00:18","but since we use split-phase power most of our circuits operate at half that voltage","land but since we use split phase power most of our circuits operate at half that voltage and the full 240"
"K_q-xnYRugQ","00:00:18","00:00:24","and the full 240V potential is generally limited to high-power devices on dedicated circuits.","volts potential is generally limited to high power devices on dedicated circuits using"
"K_q-xnYRugQ","00:00:25","00:00:26","Using split-phase power has some real advantages","split phase power has some real advantages"
"K_q-xnYRugQ","00:00:27","00:00:29","particularly when it comes to safety -","particularly when it comes to safety advantages particularly when it comes to safety and on"
"K_q-xnYRugQ","00:00:29","00:00:32","and on that note at the end I’m gonna add some clarifying words there","that note at the end i'm going to add some clarifying words there"
"K_q-xnYRugQ","00:00:33","00:00:36","because in the time since that video I’ve discovered an interesting language quirk","because in the time since that video i discovered an interesting language quirk"
"K_q-xnYRugQ","00:00:37","00:00:38","regarding that discussion.","regarding that discussion"
"K_q-xnYRugQ","00:00:39","00:00:42","But anyway this video isn’t gonna defend our electrical system.","but anyway this video isn't going to defend our electrical system in fact it's"
"K_q-xnYRugQ","00:00:42","00:00:45","In fact, it’s about perhaps the worst part of it!","about perhaps the worst part of it"
"K_q-xnYRugQ","00:00:45","00:00:49","And no, it’s not just our terrible, fully-metal plug design","and no it's not just our terrible fully metal plug design or"
"K_q-xnYRugQ","00:00:50","00:00:51","or completely unshielded receptacles.","completely unshielded receptacles"
"K_q-xnYRugQ","00:00:52","00:00:52","","although for"
"K_q-xnYRugQ","00:00:52","00:00:53","Although for what it’s worth,","what it's worth tamper"
"K_q-xnYRugQ","00:00:53","00:00:55","tamper-resistant receptacles are now available","resistant receptacles are now available"
"K_q-xnYRugQ","00:00:56","00:00:58","and usually required in new-construction.","and usually required in new construction"
"K_q-xnYRugQ","00:00:59","00:01:02","But anyway, this problem has actually nothing to do with a building’s wiring","but anyway this problem has actually nothing to do with a building's wiring"
"K_q-xnYRugQ","00:01:03","00:01:04","or the receptacles or plugs.","or the receptacles or the plugs"
"K_q-xnYRugQ","00:01:05","00:01:07","Instead, it’s that","instead it's that these exist"
"K_q-xnYRugQ","00:01:08","00:01:08","",""
"K_q-xnYRugQ","00:01:09","00:01:09","And","and"
"K_q-xnYRugQ","00:01:10","00:01:10","","these"
"K_q-xnYRugQ","00:01:10","00:01:11","these.","and especially"
"K_q-xnYRugQ","00:01:13","00:01:13","",""
"K_q-xnYRugQ","00:01:14","00:01:14","these.","these"
"K_q-xnYRugQ","00:01:15","00:01:15","",""
"K_q-xnYRugQ","00:01:16","00:01:19","Now there’s nothing wrong with extension cords or power strips themselves,","now there's nothing wrong with extension cords or power strips themselves"
"K_q-xnYRugQ","00:01:20","00:01:22","it’s just how they’re implemented which is the issue.","it's just how they're implemented which is the issue"
"K_q-xnYRugQ","00:01:23","00:01:25","Here’s a silly fact to preview the problem at hand:","here's a silly fact to preview the problem at hand"
"K_q-xnYRugQ","00:01:26","00:01:31","A strand of Christmas lights is a safer extension cord than most extension cords.","a strand of christmas lights is a safer extension cord than most extension cords"
"K_q-xnYRugQ","00:01:31","00:01:31","",""
"K_q-xnYRugQ","00:01:32","00:01:32","Yeah.","yeah"
"K_q-xnYRugQ","00:01:33","00:01:33","","i'll explain why"
"K_q-xnYRugQ","00:01:33","00:01:34","I’ll explain why in a bit,","in a bit"
"K_q-xnYRugQ","00:01:34","00:01:37","but first we need to address a common misconception.","but first we need to address a common misconception"
"K_q-xnYRugQ","00:01:37","00:01:38","Circuit breakers!","circuit breakers"
"K_q-xnYRugQ","00:01:39","00:01:39","","what are they"
"K_q-xnYRugQ","00:01:39","00:01:40","What are they for?","for"
"K_q-xnYRugQ","00:01:41","00:01:44","Well, you might think that they’re there to protect you and your stuff.","well you might think that they're there to protect you and your stuff"
"K_q-xnYRugQ","00:01:45","00:01:46","This belief is pretty understandable,","this belief is pretty understandable"
"K_q-xnYRugQ","00:01:46","00:01:49","after all one of the most common ways they get tripped","after all one of the most common ways they get tripped"
"K_q-xnYRugQ","00:01:49","00:01:52","is when one of your electrical stuffs has a bad time.","is when one of your electrical stuffs has a bad"
"K_q-xnYRugQ","00:01:53","00:01:57","And since they cut the power to a given circuit when they do their thing,","time and since they cut the power to a given circuit when they do their thing well it stands"
"K_q-xnYRugQ","00:01:57","00:02:00","well it stands to reason that they also help prevent electric shock.","to reason that they also help prevent electric shock"
"K_q-xnYRugQ","00:02:01","00:02:04","But a breaker like these does no such thing.","but a breaker like these does no such thing"
"K_q-xnYRugQ","00:02:05","00:02:06","It couldn’t care less about your stuff, and quite frankly","it couldn't care less about your stuff and quite frankly"
"K_q-xnYRugQ","00:02:07","00:02:09","it doesn’t care about you either.","it doesn't care about you either"
"K_q-xnYRugQ","00:02:09","00:02:13","Of course, there is some nuance here with the advent of arc-fault circuit interrupters,","of course there is some nuance here with the advent of arc fault circuit interrupters"
"K_q-xnYRugQ","00:02:14","00:02:17","and while we usually only put shock protection devices at the receptacle","and while we usually only put shock protection devices at the receptacle"
"K_q-xnYRugQ","00:02:18","00:02:19","in locations where hands can be wet,","in locations where hands can be wet"
"K_q-xnYRugQ","00:02:20","00:02:21","breakers with integrated residual current devices","breakers with integrated residual current devices"
"K_q-xnYRugQ","00:02:22","00:02:25","(although we call them ground-fault circuit interrupters)","although we call them ground fault circuit interrupters we call them ground fault circuit interrupters"
"K_q-xnYRugQ","00:02:25","00:02:26","are available.","are available i"
"K_q-xnYRugQ","00:02:27","00:02:29","I actually made a video about that tech if you want to check it out.","actually made a video about that tech if you want to check it out it's"
"K_q-xnYRugQ","00:02:29","00:02:31","It’s pretty interesting.","pretty interesting but anyway"
"K_q-xnYRugQ","00:02:31","00:02:35","But anyway, since AFCI breakers have only somewhat recently been mandated by code","since afci breakers have only somewhat recently been mandated by code"
"K_q-xnYRugQ","00:02:36","00:02:39","and GFCI breakers are, frankly, quite rare here","and gfci breakers are frankly quite rare here you're"
"K_q-xnYRugQ","00:02:40","00:02:42","you’re going to find lots of electrical panels like this one,","going to find lots of electrical panels like this"
"K_q-xnYRugQ","00:02:43","00:02:46","filled with nothing but bog-standard breakers.","one filled with nothing but bog standard breakers"
"K_q-xnYRugQ","00:02:46","00:02:49","And these have one job and one job only.","and these have one job and one job only"
"K_q-xnYRugQ","00:02:50","00:02:52","To protect the conductors in your walls.","to protect the conductors in your walls"
"K_q-xnYRugQ","00:02:52","00:02:53","","that's it"
"K_q-xnYRugQ","00:02:54","00:02:58","They frankly do not care what happens when the electricity leaves the wall,","they frankly do not care what happens when the electricity leaves the wall they just"
"K_q-xnYRugQ","00:02:58","00:03:02","they just want to know that you’re not overloading the wiring coming out of them.","want to know that you're not overloading the wiring coming out of them they"
"K_q-xnYRugQ","00:03:02","00:03:06","They will stand idly by as you get zapped or as your television has a meltdown,","will stand idly by as you get zapped or as your television has a meltdown you get zapped or as your television has a meltdown"
"K_q-xnYRugQ","00:03:07","00:03:12","and will only intervene once the current going through them exceeds their rating.","and will only intervene once the current going through them exceeds their rating"
"K_q-xnYRugQ","00:03:12","00:03:18","Circuit breakers like these are overcurrent protection devices for a structure’s electrical system","circuit breakers like these are over current protection devices for a structures electrical system and"
"K_q-xnYRugQ","00:03:18","00:03:19","and nothing more.","nothing more they"
"K_q-xnYRugQ","00:03:19","00:03:25","They reduce the risk of electrical fires occurring due to an overheating conductor igniting a wall stud or whatever,","reduce the risk of electrical fires occurring due to an overheating conductor igniting a wall stud or whatever but that's"
"K_q-xnYRugQ","00:03:25","00:03:28","but that’s about the only thing they can do.","about the only thing they can do now"
"K_q-xnYRugQ","00:03:28","00:03:30","Now, that is very important!","that is very important"
"K_q-xnYRugQ","00:03:30","00:03:33","A given conductor (so, a wire)","a given conductor now that is very important a given conductor so a wire can only"
"K_q-xnYRugQ","00:03:33","00:03:37","can only carry so much current before its own electrical resistance becomes significant","carry so much current before its own electrical resistance becomes significant and it"
"K_q-xnYRugQ","00:03:38","00:03:39","and it begins to heat up.","begins to heat up and that's"
"K_q-xnYRugQ","00:03:39","00:03:40","And that’s….","bad"
"K_q-xnYRugQ","00:03:42","00:03:44","Imagine you had a coffee maker and a microwave and,","imagine you had a coffee maker and a microwave"
"K_q-xnYRugQ","00:03:45","00:03:45","why not,","and why not also"
"K_q-xnYRugQ","00:03:45","00:03:48","also a toaster all connected to the same circuit.","a toaster and a microwave and why not also a toaster all connected to the same circuit"
"K_q-xnYRugQ","00:03:49","00:03:51","This can be easier to accomplish than you might think,","this can be easier to accomplish than you might think"
"K_q-xnYRugQ","00:03:52","00:03:57","as many adjacent outlets are simply daisy-chained and share the same wires in the walls","as many adjacent outlets are simply daisy-chained and share the same wires in the walls though"
"K_q-xnYRugQ","00:03:57","00:04:02","(though in fairness, kitchens are usually designed more smartly to avoid this).","in fairness kitchens are usually designed more smartly to avoid this"
"K_q-xnYRugQ","00:04:02","00:04:05","Now, on a 15 amp 120V circuit,","now on a 15 amp 120 volt circuit"
"K_q-xnYRugQ","00:04:05","00:04:10","1,875 watts is the maximum that can be safely drawn.","1875 watts is the maximum that can be safely drawn"
"K_q-xnYRugQ","00:04:11","00:04:14","And in fact, that number is really only good for non-continuous loads.","and in fact that number is really only good for non-continuous loads"
"K_q-xnYRugQ","00:04:15","00:04:20","Devices which draw a load continuously are limited to 80% of a circuit’s capacity.","devices which draw a load continuously are limited to 80 percent of a circuit's capacity"
"K_q-xnYRugQ","00:04:21","00:04:23","Let’s say the toaster uses 750 watts.","let's say the toaster uses 750 watts"
"K_q-xnYRugQ","00:04:23","00:04:26","And we’ll imagine the coffee maker is 1,000.","and we'll imagine the coffee maker is a thousand making"
"K_q-xnYRugQ","00:04:26","00:04:30","Making some toast while brewing coffee is really close to the limit,","some toast while brewing coffee is really close to the limit"
"K_q-xnYRugQ","00:04:31","00:04:34","and if you decide to microwave some bacon while that’s going on…","and if you decide to microwave some bacon while that's going on"
"K_q-xnYRugQ","00:04:35","00:04:37","now you could easily be more than a kilowatt over.","now you could easily be more than a kilowatt now you could easily be more than a kilowatt"
"K_q-xnYRugQ","00:04:38","00:04:43","That is going to cause the wiring coming from the breaker panel up to wherever you are to get pretty hot,","over that is going to cause the wiring coming from the breaker panel up to wherever you are to get pretty"
"K_q-xnYRugQ","00:04:44","00:04:47","particularly where splices and other connections have been made.","hot particularly where splices and other connections have been made splices and other connections have been made"
"K_q-xnYRugQ","00:04:48","00:04:51","Because there tends to be flammable material in or near walls,","because there tends to be flammable material in or near walls"
"K_q-xnYRugQ","00:04:52","00:04:53","this is very bad.","this is very bad and"
"K_q-xnYRugQ","00:04:54","00:04:55","And that’s why these are here.","that's why these are here they help"
"K_q-xnYRugQ","00:04:55","00:04:56","They help prevent that.","prevent that"
"K_q-xnYRugQ","00:04:57","00:04:59","If you pull more power than the wires can safely carry,","if you pull more power than the wires can safely carry the"
"K_q-xnYRugQ","00:05:00","00:05:02","the breaker will trip and kill the circuit.","breaker will trip and kill the circuit how do circuit"
"K_q-xnYRugQ","00:05:03","00:05:04","How do circuit breakers work?","breakers work well"
"K_q-xnYRugQ","00:05:04","00:05:06","Well, we’ll save that for later.","we'll save that for later"
"K_q-xnYRugQ","00:05:06","00:05:10","And then we’ll get into the stuff like arc-fault protection and other goodies.","and then we'll get into the stuff like arc fault protection and other goodies i'll"
"K_q-xnYRugQ","00:05:10","00:05:14","I’ll try to remember to come back here and put a card for that video but","try to remember to come back here and put a card for that video but i have"
"K_q-xnYRugQ","00:05:15","00:05:16","I have a bad track record, there.","a bad track record there"
"K_q-xnYRugQ","00:05:17","00:05:18","Anyway...","anyway here's the"
"K_q-xnYRugQ","00:05:19","00:05:24","This will do a fantastic job of making sure the wiring in your walls doesn’t get overloaded.","problem this will do a fantastic job of making sure the wiring in your walls doesn't get overloaded"
"K_q-xnYRugQ","00:05:25","00:05:27","But once you’re outside of the wall,","but once you're outside of the wall"
"K_q-xnYRugQ","00:05:27","00:05:29","this won’t help you.","this won't help you and"
"K_q-xnYRugQ","00:05:30","00:05:34","And since we like to cut costs wherever possible so we can sell cheap stuff,","since we like to cut costs wherever possible so we can sell cheap stuff you"
"K_q-xnYRugQ","00:05:34","00:05:37","you will find countless extension cords and power strips","will find countless extension cords and"
"K_q-xnYRugQ","00:05:38","00:05:42","which cannot safely handle the capacity of the circuits they’re plugged into.","power strips which cannot safely handle the capacity of the circuits they're plugged into"
"K_q-xnYRugQ","00:05:43","00:05:43","","capacity of the circuits they're plugged into"
"K_q-xnYRugQ","00:05:44","00:05:45","Let’s talk about wire gauge.","let's talk about wire gauge"
"K_q-xnYRugQ","00:05:46","00:05:48","The amount of current a given conductor can carry safely","the amount of current a given conductor can carry"
"K_q-xnYRugQ","00:05:49","00:05:53","depends on what it's made from as well as its total cross-sectional area.","safely depends on what it's made from as well as its total cross-sectional area and"
"K_q-xnYRugQ","00:05:54","00:05:54","And also length.","also length"
"K_q-xnYRugQ","00:05:55","00:05:57","There’s some nuance with stranded vs. solid wire","there's some nuance with stranded versus"
"K_q-xnYRugQ","00:05:58","00:06:02","and with really weird stuff like the skin effect but we’re not going there.","solid wire and with really weird stuff like the skin effect but we're not going there now"
"K_q-xnYRugQ","00:06:02","00:06:05","Now, I’m going to be talking in the American Wire Gauge.","i'm going to be talking in the american wire gauge"
"K_q-xnYRugQ","00:06:06","00:06:08","I know, not everyone uses that.","i know not everyone uses that here's"
"K_q-xnYRugQ","00:06:08","00:06:11","Here’s a chart for those that want it.","a chart for those that want it but the main"
"K_q-xnYRugQ","00:06:11","00:06:16","But the main point is that a given gauge of wire has a given maximum current it can carry","point is that a given gauge of wire has a given maximum current it can carry"
"K_q-xnYRugQ","00:06:17","00:06:19","before it becomes a problem.","before it becomes a problem now crash"
"K_q-xnYRugQ","00:06:19","00:06:20","Now, crash course.","course"
"K_q-xnYRugQ","00:06:21","00:06:23","The smaller the number, the thicker the wire.","the smaller the number the thicker the wire"
"K_q-xnYRugQ","00:06:24","00:06:27","14 gauge wire can carry less current than 12 gauge wire.","14 gauge wire can carry less current than 12 gauge wire"
"K_q-xnYRugQ","00:06:28","00:06:33","12 gauge is thicker than 14 gauge which is thicker than 16 gauge and so on.","12 gauge is thicker than 14 gauge which is thicker than 16 gauge and so on it's"
"K_q-xnYRugQ","00:06:33","00:06:36","It’s confusing, but are you really surprised?","confusing but are you really surprised except for"
"K_q-xnYRugQ","00:06:36","00:06:40","Except for circuits which handle things like water heaters, dryers, stoves, etc,","circuits which handle things like water heaters dryers stoves etc"
"K_q-xnYRugQ","00:06:41","00:06:46","you’re generally going to have a mix of 15A and 20A circuits in an American home.","you're generally going to have a mix of 15 amp and 20 amp circuits in an american home it has become"
"K_q-xnYRugQ","00:06:47","00:06:50","It has become pretty common these days to run 20A circuits for most receptacles","pretty common these days to run 20 amp circuits for most receptacles"
"K_q-xnYRugQ","00:06:51","00:06:53","and reserve 15A for lighting circuits.","and reserve 15 amps for lighting circuits"
"K_q-xnYRugQ","00:06:54","00:06:55","But not always.","but not always now it"
"K_q-xnYRugQ","00:06:56","00:07:01","Now it shouldn’t surprise you that 20A circuits need thicker wires than 15A circuits.","shouldn't surprise you that 20 amp circuits need thicker wires than 15 amp circuits"
"K_q-xnYRugQ","00:07:02","00:07:05","In runs with typical lengths, 15A circuits will use 14 gauge wire.","in runs with typical lengths 15 amp circuits will use 14 gauge wire"
"K_q-xnYRugQ","00:07:06","00:07:08","And 20A circuits use 12 gauge wire.","and 20 amp circuits use 12 gauge wire"
"K_q-xnYRugQ","00:07:09","00:07:12","This is what that wiring looks like in homes all across the country,","this is what that wiring looks like in homes all across the country with"
"K_q-xnYRugQ","00:07:12","00:07:14","with some particular caveats.","some particular caveats"
"K_q-xnYRugQ","00:07:15","00:07:16","We don’t need to get into that.","we don't need to get into that discuss in the"
"K_q-xnYRugQ","00:07:16","00:07:17","Discuss in the comments. It boosts engagement.","comments it boosts engagement"
"K_q-xnYRugQ","00:07:18","00:07:26","[THERE'S AN ERROR HERE - SEE PINNED COMMENT] Anyway, this is called THHN wiring, short for Thermoplastic High Heat-resistant Nylon-coated (cheaters) wire","anyway this is called th hhn wiring short for thermoplastic high heat resistant nylon coated cheaters wire"
"K_q-xnYRugQ","00:07:26","00:07:28","but often it’s just called Romex,","but often it's just called romex"
"K_q-xnYRugQ","00:07:29","00:07:33","which is to household wiring as Kleenex is to facial tissue.","which is to household wiring as kleenex is two facial tissue conveniently"
"K_q-xnYRugQ","00:07:33","00:07:36","Conveniently, it’s been color-coded for many years now.","it's been color coded for many years now"
"K_q-xnYRugQ","00:07:36","00:07:38","14 gauge wiring has white sheathing,","14 gauge wiring has white sheathing"
"K_q-xnYRugQ","00:07:39","00:07:41","and 12 gauge wiring has yellow sheathing.","and 12 gauge wiring has yellow sheathing it"
"K_q-xnYRugQ","00:07:42","00:07:43","It helps you know at a glance which is which,","helps you know at a glance which is which and"
"K_q-xnYRugQ","00:07:43","00:07:46","and yellow wires will be for 20A circuits,","yellow wires will be for 20 amp circuits white"
"K_q-xnYRugQ","00:07:46","00:07:48","white wires for 15.","wires for 15."
"K_q-xnYRugQ","00:07:48","00:07:51","Oddly, there is also orange for 10 gauge wire,","oddly there is also orange for 10 gauge wire"
"K_q-xnYRugQ","00:07:52","00:07:54","good for up to 30A depending on the length of the run,","good for up to 30 amps depending on the length of the run"
"K_q-xnYRugQ","00:07:54","00:07:57","but then after that color coding goes out the window.","but then after that the color coding goes out the window"
"K_q-xnYRugQ","00:07:59","00:08:00","Anyway, the circuit breakers?","anyway the circuit breakers"
"K_q-xnYRugQ","00:08:01","00:08:03","They’re protecting this stuff.","they're protecting anyway the circuit breakers they're protecting this stuff they're making"
"K_q-xnYRugQ","00:08:03","00:08:07","They’re making sure you don’t put too much current through these wires.","sure you don't put too much current through these wires but"
"K_q-xnYRugQ","00:08:07","00:08:10","But these wires are inside your walls.","these wires are inside your walls"
"K_q-xnYRugQ","00:08:11","00:08:13","This one goes on the outside.","this one goes on the outside and the problem"
"K_q-xnYRugQ","00:08:14","00:08:18","And the problem is that this cannot handle the amount of current that the wires in the walls can,","is that this cannot handle the amount of current that the wires in the walls can especially"
"K_q-xnYRugQ","00:08:18","00:08:20","especially on 20A circuits.","on 20 amp circuits"
"K_q-xnYRugQ","00:08:21","00:08:23","But your circuit breakers don't know that.","but your circuit breakers don't know that"
"K_q-xnYRugQ","00:08:24","00:08:26","Now this doesn’t have to be a problem.","now this doesn't have to be a problem one of the"
"K_q-xnYRugQ","00:08:26","00:08:32","One of the best features of the UK’s electrical system is that the plugs have fuses in them.","best features of the uk's electrical system is that the plugs have fuses in them"
"K_q-xnYRugQ","00:08:32","00:08:35","Now, the reason for that is kinda weird.","now the reason for that is kind of weird ring"
"K_q-xnYRugQ","00:08:35","00:08:37","Ring circuits.","circuits what were you"
"K_q-xnYRugQ","00:08:37","00:08:38","What were you thinking?","thinking but anyway"
"K_q-xnYRugQ","00:08:38","00:08:43","But anyway the lasting benefit there is that you could provide overcurrent protection","the lasting benefit there is that you could provide over current protection on the other"
"K_q-xnYRugQ","00:08:43","00:08:44","on the other side of the wall,","side of the wall"
"K_q-xnYRugQ","00:08:45","00:08:50","allowing you to safely use smaller wiring that’s sized according to the device’s needs.","allowing you to safely use smaller wiring that's sized according to the device's needs"
"K_q-xnYRugQ","00:08:51","00:08:52","If you put in a 7A fuse,","if you put in a seven amp fuse"
"K_q-xnYRugQ","00:08:53","00:08:56","well then that fuse will blow before the wire gets overloaded.","well then that fuse will blow before the wire gets overloaded that fuse will blow before the wire gets overloaded"
"K_q-xnYRugQ","00:08:56","00:08:57","Simple.","simple trouble"
"K_q-xnYRugQ","00:08:58","00:08:58","Trouble is?","is we"
"K_q-xnYRugQ","00:08:58","00:09:00","We don’t do that over here.","don't do that over here simple trouble is we don't do that over here"
"K_q-xnYRugQ","00:09:01","00:09:04","This extension cord has 16 gauge wire in it,","this extension cord has 16 gauge wire in it and is only"
"K_q-xnYRugQ","00:09:04","00:09:08","and it’s only rated for 1,625 watts, or 13 amps.","rated for 1 625 watts or 13 amps and"
"K_q-xnYRugQ","00:09:08","00:09:09","And yet,","yet"
"K_q-xnYRugQ","00:09:10","00:09:13","it has nothing to stop you from exceeding that.","it has nothing to stop you from exceeding that isn't that"
"K_q-xnYRugQ","00:09:13","00:09:14","Isn’t that lovely?","lovely even"
"K_q-xnYRugQ","00:09:15","00:09:18","Even a 12 amp load, which is technically OK to put on this,","a 12 amp load which is technically which is technically okay to put on this"
"K_q-xnYRugQ","00:09:19","00:09:21","makes the cord disconcertingly warm.","makes the cord disconcertingly warm but"
"K_q-xnYRugQ","00:09:21","00:09:23","But on any otherwise unloaded circuit,","on any otherwise unloaded circuit you"
"K_q-xnYRugQ","00:09:24","00:09:28","you can still pull at least another three amps through here without the breaker tripping.","can still pull at least another three amps through here without the breaker tripping"
"K_q-xnYRugQ","00:09:28","00:09:31","As far as it's concerned, well there’s nothing wrong.","as far as it's concerned well there's nothing wrong 15"
"K_q-xnYRugQ","00:09:31","00:09:34","15 amps are on the wires in the walls, which is OK.","amps are on the wires in the walls which is okay"
