"video_id","min_timecode","max_timecode","text.user","text.auto"
"3sq658Okvao","00:10:57","00:11:03","weird signal was only spotted over a year later when a student working with the Breakthrough","signal was only spotted more than a year after the observations when a student working with the breakthrough"
"3sq658Okvao","00:11:04","00:11:09","Listen project was re-analyzing the data. There are lots of non-alien sources of radio","listen project working with the breakthrough listen project was re-analyzing the data now there are lots of non-alien sources of radio"
"3sq658Okvao","00:11:10","00:11:15","frequency blips - mostly human-made noise. But Breakthrough Listen has detailed protocols","frequency blips mostly human-made noise but breakthrough listen has detailed protocols for"
"3sq658Okvao","00:11:15","00:11:21","for sifting out these false signals. According to the program, this is one of a few candidates","sifting out these false signals according to their program this is one of the few candidates that so"
"3sq658Okvao","00:11:21","00:11:23","that so far eludes natural explanation.","far eludes natural explanation"
"3sq658Okvao","00:11:24","00:11:30","This one is especially exciting because Proxima Cen was also recently shown to have a planetary","this one is especially exciting because proxima cen was also recently shown to have a planetary system"
"3sq658Okvao","00:11:30","00:11:35","system, including a nearly Earth-mass planet it its habitable zone, where liquid water","including a nearly earth mass planet in its habitable zone where liquid"
"3sq658Okvao","00:11:36","00:11:42","is possible. Now the Breakthrough Listen program hasn’t published its findings so we can’t say much - we know","water is possible now the breakthrough listen program hasn't published its findings so we can't say much we know that the increase"
"3sq658Okvao","00:11:42","00:11:46","the increase in frequency is consistent with the Doppler shift of something accelerating","in frequency is consistent with the doppler shift of something accelerating"
"3sq658Okvao","00:11:47","00:11:53","towards us. An invading fleet of Proximans? More plausibly from the motion of a planet","towards us an invading fleet of proximans perhaps or more plausibly from the motion of a planet around the star"
"3sq658Okvao","00:11:53","00:11:59","around the star. Now there are very good reasons to think that this signal isn't aliens. For example,","now there are very good reasons to think that this signal is an aliens for example"
"3sq658Okvao","00:12:00","00:12:04","Proxima is a dangerously active red dwarf - it’s unlikely that any planetary atmosphere","proxima is a dangerously active red dwarf it's unlikely that any planetary atmosphere could"
"3sq658Okvao","00:12:04","00:12:10","could survive ts outbursts. It’s also so close! If there’s a technological civilization","survive its outbursts it's also so close if there's a technological civilization"
"3sq658Okvao","00:12:11","00:12:15","on Proxima, that would suggest that there are many billions of them through the Milky","on proxima that would suggest that there are many billions of them through the milky way"
"3sq658Okvao","00:12:16","00:12:20","Way, and many of them millions of years ahead of us. Which means we should have seen ample","and many of them millions of years ahead of us which means we should have seen ample"
"3sq658Okvao","00:12:21","00:12:27","evidence by now. More likely this signal has a human source that somehow sneaked through the Breakthrough","evidence by now more likely this signal has a human source that somehow sneaks through the breakthrough listen protocols"
"3sq658Okvao","00:12:27","00:12:31","Listen protocols, or is a natural source that we don’t know about yet. Or it could","sneaks through the breakthrough listen protocols or is a natural source that we just don't know about yet"
"3sq658Okvao","00:12:32","00:12:35","be aliens - but no one’s claiming aliens just yet.","or it could be aliens but no one's claiming aliens just yet"
"3sq658Okvao","00:12:36","00:12:40","The fact is, no matter now long we study the universe, it will always come up with natural","the fact is no matter how long we study the universe it will always come up with natural phenomena"
"3sq658Okvao","00:12:40","00:12:45","phenomena that we’ve never seen before. So does this mean we can never conclude the","that we've never seen before so does that mean we can never conclude the existence of"
"3sq658Okvao","00:12:45","00:12:49","existence of aliens based on any observation? Should we not even bother looking? Not at","aliens based on any observation should we not even bother looking"
"3sq658Okvao","00:12:50","00:12:54","all. I personally think that SETI programs should be robustly funded, and that we should","well not at all i personally think that seti programs should be robustly funded and that"
"3sq658Okvao","00:12:55","00:13:00","actively pursue the “It’s Aliens!” Hypotheses when warranted. The question is - when do","we should actively pursue the its aliens hypothesis when warranted the question is"
"3sq658Okvao","00:13:01","00:13:05","you run to the press shouting that it’s aliens? Because you know the press is going","when do you run to the press shouting that it's aliens because you know the press is going to go crazy"
"3sq658Okvao","00:13:05","00:13:09","to go crazy over that - which is probably why you ran to the press in the first place.","over that which is probably why you ran to the press in the first place"
"3sq658Okvao","00:13:10","00:13:15","Perhaps the more useful question for most of us is - When do we believe some new hint","perhaps the more useful question for most of us though is when do we believe some new hint or"
"3sq658Okvao","00:13:15","00:13:23","or claim of the detection of alien life? That’s easier to answer - optimistic skepticism is","claim of the detection of alien life well that's easier to answer optimistic skepticism is always the way to go"
"3sq658Okvao","00:13:23","00:13:30","the way to go. Believe me, if it is aliens the evidence will mount. Most scientists do want","believe me if it is aliens the evidence will mount most scientists do wanted"
"3sq658Okvao","00:13:30","00:13:35","it to be aliens more than anyone, and will vigorously jump on board when it really does","to be aliens more than anyone and will vigorously jump on board when it really does become"
"3sq658Okvao","00:13:36","00:13:42","become more likely aliens than not-aliens. Currently it’s not aliens. However planned missions","more likely aliens than not aliens but currently it's not aliens however planned missions"
"3sq658Okvao","00:13:43","00:13:48","to Mars, Europa, Venus, and even the alpha-centuri system may finally prove that we’re not","to mars europa venus and even the alpha centauri system may finally prove that we're not the"
"3sq658Okvao","00:13:48","00:13:52","the only living denizens in all of space time.","only living denizens in all of space time as always"
"3sq658Okvao","00:13:52","00:13:57","As always, our deepest thanks to all of our Patreon supporters. Yes the money is really","our deepest thanks to all of our patreon supporters yes the money is really useful"
"3sq658Okvao","00:13:57","00:14:01","useful - this stuff costs a bit to make - but the other thing that's incredibly helpful","this stuff does cost a bit to make but the other thing that's incredibly helpful"
"3sq658Okvao","00:14:01","00:14:06","is to feel your incredible support and enthusiasm. It's amazing to know there are so many people","is to feel your incredible support and enthusiasm it's amazing to know there are so many people"
"3sq658Okvao","00:14:06","00:14:11","who share our love for this stuff. Today's special Patreon shoutout goes to Leo Koguan,","who share our love for this stuff now today's special patreon shout out goes to leo koguan"
"3sq658Okvao","00:14:12","00:14:17","who's supporting us at the Big Bang level. Leo, as your special Big Bang Patreon reward","who's supporting us at the big bang level leo as your special big band patreon reward"
"3sq658Okvao","00:14:17","00:14:23","we're going to reveal to you the true secrets of all those alien communications that astronomers","we're going to reveal to you the true secrets of all those alien communications that astronomers have been hiding from"
"3sq658Okvao","00:14:23","00:14:29","have been hiding from the public for years. We'll then introduce some nice Alpha Centaurians.","the public for years then we'll introduce you to some nice alpha centaurians after that we have"
"3sq658Okvao","00:14:29","00:14:33","After that we have to neuralize you so you won't remember the details. But deep down","to neutralize you so you won't remember the details but deep down"
"3sq658Okvao","00:14:33","00:14:35","you'll know. You'll always know.","you'll know you'll always know"
"3sq658Okvao","00:14:35","00:14:41","Today we’re covering comments from the last two episodes: our update on warp drive theory,","today we're covering comments from the last two episodes our update on warp drive theory and"
"3sq658Okvao","00:14:41","00:14:45","and the one about whether dark matter can be explained by enormous numbers of black","the one about whether dark matter can be explained by enormous numbers of black holes"
"3sq658Okvao","00:14:46","00:14:47","holes - tldw - it probably can’t.","tltw it probably"
"3sq658Okvao","00:14:48","00:14:54","Aksel Randlepp asks whether understanding quantum gravity might be helpful for developing","can't ask randlet asks whether understanding quantum gravity might be helpful for developing warp drives"
"3sq658Okvao","00:14:54","00:15:01","warp drives. Good insight. All this warp drive stuff is pure general relativity, and we know","good insight all of this warp drive stuff is pure general relativity and we know for sure"
"3sq658Okvao","00:15:01","00:15:05","for sure that GR is not our final theory of nature because it doesn’t perfectly gel","that gr is not our final theory of nature because it doesn't perfectly gel"
"3sq658Okvao","00:15:06","00:15:11","with quantum mechanics. So maybe a theory of quantum gravity will reveal that warp drives","with quantum mechanics so maybe a theory of quantum gravity will reveal that warp drives are"
"3sq658Okvao","00:15:12","00:15:16","are really possible, but the opposite is also true. Stephen hawking’s chronology protection","really possible but the opposite is also true stephen hawking's chronology"
"3sq658Okvao","00:15:17","00:15:20","conjecture states that the universe will always find a way to make time travel impossible","protection conjecture states that the universe will always find a way to make time travel"
"3sq658Okvao","00:15:21","00:15:24","- and it’s been speculated that quantum gravity effects will come into play for things","impossible and it's been speculated that quantum gravity effects will come into play for things"
"3sq658Okvao","00:15:25","00:15:30","like warp drives, whose superluminal motion must allow time travel. A simple example is","like warp drives whose super luminal motion must allow time travel a simple example is that the extreme"
"3sq658Okvao","00:15:30","00:15:34","that the extreme curvature in the warp bubble walls should produce something like Hawking","curvature in the warp bubble walls should produce something like hawking"
"3sq658Okvao","00:15:35","00:15:39","radiation, which may obliterate anything trying to ride in a warp bubble.","radiation which may obliterate anything trying to ride a warp bubble hall 9000"
"3sq658Okvao","00:15:40","00:15:44","Hall 9000 and RH2racing worry that warp travel is a non-starter unless there’s a way to","and rh2 racing worry that warp travel is a non-starter unless there's a way"
"3sq658Okvao","00:15:45","00:15:49","protect the ship from impacts because hitting even a tiny particle at those speeds would","to protect the ship from impacts because hitting even a tiny particle at those speeds would be devastating"
"3sq658Okvao","00:15:49","00:15:53","be devestating. So people have actually looked into this. It turns out that if a warp bubble","so people have actually looked into this it turns out that if a warp bubble"
"3sq658Okvao","00:15:54","00:15:58","runs into an object, that object will become frozen at the leading edge of the bubble in","runs into an object that object will become frozen at the leading edge of the bubble in a"
"3sq658Okvao","00:15:58","00:16:03","a similar way to how things appear to freeze at the event horizon of a black hole. Nothing","similar way to how things appear to freeze at the event horizon of a black hole nothing"
"3sq658Okvao","00:16:04","00:16:08","actually passes into the bubble, so the ship is safe. When the ship reaches its destination","actually passes into the bubble so the ship is safe when the ship reaches its destination"
"3sq658Okvao","00:16:09","00:16:13","and the warp bubble dissipates, everything collected en-route would be released in the","and the warp bubble dissipates everything collected on route would be released"
"3sq658Okvao","00:16:14","00:16:19","forward direction. This would have so much energy on release that even just the space dust from","in the forward direction this would have so much energy on release that even just the space"
"3sq658Okvao","00:16:20","00:16:25","a short interstellar trip would become a beam of energy powerful enough to destroy a planet.","dust from a short interstellar trip would become a beam of energy powerful enough to destroy a planet"
"3sq658Okvao","00:16:25","00:16:30","So, yeah, don’t pull up right in front of your destination, that’s rude; just park","so yeah don't pull up right in front of your destination that's rude just park around"
"3sq658Okvao","00:16:30","00:16:31","around the side.","the side"
"3sq658Okvao","00:16:32","00:16:36","Nick Williams asks what the difference between super small black holes or naked singularities","nick williams asks what's the difference between super small black holes or naked singularities"
"3sq658Okvao","00:16:37","00:16:44","and WIMPs be. Normally when people talk about wimps they’re referring to some undiscovered","and wimps or weakly interacting massive particles a candidate for dark matter now normally when people talk about wimps they're referring to"
"3sq658Okvao","00:16:45","00:16:50","quantum particle, but actually a micro black hole would have all the properties to qualify","some undiscovered quantum particle but actually micro black holes would have all the properties to qualify them"
"3sq658Okvao","00:16:51","00:16:57","it as a WIMP - namely wearing interacting, massive, and particle-like. Fun fact: Einstein,","as wimps namely weakly interacting massive and particle-like now fun fact einstein"
"3sq658Okvao","00:16:58","00:17:04","along with Nathan Rosen, tried to explain particles as gravitational singularities - wormholes","along with rosen tried to explain particles in general as gravitational singularities wormholes gravitational singularities wormholes"
"3sq658Okvao","00:17:05","00:17:10","between adjacent dimensions threaded by electromagnetic fields. Turns out particles aren’t that,","between adjacent dimensions threaded by electromagnetic fields turns out particles aren't that"
"3sq658Okvao","00:17:11","00:17:14","but it’s how the wormhole concept was invented in the first place.","but it's how the wormhole concept was invented in the first place philippe"
"3sq658Okvao","00:17:15","00:17:18","Philippe Chaps correctly points out that there are scientists who have pushed the black hole","chaps correctly points out that there are scientists who have pushed the"
"3sq658Okvao","00:17:19","00:17:24","dark matter hypothesis for years, so it hasn’t been overlooked as I implied at the beginning","black hole dark matter hypothesis for years and so it hasn't been overlooked as i implied at the"
"3sq658Okvao","00:17:25","00:17:29","of the episode. That’s fair - what I meant to say is that the hypothesis is not talked","beginning of that episode well that's very fair what i meant to say is that the hypothesis is"
"3sq658Okvao","00:17:30","00:17:34","about much in the public sphere, hence the video.","not talked about much in the public sphere hence the video much in the public sphere hence the video markabella"
"3sq658Okvao","00:17:34","00:17:38","Marc Abelha drops some wisdom from the opposite side of science - molecular biology. Which","drops from wisdom from the opposite side of science molecular biology"
"3sq658Okvao","00:17:39","00:17:46","is that the answer often lies in plurality. Dark matter might not be a single type of","which is that the answer often lies in plurality dark matter might not be a single type of thing"
"3sq658Okvao","00:17:46","00:17:51","thing, but rather many different types of thing- like a dark standard model. Marc, your","but rather many different types of thing like a dark standard model mark your"
"3sq658Okvao","00:17:52","00:17:56","idea is so good that some very smart people already thought of it. For example, certain","idea is so good that some very smart people already thought of it for example certain"
"3sq658Okvao","00:17:56","00:18:01","types of supersymmetric counterparts to the standard model particles might serve as dark","types of supersymmetric counterparts to the standard model particles might serve as dark matter speaking"
"3sq658Okvao","00:18:02","00:18:06","Speaking of thinking along the same line as geniuses, many of you commented that you thought","of thinking along the same lines as geniuses many of you commented that you thought of"
"3sq658Okvao","00:18:07","00:18:11","of the idea that dark matter is black holes years ago. That’s impressive - you’re","the idea that dark matter holes years ago and that is impressive you're"
"3sq658Okvao","00:18:12","00:18:16","in the company of some very smart people in that you’ve all been wrong about this for years.","in the company of some very smart people in that you've all been wrong about this for years dark"
"3sq658Okvao","00:18:16","00:18:22","Dark matter ain’t black holes. That may have sounded unnecessarily snarky - and it","matter ain't black holes that may have sounded unnecessarily snarky and it wasn't meant"
"3sq658Okvao","00:18:22","00:18:25","wasn’t meant to be - it takes excellent intuition to come up with hypotheses that","to be it takes excellent intuition to come up with a hypothesis"
"3sq658Okvao","00:18:26","00:18:32","are even plausible. Actually being right is a whole new level. Who knows, one day.","that's even plausible actually being right is a whole new level who knows one day"
"3sq658Okvao","00:18:33","00:18:38","Keagan Wheeler-McCann offers a very nice addendum to Occam’s Razor: The simplest answer isn't","keegan wheeler mccann offers a very nice addendum to occam's razor the simplest answer"
"3sq658Okvao","00:18:39","00:18:44","always the truth. But it doesn't, hurt to check. I like this a lot. Looking for dark","isn't always the truth but it doesn't hurt to check i like this a lot looking for dark matter"
"3sq658Okvao","00:18:44","00:18:48","matter in, say, string theory, before you check whether it’s black holes is like looking","in say string theory before you check whether it's black holes is like"
"3sq658Okvao","00:18:49","00:18:53","for your keys in the freezer before checking your pockets. And, actually, if dark matter","looking for your keys in the freezer before checking your pockets and actually if dark"
"3sq658Okvao","00:18:54","00:18:58","is enormous numbers of Planck-mass black holes, perhaps you could actually find your keys","matter is enormous numbers of plant mass black holes perhaps you could actually find your"
"3sq658Okvao","00:18:59","00:19:04","AND dark matter if you checked your pockets. More on that soon.","keys and dark matter if you check your pockets more on that"
"3sq658Okvao","00:19:04","00:19:19","","soon you"
