"video_id","min_timecode","max_timecode","text.user","text.auto"
"EukpxRuDUzA","00:07:48","00:07:49","We're using suitcases, just pack up all her clothes","suitcases to just pack up all of her clothes"
"EukpxRuDUzA","00:07:50","00:07:50","and stuff in there.","and stuff in there and then"
"EukpxRuDUzA","00:07:50","00:07:52","Then the bathroom, we haven't like cleaned it yet.","the bathroom we haven't like cleaned it or anything"
"EukpxRuDUzA","00:07:53","00:07:56","But down here I have just a ton of Lush men's products.","yet but down here i have just a ton of lush men's products and i got"
"EukpxRuDUzA","00:07:56","00:07:58","And I'm super into bath foams.","them super into bath bombs so they're a bunch"
"EukpxRuDUzA","00:07:58","00:07:59","","of bath bombs i'll go through some"
"EukpxRuDUzA","00:07:59","00:08:00","I'll go through some of that later.","of that later and then we got"
"EukpxRuDUzA","00:08:00","00:08:02","And then we got these at the container store.","these at the container store i'm"
"EukpxRuDUzA","00:08:03","00:08:05","I'm going to use them to organize some of this stuff.","gonna use them to organize some of this stuff so you know just"
"EukpxRuDUzA","00:08:06","00:08:09","Getting him floss and toothpaste some mouthwash,","getting him floss and toothpicks some mouthwash hand soap"
"EukpxRuDUzA","00:08:09","00:08:11","hand soap, Q-tips, cotton rounds.","q-tips cotton rounds and"
"EukpxRuDUzA","00:08:12","00:08:12","And he's been saying","he's been saying that he's been"
"EukpxRuDUzA","00:08:12","00:08:14","that he's been wanting to get a good men skincare regime","wanting to get like a good men's skincare"
"EukpxRuDUzA","00:08:15","00:08:16","so I got him a bunch of skincare for men.","regime so i got him a bunch of skincare for men"
"EukpxRuDUzA","00:08:17","00:08:19","We can't find it however, because of the chaos.","we can't find it however because of the chaos all the"
"EukpxRuDUzA","00:08:19","00:08:21","All the things we've been storing for him,","things we've been storing for him because"
"EukpxRuDUzA","00:08:22","00:08:23","'cause we also have the desk that we have stored,","we also have like the desk that we have stored the desk"
"EukpxRuDUzA","00:08:23","00:08:24","the desk chair that we have stored,","chair that we have stored"
"EukpxRuDUzA","00:08:25","00:08:27","so it's been nuts keeping this all under wraps.","so it's been nuts keeping this all under wraps"
"EukpxRuDUzA","00:08:28","00:08:28","So we have to dig through and find out,","so we have to dig through and"
"EukpxRuDUzA","00:08:29","00:08:31","but I'm gonna start by organizing some of the products","find that but i'm gonna start by organizing some of the products that i do have"
"EukpxRuDUzA","00:08:31","00:08:34","that I do have into these two containers that I got from him","into these two containers that i got for him and into"
"EukpxRuDUzA","00:08:34","00:08:36","and into this kind of built-in storage up here","this kind of built-in storage up here"
"EukpxRuDUzA","00:08:38","00:08:38","and under the sink.","and under the sink and"
"EukpxRuDUzA","00:08:38","00:08:39","And that's what I'm up to.","that's what i'm up to"
"EukpxRuDUzA","00:08:40","00:08:42","I'm just gonna throw a podcast on and get organizing.","i'm just going to throw a podcast on and get organizing"
"EukpxRuDUzA","00:08:43","00:08:46","","organizing okay so"
"EukpxRuDUzA","00:08:46","00:08:48","So far you want to see what I've done mom?","far you want to see what i've done what a good time okay"
"EukpxRuDUzA","00:08:48","00:08:49","- [Mom] What have you done girl?","so i have this here just to dump"
"EukpxRuDUzA","00:08:49","00:08:52","- Just to dump trash in here as I organize everything.","trash in as i organize everything so"
"EukpxRuDUzA","00:08:53","00:08:55","So I'm separating these two for under the sink,","i'm separating these two for under the sink"
"EukpxRuDUzA","00:08:55","00:08:58","into his morning routine and his night time routine.","into his morning routine and his nighttime routine so"
"EukpxRuDUzA","00:08:58","00:09:01","- [Mom] Cool, what a great woman you are?","what a good woman you are i know okay so in his morning"
"EukpxRuDUzA","00:09:01","00:09:02","- Okay. So in his morning routine,","routine i got him this"
"EukpxRuDUzA","00:09:02","00:09:03","I got him this is, the label?","is"
"EukpxRuDUzA","00:09:04","00:09:06","- [Mom] Kiehl's, yes, oil eliminator.","the label peels yes oil eliminator so"
"EukpxRuDUzA","00:09:06","00:09:08","- So this is his toner it's for men.","this is his toner it's for men so this will"
"EukpxRuDUzA","00:09:08","00:09:09","","be like you"
"EukpxRuDUzA","00:09:09","00:09:12","I don't like to fully like wash my face in the morning,","know i don't like to um fully like wash my face in"
"EukpxRuDUzA","00:09:13","00:09:14","so I kinda of just built him a routine based","the morning so i kind of just built him a routine based"
"EukpxRuDUzA","00:09:15","00:09:16","on kind of the routine that I like.","on kind of the routine that i like so"
"EukpxRuDUzA","00:09:17","00:09:17","So he doesn't really want a routine,","he's like really wants a"
"EukpxRuDUzA","00:09:18","00:09:19","but he said I don't know what to do, can you help me?","routine but he's like i don't know what to do can you help"
"EukpxRuDUzA","00:09:20","00:09:21","So I figured this the perfect time to help him.","me so i figured this is the perfect time to help"
"EukpxRuDUzA","00:09:22","00:09:23","So I got him a toner to start.","him so i got him a toner to start and then"
"EukpxRuDUzA","00:09:24","00:09:26","In here also his cotton rounds for his toner.","in here he also has cotton rounds for his toner and then"
"EukpxRuDUzA","00:09:27","00:09:30","This is a men's moisturizer with SPF,","this is a men's moisturizer with spf"
"EukpxRuDUzA","00:09:31","00:09:32","'cause he likes to use SPF to protect his skin.","because he likes to use spf to protect his skin and"
"EukpxRuDUzA","00:09:33","00:09:34","I got into this shaving cream.","then i got in this shaving cream"
"EukpxRuDUzA","00:09:34","00:09:35","So that's so far what I've put","so that's so far what i've put"
"EukpxRuDUzA","00:09:36","00:09:37","in the morning routine section.","in the in the morning routine section and"
"EukpxRuDUzA","00:09:38","00:09:40","In the evening I have, this is a Kate Somerville.","then in the evening i have this is it kate somerville"
"EukpxRuDUzA","00:09:41","00:09:41","Is it the right way?","is it the right way yes"
"EukpxRuDUzA","00:09:42","00:09:42","- [Mom] Yes.","okay"
"EukpxRuDUzA","00:09:43","00:09:44","Perfect, love that for me, Kate Somerville.","perfect love that for me it's kate somerville"
"EukpxRuDUzA","00:09:45","00:09:46","I get sent Kate Somerville products,","i get sent kate somerville products"
"EukpxRuDUzA","00:09:46","00:09:47","very lucky to be on that PR list.","very lucky beyond that pr list"
"EukpxRuDUzA","00:09:48","00:09:49","So I grabbed one of the ones for sensitive skin.","so i grabbed one of the ones for sensitive skin"
"EukpxRuDUzA","00:09:50","00:09:51","I figured that didn't need to be male specific.","i figured that didn't need to be like male specific i"
"EukpxRuDUzA","00:09:52","00:09:52","I had ahead of time looked up,","had ahead of time"
"EukpxRuDUzA","00:09:53","00:09:55","whether I should get male specific skincare or not.","looked up like whether i should get male specific skincare or not"
"EukpxRuDUzA","00:09:55","00:09:58","It's like a lot of the stuff that's in women's skincare","it said like a lot of the stuff that's in women's skincare like it's not like"
"EukpxRuDUzA","00:09:58","00:10:00","it's not like it's harmful for men, it's just unnecessary.","it's harmful for men it's just unnecessary so"
"EukpxRuDUzA","00:10:01","00:10:02","So I was like, then I should keep my skincare for me","i was like well then i should keep my skin care"
"EukpxRuDUzA","00:10:03","00:10:04","and get him kind of men specific.","for me and get him kind of men specific"
"EukpxRuDUzA","00:10:05","00:10:07","But I figured this is pretty unisex.","but i figured this is like pre unisex and then in here i"
"EukpxRuDUzA","00:10:07","00:10:10","In here I have the night cream that I got him","have the night cream that i got him"
"EukpxRuDUzA","00:10:11","00:10:15","I have the Kate Somerville eradicate acne treatment","and then i have the kate somerville eradicate acne treatment"
"EukpxRuDUzA","00:10:16","00:10:17","in case he gets a breakout.","in case he gets a breakout and then"
"EukpxRuDUzA","00:10:18","00:10:21","Also in here I put floss and the toothpicks,","also in here i put floss and the toothpicks and then i put the q-tips"
"EukpxRuDUzA","00:10:21","00:10:25","I put the Q-tips, you need them for the eradicate.","so that you know you need them for the eradicate and then also they're"
"EukpxRuDUzA","00:10:25","00:10:29","","just there if he needs you know q-tip what you usually would cute tip"
"EukpxRuDUzA","00:10:30","00:10:32","- This the toothbrush he's had here at my place","adorable and then this is the toothbrush he's had here at my place"
"EukpxRuDUzA","00:10:33","00:10:34","for when he's been staying over,","for when he's been staying"
"EukpxRuDUzA","00:10:34","00:10:36","so I'm gonna pop that in here.","over so i'm just gonna like pop that in here"
"EukpxRuDUzA","00:10:37","00:10:37","I should get him toothpaste.","i should get him toothpaste"
"EukpxRuDUzA","00:10:38","00:10:39","- [Mom] And I was thinking that.","and i was thinking yeah i should get"
"EukpxRuDUzA","00:10:40","00:10:40","- I should get them toothpaste.","him toothpaste we're making the list"
"EukpxRuDUzA","00:10:40","00:10:41","- [Mom] We're making the list right now?","right now yeah and i need to get"
"EukpxRuDUzA","00:10:41","00:10:43","- Yeah and I need to get them facecloths as well.","him face cloths as well like christmas"
"EukpxRuDUzA","00:10:43","00:10:44","- [Mom] Like Christmas.","i know"
"EukpxRuDUzA","00:10:45","00:10:47","So the facecloths will go in the evening one","so the face class will go in the evening one since he"
"EukpxRuDUzA","00:10:47","00:10:50","since he does have, face wash in that evening routine","does have you know face wash in that evening routine"
"EukpxRuDUzA","00:10:51","00:10:51","that I made him.","that i made"
"EukpxRuDUzA","00:10:52","00:10:53","- [Mom] This is exciting.","this is so exciting my love landscape"
"EukpxRuDUzA","00:10:54","00:10:55","","yes nesting my"
"EukpxRuDUzA","00:10:56","00:10:56","- My love language is gift giving.","love language is gift giving"
"EukpxRuDUzA","00:10:57","00:10:59","So this is honestly truly like I'm giving to myself","so this is honestly truly like i'm giving to myself"
"EukpxRuDUzA","00:11:00","00:11:00","and giving to him.","and giving to him this"
"EukpxRuDUzA","00:11:01","00:11:01","I love it so much.","is i love"
"EukpxRuDUzA","00:11:02","00:11:04","- [Mom] We need heart's rising through the screen right now.","it so much we need hearts rising through the screen right now"
"EukpxRuDUzA","00:11:04","00:11:06","- All the love hearts.","all the loved ones like i just"
"EukpxRuDUzA","00:11:06","00:11:09","- I just love gift giving it really brings me so much joy","love gift giving it really brings me so much joy and it is"
"EukpxRuDUzA","00:11:09","00:11:11","and it is truly how I show people I love them,","truly how i show people i love"
"EukpxRuDUzA","00:11:12","00:11:13","whether they're my friends, my family,","them whether they're my friends my family or my significant"
"EukpxRuDUzA","00:11:13","00:11:14","or my significant other.","other so"
"EukpxRuDUzA","00:11:14","00:11:16","So this really is such a joy for me.","this really is like such a joy joy for me"
"EukpxRuDUzA","00:11:17","00:11:17","I've been having so much fun.","i've been having"
"EukpxRuDUzA","00:11:18","00:11:20","Can you come read with you?","so much fun can you can you come can you come read what are oh"
"EukpxRuDUzA","00:11:20","00:11:21","- [Mom] Oh nice.","nice this one"
"EukpxRuDUzA","00:11:22","00:11:24","This one is Wasabi Shan Kui shampoo","is wasabi shampoo shampoo"
"EukpxRuDUzA","00:11:25","00:11:26","and Dirty Springwash shower gel.","and dirty spring wash shower gel"
"EukpxRuDUzA","00:11:30","00:11:31","Also back here at the back of the toilet,","also back here at the back of the"
"EukpxRuDUzA","00:11:32","00:11:35","in case somebody makes a stinky doo doo (chuckles)","toilet in case somebody makes a stinky doo doo you got dirty we got"
"EukpxRuDUzA","00:11:36","00:11:37","- We got Dirty which is my favorite,","dirty which is my favorite one of my"
"EukpxRuDUzA","00:11:37","00:11:38","one of my favorite room sprays from Lush.","favorite room sprays from lush"
"EukpxRuDUzA","00:11:39","00:11:41","I have Twilight room spray in my bathroom","i have twilight room spray in my bathroom for stinky doodoos"
"EukpxRuDUzA","00:11:42","00:11:44","And then I thought this one was a little more masculine","and then i thought this one was a little more masculine at"
"EukpxRuDUzA","00:11:45","00:11:47","at the back of his toilet in case there's stinky doo doos","the back of his toilet in case there's stinky doodles in this"
"EukpxRuDUzA","00:11:47","00:11:48","in this one.","one and by the way i know people can"
"EukpxRuDUzA","00:11:49","00:11:49","And by the way, people are gonna be like","like why do you"
"EukpxRuDUzA","00:11:49","00:11:50","why do you have separate bathrooms?","have separate bathrooms"
"EukpxRuDUzA","00:11:50","00:11:53","It's mainly because he wakes up much earlier in the morning","it's mainly because he wakes up much earlier in the morning than i"
"EukpxRuDUzA","00:11:54","00:11:57","And we've agreed that he will do his morning routine","do and we've agreed that he will do his morning routine in this"
"EukpxRuDUzA","00:11:57","00:12:00","in this bathroom because I like to sleep.","bathroom because i like to sleep the shared"
"EukpxRuDUzA","00:12:00","00:12:02","The shared bathroom is in our bedroom.","bathroom like is in our bedroom"
"EukpxRuDUzA","00:12:03","00:12:05","So he would wake me if he was doing his full morning routine","so he would wake me if he was doing his full morning routine"
"EukpxRuDUzA","00:12:05","00:12:06","in there.","in there so that's why he's getting"
"EukpxRuDUzA","00:12:06","00:12:08","So that's why he's getting his stuff in this bathroom.","his stuff in this bathroom it's perfect"
"EukpxRuDUzA","00:12:08","00:12:09","- [Mom] It's perfect.","yeah okay"
"EukpxRuDUzA","00:12:09","00:12:10","","not a little kid"
"EukpxRuDUzA","00:12:11","00:12:11","There's a little kitten home,","she just disappeared"
"EukpxRuDUzA","00:12:11","00:12:12","she just disappeared into the shower.","into the shower she loves"
"EukpxRuDUzA","00:12:12","00:12:13","- She loves the bathroom.","the bathroom"
"EukpxRuDUzA","00:12:14","00:12:14","","okay"
"EukpxRuDUzA","00:12:15","00:12:15","- So what is this one?","so what is what is this one"
"EukpxRuDUzA","00:12:16","00:12:18","- [Mom] This one is Candy Rain conditioner.","this one is candy rain conditioner okay perfect so these"
"EukpxRuDUzA","00:12:18","00:12:20","- So these three will go together with the shower foam.","three will go get inside the shower"
"EukpxRuDUzA","00:12:21","00:12:22","He's also so cute and supportive.","he's also he's so cute and supportive"
"EukpxRuDUzA","00:12:23","00:12:25","He's like obsessed with using my Dove shower foam","he's like obsessed with using my dove shower phone"
"EukpxRuDUzA","00:12:25","00:12:26","because of the commercial that I was in","because of the commercial"
"EukpxRuDUzA","00:12:27","00:12:29","says I got only ever wanna use, Dove shower foam.","that i was in it's like i only ever want to use dove shower foam so"
"EukpxRuDUzA","00:12:29","00:12:32","So I will pick him up a Dove shower foam as well","i will pick him up a dumb shower foam as well because he's just so"
"EukpxRuDUzA","00:12:32","00:12:34","'cause he's just so stinking cute, like that.","stinking cute like that there she is"
"EukpxRuDUzA","00:12:34","00:12:35","",""
"EukpxRuDUzA","00:12:36","00:12:37","Hey Lav,","he's checking out his shower"
"EukpxRuDUzA","00:12:38","00:12:41","So here we have White Fang toothpaste jelly,","curtain so here we have white fang toothpaste jelly wild"
"EukpxRuDUzA","00:12:41","00:12:43","wild mint, spear and peppermint.","mint spearmint oh and that one"
"EukpxRuDUzA","00:12:43","00:12:44","And that one there, no that one there","there now that one there is"
"EukpxRuDUzA","00:12:44","00:12:46","is the deodorant that you just took with.","the deodorant that you just shook"
"EukpxRuDUzA","00:12:47","00:12:48","- This is deodorant and then this is the toothpaste.","this is deodorant and then this is the toothpaste yes"
"EukpxRuDUzA","00:12:49","00:12:49","- [Mom] Yes.","perfect okay"
"EukpxRuDUzA","00:12:50","00:12:50","- Perfect.","so i'll put this"
"EukpxRuDUzA","00:12:50","00:12:51","So I'll put this toothpaste,","toothpaste god i was more"
"EukpxRuDUzA","00:12:51","00:12:53","God I was more prepared than I thought.","prepared than i thought"
"EukpxRuDUzA","00:12:55","00:12:58","I'll put this little fang toothpaste in his morning","i'll put this little fun toothpaste in his morning bin"
"EukpxRuDUzA","00:12:58","00:13:00","(indistinct)","with his"
"EukpxRuDUzA","00:13:01","00:13:02","he'll be bringing his electric toothbrush when he moves in,","i mean he'll be bringing his electric toothbrush when he moves in"
"EukpxRuDUzA","00:13:03","00:13:03","but...","but"
"EukpxRuDUzA","00:13:04","00:13:04","- [Mom] That's his.","that's his yeah in case"
"EukpxRuDUzA","00:13:05","00:13:07","In case like he can't unpack and don't find it.","he like can't unpack on and you don't find it and then we'll"
"EukpxRuDUzA","00:13:07","00:13:08","And then we'll just put the deodorant","just put the deodorant in"
"EukpxRuDUzA","00:13:09","00:13:11","in the morning one as well.","the morning one as well oh it just smells"
"EukpxRuDUzA","00:13:11","00:13:12","- [Mom] Oh, it just smells divine in here.","divine"
"EukpxRuDUzA","00:13:13","00:13:14","- I know this is fine.","in here i know okay this is fun"
"EukpxRuDUzA","00:13:15","00:13:17","This one's has some bath foams in it.","this one's um some bath bombs in it and then"
"EukpxRuDUzA","00:13:18","00:13:20","And then I got some more loose bath foams as well.","i got some more loose bath bombs as well are you going to keep it in the ball"
"EukpxRuDUzA","00:13:20","00:13:21","- [Mom] Are you gonna to keep it in the box?","i'm going to keep it in the box and"
"EukpxRuDUzA","00:13:22","00:13:23","- I'm gonna keep it in the box have it as a little present","just like have it as a little present under the sink"
"EukpxRuDUzA","00:13:24","00:13:24","under the sink.","so when i open"
"EukpxRuDUzA","00:13:24","00:13:27","So when I open it to surprise him with all of this stuff","it to surprise him with all of this stuff under the sink he'll like find"
"EukpxRuDUzA","00:13:27","00:13:28","under the sink, he'll I find a little box","a little box"
"EukpxRuDUzA","00:13:28","00:13:30","and get to open it like a full present.","and get to open it like a full present i'm dying"
"EukpxRuDUzA","00:13:30","00:13:31","- [Mom] I'm dying.","i'm"
"EukpxRuDUzA","00:13:32","00:13:33","So again, let me know, comment below,","dying so again let me know comment below give this"
"EukpxRuDUzA","00:13:34","00:13:34","give this video a thumbs up.","video a thumbs"
"EukpxRuDUzA","00:13:35","00:13:37","If you wanna see the video of him, reacting to everything,","up if you want to see the video of him reacting to everything"
"EukpxRuDUzA","00:13:38","00:13:39","and trying all the clothes on and stuff.","and trying all the clothes on and stuff i don't know if it'll be"
"EukpxRuDUzA","00:13:40","00:13:40","I don't know if it'll be interesting.","interesting i know"
"EukpxRuDUzA","00:13:40","00:13:42","I know it'll be fun for me to see my boyfriend react","it'll be fun for me to see my boyfriend react to all the surprises"
"EukpxRuDUzA","00:13:42","00:13:43","to all the surprise.","i think he's gonna"
"EukpxRuDUzA","00:13:44","00:13:44","- [Mom] I guess he's gonna to cry.","cry he is sensitive"
"EukpxRuDUzA","00:13:44","00:13:46","- He is sensitive in a really sweet way.","in a really sweet way i know he's"
"EukpxRuDUzA","00:13:47","00:13:47","","like a very like very"
"EukpxRuDUzA","00:13:48","00:13:48","He's very grateful,","grateful"
"EukpxRuDUzA","00:13:49","00:13:49","very sweet, - [Mom] Sweet, polite","very sweet"
"EukpxRuDUzA","00:13:51","00:13:52","- [Mom] adorable.","yeah he's just adorable wonderful"
"EukpxRuDUzA","00:13:53","00:13:54","","i i i definitely like"
"EukpxRuDUzA","00:13:55","00:13:56","I know he'll just feel so much gratitude","i know he'll just feel so much gratitude because"
"EukpxRuDUzA","00:13:56","00:13:59","'cause I know he wouldn't ever expect any of this.","i know he wouldn't ever expect any of this you know"
"EukpxRuDUzA","00:14:00","00:14:00","(air whooshing)","hi lavender"
"EukpxRuDUzA","00:14:01","00:14:01","Hi lavender, do you wanna to help?","do you want to"
"EukpxRuDUzA","00:14:02","00:14:04","- [Mom] I think she's very helpful.","help i find she's very helpful you went down"
"EukpxRuDUzA","00:14:05","00:14:06","She wanna crawl into the basket,","i'm going to crawl into the basket which"
"EukpxRuDUzA","00:14:07","00:14:07","which isn't actually helpful.","isn't actually helpful"
"EukpxRuDUzA","00:14:08","00:14:08","","because then i can't put"
"EukpxRuDUzA","00:14:09","00:14:10","I've got a cat in the basket.","i've got a cat in the basket"
"EukpxRuDUzA","00:14:11","00:14:13","So distracting, here, if you're gonna go in just, just go.","it's so distracting here if you're going to go in just just go in"
"EukpxRuDUzA","00:14:14","00:14:15","","you know"
"EukpxRuDUzA","00:14:16","00:14:17","- [Mom] She's gotten so big.","she's getting so big"
"EukpxRuDUzA","00:14:18","00:14:19","- Got a cat in the basket.","got a cat in the basket she's getting so big got a cat in the basket she's so"
"EukpxRuDUzA","00:14:20","00:14:21","She's grown so big it's crazy.","she's going so big it's crazy your"
"EukpxRuDUzA","00:14:22","00:14:24","You've grown so fast.","bubba's growing so fast so okay bye"
"EukpxRuDUzA","00:14:25","00:14:26","So I got these two metal baskets,","so i got these two metal baskets"
"EukpxRuDUzA","00:14:27","00:14:29","I thought they were kind of masculine at the container store","i thought they were kind of masculine at the container store for his"
"EukpxRuDUzA","00:14:30","00:14:30","for his closet.","closet"
"EukpxRuDUzA","00:14:31","00:14:32","So I'm gonna use them for socks and underwear.","so i'm gonna use them for socks and underwear but i"
"EukpxRuDUzA","00:14:33","00:14:36","But I think just for display purposes, for the surprise,","think just for display purposes for the surprise i'll probably"
"EukpxRuDUzA","00:14:36","00:14:38","I'll probably use this one to display the socks","use this one to display the socks and underwear"
"EukpxRuDUzA","00:14:39","00:14:39","and underwear that I've bought him.","that i've bought"
"EukpxRuDUzA","00:14:40","00:14:42","And then I'll use this one to display all the accessories","him and then i'll use this one to display all the accessories that i've bought"
"EukpxRuDUzA","00:14:43","00:14:45","And then he can do what he wants with them","him and then you know he can do what he wants with them"
"EukpxRuDUzA","00:14:46","00:14:47","once he has all of his stuff here.","once he has all of his stuff here and then we also"
"EukpxRuDUzA","00:14:48","00:14:49","And then we also got these bunch of hangers,","got these bunch of hangers these"
"EukpxRuDUzA","00:14:50","00:14:52","these ones to clip like shorts and pants up there,","ones to clip like shorts and pants up they're like a nice"
"EukpxRuDUzA","00:14:52","00:14:53","like a nice matte black rubber.","matte black rubber and then"
"EukpxRuDUzA","00:14:54","00:14:56","And then we got matte black rubber regular ones","we got matte black rubber regular ones or it's closed"
"EukpxRuDUzA","00:14:57","00:14:57","for his clothes.","so right now"
"EukpxRuDUzA","00:14:58","00:14:58","So right now, well my mom's still has her clothes","while my mom still has"
"EukpxRuDUzA","00:14:59","00:15:00","in her closet.","her clothes in her closet i'm just gonna start organizing"
"EukpxRuDUzA","00:15:01","00:15:02","I'm just gonna start organizing some of the accessories","some of the accessories"
"EukpxRuDUzA","00:15:02","00:15:04","and underwear and socks into these bins.","and underwear and socks into these bins"
"EukpxRuDUzA","00:15:05","00:15:07","Look, who's back back again.","look who's back back again it's lavender"
"EukpxRuDUzA","00:15:07","00:15:08","It's Lavender.","lavender"
"EukpxRuDUzA","00:15:09","00:15:11","She just came and jumped back into the basket.","she just came and jumped back into the basket yeah so i'm gonna organize"
"EukpxRuDUzA","00:15:11","00:15:12","So I'm gonna organize this stuff.","this stuff poof"
"EukpxRuDUzA","00:15:13","00:15:13","(sighs)","i've"
"EukpxRuDUzA","00:15:14","00:15:16","I've done as much as I can in the bathroom at this point,","done as much as i can in the bathroom at this point we need to go through"
"EukpxRuDUzA","00:15:16","00:15:17","we need to go through it and like give the bathroom","and like give the bathroom a"
"EukpxRuDUzA","00:15:18","00:15:19","a full scrub and clean on Friday","full scrub and clean on friday after"
"EukpxRuDUzA","00:15:19","00:15:21","after my mom fully moves out and then....","my mom fully moves out and then"
"EukpxRuDUzA","00:15:22","00:15:23","(laughing)","oh stop acting"
"EukpxRuDUzA","00:15:24","00:15:25","mom, they're gonna think you're actually not excited","mom they're gonna think you're actually not excited"
"EukpxRuDUzA","00:15:26","00:15:26","for me.","no i i'm"
"EukpxRuDUzA","00:15:27","00:15:28","- [Mom] I'm so excited to leave","so excited you're kidding i'm so excited to leave but i"
