"video_id","min_timecode","max_timecode","text.user","text.auto"
"EukpxRuDUzA","00:23:13","00:23:17","Lavender has been such a help getting us the screwdriver.","been such such a help getting us the screwdriver"
"EukpxRuDUzA","00:23:18","00:23:19","Thanks Lavender.","thanks for having me very excited by"
"EukpxRuDUzA","00:23:19","00:23:20","- She's very excited by the desk.","the desk she loves"
"EukpxRuDUzA","00:23:20","00:23:22","- [Mom] She loves it all. Don't you?","it all don't you oh there we"
"EukpxRuDUzA","00:23:23","00:23:23","Such a big help.","go such a big help"
"EukpxRuDUzA","00:23:24","00:23:25","- Yes, thank you.","yes thank you yeah"
"EukpxRuDUzA","00:23:26","00:23:27","You're distracting Lavender.","you're not distracted"
"EukpxRuDUzA","00:23:27","00:23:28","- [Mom] You are distracting, no.","no yes thank you yeah you're not distracted no"
"EukpxRuDUzA","00:23:29","00:23:29","Wonderful.","wonderful"
"EukpxRuDUzA","00:23:29","00:23:31","",""
"EukpxRuDUzA","00:23:32","00:23:34","- My boyfriend and I call Lavender our relationship cat","my boyfriend and i call lavender our relationship cat"
"EukpxRuDUzA","00:23:34","00:23:37","because the day I got Lavender was June 7th,","because the day i got lavender was june 7th which"
"EukpxRuDUzA","00:23:37","00:23:39","which as I said earlier in the video is the day","as i said earlier in the video was"
"EukpxRuDUzA","00:23:40","00:23:40","he asked me to be his girlfriend.","the day he asked me to be his girlfriend"
"EukpxRuDUzA","00:23:41","00:23:42","That was a huge day for me you guys.","that was a huge day for me you guys i got a"
"EukpxRuDUzA","00:23:42","00:23:44","I got a kitten and a boyfriend in one full swoop.","kitten and a boyfriend in one fell swoop so she"
"EukpxRuDUzA","00:23:44","00:23:46","So she is our relationship cat.","is a relationship cat"
"EukpxRuDUzA","00:23:47","00:23:47","Aren't you?","aren't you a little"
"EukpxRuDUzA","00:23:47","00:23:49","- [Mom] It was a little shocking for me too.","shocking for me too"
"EukpxRuDUzA","00:23:50","00:23:51","(air whooshing)","what just happened"
"EukpxRuDUzA","00:23:52","00:23:53","She's eating, no, no, no no.","she's eating no no"
"EukpxRuDUzA","00:23:54","00:23:56","(laughing)","she"
"EukpxRuDUzA","00:23:56","00:23:57","She keeps trying eating the plastic and the stuff","keeps trying to eat the plastic"
"EukpxRuDUzA","00:23:58","00:24:00","when the time comes she was gonna put it in my room","in the styrofoam or a time crunch so i was gonna put her in my room and close the door so"
"EukpxRuDUzA","00:24:00","00:24:01","and close the door so she couldn't go eat stuff","she couldn't go eat styrofoam and"
"EukpxRuDUzA","00:24:02","00:24:04","from plastic, but she is so fast.","plastic but she's so fast"
"EukpxRuDUzA","00:24:05","00:24:07","- [Mom] Lavender, you're going back.","lavender you're going back time"
"EukpxRuDUzA","00:24:07","00:24:08","Timeout.","out okay so we"
"EukpxRuDUzA","00:24:09","00:24:09","(air whooshing)","just came"
"EukpxRuDUzA","00:24:09","00:24:11","- We just came over to drop a few more things off","over to drop a few more things off at my mom's"
"EukpxRuDUzA","00:24:12","00:24:13","at my mom's apartment before my boyfriend comes.","apartment before my boyfriend comes"
"EukpxRuDUzA","00:24:14","00:24:16","So I thought we'd just quickly show you obviously","so i thought we'd just quickly show you obviously like we're just"
"EukpxRuDUzA","00:24:16","00:24:17","she's just moving in.","she's just moving in so everything's"
"EukpxRuDUzA","00:24:17","00:24:19","So everything's still a mess, but this is the kitchen.","still a mess but this is the kitchen"
"EukpxRuDUzA","00:24:20","00:24:22","And then there's the living room area here.","and then there's the living room area here"
"EukpxRuDUzA","00:24:23","00:24:25","Big window patio.","big window she has a patio obviously"
"EukpxRuDUzA","00:24:25","00:24:28","Obviously it looks like relatively similar to ours","it looks like relatively similar to ours"
"EukpxRuDUzA","00:24:29","00:24:30","because it's in the same building.","because it's the same building same building"
"EukpxRuDUzA","00:24:31","00:24:35","And then here, the bedroom with all her bedroom furniture,","and then in here the bedroom with all her bedroom furniture the"
"EukpxRuDUzA","00:24:36","00:24:38","the closet that I organized.","closet that i organized"
"EukpxRuDUzA","00:24:39","00:24:40","- [Mom] I'm about to be hung up.","about to be hung up there we go"
"EukpxRuDUzA","00:24:41","00:24:42","Closet's all organized.","closets all organized"
"EukpxRuDUzA","00:24:43","00:24:45","","and then uh yeah just the coat"
"EukpxRuDUzA","00:24:45","00:24:48","- Just the coat closet, bathroom, laundry.","closet bathroom and then uh yeah just the coat closet bathroom laundry turn"
"EukpxRuDUzA","00:24:49","00:24:49","- [Mom] Turn the light on there.","the light on there i"
"EukpxRuDUzA","00:24:50","00:24:50","","don't know it's all such a"
"EukpxRuDUzA","00:24:51","00:24:52","It's all such a mess.","mess yeah i mean"
"EukpxRuDUzA","00:24:52","00:24:53","","we're moving so"
"EukpxRuDUzA","00:24:53","00:24:54","- We're moving.","it's a"
"EukpxRuDUzA","00:24:55","00:24:55","So it's a moving lot.","moving vlog it's okay"
"EukpxRuDUzA","00:24:56","00:24:57","- [Mom] It's okay.","um but yeah this"
"EukpxRuDUzA","00:24:57","00:24:59","- This is my mom's new place.","is my mom's new place it'll be"
"EukpxRuDUzA","00:24:59","00:25:01","It'll be spick and span and looking beautiful","and span looking beautiful"
"EukpxRuDUzA","00:25:02","00:25:03","and decorated shortly.","and decorated shortly okay you guys"
"EukpxRuDUzA","00:25:04","00:25:05","Hey you guys I'm so stressed.","i'm like so stressed okay i've"
"EukpxRuDUzA","00:25:06","00:25:07","I've never lived with anybody by the way.","never lived with anybody by the way i've lived"
"EukpxRuDUzA","00:25:07","00:25:09","I lived alone for two years, 18, 19, 20.","i lived alone for two years 18 19"
"EukpxRuDUzA","00:25:10","00:25:10","I lived alone.","20. i lived"
"EukpxRuDUzA","00:25:11","00:25:12","But other than that, I've only ever lived with family.","alone but other than that i've only ever lived with family"
"EukpxRuDUzA","00:25:13","00:25:15","And then with my ex I would stay for extended periods,","and then with my ex i would stay for like extended periods like two or"
"EukpxRuDUzA","00:25:15","00:25:16","like two or three weeks.","three weeks but i've"
"EukpxRuDUzA","00:25:16","00:25:17","But I've never lived with a roommate.","never lived with a roommate"
"EukpxRuDUzA","00:25:18","00:25:19","I've never lived with a boyfriend.","i've never lived with a boyfriend this is a pretty big deal for"
"EukpxRuDUzA","00:25:20","00:25:21","It's a big day in my life.","me it's a big day in my life you guys okay"
"EukpxRuDUzA","00:25:22","00:25:24","You're a part of this big monumental moment.","you're a part of this big monumental moment okay so in here"
"EukpxRuDUzA","00:25:24","00:25:26","So in here we've got these cute little boxes.","we got these cute little boxes"
"EukpxRuDUzA","00:25:27","00:25:28","So on the left, the unicorn is Lavender's box.","so on the left the unicorn is lavender's box"
"EukpxRuDUzA","00:25:29","00:25:31","And on the right, the gorilla is Gallop's box.","and on the right the gorilla is gallop's box so"
"EukpxRuDUzA","00:25:32","00:25:34","So we can easily tell a part which box is which.","we can like easily tell apart which box is which"
"EukpxRuDUzA","00:25:35","00:25:38","And then here I've like got some of his favorite things.","and then here i've like got some of his favorite things so in our drinks"
"EukpxRuDUzA","00:25:38","00:25:41","So in our drinks area, I got him Stella,","area i got him stella which is his favorite"
"EukpxRuDUzA","00:25:41","00:25:42","which is his favorite beer.","beer and then"
"EukpxRuDUzA","00:25:42","00:25:44","And then I got him grapefruit Spindrift,","i got him grapefruit spin drift which is his favorite i'm"
"EukpxRuDUzA","00:25:44","00:25:45","which is his favorite I'm look right girl.","a kroy girl"
"EukpxRuDUzA","00:25:45","00:25:46","He's more of a Spindrift guy.","he's more of a spindrift guy"
"EukpxRuDUzA","00:25:47","00:25:48","Then we've got the Champagne to celebrate.","we got champagne to celebrate"
"EukpxRuDUzA","00:25:49","00:25:49","(drawer closing)","and then"
"EukpxRuDUzA","00:25:49","00:25:54","In the fridge, we have some of his favorite salads","in the fridge we have some of his favorite salads"
"EukpxRuDUzA","00:25:54","00:25:57","from Trader Joe's and then just some other goodies.","from trader joe's and then just some other goodies we have leftover"
"EukpxRuDUzA","00:25:57","00:25:58","We have leftover Indian food,","indian food which we're all gonna"
"EukpxRuDUzA","00:25:58","00:25:59","which we're all going to have for lunch.","have for lunch you know"
"EukpxRuDUzA","00:26:00","00:26:02","When you're moving, you just have take out most of the time","when you're moving like you just have takeout most of the time because"
"EukpxRuDUzA","00:26:02","00:26:04","'cause it's so hectic.","it's so hectic and then"
"EukpxRuDUzA","00:26:04","00:26:06","And then over here I have an array","over here i have an array of"
"EukpxRuDUzA","00:26:07","00:26:10","of his favorite snack foods, including pop tarts,","his favorite snack foods including pop-tarts"
"EukpxRuDUzA","00:26:11","00:26:13","the cinnamon sugar pop tarts are his guilty pleasure.","the cinnamon sugar pop-tarts are his like guilty pleasure he"
"EukpxRuDUzA","00:26:14","00:26:15","He eats super healthy, but the cinnamon pop tarts","eats super healthy but the cinnamon pop-tarts"
"EukpxRuDUzA","00:26:16","00:26:17","are like his absolute guilty pleasure foods,","are like his absolute guilty pleasure"
"EukpxRuDUzA","00:26:18","00:26:19","so I treated him.","food so i treated him we"
"EukpxRuDUzA","00:26:20","00:26:20","We have flowers","have flowers which we're gonna put"
"EukpxRuDUzA","00:26:20","00:26:21","- [Mom] Which we're going to put out.","out okay and then"
"EukpxRuDUzA","00:26:22","00:26:23","","over here i'll bring"
"EukpxRuDUzA","00:26:24","00:26:24","I'll bring you guys to the bathroom and","you guys to the bathroom and show"
"EukpxRuDUzA","00:26:25","00:26:26","show you what I've done.","you what i've done so"
"EukpxRuDUzA","00:26:27","00:26:30","So we have a toothbrush holder, with his toothbrush","we have a toothbrush holder with his oh you took his two oh no it is"
"EukpxRuDUzA","00:26:30","00:26:32","","i'm blind there his toothbrush"
"EukpxRuDUzA","00:26:33","00:26:34","and then some toothpaste.","and then some toothpaste and then we got him"
"EukpxRuDUzA","00:26:34","00:26:36","We got him a nice hand soap.","a nice hand soap and then"
"EukpxRuDUzA","00:26:37","00:26:40","Under here, it's all organized now.","under here it's all organized now so there's"
"EukpxRuDUzA","00:26:41","00:26:42","So there's a new towel for him to send new bathmat.","a new towel for him this is a new"
"EukpxRuDUzA","00:26:43","00:26:45","We got the gift I showed you guys, his morning routine,","bath mat we got the gift i showed you guys"
"EukpxRuDUzA","00:26:46","00:26:47","his evening routine.","his morning routine his evening routine i got him some more"
"EukpxRuDUzA","00:26:47","00:26:49","I got him some more stuff like facecloths back there.","stuff like face cloths back there"
"EukpxRuDUzA","00:26:50","00:26:53","I got him a men's manicure set, Epsom salt","i got him like a manicure a men's manicure set epsom salts"
"EukpxRuDUzA","00:26:54","00:26:54","his back foams.","his bath bombs so that's"
"EukpxRuDUzA","00:26:55","00:26:58","So that's all of that stuff organized under the sink.","kind of all of that stuff organized under the sink and"
"EukpxRuDUzA","00:26:58","00:26:59","And then of course I have the Dirty,","then of course i have the dirty like"
"EukpxRuDUzA","00:26:59","00:27:01","like I showed you before.","i showed you before and then in"
"EukpxRuDUzA","00:27:02","00:27:04","In the corner we have is Lush products.","the corner we have his lush products and then in this corner i have"
"EukpxRuDUzA","00:27:04","00:27:06","In this corner I have the little Dove shower foam","the little dove shower phone because he"
"EukpxRuDUzA","00:27:07","00:27:09","'cause he very proud of me and loves the shower foam.","is very proud of me and loves the shower foam so"
"EukpxRuDUzA","00:27:10","00:27:13","So then we come into here, we've put together the desk,","then we come into here we've put together the desk we have a desk"
"EukpxRuDUzA","00:27:13","00:27:14","we have a desk lamp,","lamp"
"EukpxRuDUzA","00:27:14","00:27:17","and then this is the gold and white executive chair","and then this is the gold and white executive"
"EukpxRuDUzA","00:27:18","00:27:19","that I got him.","chair that i got him and has like nice cushy arms"
"EukpxRuDUzA","00:27:19","00:27:20","Nice cushy arms and everything.","and"
"EukpxRuDUzA","00:27:21","00:27:23","So we haven't made that yet, but this will be going here.","everything so we haven't made that yet but this will be going here"
"EukpxRuDUzA","00:27:24","00:27:25","This is where my boyfriend is going to have","this is where my boyfriend is gonna have all of his"
"EukpxRuDUzA","00:27:25","00:27:27","all of his work equipment, computer equipment,","work equipment computer equipment"
"EukpxRuDUzA","00:27:28","00:27:29","get this job done.","get his job done"
"EukpxRuDUzA","00:27:29","00:27:31","And a part of that is building websites.","and a part of that is building websites"
"EukpxRuDUzA","00:27:32","00:27:33","That's a part of what he does.","that's a part of what he does that's"
"EukpxRuDUzA","00:27:33","00:27:35","That's a very simplified version of what he does.","a very simplified version of what he does he's like absurdly"
"EukpxRuDUzA","00:27:35","00:27:38","He's like absurdly smart and he'll be able to properly tell","smart and he'll be able to properly tell you all the things"
"EukpxRuDUzA","00:27:38","00:27:40","you all the things that he does when he meets you guys","that he does when he meets you guys"
"EukpxRuDUzA","00:27:41","00:27:41","in a few weeks.","in a few weeks but"
"EukpxRuDUzA","00:27:42","00:27:43","But speaking of building websites,","speaking of building websites in a few weeks but speaking of building websites"
"EukpxRuDUzA","00:27:43","00:27:46","Squarespace is where I personally built my website","squarespace is where i personally built my website many"
"EukpxRuDUzA","00:27:47","00:27:49","I've been using Squarespace to host my site","years ago i've been using squarespace to host my site for many"
"EukpxRuDUzA","00:27:49","00:27:50","for many years now.","years now i"
"EukpxRuDUzA","00:27:51","00:27:52","I love how easy it was to build.","love how easy it was to build they have"
"EukpxRuDUzA","00:27:52","00:27:54","They have so many premade templates,","so many pre-made templates but even when you use"
"EukpxRuDUzA","00:27:54","00:27:55","but even when you use the premade templates,","the pre-made"
"EukpxRuDUzA","00:27:56","00:27:57","you can just switch things out and change things","templates you can just switch things out and change things"
"EukpxRuDUzA","00:27:58","00:28:00","up to really make it look unique, make it look your own.","up to really make it look unique make it look your own"
"EukpxRuDUzA","00:28:01","00:28:02","I made mine bright and colorful and fun.","i made mine bright and colorful"
"EukpxRuDUzA","00:28:03","00:28:05","And honestly, it's just the perfect place to start.","and fun and honestly it's just the perfect place to start if you're"
"EukpxRuDUzA","00:28:06","00:28:07","If you're also trying to build an online presence","also trying to build an online presence"
"EukpxRuDUzA","00:28:08","00:28:11","and make a website professional for your own business,","and make a website professional for your own business being a ladyboss"
"EukpxRuDUzA","00:28:11","00:28:13","being a lady boss or entrepreneur.","or an entrepreneur so go"
"EukpxRuDUzA","00:28:14","00:28:14","So go to","to squarespace.com"
"EukpxRuDUzA","00:28:15","00:28:16","to start a free trial","to start a free"
"EukpxRuDUzA","00:28:17","00:28:17","and go to","trial and go to"
"EukpxRuDUzA","00:28:18","00:28:20","squarespace.com/mollyburke,","squarespace.com molly burke to get 10"
"EukpxRuDUzA","00:28:20","00:28:22","to get 10% off your first website purchase","off your first website"
"EukpxRuDUzA","00:28:23","00:28:24","or purchase a domain.","purchase or purchase of a domain all"
"EukpxRuDUzA","00:28:25","00:28:26","All the links are down below.","the links are down below and"
"EukpxRuDUzA","00:28:27","00:28:28","And then a bunch of his shoes are here","then a bunch of his shoes are here that he"
"EukpxRuDUzA","00:28:28","00:28:30","that he moved last night.","moved last night so that's kind of a"
"EukpxRuDUzA","00:28:30","00:28:31","So that's kind of a mess, but we'll be,","mess but"
"EukpxRuDUzA","00:28:32","00:28:33","organizing that later.","we'll be you know organizing that later and then"
"EukpxRuDUzA","00:28:34","00:28:34","",""
"EukpxRuDUzA","00:28:36","00:28:38","Here is all the clothes that I got him.","here is all the clothes that i"
"EukpxRuDUzA","00:28:39","00:28:41","So let me quickly show you guys.","got him so let me quickly show you guys so"
"EukpxRuDUzA","00:28:41","00:28:44","So we have this hoodie from Urban Outfitters.","we have this hoodie from urban outfitters"
"EukpxRuDUzA","00:28:45","00:28:47","We have this from J.Crew","we have this from j crew and again all the"
"EukpxRuDUzA","00:28:47","00:28:48","and again, all the J.Crew stuff, most of it,","j crew stuff most of it i"
"EukpxRuDUzA","00:28:49","00:28:49","I got crazy sale.","got crazy sale"
"EukpxRuDUzA","00:28:50","00:28:54","J.Crew, J.Crew, J.Crew, J.Crew, Urban Outfitters.","j crew j crew j crew j crew urban outfitters"
"EukpxRuDUzA","00:28:55","00:28:55","","so"
"EukpxRuDUzA","00:28:55","00:28:56","So it was all the sweaters.","those are all the sweaters and"
"EukpxRuDUzA","00:28:57","00:29:00","And then we go to tops Topman, Topman, Topman,","then we go to top's topman topman topman"
"EukpxRuDUzA","00:29:01","00:29:01","",""
"EukpxRuDUzA","00:29:02","00:29:03","Urban Outfitters, I love this one.","urban outfitters i love this one it says"
"EukpxRuDUzA","00:29:03","00:29:04","It says, ""Love everybody.""","love"
"EukpxRuDUzA","00:29:05","00:29:09","And then we have J.Crew, J.Crew, J.Crew, J.Crew,","everybody and then we have j crew j crew j cruz j crew"
"EukpxRuDUzA","00:29:10","00:29:11","J.Crew, J.Crew.","j crew so"
"EukpxRuDUzA","00:29:11","00:29:12","So those tops I got him.","those tops i got them and"
"EukpxRuDUzA","00:29:13","00:29:13","- And here are the bottoms.","here are the bottoms"
"EukpxRuDUzA","00:29:14","00:29:16","So we have swim J.Crew, J.Crew.","so we have swim j crew j crew and we have these"
"EukpxRuDUzA","00:29:16","00:29:18","And we have these like black distressed denim shorts,","like black distressed denim shorts"
"EukpxRuDUzA","00:29:19","00:29:21","which are Topman J.Crew J.Crew.","which are top man j crew j crew and then"
"EukpxRuDUzA","00:29:21","00:29:22","And then we go to pants.","we go to pants and all of"
"EukpxRuDUzA","00:29:23","00:29:24","All of these are pretty much J.Crew.","these are pretty much j crew so i"
"EukpxRuDUzA","00:29:24","00:29:25","So I won't bother saying it.","won't bother saying it"
"EukpxRuDUzA","00:29:26","00:29:27","Love these ones.","love these ones i love these ones um"
"EukpxRuDUzA","00:29:27","00:29:28","","ones um all these"
"EukpxRuDUzA","00:29:29","00:29:30","All these different pants.","different pants and then"
"EukpxRuDUzA","00:29:30","00:29:32","And then these ones are interesting","these ones are interesting and these are from"
"EukpxRuDUzA","00:29:32","00:29:34","and these are from Urban Outfitters.","urban outfitters and then"
"EukpxRuDUzA","00:29:34","00:29:36","And then the shoes that I got him.","the shoes that i got him here"
"EukpxRuDUzA","00:29:36","00:29:37","Right here, we have the shoe rack that we found","we have the shoe rack that we"
"EukpxRuDUzA","00:29:38","00:29:39","somebody was moving out and getting rid of it,","found somebody was moving out and getting rid of it so we"
"EukpxRuDUzA","00:29:40","00:29:41","so we grabbed it 'cause he's a shoe guy like me,","grabbed it because he's a shoe guy like me"
"EukpxRuDUzA","00:29:42","00:29:43","as you saw the corner, he loves shoes.","as you saw in the corner he loves shoes so"
"EukpxRuDUzA","00:29:43","00:29:47","So I got these Vans for him, which I think are so cool.","i got these vans for him which i think are so cool"
"EukpxRuDUzA","00:29:48","00:29:50","See they have a yellow lace and it's a mixed denim.","see they have like a yellow lace and it's a mixed denim"
"EukpxRuDUzA","00:29:51","00:29:53","So I think this are super nice.","so i think these are super nice"
"EukpxRuDUzA","00:29:54","00:29:57","And then I got him the classic Sperry's,","and then i just got him kind of like the classic"
"EukpxRuDUzA","00:29:57","00:29:59","","sperries which are just"
"EukpxRuDUzA","00:29:59","00:30:02","they're just the brown leather ones. (folding paper)","the brown leather ones"
"EukpxRuDUzA","00:30:03","00:30:04","","yeah it's a good staple"
"EukpxRuDUzA","00:30:06","00:30:08","And then, this is his socks and underwear.","and then so this is his socks and underwear so"
"EukpxRuDUzA","00:30:08","00:30:11","So I got him the pastel ones and the pineapple ones","i got him the pastel ones and the pineapple ones"
"EukpxRuDUzA","00:30:12","00:30:12","from Topman.","from topman"
"EukpxRuDUzA","00:30:13","00:30:15","And then what's this?","and then what's this oh they're masks"
"EukpxRuDUzA","00:30:15","00:30:16","Oh, they are masks.","oh"
"EukpxRuDUzA","00:30:17","00:30:18","(laughing)","i bought those very"
"EukpxRuDUzA","00:30:18","00:30:21","Oh, very 2020 masks.","um very 20 20 masks"
"EukpxRuDUzA","00:30:22","00:30:24","And then I got him in these pastel boxers,","and then i got them in these like pastel boxers which i think"
"EukpxRuDUzA","00:30:24","00:30:25","which I think are cute to go with the other boxers","are cute to go with the other boxers"
"EukpxRuDUzA","00:30:26","00:30:27","I got him.","i got him i just have it lined up like"
"EukpxRuDUzA","00:30:27","00:30:28","So I just have it lined up like this to show him.","show him yeah and"
"EukpxRuDUzA","00:30:28","00:30:30","And then we have a bunch of extra hangers over there","then we have a bunch of extra hangers over there"
"EukpxRuDUzA","00:30:31","00:30:31","to hang his stuff.","hang his stuff"
"EukpxRuDUzA","00:30:32","00:30:34","Boxes to kind of fold some other stuff into.","yeah and boxes to kind of fold some other stuff into"
"EukpxRuDUzA","00:30:35","00:30:36","Oh my God, you guys something crazy that happened yesterday.","oh my god you guys something crazy that happened"
"EukpxRuDUzA","00:30:37","00:30:39","Obviously we've been putting this surprise together.","yesterday obviously like we've been putting this surprise together i mean i've been putting the surprise"
"EukpxRuDUzA","00:30:39","00:30:40","I've been putting this surprise together for like","together for"
"EukpxRuDUzA","00:30:40","00:30:41","three weeks to a month","like three weeks to a month"
"EukpxRuDUzA","00:30:42","00:30:45","and we've just been three or four days","and we've just been like kind of the last three or four days starting to actually"
"EukpxRuDUzA","00:30:45","00:30:47","starting to actually put stuff around the place,","put stuff around the place but"
"EukpxRuDUzA","00:30:48","00:30:49","but he's still been coming over to help mom move.","he's still been coming over to help mom move"
"EukpxRuDUzA","00:30:50","00:30:52","So it's been like, don't look at stuff.","so it's been like i'm like don't stop don't focus"
"EukpxRuDUzA","00:30:52","00:30:55","So he comes last night, we've gotten scot-free.","so he comes last night we've gotten scot-free so he comes last night we've gotten scot-free"
"EukpxRuDUzA","00:30:55","00:30:56","Right?","right he's about to leave"
"EukpxRuDUzA","00:30:57","00:30:58","He just brings his shoes into dump them","he just brings his shoes in to dump them and"
"EukpxRuDUzA","00:30:59","00:31:00","and then he's on his way home.","then he's on his way home and"
"EukpxRuDUzA","00:31:01","00:31:01","And I was like, okay, perfect.","i was like okay perfect"
"EukpxRuDUzA","00:31:02","00:31:02","We made it.","we made it"
"EukpxRuDUzA","00:31:03","00:31:03","The surprise hasn't been ruined,","the surprise hasn't been ruined"
"EukpxRuDUzA","00:31:04","00:31:04","tomorrow when he comes I'll reveal","tomorrow when he comes i'll reveal"
"EukpxRuDUzA","00:31:05","00:31:05","and I don't have to be stressed","and i don't have to"
"EukpxRuDUzA","00:31:06","00:31:06","about him finding anything anymore.","be stressed about finding anything"
"EukpxRuDUzA","00:31:07","00:31:08","And then he's like,","anymore and then he's like i'm just gonna look in the closet"
"EukpxRuDUzA","00:31:08","00:31:09","""I'm just gonna look in the closet to see how much space","to see how much space"
"EukpxRuDUzA","00:31:10","00:31:10","""I'm gonna,""","i'm gonna and i was like because he"
"EukpxRuDUzA","00:31:11","00:31:12","'cause he had never looked in his closet before","had never looked in this closet before because my mom's clothes"
"EukpxRuDUzA","00:31:12","00:31:13","'cause my mom's clothes were always in here.","were always in here so he's like"
"EukpxRuDUzA","00:31:14","00:31:15","So he's like, "" I'm gonna look and see how much space","i'm just gonna look and see how much space i'm gonna have"
"EukpxRuDUzA","00:31:15","00:31:16","""I'm gonna have."" And I was like, ""Don't open the closet.""","and i was like don't open the closet"
"EukpxRuDUzA","00:31:17","00:31:18","And he was like, ""I just gonna...""","and he was like no i'm just i'm not gonna look"
