"video_id","min_timecode","max_timecode","text.user","text.auto"
"1Gxrwh4zGPg","00:26:33","00:26:34","All right, here we go.","all right here we go can you see"
"1Gxrwh4zGPg","00:26:34","00:26:35","Can you see it?","it oh it's sliding down my hand"
"1Gxrwh4zGPg","00:26:35","00:26:37","Oh it's sliding down my hand, nevermind!","never mind let's rub that"
"1Gxrwh4zGPg","00:26:37","00:26:38","Let's rub that in.","in oh oh"
"1Gxrwh4zGPg","00:26:38","00:26:40","Ooh, oh.","oh oh"
"1Gxrwh4zGPg","00:26:40","00:26:41","Ooh, oh!","and i've concluded"
"1Gxrwh4zGPg","00:26:41","00:26:44","And I've concluded that I think it mostly smells","that i think it mostly smells"
"1Gxrwh4zGPg","00:26:44","00:26:46","like sweet orange potpourri.","like sweet orange potpourri"
"1Gxrwh4zGPg","00:26:47","00:26:48","- [Tyler] Orange is in potpourri sometimes.","oranges invoking sometimes"
"1Gxrwh4zGPg","00:26:49","00:26:50","- [Safiya] Orange is in potpourri sometimes,","orange is in potpourri sometimes"
"1Gxrwh4zGPg","00:26:50","00:26:51","you're right.","you're right like"
"1Gxrwh4zGPg","00:26:52","00:26:55","Like a dried orange, a petrified orange.","a dried orange a petrified orange right like a dried orange a petrified orange which was"
"1Gxrwh4zGPg","00:26:55","00:26:58","Which was semi-confirmed by our guest sniffers.","semi-confirmed by our guest sniffers hello"
"1Gxrwh4zGPg","00:26:59","00:26:59","Hello, Tyler. - Spritz me.","tyler spritz"
"1Gxrwh4zGPg","00:27:00","00:27:02","- Welcome to my vlogging camera.","me welcome to my vlogging camera hi"
"1Gxrwh4zGPg","00:27:03","00:27:03","- [Safiya] Husband Tyler,","husband tyler"
"1Gxrwh4zGPg","00:27:04","00:27:05","all right, ready? - Yes.","all right ready yes expert"
"1Gxrwh4zGPg","00:27:05","00:27:07","Expert baker, Rosanna Pansino.","baker rosanna pansino oh"
"1Gxrwh4zGPg","00:27:08","00:27:08","- Oh!","it"
"1Gxrwh4zGPg","00:27:08","00:27:09","It smells like so many things.","smells like so many things"
"1Gxrwh4zGPg","00:27:10","00:27:11","- [Safiya] And Mat and Steph Pat","and matt and steph pat"
"1Gxrwh4zGPg","00:27:12","00:27:12","from the Game Theorists.","from the game theorists"
"1Gxrwh4zGPg","00:27:13","00:27:14","- Ah!","ah"
"1Gxrwh4zGPg","00:27:14","00:27:15","It is... - Oh!","it is ow"
"1Gxrwh4zGPg","00:27:16","00:27:18","- Strawberry crossed with penicillin.","strawberry crossed with penicillin we also tried"
"1Gxrwh4zGPg","00:27:18","00:27:19","- [Safiya] We also tried to send it","to send"
"1Gxrwh4zGPg","00:27:20","00:27:22","to Simply Cristine Logical in Canada,","it to simply christine logical in canada"
"1Gxrwh4zGPg","00:27:23","00:27:24","but customs rejected it.","but customs rejected it and although"
"1Gxrwh4zGPg","00:27:24","00:27:27","And although Tyler sort of gave us nonsense.","tyler sort of gave us nonsense and although tyler sort of gave us nonsense it smells"
"1Gxrwh4zGPg","00:27:27","00:27:29","- It smells like a lovely store,","like a lovely store an inviting"
"1Gxrwh4zGPg","00:27:30","00:27:30","an inviting store.","store"
"1Gxrwh4zGPg","00:27:30","00:27:32","Maybe one that like sells cards,","maybe one that like sells cards almost like a"
"1Gxrwh4zGPg","00:27:32","00:27:35","almost like a well-fragranted papyrus.","well-fragranted papyrus our"
"1Gxrwh4zGPg","00:27:35","00:27:38","- [Safiya] Our other smellers were generally in agreement","other smellers were generally in agreement that our"
"1Gxrwh4zGPg","00:27:38","00:27:41","that our sanitizer smelled strong.","sanitizer smelled strong whoa"
"1Gxrwh4zGPg","00:27:42","00:27:44","- Whoa, okay! (Rosanna laughs)","okay so top smells"
"1Gxrwh4zGPg","00:27:44","00:27:45","- So top smells are...","are"
"1Gxrwh4zGPg","00:27:46","00:27:47","- Alcohol.","alcohol alcohol"
"1Gxrwh4zGPg","00:27:48","00:27:48","- [Safiya] Fruity.","fruity"
"1Gxrwh4zGPg","00:27:49","00:27:49","- From the looks of it.","from the looks of it"
"1Gxrwh4zGPg","00:27:50","00:27:52","With my head, it smells like cranberry.","it's with my head i it smells like cranberry it smells"
"1Gxrwh4zGPg","00:27:53","00:27:53","It smells like...","like straight out"
"1Gxrwh4zGPg","00:27:53","00:27:54","- Straight out of a hospital.","of a hospital"
"1Gxrwh4zGPg","00:27:55","00:27:55","- Mixed berry.","mixed berry"
"1Gxrwh4zGPg","00:27:56","00:27:59","- [Safiya] And also kind of sweet/spicy.","and also kind of sweet slash spicy i'm also getting some vanilla"
"1Gxrwh4zGPg","00:27:59","00:28:00","- I'm also getting some vanilla.","are you getting"
"1Gxrwh4zGPg","00:28:01","00:28:02","once it's on your hands?","some vanilla once it's on your hands my all"
"1Gxrwh4zGPg","00:28:03","00:28:04","- All of my nose buds are dead.","of my nose buds are dead vanilla"
"1Gxrwh4zGPg","00:28:04","00:28:06","- Vanilla, pumpkin spice.","pumpkin spice it"
"1Gxrwh4zGPg","00:28:06","00:28:08","It smells like gingerbread, cinnamon,","smells like gingerbread cinnamon it smells like the"
"1Gxrwh4zGPg","00:28:08","00:28:09","smells like the holidays.","holidays"
"1Gxrwh4zGPg","00:28:10","00:28:11","Like maybe someone made a terrible decision","like maybe someone made a terrible decision and"
"1Gxrwh4zGPg","00:28:12","00:28:13","and made like a gingerbread hand sanitizer.","made like a gingerbread hand sanitizer"
"1Gxrwh4zGPg","00:28:14","00:28:15","And like maybe it's in there somewhere.","and like maybe it's in there somewhere"
"1Gxrwh4zGPg","00:28:15","00:28:16","I'm not sure.","i'm not sure it's"
"1Gxrwh4zGPg","00:28:17","00:28:18","- It's a weird combination,","a weird combination"
"1Gxrwh4zGPg","00:28:18","00:28:19","but I actually like it.","but i actually like it sofia"
"1Gxrwh4zGPg","00:28:20","00:28:20","Safiya, if you are testing","if you are testing"
"1Gxrwh4zGPg","00:28:21","00:28:23","and developing a hand sani line,","and developing a hands danny line testing and developing a hands danny line"
"1Gxrwh4zGPg","00:28:24","00:28:24","count me in.","um count me in"
"1Gxrwh4zGPg","00:28:24","00:28:26","I will take a couple of these.","i will take a couple of these"
"1Gxrwh4zGPg","00:28:27","00:28:29","- And when attempting to triangulate the scent","and when attempting to triangulate the scent by"
"1Gxrwh4zGPg","00:28:29","00:28:32","by smelling some of the sanitizers that went into it,","smelling some of the sanitizers that went into it"
"1Gxrwh4zGPg","00:28:33","00:28:34","we found that a combination","we found that a combination of"
"1Gxrwh4zGPg","00:28:35","00:28:36","of Ho Ho Ho Tis the Season,","ho ho ho tis the season"
"1Gxrwh4zGPg","00:28:37","00:28:38","Crisp Morning Air,","crisp morning air"
"1Gxrwh4zGPg","00:28:39","00:28:41","and Orange Sunrise was a pretty close comp.","and orange sunrise was a pretty close"
"1Gxrwh4zGPg","00:28:42","00:28:45","In general, I think the fruity/berry vibes","comp in general i think the fruity slash berry vibes of the"
"1Gxrwh4zGPg","00:28:45","00:28:48","of the frankensanitizer definitely makes sense","frankin sanitizer definitely makes sense when"
"1Gxrwh4zGPg","00:28:48","00:28:51","when you look at our fragrance note breakdown,","you look at our fragrance note breakdown but interestingly"
"1Gxrwh4zGPg","00:28:51","00:28:52","but interestingly,","spicy"
"1Gxrwh4zGPg","00:28:53","00:28:55","spicy scents like cinnamon and clove make up","scents like cinnamon and clove make up only"
"1Gxrwh4zGPg","00:28:56","00:28:58","only about 4% of the total mixture,","about four percent of the total mixture which means"
"1Gxrwh4zGPg","00:28:59","00:29:00","which means they're definitely punching","they're definitely punching above"
"1Gxrwh4zGPg","00:29:00","00:29:02","above their weight class,","their weight class and bringing"
"1Gxrwh4zGPg","00:29:02","00:29:03","and bringing some fall","some fall and"
"1Gxrwh4zGPg","00:29:03","00:29:05","and winter vibes to our aroma.","winter vibes to our aroma"
"1Gxrwh4zGPg","00:29:06","00:29:08","I like that you're smelling like this.","i like that you're smelling like this"
"1Gxrwh4zGPg","00:29:08","00:29:09","(laughing)","i'm trying to not"
"1Gxrwh4zGPg","00:29:09","00:29:10","- I'm trying to lock in the scent!","get ascend"
"1Gxrwh4zGPg","00:29:11","00:29:12","- [Safiya] So I think that is our best attempt","so i think that is our best attempt at"
"1Gxrwh4zGPg","00:29:12","00:29:15","at conveying the frankensanitizer's smell.","conveying the franken sanitizer smell"
"1Gxrwh4zGPg","00:29:16","00:29:17","Now as for how it feels,","now as for how it feels"
"1Gxrwh4zGPg","00:29:18","00:29:20","which I think is also like another aspect","which i think is also like another aspect of the"
"1Gxrwh4zGPg","00:29:20","00:29:21","of the hand sanitizer,","hand sanitizer is like"
"1Gxrwh4zGPg","00:29:21","00:29:22","is like, you know,","you know"
"1Gxrwh4zGPg","00:29:23","00:29:24","what it actually feels like on your hands.","what it actually feels like on your hands it"
"1Gxrwh4zGPg","00:29:24","00:29:26","It is quite moisturizing.","is quite moisturizing"
"1Gxrwh4zGPg","00:29:27","00:29:29","Like I don't feel super dried out,","like i don't feel super dried out which is"
"1Gxrwh4zGPg","00:29:29","00:29:30","which is a huge plus,","a huge plus"
"1Gxrwh4zGPg","00:29:31","00:29:33","but I do feel a bit of residue.","but i do feel a bit of residue"
"1Gxrwh4zGPg","00:29:34","00:29:35","Like you can feel it on your hands","like you can feel it on your hands"
"1Gxrwh4zGPg","00:29:36","00:29:36","once you've put it on.","once you've put it on"
"1Gxrwh4zGPg","00:29:37","00:29:38","It's not the worst I've ever felt,","it's not the worst i've ever felt"
"1Gxrwh4zGPg","00:29:39","00:29:39","but it is there.","but it is there"
"1Gxrwh4zGPg","00:29:40","00:29:41","And in general,","and in general i really"
"1Gxrwh4zGPg","00:29:41","00:29:43","I really like how it ended up looking","like how it ended up looking"
"1Gxrwh4zGPg","00:29:44","00:29:44","and smelling,","and smelling as"
"1Gxrwh4zGPg","00:29:45","00:29:47","as I think the fragrance actually really does seem","i think the fragrance actually really does seem to"
"1Gxrwh4zGPg","00:29:48","00:29:51","to capture Bath and Body Works' spectrum of scents.","capture bath and body works spectrum of sense like"
"1Gxrwh4zGPg","00:29:51","00:29:52","Like we do have a little bit","we do have a little bit of"
"1Gxrwh4zGPg","00:29:53","00:29:54","of a Christmas in July vibe going here.","a christmas in july vibe"
"1Gxrwh4zGPg","00:29:55","00:29:56","So all in all,","going here so all in all i"
"1Gxrwh4zGPg","00:29:56","00:29:59","I think our frankensanitizer turned out","think our franken sanitizer turned out much"
"1Gxrwh4zGPg","00:29:59","00:30:00","much better than expected.","better than"
"1Gxrwh4zGPg","00:30:01","00:30:03","I'm not sure how much potency it has left","expected i'm not sure how much potency it has"
"1Gxrwh4zGPg","00:30:04","00:30:06","after being mixed in a Pyrex,","left after being mixed in a pyrex and"
"1Gxrwh4zGPg","00:30:06","00:30:08","and I did potentially get some sanitizer","i did potentially get some sanitizer"
"1Gxrwh4zGPg","00:30:09","00:30:11","permanently lodged in my brain.","permanently lodged in my brain someday someone's"
"1Gxrwh4zGPg","00:30:11","00:30:13","- [Tyler] Someday someone's going to evaluate your sinuses","gonna evaluate your sinuses and you'll be like"
"1Gxrwh4zGPg","00:30:13","00:30:14","and they'll be like,","man there's a lot of"
"1Gxrwh4zGPg","00:30:14","00:30:15","ma'am, there's a lot of stuff up there.","stuff up there"
"1Gxrwh4zGPg","00:30:16","00:30:17","- Yeah, autopsy report.","yeah autopsy report just like"
"1Gxrwh4zGPg","00:30:17","00:30:20","Just like particles of Bath and Body Works.","particles of bath and body works an entire bath"
"1Gxrwh4zGPg","00:30:20","00:30:22","An entire Bath and Body Works store was found inside","and bodywork store was found inside her"
"1Gxrwh4zGPg","00:30:23","00:30:23","of her nasal cavity.","nasal cavity but"
"1Gxrwh4zGPg","00:30:24","00:30:26","But nevertheless, I am pleased.","nevertheless i am pleased thank you guys"
"1Gxrwh4zGPg","00:30:26","00:30:28","Thank you guys so much for watching.","so much for watching if you liked that"
"1Gxrwh4zGPg","00:30:28","00:30:29","If you liked that video,","video make sure to"
"1Gxrwh4zGPg","00:30:29","00:30:31","make sure to smash that like button,","smash that like button and if"
"1Gxrwh4zGPg","00:30:32","00:30:33","and if you want to see more videos like this,","you want to see more videos like this make"
"1Gxrwh4zGPg","00:30:34","00:30:35","make sure to smash that subscribe button.","sure to smash that subscribe button here"
"1Gxrwh4zGPg","00:30:36","00:30:37","Here is my Instagram,","is my instagram here is"
"1Gxrwh4zGPg","00:30:37","00:30:38","here is my TikTok,","my tick tock and"
"1Gxrwh4zGPg","00:30:38","00:30:40","and here is our livestreaming channel,","here is our live streaming channel"
"1Gxrwh4zGPg","00:30:41","00:30:44","where we live stream every Tuesday at 5:00 PM Eastern.","where we live stream every tuesday at 5 pm eastern so"
"1Gxrwh4zGPg","00:30:44","00:30:46","So feel free to check any of those things out","feel free to check any of those things out if they"
"1Gxrwh4zGPg","00:30:47","00:30:48","if they seem interesting to you.","seem interesting to you and"
"1Gxrwh4zGPg","00:30:49","00:30:49","And with that,","with that"
"1Gxrwh4zGPg","00:30:50","00:30:51","I will see you guys next time.","i will see you guys a next"
"1Gxrwh4zGPg","00:30:52","00:30:52","","time"
