"video_id","min_timecode","max_timecode","text.user","text.auto"
"3sq658Okvao","00:00:00","00:00:06","We follow one rule on Space Time: It’s never aliens. But every rule has an exception and","we follow one rule on space-time it's never aliens but every rule has an exception"
"3sq658Okvao","00:00:07","00:00:13","this rule is no exception because: It’s never aliens, until it is. So is it aliens yet?","and this rule is no exception because it's never aliens until it is so is it aliens"
"3sq658Okvao","00:00:13","00:00:19","","yet [Music] 45 years ago"
"3sq658Okvao","00:00:19","00:00:24","45 years ago, a pair of small Earth spacecraft inserted themselves into orbit around Mars.","a pair of small earth spacecraft inserted themselves into orbit around mars each dropped"
"3sq658Okvao","00:00:25","00:00:28","Each dropped landing craft, which descended to opposite sides of the planet. This was","landing craft which descended to opposite sides of the planet"
"3sq658Okvao","00:00:29","00:00:33","the Viking mission - the first successful Martian landing by the US. The landers performed","this was the viking mission the first successful martian landing by the us the landers performed"
"3sq658Okvao","00:00:34","00:00:38","multiple experiments to investigate the Martian soil for signs of living microbes. In one","multiple experiments to investigate the martian soil for signs of living microbes"
"3sq658Okvao","00:00:39","00:00:44","of these, samples were injected with a nutrient solution laced with radioactive carbon. The idea","in one of these samples were injected with a nutrient solution laced with radioactive carbon the"
"3sq658Okvao","00:00:45","00:00:49","of this labeled release experiment was that living microbes would metabolize the nutrients","idea of this labeled release experiment was that living microbes would metabolize the nutrients"
"3sq658Okvao","00:00:50","00:00:52","and emit radioactive gases.","and emit radioactive gases stunningly"
"3sq658Okvao","00:00:52","00:00:58","Stunningly, both landers reported positive results - 4000km apart from each other. As","both landers reported positive results four thousand kilometers apart from each other as a control"
"3sq658Okvao","00:00:58","00:01:04","a control, identical soil samples were first heated to 160 Celsius, in which case no response","identical soil samples were first heated to 160 celsius in which case no"
"3sq658Okvao","00:01:05","00:01:10","was observed - as you might expect if the microbes had been fried It seemed like a slam","response was observed as you might expect if the microbes had been fried it seemed like a slam dunk"
"3sq658Okvao","00:01:10","00:01:16","dunk detection of life on Mars. And yet no other Mars mission has managed to detect clear","detection of life on mars and yet no other mass mission has managed to detect clear bio signatures"
"3sq658Okvao","00:01:16","00:01:21","biosignatures, and today, the scientific consensus is that the labeled release experiment did in fact ","and today the scientific consensus is that the labelled release experiment"
"3sq658Okvao","00:01:22","00:01:23","not detect life.","did in fact not detect life"
"3sq658Okvao","00:01:24","00:01:29","It seems that every few years for at least the last half century we get another tantalizing","it seems that every few years for at least the past half a century we get another tantalizing"
"3sq658Okvao","00:01:29","00:01:34","hint of the existence of alien life. But they all seem to fizzle out - at least, we never","hint of the existence of alien life but they all seem to fizzle out at least"
"3sq658Okvao","00:01:35","00:01:41","get the grand announcement that THIS particular evidence of aliens turns out to be aliens.","we never get the grand announcement that this particular evidence of aliens turns out to be aliens so what"
"3sq658Okvao","00:01:41","00:01:46","So what happened to all of this evidence. Are any of them still credible? And what's it going","happened to all of this evidence are any of them still credible and what's it"
"3sq658Okvao","00:01:47","00:01:51","to take for scientists to decide that any given line of evidence adds up to proof. Or","gonna take for scientists to decide that any given line of evidence adds up to proof or"
"3sq658Okvao","00:01:52","00:01:55","are scientists just too skeptical for that to even happen?","are scientists just too skeptical for that to ever happen let's start"
"3sq658Okvao","00:01:55","00:01:58","Let’s start - or rather continue with our quest to find evidence of primitive life in","or rather continue with our quest to find evidence of primitive life"
"3sq658Okvao","00:01:59","00:02:03","our solar system. The Viking mission’s labeled release experiment sure looked like it had","in our solar system the viking missions labelled release experiment sure looked like it"
"3sq658Okvao","00:02:04","00:02:09","detected life. Except for one major difference. After the initial detection of these supposed","had detected life except for one major difference after the initial detection of these supposed"
"3sq658Okvao","00:02:10","00:02:14","microbe metabolites, additional shots of nutrients were injected. Now when this is done with","micro metabolites additional shots of nutrients were injected now when this is"
"3sq658Okvao","00:02:15","00:02:20","Earth samples, new bursts of gas are always observed as the microbes wake up and start","done with earth samples new bursts of gas are always observed as the microbes wake up and start feeding"
"3sq658Okvao","00:02:21","00:02:23","feeding. But not so in the Martian samples.","as the microbes wake up and start feeding but not so in the martian samples subsequent"
"3sq658Okvao","00:02:23","00:02:28","Subsequent injections of nutrients yielded no response. This came to be interpreted as","injections of nutrients yielded no response this came to be interpreted as evidence"
"3sq658Okvao","00:02:28","00:02:34","evidence that the initial reaction was NOT biological, but rather purely chemical.","that the initial reaction was not biological but rather purely chemical and nasa's 2006"
"3sq658Okvao","00:02:34","00:02:40","And NASA’s 2006 Phoenix lander found a possible culprit - perchlorate in the Martian soil.","but rather purely chemical and nasa's 2006 phoenix lander found a possible culprit perchlorate in the martian soil"
"3sq658Okvao","00:02:40","00:02:45","This toxic chemical, or its byproduct hypochlorite, would be expected to break apart the organic","this toxic chemical or its byproduct hypochlorate would be expected to break apart the organic"
"3sq658Okvao","00:02:46","00:02:51","compounds in the nutrients, producing gases that mimicked metabolites of biological activity.","compounds in the nutrients producing gases that mimics metabolites of biological activity"
"3sq658Okvao","00:02:52","00:02:58","And while microbes should multiply after feeding, a simple chemical like this would be depleted,","and while microbes should multiply after feeding and while microbes should multiply after feeding a simple chemical like this would be depleted"
"3sq658Okvao","00:02:59","00:03:03","explaining the lack of response after the first nutrient injection. Hypochlorite should","explaining the lack of response after the first nutrient injection hypochlorite the first nutrient injection hypochlorite should also be"
"3sq658Okvao","00:03:03","00:03:07","also be destroyed by high temperatures, explaining the non-detection in the control sample.","destroyed at high temperatures explaining the non-detection high temperatures explaining the non-detection in the control"
"3sq658Okvao","00:03:08","00:03:12","Let’s look as some of the other hints in our solar system. Still on Martian","sample let's look at some of the other hints in our solar system still on martian life what"
"3sq658Okvao","00:03:12","00:03:16","life, what ever happened to that supposed fossil microbe found in that Martian meteorite?","ever happened to the supposed fossil microbes found in that martian meteorite"
"3sq658Okvao","00:03:17","00:03:22","In 1996, scientists discovered elongated mineral structures that looked for all the world like","in 1996 scientists discovered elongated mineral structures that looked for all the world"
"3sq658Okvao","00:03:23","00:03:27","fossilized bacteria - but embedded deep in a Martian meteorite that had been found in","like fossilized bacteria but embedded deep in a martian meteorite that had been"
"3sq658Okvao","00:03:28","00:03:34","Antarctica. The scientists also found magnetite - a common byproducts of microbial metabolism","found in antarctica the scientists also found magnetite a common by-product of microbial metabolism which at the time had"
"3sq658Okvao","00:03:34","00:03:40","which at the time had no known abiotic source. This meteorite was special in other ways too - it","no known abiotic source this meteorite was special in other ways too"
"3sq658Okvao","00:03:41","00:03:46","had formed over 4 billion years ago, back when Mars had liquid water - in fact its geology","it had formed over four billion years ago back when mars had liquid water in fact its geology required"
"3sq658Okvao","00:03:46","00:03:52","required the presence of liquid water. This was a compelling enough hint at life that Bill Clinton made","the presence of liquid water this was a compelling enough hint at life that bill clinton made"
"3sq658Okvao","00:03:53","00:03:54","a special TV announcement.","a special tv announcement so"
"3sq658Okvao","00:03:55","00:04:01","So why don’t we count this as the discovery of life on Mars? Over the past couple of decades,","why don't we count this as the discovery of life on mars well over the past couple of decades researchers have shown"
"3sq658Okvao","00:04:01","00:04:06","researchers have shown how these same structures - the “fossils” and the magnetite can","how these same structures the fossils and the magnetite can be produced"
"3sq658Okvao","00:04:06","00:04:11","be produced by the sort of chemical reactions you might have expected to have happened in this meteorite.","by the sort of chemical reactions that you might have expected to have happened in this meteorite"
"3sq658Okvao","00:04:12","00:04:16","It’s also difficult to rule out contamination by Earth microbes - after all, the thing had","it's also difficult to rule out contamination by earth microbes after all the thing had been"
"3sq658Okvao","00:04:16","00:04:21","been buried in Antarctica for millions of years before geologists cut it open. No one","buried in antarctica all the thing had been buried in antarctica for millions of years before geologists cut it open no one"
"3sq658Okvao","00:04:21","00:04:27","has ever demonstrated convincingly that these are NOT Martian fossils - but they don’t","has ever demonstrated convincingly that these are not martian fossils but they don't need to"
"3sq658Okvao","00:04:27","00:04:33","need to. When we’re talking about the discovery of alien life, the burden of proof rests very","when you're talking about the discovery of alien life the burden of proof rests very heavily"
"3sq658Okvao","00:04:33","00:04:39","heavily on the shoulders of the discoverer. It has to be implausible that the result could be","on the shoulders of the discoverer it has to be implausible that the result could"
"3sq658Okvao","00:04:40","00:04:45","anything but life, and that’s just not the case with the would-be Martian fossils.","be anything but life and that's just not the case with the would-be martian fossils and this"
"3sq658Okvao","00:04:46","00:04:50","And this is the same reason we’re forced to reject - or at least be very cautious about - all","is the same reason that we are forced to reject or at least be very cautious about all prior"
"3sq658Okvao","00:04:51","00:04:56","prior claims of evidence of alien life. For example, the occasional spikes in methane","claims of evidence of alien life for example the occasional spikes in methane"
"3sq658Okvao","00:04:57","00:05:02","detected by the Curiosity Rover on Mars could be microbe farts, but could also be any one of a number","detected by the curiosity rover on mars could be microbe farts but could also be any one of a number of"
"3sq658Okvao","00:05:02","00:05:07","of geochemical processes. The red patterning on the surface of Jupiter’s moon Europa","geochemical processes the red patterning on the surface of jupiter's moon europa"
"3sq658Okvao","00:05:07","00:05:10","could be slime colonies, but could also be rust.","could be slime colonies but could also be rust"
"3sq658Okvao","00:05:11","00:05:16","This brings us to Venus. In September 2020 Astronomers reported the signature of phosphine","this brings us to venus in september 2020 astronomers reported the signature of phosphine in"
"3sq658Okvao","00:05:17","00:05:22","in the upper atmosphere of Venus from radio data taken with ALMA, the Atacama Large Millimeter/submillimeter","the upper atmosphere of venus from radio data taken with alma the atacama large millimeter submillimeter array phosphate"
"3sq658Okvao","00:05:22","00:05:27","Array. Phosphine is a common byproduct of biological activity on Earth, but it was difficult","is a common by-product of biological activity on earth but it was very difficult to"
"3sq658Okvao","00:05:28","00:05:32","to come up with a non-living source of so much of it on Venus. This may have generated","come up with a non-living source of so much of it on venus this may have generated"
"3sq658Okvao","00:05:33","00:05:37","the most excitement since the Martian meteorite thing. Now, we went into the details soon after","the most excitement since the martian meteorite thing now we went into the detail soon after"
"3sq658Okvao","00:05:38","00:05:43","the announcement, so today I just want to answer the question: what happened to this result?","the announcement so today i just want to answer the question what happened to this result"
"3sq658Okvao","00:05:44","00:05:50","Well, as you can imagine - for such a huge claim it sparked very careful scrutiny and","well as you can imagine for such a huge claim it sparked very careful scrutiny and analysis"
"3sq658Okvao","00:05:50","00:05:56","analysis. A few independent teams found issues with the original data processing, and their","a few independent teams found issues with the original data processing and their new analysis"
"3sq658Okvao","00:05:56","00:06:03","new analysis found little to no phosphine on Venus. The original team also re-did their analysis","found literal to no phosphine on venus the original team also redid their analysis"
"3sq658Okvao","00:06:04","00:06:09","and now claim a seven-fold lower abundance of phosphine than in the original report - placing","and now claim a seven-fold lower abundance of phosphine than in their original report placing it at the"
"3sq658Okvao","00:06:10","00:06:12","it at the level of a “tentative” detection.","level of a tentative detection so"
"3sq658Okvao","00:06:13","00:06:17","So the phosphine hasn’t quite gone away, but even if it is actually present, it’s","the phosphene hasn't quite gone away but even if it is actually present it's now much"
"3sq658Okvao","00:06:17","00:06:23","now much easier to explain with non-biological processes. Once again - the burden of proof","easier to explain with non-biological processes once again the burden of proof is on the new"
"3sq658Okvao","00:06:23","00:06:26","is on the new claim, and the evidence just doesn’t cut it.","claim and the evidence just doesn't cut it"
"3sq658Okvao","00:06:27","00:06:32","There’s a relevant quote from Sherlock Holmes on this point. ""When you have eliminated the","there's a relevant quote from sherlock holmes on this point when you have eliminated"
"3sq658Okvao","00:06:32","00:06:39","impossible, whatever remains, however improbable, must be the truth."" There’s a certain Harvard","the impossible whatever remains however improbable must be the truth now there's a certain harvard astrophysicist"
"3sq658Okvao","00:06:40","00:06:43","Astrophysicist who’s fond of saying this in reference to his many claims that some","who's fond of saying this in reference to his many claims that some"
"3sq658Okvao","00:06:44","00:06:49","new astrophysical phenomenon might be aliens. And the statement is logically correct - improbable","new astrophysical phenomenon might be aliens and the statement is logically correct improbable"
"3sq658Okvao","00:06:50","00:06:55","does beat impossible in terms of likelihood. But it’s exactly this illusion of logic","does beat impossible in terms of likelihood but it's exactly this illusion of logic"
"3sq658Okvao","00:06:56","00:07:02","that makes the Sherlock argument so misleading, and by far the most common cause of false","that makes the sherlock argument so misleading and by far the most common cause the forced declarations"
"3sq658Okvao","00:07:02","00:07:09","declarations that it must be aliens cause it couldn't be anything else. The universe is weirder that we can ever imagine, and it’s","by far the most common cause the forced declarations that it must be aliens because it couldn't be anything else the universe is weirder than we can ever imagine and it's arrogant"
"3sq658Okvao","00:07:10","00:07:13","arrogant to assume you’ve thought of every possible non-alien phenomenon that could lead","to assume that you've thought of every possible non-alien phenomenon"
"3sq658Okvao","00:07:14","00:07:16","to a particular observation","that could lead to a particular observation a great example"
"3sq658Okvao","00:07:16","00:07:20","A great example of this is ‘Oumuamua - that weird object that flew through our solar system","of this is umuamua that weird object that flew through our solar system"
"3sq658Okvao","00:07:21","00:07:26","a few years back. ‘Oumuamua appeared as a very faint, pulsing, reddish spot that slung","a few years back umuamua appeared as a very faint pulsing reddish spot that slung around the inner"
"3sq658Okvao","00:07:26","00:07:31","around inner solar system just fast enough that it most likely fell from interstellar","solar system just fast enough that it most likely fell from interstellar space"
"3sq658Okvao","00:07:31","00:07:38","space. Its pulsing was interpreted as being due to an elongated object tumbling. Besides","its pulsing was interpreted as being due to it being an elongated object tumbling besides its interstellar"
"3sq658Okvao","00:07:38","00:07:42","its interstellar origin, the weirdest thing about it was the it appeared to accelerate","origin the weirdest thing about it was that it appeared to accelerate on its way"
"3sq658Okvao","00:07:43","00:07:49","on its way out of the solar system,  in exactly the same way that comets do due to outgassing - ices vaporizing","out of the solar system in exactly the same way that comets do due to outgassing ice is vaporizing"
"3sq658Okvao","00:07:50","00:07:54","in the Sun’s radiation acting like jets. In the case of comets, this also results in","in the sun's radiation and acting like jets in the case of comets this also results"
"3sq658Okvao","00:07:55","00:08:00","classic comet tails, but Oumuamua had no tail. There was a claim by a,","in the classic comet tails but umumua had no tail there was a claim by a"
"3sq658Okvao","00:08:01","00:08:06","Harvard astrophysicist that the most likely explanation for Oumuamua is that it’s an alien artifact","harvard astrophysicist that the most likely explanation for umuamua is that it's an alien artifact"
"3sq658Okvao","00:08:07","00:08:10","- in particular a light sail - probably a broken one. Now, we covered all of this before","in particular a light sail probably a broken one now we covered all of this before"
"3sq658Okvao","00:08:11","00:08:17","- both the discovery of Oumuamua and a clarification that there are huge problems with the alien hypothesis. But why","both the discovery of umuamua and the clarification that there are huge problems with the alien hypothesis but why"
"3sq658Okvao","00:08:17","00:08:23","not aliens if there’s no accepted natural explanation? Well the answer is simple: because","not aliens if there's no accepted natural explanation well the answer is simple because there"
"3sq658Okvao","00:08:23","00:08:28","there are more things in heaven and earth than are dreamt of in your philosophy.","are more things in heaven and earth than are dreamt of in your philosophy"
"3sq658Okvao","00:08:28","00:08:34","And, lo and behold, since the publication of our video a far more reasonable explanation","and lo and behold since the publication of our video a far more reasonable explanation has"
"3sq658Okvao","00:08:34","00:08:39","has been proposed. I’m actually going to direct you to Anton Petrov’s excellent channel","been proposed i'm actually going to direct you to anton petrov's excellent channel"
"3sq658Okvao","00:08:40","00:08:44","for a really clear, in-depth analysis - but in short, Oumuamua is very well explained","for a really clear in-depth analysis but in short umuamua is very"
"3sq658Okvao","00:08:45","00:08:51","as a shard of an extra-solar ice world similar to Pluto, ejected into interstellar space","well explained as a shard of an extrasolar ice world similar to pluto ejected into interstellar space by"
"3sq658Okvao","00:08:52","00:08:57","by an impact. Pluto also has a red tinge due to radiation processing its surface methane","an impact pluto also has a red tinge due to radiation processing its surface methane into"
"3sq658Okvao","00:08:58","00:09:02","into hydrocarbons. This also explains the acceleration - it would be due to outgassing","hydrocarbons and this also explains the acceleration it will be due to outgassing"
"3sq658Okvao","00:09:03","00:09:08","of the nitrogen-ice, abundant on such worlds. That would still act as a jet, but should","of the nitrogen ice abundant on such worlds that would still act like a jet but"
"3sq658Okvao","00:09:09","00:09:15","be invisible. Now this may well not be the correct or entire explanation, but it does","should be invisible now this may well not be the correct or the entire explanation but it"
"3sq658Okvao","00:09:15","00:09:21","make it very clear that there are perfectly plausible natural explanations for 'Oumuamua.","does make it very clear that there are perfectly plausible natural explanations for amulemua"
"3sq658Okvao","00:09:21","00:09:25","Tabby’s Star is another good example of this. Perhaps you recall - the crazily dimming","tabistar is another good example perhaps you recall the crazily"
"3sq658Okvao","00:09:26","00:09:31","star discovered by Tabitha Boyajian. Some declared that it’s best explained by an","dimming star discovered by tabitha boyajian some declared that it's best explained by an"
"3sq658Okvao","00:09:32","00:09:36","alien megastructure eclipsing the star’s light. That claim was on the strength that","alien megastructure eclipsing the stars lights that claim was on the strength that no"
"3sq658Okvao","00:09:36","00:09:41","no known natural phenomenon easily explained the observations. Since then, new observations","known natural phenomena easily explained the observations since then new observations"
"3sq658Okvao","00:09:42","00:09:47","have shown that the obscuring stuff filters the star’s light i n a way consistent with","have shown that the obscuring stuff filters the star's light in a way consistent with clouds"
"3sq658Okvao","00:09:47","00:09:53","clouds of particulates - space dust, rather than an opaque object. So we’re probably","of particulates space dust rather than an opaque object so we're probably"
"3sq658Okvao","00:09:54","00:09:58","looking at a tidally disrupted exoplanet or an evaporating exomoon.","looking at a tidally disrupted exoplanet or an evaporating exomoon"
"3sq658Okvao","00:09:59","00:10:03","OK, so all of this is a bit of a bummer if you really want it to be aliens. Let’s get to ","okay so all this is a bit of a bummer if you really want it to be aliens"
"3sq658Okvao","00:10:03","00:10:09","some hints that don’t yet have satisfactory natural explanations. Many of you have heard","let's get to some hints that don't yet have satisfactory natural explanations many of"
"3sq658Okvao","00:10:10","00:10:15","of the WOW signal. This was a weird spike of radio emission detected by the Big Ear","you have heard of the wow signal this was a weird spike of radio emission detected by the big ear radio telescope"
"3sq658Okvao","00:10:15","00:10:20","radio telescope at Ohio State University. There was one idea that a pair of comets were","at ohio state university there was one idea that a pair of comets"
"3sq658Okvao","00:10:21","00:10:24","in the radio beam at the time, but the Ohio State astronomers insist that those comets","were in the radio beam at the time but the ohio state astronomers insisted those"
"3sq658Okvao","00:10:25","00:10:30","were not in the beam at all. No other straightforward, generally accepted explanation has emerged.","comets were not in the beam at all no other straightforward generally accepted explanation has emerged"
"3sq658Okvao","00:10:31","00:10:35","Nor has such a signal ever been seen again.","nor has such a signal ever been seen again or has it"
"3sq658Okvao","00:10:35","00:10:42","Or has it? On April 29th, 2019 the Parkes Radio Telescope in Australia was studying the","on april 29 2019 the parks radio telescope in australia was studying the"
"3sq658Okvao","00:10:42","00:10:48","flare activity of Proxima Centauri - our nearest stellar neighbor. A sharp spike of radio emission","flare activity of proxima centauri our nearest stellar neighbor a sharp spike of radio emission"
"3sq658Okvao","00:10:49","00:10:57","appeared at 982.002 MHz and then drifted upwards in frequency over a 3 hour observation. This","appeared at 982.002 megahertz appeared at 982.002 megahertz and then drifted upwards in frequency over a three-hour observation this weird"
