"video_id","min_timecode","max_timecode","text.user","text.auto"
"m6TW35oIefE","00:09:44","00:09:48","But boy do they taste good. All the protein you need to become a human.","but boy do they taste good all the protein you need to become a human the next day"
"m6TW35oIefE","00:09:48","00:09:50","The next day, the kids take Alasdair to meet PG.","the kids take alistar to meet pg they"
"m6TW35oIefE","00:09:51","00:09:56","They bring a CRT TV, which, along with the lack of cell phones and an earlier discussion about an N64 game,","bring a crt tv which along with the lack of cell phones and an earlier discussion about an n64"
"m6TW35oIefE","00:09:57","00:10:00","are our indications that this movie takes place in the 90s.","game are our indications that this movie takes place in the 90s that"
"m6TW35oIefE","00:10:01","00:10:03","That feeds into the nostalgia factor Kostanski was going for.","feeds into the nostalgia factor kostansky was going for"
"m6TW35oIefE","00:10:03","00:10:06","In addition to the TV, Mimi also brings PG magazines","in addition to the tv mimi also brings pg magazines"
"m6TW35oIefE","00:10:07","00:10:08","""Look at all the hunky boys!""","look at all the hunky boys i"
"m6TW35oIefE","00:10:09","00:10:15","""I do not care for 'hunky boys'!"" *low strings* * bass hits*","do not care for hunky"
"m6TW35oIefE","00:10:16","00:10:18","""...or do I?""","boys ha"
"m6TW35oIefE","00:10:19","00:10:20","Hah! We stan a bicurious king.","we stand a bicurious king"
"m6TW35oIefE","00:10:21","00:10:25","At Luke's inquiry and Mimi's command, PG sits down to tell them his backstory:","at luke's inquiry and mimi's command pg sits down to tell them his backstory he was"
"m6TW35oIefE","00:10:26","00:10:31","He was born before time on the planet of Gigex, where he and his race were enslaved by the ruthless Templars.","born before time on the planet of gygax where he and his race were enslaved by the ruthless templars the"
"m6TW35oIefE","00:10:32","00:10:37","The Templars forced them to build their pyramid shrines, until one day PG came across the Gem of, uh, Peroxide.","templars forced them to build their pyramid shrines until one day pg came across the gem of peroxide"
"m6TW35oIefE","00:10:38","00:10:44","It gave him the power to liberate his people with glowy eyes,  and I'll kill count 7 Templars that he's standing atop in a heap here,","it gave him the power to liberate his people with glowy eyes and i'll kill count seven templars that he's standing atop in a heap here as well"
"m6TW35oIefE","00:10:45","00:10:49","as well as this 8th one whose head gets DECIMATED WITH A PUNCH! FLAMES OF AWESOMENESS!","as this eighth one whose head gets decimated with a punch flames of awesomeness"
"m6TW35oIefE","00:10:50","00:10:55","With his powers, PG took control of Gigex, then traveled to other planets to kill indiscriminately.","with his powers pg took control of gigex then traveled to other planets to kill indiscriminately i'll"
"m6TW35oIefE","00:10:56","00:11:02","I'll count a whopping 55 kills here as PG goes about his goal of killing every living thing in the universe.","count a whopping 55 i'll count a whopping 55 kills here as pg goes about his goal of killing every living thing in the universe sure 50"
"m6TW35oIefE","00:11:02","00:11:07","Sure, 50 of them are these background bodies on stakes, but they're still countable! Yknow, kinda!","of them are these background bodies on stakes but they're still countable you know kind of"
"m6TW35oIefE","00:11:07","00:11:17","To stop this destructive force, the Templars imprisoned PG with the Gem of, ah, Pera- Pericles. He stayed in this  Terran prison cell until he was released by these idiot kids.","to stop this destructive force the templars imprisoned pg with the gem of pericles he stayed in this terran prison cell until he was released by these idiot kids the flashback"
"m6TW35oIefE","00:11:17","00:11:25","The flashback story segment is my favorite sequence of the movie due to its extensive use of green screens, stop motion and miniatures.","story segment is my favorite sequence of the movie due to its extensive use of green screens stop motion and miniatures i'm always"
"m6TW35oIefE","00:11:25","00:11:31","I'm always impressed by detailed miniatures like these, which were shot by cinematographers Andrew Appelle and Pierce Derks.","impressed by detailed miniatures like these which were shot by cinematographers andrew appel and pierce dirks it's so"
"m6TW35oIefE","00:11:31","00:11:38","It's so fucking cool how you can make these creations look like a stormy planet with simple tricks like the use of a spritz bottle.","fucking cool how you can make these creations look like a stormy planet with simple tricks like the use of a spritz bottle these practical"
"m6TW35oIefE","00:11:38","00:11:45","These practical effects, which were mostly done in Kostanski's workshop,  evoke his earlier film Manborg, which took him 3 years to make.","effects which were mostly done in kostansky's workshop evoke his earlier film manbork which took him three years to make"
"m6TW35oIefE","00:11:45","00:11:50","After Mimi and the boys leave for the night, PG tunes the TV to channel Blood Oh One.","after mimi and the boys leave for the night pg tunes the tv to channel blood 01. this puts"
"m6TW35oIefE","00:11:51","00:11:55","This puts him in contact with his loyal generals,  whom he tells to come to Earth and kill the kids.  ","him in contact with his loyal generals whom he tells to come to earth and kill the kids"
"m6TW35oIefE","00:11:56","00:12:00","Luke has Alasdair over for a microwave chicken dinner prepared by their ruthlessly inept father.  ","luke has alistair over for a microwave chicken dinner prepared by their ruthlessly inept father"
"m6TW35oIefE","00:12:01","00:12:05","Greg is my least favorite character of the film, but he does get a funny line in here","greg is my least favorite character of the film but he does get a funny line in here back"
"m6TW35oIefE","00:12:05","00:12:11","""Back when I was in the army, we used to play 'guns' all the time. Except it was called the Iraq War... and you played for keeps.""","when i was in the army we used to play guns all the time except it was called the iraq war and you played for keeps"
"m6TW35oIefE","00:12:12","00:12:16","The rest of his lines feel more like an actor trying to be funny than an actual person who IS funny.","the rest of his lines feel more like an actor trying to be funny than an actual person who"
"m6TW35oIefE","00:12:17","00:12:22","Like, he'd work as a character in a 3 minute BriTaNiK video, but not in a feature length film.","is funny like he'd work as a character in a three-minute britannic video but not in a feature lane film"
"m6TW35oIefE","00:12:22","00:12:28","Greg was written specifically for actor Adam Brooks, who co-founded Astron-6 with Jeremy Gillespie in 2007.","greg was written specifically for actor adam brooks who co-founded astron 6 with jeremy gillespie in 2007."
"m6TW35oIefE","00:12:29","00:12:35","Kostanski and Brooks describe Greg as 'charming and pathetic,' which is an assessment I sadly only half-agree with.","kostansky and brooks described greg as charming and pathetic which is an assessment i sadly only half agree"
"m6TW35oIefE","00:12:36","00:12:42","Shunned by Alasdair and Luke wanting to play without her, Mimi uses her gemmy to call for a friendy, and eventually PG arrives.","with shunned by alistair and luke wanting to play without her mimi uses her jemmy to call for a frendy and eventually pg arrives"
"m6TW35oIefE","00:12:43","00:12:51","Mimi asks him to quote, 'make Alasdair less of a dork', and PG's idea of granting that wish is to turn Alasdair into a giant brain with googly eyes.  ","mimi asks him to quote make alistar less of a dork and pg's idea of granting that wish is to turn alistar into a giant brain with googly eyes"
"m6TW35oIefE","00:12:51","00:12:53","Susan and the cowardly Greg wind up outside,","susan and the cowardly greg wind up outside"
"m6TW35oIefE","00:12:54","00:13:00","and though PG promises to one day murder them with the hatred of a thousand suns, at the moment, Mimi is still in control,  ","and though pg promises to one day murder them with the hatred of a thousand sons at the moment mimi is still in control and"
"m6TW35oIefE","00:13:01","00:13:03","and she promises her parents that he's really a big softy.","she promises her parents that he's really a big softy"
"m6TW35oIefE","00:13:04","00:13:06","""Don't worry."" ""BE worried!""","don't worry be worried if we really want to"
"m6TW35oIefE","00:13:06","00:13:12","If we really wanna soften PG up, we're gonna need a montage -  to the most cringeworthy song I've ever heard","soften pg up we're going to need a montage to the most cringe-worthy song i've ever heard"
"m6TW35oIefE","00:13:13","00:13:17","♪ ""I'm the heckin' best! Yeah, yeah, yeah!"" ♪","[Applause]"
"m6TW35oIefE","00:13:18","00:13:18","Oof.","oh i get what they're going"
"m6TW35oIefE","00:13:18","00:13:24","I get what they're going for, but hearing 'heckin' and 'frig you' over and over is just not my sense of humor.","for but hearing heckin and friggy over and over is just not my sense of humor i"
"m6TW35oIefE","00:13:25","00:13:26","I hate cutesy cuss subs.","hate cutesy cuss subs just say"
"m6TW35oIefE","00:13:27","00:13:34","It's not all bad though - I get a good laugh outta PG killing a heckling kid by blowing her up with his alien MIND BULLETS.","fuck it's not all bad though i get a good laugh out of pg killing a heckling kid by blowing her up with his alien mind bonus after"
"m6TW35oIefE","00:13:35","00:13:40","After well-worn jokes and Disney Channel Style Head Peaking, the try-too-hard trio has a fried food break.","well-worn jokes and disney channel style head peeking the try too hard trio has a fried food break and"
"m6TW35oIefE","00:13:41","00:13:43","And lemme tell ya, those Gigex know how to eat!","let me tell you those guy guys know how to eat pg"
"m6TW35oIefE","00:13:44","00:13:47","PG takes special note of Mimi's continued assholery towards Luke,","takes special note of mimi's continued assholery special note of mimi's continued assholery towards luke and in an effort"
"m6TW35oIefE","00:13:47","00:13:53","and in an effort to divorce her from the gem, he attempts to exploit Luke's unhappiness by visiting him in a dream.","to divorce her from the gem he attempts to exploit luke's unhappiness by visiting him in a dream i love the shot"
"m6TW35oIefE","00:13:53","00:13:58","I love the shot of Luke waking up in his bed in a cemetary as a direct homage to a similar shot in Phantasm,","of luke waking up in his bed in a cemetery as a direct homage to a similar shot in phantasm"
"m6TW35oIefE","00:13:59","00:14:03","AND I love that the reference is underlined when PG makes his entrance.","and i love that the reference is underlined when pg makes his entrance"
"m6TW35oIefE","00:14:03","00:14:04","""Boy...""","that"
"m6TW35oIefE","00:14:04","00:14:07","That is a Tall Man 'Boy' to a T... er, B","is a tall man boy to a t or b"
"m6TW35oIefE","00:14:08","00:14:08","""Boy..!""","boy that is a tall man boy to a t or b boy"
"m6TW35oIefE","00:14:09","00:14:10","*modulated deep voice* Boyyy!","pg"
"m6TW35oIefE","00:14:10","00:14:15","PG tells Luke to steal the gem from Mimi because she's a little fucking monster who treats him like shit!","tells luke to steal the gem from mimi because she's a little fucking monster who treats him like shit how long"
"m6TW35oIefE","00:14:15","00:14:19","""How long before she puts her life... before yours?""","before she puts her life before yours"
"m6TW35oIefE","00:14:20","00:14:25","This is the closest the plot comes to being interesting, in my opinion, but I don't think there's ever any satisfactory pay-off.","this is the closest the plot comes to being interesting in my opinion but i don't think there's ever any satisfactory payoff"
"m6TW35oIefE","00:14:26","00:14:32","I do enjoy the ending to this sequence though, with its long awkward silence while zombies wriggle around in the dirt.","i do enjoy the ending to the sequence though with its long awkward silence while zombies wriggle around in the dirt mimi tries to"
"m6TW35oIefE","00:14:33","00:14:41","Mimi tries to teach PG the rules of Crazyball, but since it takes a whole montage to explain, they're barely finished when the 5-0 arrive - and PG HATES 5-0.","teach pg the rules of crazy ball but since it takes a whole montage to explain they're barely finished when the 5-0 arrives and pg hates 5-0"
"m6TW35oIefE","00:14:42","00:14:49","He grabs Officer Vince and fuses to him like a Cronenberg, and his blast of ancient galactic truths is enough to turn the cop into a melty moany mess","he grabs officer vince and fuses to him like a cronenberg and his blast of ancient galactic troops is enough to turn the cop into a melty moaning"
"m6TW35oIefE","00:14:50","00:14:52","*agonized moans, garbled*","mask he"
"m6TW35oIefE","00:14:52","00:14:54","*chuckles* He sounds like that Batman YTMND.","sounds like that batman ytm d"
"m6TW35oIefE","00:14:55","00:14:56","*garbled nonsense*","pg"
"m6TW35oIefE","00:14:57","00:15:03","PG sends the other cop to spread word of his presence while his partner is left being a sorry son-of-a-shambler. He doesn't like it.","sends the other cop to spread word of his presence while his partner is left being a sorry son of a shambler he doesn't like it this character"
"m6TW35oIefE","00:15:03","00:15:09","This character is actually Bio-Cop, the subject of a fake movie trailer made by Kostanski back in 2011.","is actually biopop the subject of a fake movie trailer made by kastansky back in 2011. i mean"
"m6TW35oIefE","00:15:09","00:15:11","""I mean, I didn't need to put Bio-Cop in the movie...","i didn't need to put biocop in the movie"
"m6TW35oIefE","00:15:12","00:15:12","","but"
"m6TW35oIefE","00:15:12","00:15:15","but I had to put Bio-Cop in the movie.""","i had to put biocop in the movie the biocop"
"m6TW35oIefE","00:15:15","00:15:23","The Bio-Cop trailer was included on the DVD of Manborg, and the guy who played Bio-Cop then, Robert Homer, reprised the role here nearly a decade later.","trailer was included on the dvd of manborg and the guy who played biocop then robert homer reprised the role here nearly a decade later"
"m6TW35oIefE","00:15:24","00:15:25","I thought that was really cool.","i thought that was really cool at the"
"m6TW35oIefE","00:15:25","00:15:32","At the police station, Officer Dennis is relaying his brush with the Archduke of Nightmares when Pandora arrives in her brand new human form.","police station officer dennis is relaying his brush with the archduke of nightmares when pandora arrives in her brand new human form"
"m6TW35oIefE","00:15:33","00:15:35","She extracts the info she needs from the police officer's head,","she extracts the info she needs from the police officer's head"
"m6TW35oIefE","00:15:36","00:15:42","and considering her track record with humans, I'm gonna assume this kills the man, even though we cut away before it can be confirmed.","and considering her track record with humans i'm gonna assume this kills the man even though we cut away before it can be confirmed a"
"m6TW35oIefE","00:15:43","00:15:48","A minor dispute in the woods leads Mimi to ordering Luke's death at the hands of PG, and though she calls it off -","minor dispute in the woods leads mimi to ordering luke's death at the hands of pg and though she calls it off"
"m6TW35oIefE","00:15:49","00:15:55","this was just a 'power is power' kind of moment -  it's worrisome enough for Luke to begin considering PG's dream overture.","this was just a power is power kind of moment it's worrisome enough for luke to begin considering pg's dream overture"
"m6TW35oIefE","00:15:55","00:16:00","A bunch of lightening strikes touch down in front of them, each transporting a new fanciful being -","a bunch of lightning strikes touched down in front of them each transporting a new fanciful being these are"
"m6TW35oIefE","00:16:00","00:16:07","these are PG's loyal generals, the Paladins Obsidian, and he's called them here to kill the kids and finally set him free.","pg's loyal generals the paladin's obsidian and he's called them here to kill the kids and finally set him free to his"
"m6TW35oIefE","00:16:07","00:16:12","To his dismay, they instead laugh in his face, and say that things are much better without him in charge.","dismay they instead laugh in his face and say that things are much better without him in charge"
"m6TW35oIefE","00:16:13","00:16:16","""We take turns as the appointed leader so everyone gets a fair chance.""","we take turns as the appointed leader so everyone gets adventure"
"m6TW35oIefE","00:16:17","00:16:19","""As you can see, it is currently my turn.""","as you can see it is currently my turn the paladin's"
"m6TW35oIefE","00:16:19","00:16:23","The Paladins Obsidian are another kick-ass part of Psycho Goreman -","obsidian are another kickass part of psycho gorman their"
"m6TW35oIefE","00:16:23","00:16:26","their specific and unique character designs remind me of Venture Brothers,","specific and unique character designs remind me of venture"
"m6TW35oIefE","00:16:27","00:16:31","where idiosyncratic characters are sometimes constructed out of a single joke.","brothers where idiosyncratic characters are sometimes constructed out of a single joke like this robot"
"m6TW35oIefE","00:16:31","00:16:36","Like this robot pirate, Cassius 3000, who's played by Astron-6 member Conor Sweeney.","pirate cassius 3000 who's played by astron 6 member connor sweeney or their"
"m6TW35oIefE","00:16:37","00:16:41","Or their leader, Darkscream, who looks like he'd eat a hobbit - or, yknow, at least their legs.","leader dark scream who looks like you need a hobbit or you know at least their legs they"
"m6TW35oIefE","00:16:41","00:16:42","They don't need those.","don't need those"
"m6TW35oIefE","00:16:42","00:16:45","Or this Mr. Bucket-lookin bastard, who's named Death Trapper.","or this mr bucket looking bastard who's named death trapper"
"m6TW35oIefE","00:16:46","00:16:51","His backstory is that he collects bodies from the battlefield and melts them down to shoot out of his arm cannons.","his backstory is that he collects bodies from the battlefield and melts them down to shoot out of his arm cannon"
"m6TW35oIefE","00:16:52","00:16:55","He's voiced by Rich Evans of RedLetterMedia, which Kostanski is a big fan of.","he's voiced by rich evans of red letter media which kastadsky is a big fan"
"m6TW35oIefE","00:16:56","00:17:01","Mimi, mad that PG was trying to kill them, orders him not to defend himself against this slow-motion ass-beating.","of mimi mad that pg was trying to kill them orders him not to defend himself against the slow motion ass beating"
"m6TW35oIefE","00:17:02","00:17:07","I hate that they re-use two jokes in this scene, both of which are more of the movie commenting on itself:","i hate that they reused two jokes in this scene both of which are more of the movie commenting on itself how"
"m6TW35oIefE","00:17:08","00:17:09","""How long is this gonna go on for?""","long is this going to go on for luke"
"m6TW35oIefE","00:17:09","00:17:12","Luke JUST asked that during the Phantasm dream scene!","just asked that during the phantasm dream scene"
"m6TW35oIefE","00:17:13","00:17:18","They also re-use the joke they did with Crazy Ball, where the action zooms out to show an awkward objective shot.","they also reused the joke they did with crazy ball where the action zooms out to show an awkward objective shot"
"m6TW35oIefE","00:17:24","00:17:26","I wish this movie's humor was a little less obvious,","i wish this movie's humor was a little less obvious"
"m6TW35oIefE","00:17:27","00:17:30","but at the same time, this scene is a triumph of practical effects.","but at the same time this scene is a triumph of practical effects getting"
"m6TW35oIefE","00:17:30","00:17:36","Getting all these costumes and effects to work properly is NOT an easy thing to do, especially with a low budget.","all these costumes and effects to work properly is not an easy thing to do especially with a low budget"
"m6TW35oIefE","00:17:37","00:17:40","Fight choreographer Alex Chung, who also plays the lead Paladin, Darkscream,  ","fight choreographer alex chung who also plays the lead paladin dark scream put"
"m6TW35oIefE","00:17:40","00:17:44","put a ton of work into making sure everything ran smoothly the day of the shoot -","a ton of work into making sure everything ran smoothly the day of the shoot"
"m6TW35oIefE","00:17:45","00:17:48","in fact, they did pre-visualization for the entire fight first,","in fact they did pre-visualization for the entire fight first"
"m6TW35oIefE","00:17:49","00:17:52","mapping out each individual shot to know how it'd all fit together.","mapping out each individual shot to know how it all fit together chung specifically"
"m6TW35oIefE","00:17:52","00:17:55","Chung specifically requested they work in a so-called 'Guyver kick',","requested they work in a so-called gyver kick"
"m6TW35oIefE","00:17:56","00:17:59","named after the Guyver films which served as an inspiration for Psycho Goreman -","named after the guyver films which served as an inspiration for psycho gore"
"m6TW35oIefE","00:18:00","00:18:06","Kostanski loved how Guyver 2 was like an R-rated Power Rangers,  and he sought to re-create that tokusatsu style here.","man kastadsky inspiration for psycho gore man kastadsky loved how geivor 2 was like an r rated power rangers and he sought to recreate that tokusatsu style here"
"m6TW35oIefE","00:18:06","00:18:09","Thus all the sparks accompanying sword strikes.","thus all the sparks accompanying sword strikes after"
"m6TW35oIefE","00:18:09","00:18:14","After Mimi wrings an apology out of PG, she lets him get up and give my graphics creator something to do.","mimi rings an apology out of pg she lets him get up and give my graphics creator something to do"
"m6TW35oIefE","00:18:15","00:18:19","First, PG quickly murders Death Trapper with a single archdukian punch.","first pg quickly murders death trapper with a single archdukey and punch as the kids"
"m6TW35oIefE","00:18:20","00:18:27","As the kids watch with detached snack-eating - uch - this Witchmaster lady uses her staff to tear off PG's head, hell yeah!","watch with detached snack eating this witch master lady uses her staff to tear off pg's head hell yeah but it unsevers"
"m6TW35oIefE","00:18:27","00:18:34","But it un-severs itself in no time and PG shows her how it's supposed to be done by making her body disappear and leaving her as just a head.","itself in no time and pg shows her how it's supposed to be done by making her body disappear and leaving her as just a hand pg"
"m6TW35oIefE","00:18:35","00:18:40","PG stabs Vince the cop in the eyes with the Witchmasters broken staff, finally put him out of his misery -","stabs vince the cop in the eyes with the witch master's broken staff finally putting him out of his misery nice little"
"m6TW35oIefE","00:18:40","00:18:43","nice little gift, since it turns out it was the poor dude's birthday.","gift since it turns out it was the poor dude's birthday"
"m6TW35oIefE","00:18:44","00:18:48","PG then turns to the Medusa-like Queen Obelisk and rips out the rose she has for a heart.","pg then turns to the medusa-like queen obelisk and rips out the rose she has for a heart"
"m6TW35oIefE","00:18:49","00:18:51","That's enough to make her blow up into masonry bits.","that's enough to make her blow up into masonry bits and for"
"m6TW35oIefE","00:18:51","00:18:58","And for Cassius 3000, PG uses a pool of eternal darkness to make the android pirate realize some universal truths.","cassius 3000 pg uses a pool of eternal darkness to make the android pirate realize some universal"
"m6TW35oIefE","00:18:59","00:19:03","Then a hand reaches out of it and rips the guy's face off. Love those googly eyes!","truths then a hand reaches out of it and rips the guy's face off love those googly eyes dark scream is"
"m6TW35oIefE","00:19:03","00:19:06","Darkscream is saved for last, and PG gives him a warrior's death -","saved for last and pg gives him a warrior's dab which"
"m6TW35oIefE","00:19:07","00:19:15","which in Gigex terms, means eating him whole with his giant expansive mouth.  Yo, I thought this was sci fi HORROR, not sci fi VORE!","in geigex terms means eating him whole with his giant expansive mouth yo i thought this was sci-fi whore not sci-fi more after the battle pg"
"m6TW35oIefE","00:19:15","00:19:17","After the battle, PG finds himself weakened","finds himself weakened"
"m6TW35oIefE","00:19:18","00:19:18","""I'm dying.""","i'm dying what"
"m6TW35oIefE","00:19:19","00:19:19","Both kids: ""What!?""","turns"
"m6TW35oIefE","00:19:19","00:19:23","Turns out the Paladins used cursed weapons and now PG's losin Pepto Bismol fast.","out the paladins used cursed weapons and now pg's losing pepto-bismol"
"m6TW35oIefE","00:19:24","00:19:29","He sends a screaming telegram to Greg on the shitter, yelling that he needs help and giving him directions where to go.","fast he sends a screaming telegram to greg on the shitter yelling that he needs help and giving him directions where"
"m6TW35oIefE","00:19:30","00:19:37","It's an extended bit that goes on for way too long, just like the argument Greg and Susan had in the scene right before this one.","to go it's an extended bit that goes on for way too long just like the argument greg and susan had in the scene right before this one they were fighting over"
"m6TW35oIefE","00:19:37","00:19:41","They were fighting over Greg's laziness,  which is just too over the top for me to find funny","greg's laziness which is just too over the top for me to find funny"
