"video_id","min_timecode","max_timecode","text.user","text.auto"
"m6TW35oIefE","00:19:42","00:19:43","""Oh yeah, I bought a new TV.","oh yeah i bought a new tv in"
"m6TW35oIefE","00:19:44","00:19:49","In other news, I'm gonna take a couple weeks off work 'til my hand can heal completely, so you might wanna pick up a few extra shifts at the pharmacy.""","other news i'm gonna take a couple weeks off work till my hand can heal completely so you might want to pick up a few extra shifts at the pharmacy"
"m6TW35oIefE","00:19:50","00:19:51","That's not real human behavior!","that's not real human behavior"
"m6TW35oIefE","00:19:52","00:19:59","Greg helps pick up PG and on the way back home, runs over the Witchmaster's head as it's rolling down the road, finally putting her on the kill count.","greg helps pick up pg and on the way back home runs over the witch master's head as it's rolling down the road finally putting her on the kill count when they get"
"m6TW35oIefE","00:20:00","00:20:04","When they get home, they find Susan waiting with Pandora, and the battle lines are drawn between good and evil.","home they find susan waiting with pandora and the battle lines are drawn between good and evil"
"m6TW35oIefE","00:20:05","00:20:13","Since Mimi friggin sucks, Luke hightails it to the Templar side, but because their parents hate each other so much, Greg decides to spite Susan.","since mimi friggin sucks luke hightails it to the templar side but because their parents hate each other so much greg decides to spite susan he signs with mimi"
"m6TW35oIefE","00:20:13","00:20:17","He sides with Mimi and PG and they all drive off together to the old shoe mill.","and pg and they all drive off together to the old shoe mill there mimi"
"m6TW35oIefE","00:20:17","00:20:22","There, Mimi wraps PG up in her finest cow-print blankie.  Ha ha, what'd that be, a ba-moo-sh-ka?","wraps pg up in her finest cow print blankie would that be a bamushka"
"m6TW35oIefE","00:20:23","00:20:26","The movie GRINDS to a halt with two painfully unfunny scenes -","the movie grinds to a halt with two painfully unfunny scenes"
"m6TW35oIefE","00:20:27","00:20:34","one, wherein Greg tells a childhood story and another where Mimi pretends to pray only to break a crucifix in the name of Psycho Goreman.","one wherein greg tells a childhood story and another where mimi pretends to pray only to break a crucifix in the name of psycho gorman"
"m6TW35oIefE","00:20:35","00:20:41","Back at home, Pandora reverts to her natural form and invites Susan to become like her by drinking a little Templar Tonic.","back at home pandora reverts to her natural form and invites susan to become like her by drinking a little templar tonic it's"
"m6TW35oIefE","00:20:42","00:20:45","""It's time for you to stand beside me and right the wrongs of this universe.""","time for you to stand beside me and write the wrongs of this universe"
"m6TW35oIefE","00:20:46","00:20:46","",""
"m6TW35oIefE","00:20:47","00:20:47","""...I'll drink to that.""","i'll drink to that"
"m6TW35oIefE","00:20:48","00:20:52","Pandora busts into the shoe factory followed by Susan in her new metallic get-up.","pandora busts into the shoe factory followed by susan in her new metallic get up luke's"
"m6TW35oIefE","00:20:53","00:20:54","Luke's here too, and he's got the gem. Cool.","here too and he's got the gem"
"m6TW35oIefE","00:20:55","00:20:59","Now let's everybody pair up so we can get through this climactic fight scene, k?","cool now let's everybody pair up so we can get through the climactic fight scene okay all three of the lady"
"m6TW35oIefE","00:20:59","00:21:06","All 3 of the lady combatants gain their respective upper hands, but PG invokes some ancient rules, and the quarrel comes down to a game of Crazy Ball -","combatants gain their respective upper hands but pg invokes some ancient rules and the quarrel comes down to a game of crazy"
"m6TW35oIefE","00:21:07","00:21:10","in Mimi's words, 'Team Suck' versus 'Team Hero'.","ball in mimi's words team suck vs team hero right on par"
"m6TW35oIefE","00:21:10","00:21:17","Right on par with the rest of the movie, this climax is a senseless montage of style over substance - all jokes, no plot","with the rest of the movie this climax is a senseless montage of style over substance all jokes no plot 5"
"m6TW35oIefE","00:21:18","00:21:19","""Five point butt bonus!"" *PG laughs victoriously*","style over substance all jokes no plot 5 bonus with a switcheroo"
"m6TW35oIefE","00:21:19","00:21:22","With a switcheroo and a gut punch, Mimi wins the game for Team Hero,","and a gut punch mimi wins the game for team hero"
"m6TW35oIefE","00:21:23","00:21:27","but turns out all that bullshit was pointless because Pandora goes to kill PG anyway.","but turns out all that bullshit was pointless because pandora goes to kill pg anyway"
"m6TW35oIefE","00:21:28","00:21:35","As Susan holds off the Templar to protect her kids, Luke goes for a heartfelt moment and tries to get Mimi to see how fucking annoying she is.","as susan holds off the templar to protect her kids luke goes for a heartfelt moment and tries to get mimi to see how fucking annoying she is"
"m6TW35oIefE","00:21:35","00:21:42","Instead of an apology or a real character moment, she instead does a downtempo acoustic version of that awful Frig Off song.","instead of an apology or a real character moment she instead does a down tempo acoustic version of that awful freak off song"
"m6TW35oIefE","00:21:43","00:21:44","Luke likes it, I guess, and hands over the gem.","luke likes it i guess and hands"
"m6TW35oIefE","00:21:45","00:21:52","Pandora strips Susan of her Templar powers, so she finds herself solo fighting a newly-empowered Psycho Goreman - now with batteries included!","over the gem pandora strips susan of her templar powers so she finds herself solo fighting a newly empowered psycho gore man now with batteries included"
"m6TW35oIefE","00:21:53","00:21:58","PG strafes past Pandora a bunch until he's collected enough body parts to make himself a weapon.","pg strafes past pandora on munch until he's collected enough body parts to make himself a weapon it's now time"
"m6TW35oIefE","00:21:58","00:22:01","It's now time for a, quote, 'Masters of the Universe' style sword fight,","for a quote masters of the universe style sword fight"
"m6TW35oIefE","00:22:02","00:22:09","which was once again choreographed by Alex Chung for the two suit performers: Matthew Ninabar and Kristen MacCulloch, who plays Pandora in her true form.","which was once again choreographed by alex chung for the two suit performers matthew neneber and kristen mcculloch who plays pandora in her true"
"m6TW35oIefE","00:22:10","00:22:15","MacCulloch had an added difficulty when it came to wearing her suit: the fact that Pandora's eyes are a pair of wings,","form mcculloch had an added difficulty when it came to wearing her suit the fact that pandora's eyes are a pair of"
"m6TW35oIefE","00:22:16","00:22:23","a great idea courtesy of concept artist Aurelio Mazzara, but which made it difficult for her to maneuver around safely on set.","wings a great idea courtesy of concept artist aurelio mazara but which made it difficult for her to maneuver around safely on set as"
"m6TW35oIefE","00:22:24","00:22:27","As the two of them fight, Mimi finally gets around to apologizing -","the two of them fight mimi finally gets around to apologizing"
"m6TW35oIefE","00:22:27","00:22:31","although she doesn't do it verbally, she only knocks it out in their code language.","although she doesn't do it verbally she only knocks it out in their code language that's"
"m6TW35oIefE","00:22:31","00:22:33","That's not good enough, Luke, quit enabling her!","not good enough luke quit enabling her during"
"m6TW35oIefE","00:22:34","00:22:38","During the fight, Pandora ruins PG's hunky boys, giving him the strength to defeat her in battle.","the fight pandora ruins pg's hunky boys giving him the strength to defeat her in battle"
"m6TW35oIefE","00:22:39","00:22:43","He then gives her a warrior's death, a sight that those parents are better off not seeing.","he then gives her a warrior's death a sight that those parents are better off not seeing"
"m6TW35oIefE","00:22:44","00:22:50","Thanks to Mimi, the unspeakable evil has triumphed, and PG agrees to spare her family as he sets out to conquer and murder.","thanks to mimi the unspeakable evil has triumphed and pg agrees to spare her family as he sets out to conquer and murder"
"m6TW35oIefE","00:22:51","00:22:52","Okay, kisses for chaos!","okay kisses for chaos i do love"
"m6TW35oIefE","00:22:53","00:22:56","I do love him hopping through a portal and starting wholesale destruction willy nilly.","him hopping through a portal and starting wholesale destruction willy-nilly"
"m6TW35oIefE","00:22:57","00:23:04","The movie ends with a news report about a giant Psycho Goreman destroying the world - though there are thankfully no clearly broadcasted kills for me to count.","the movie ends with a news report about a giant psycho gore man destroying the world though there are thankfully no clearly broadcasted kills for me to count"
"m6TW35oIefE","00:23:05","00:23:13","The credits play over a supper time scene reminding us of Alasdair's unfortunate state, with his mom played by Kristen MacCulloch, Pandora's actor, out of the suit.","the credits play over a supper time scene reminding us of alistar's unfortunate state with his mom played by kristin mcculloch pandora's actor out of the suit how"
"m6TW35oIefE","00:23:13","00:23:16","How many people died in PG: Psycho Goreman?","many people died in pg psycho gore man"
"m6TW35oIefE","00:23:17","00:23:24","*modulated deep voice* The answer reminds me of a time when I counted kills on the planet Gigex while avoiding laser eyes from the invasive Lucy Monster.","the answer reminds me of a time when i counted kills on the planet guy decks while avoiding laser rise from the invasive new sea monster"
"m6TW35oIefE","00:23:25","00:23:29","*intense metal swells* Using the Gem of.. uh, Proximity, I was able to increase my size.","laser rise from the invasive new sea monster using the gem of proximity i was able to increase my size i managed"
"m6TW35oIefE","00:23:29","00:23:31","I managed to tame the beast, when all of a sudden!-","to tame the beast when all of a sudden"
"m6TW35oIefE","00:23:32","00:23:34","Wait. What was I talking about? Oh, yeah. The numbers.","wait what was i talking about oh yeah the"
"m6TW35oIefE","00:23:35","00:23:38","","numbers"
"m6TW35oIefE","00:23:39","00:23:42","By my count, there were 76 deaths in Psycho Goreman.","by my count there were 76 deaths in psycho gourmand the victims"
"m6TW35oIefE","00:23:42","00:23:51","The victims included men, women, children, templars, orcs, Misters Bucket, and plenty more, so don't even think about touchin that pie chart -","included men women children templars orcs mrs bucket and plenty more so don't even think about touching that pie chart it is full"
"m6TW35oIefE","00:23:51","00:23:53","it is FULL of purply space stuff.","of purpley space stuff"
"m6TW35oIefE","00:23:54","00:23:58","With a runtime of 95 minutes, that left us with a kill on average every 1.25 minutes.","with a run time of 95 minutes that left us with a kill on average every 1.25"
"m6TW35oIefE","00:23:59","00:24:05","Golden Chainsaw for Coolest Kill is actually gonna go to two separate kills - Cause I just can't decide between em!","minutes goldman chainsaw for coolest kill is actually gonna go to two separate kills cause i just can't decide between them firstly"
"m6TW35oIefE","00:24:05","00:24:10","Firstly, the head thief, since I legit laughed when Luke knocked him over.  And those people parts look great.  ","the head thief since i legit laughed when luke knocked him over and those people parts look"
"m6TW35oIefE","00:24:11","00:24:12","*squishy noises* ""Thank... you.""","great thank you secondly"
"m6TW35oIefE","00:24:12","00:24:17","Secondly, Darkscream - a warrior's death is the noblest death, and also the nastiest.","dark screen a warrior's death is the noblest death and also the nastiest"
"m6TW35oIefE","00:24:18","00:24:20","I love PG's unhinged jaw.","i love pg's unhinged jaw dome machete for"
"m6TW35oIefE","00:24:20","00:24:27","Dull Machete for Lamest Kill will go to the 50 bodies we counted on stakes, which is definitely a bio-cop out but most every other kill was awesome.","less kill will go to the 50 bodies we counted on stakes which is definitely a bio cop out but most every other kill was awesome"
"m6TW35oIefE","00:24:28","00:24:31","And that's it. PG: Psycho Goreman came out in 2020,","and that's it pg psycho gore man came out in 2020"
"m6TW35oIefE","00:24:31","00:24:35","and director Steven Kostanski says he plans to do more with the character in the future.","and director stephen kastansky says he plans to do more with the character in the future"
"m6TW35oIefE","00:24:36","00:24:39","I'll keep an eye out for any sequels, but until then, I'm James A. Janisse.","i'll keep an eye out for any sequels but until then i'm james agenese"
"m6TW35oIefE","00:24:40","00:24:41","This has been the Kill Count.","this has been the kill council for"
"m6TW35oIefE","00:24:42","00:24:42","On the next Kill Count...","the next kill count"
"m6TW35oIefE","00:24:43","00:24:47","Detroit, Michigan... Hockey Town... Motor City... The Big D...","detroit michigan hockey hockeytown motor city the big d"
"m6TW35oIefE","00:24:48","00:24:49","","these three small-time"
"m6TW35oIefE","00:24:49","00:24:54","These 3 small-time criminals are trying to get out of Mo Town, and they're robbing houses to make the money they need.","criminals are trying to get out of motown and they're robbing houses to make the money they need you"
"m6TW35oIefE","00:24:55","00:25:01","""Yknow, we keep hitting houses like today's Rocky? And...?"" ""Bye bye, Detroit!""  ""And hola California!""","know we keep hitting houses like today's rocky and bye-bye detroit"
"m6TW35oIefE","00:25:02","00:25:07","This next hit should be their last... and also their easiest.  Because they're robbing an old blind man.","this next hit should be their last and also their easiest because they're robbing an old blind man"
"m6TW35oIefE","00:25:07","00:25:10","And no way that guy could be a threat.","and no way that guy could be a"
"m6TW35oIefE","00:25:10","00:25:11","",""
"m6TW35oIefE","00:25:12","00:25:14","""Stop!"" *hit impacts* *gun shot* ","threat ooh"
"m6TW35oIefE","00:25:14","00:25:15","Ooo, nevermind!","never mind"
"m6TW35oIefE","00:25:16","00:25:20","Don't Breathe is 90 minutes of pure tension, where the criminals become the victims. ","don't breathe is 90 minutes of pure tension where the criminals become the victims and"
"m6TW35oIefE","00:25:20","00:25:22","And the victim is much more than meets the eye.","the victim is much more than meets"
"m6TW35oIefE","00:25:23","00:25:24","*scream* *gun shot*","the eye"
"m6TW35oIefE","00:25:24","00:25:27","This week, raise your heart rate and watch Don't Breathe. ","this week raise your heart rate and watch don't breathe"
"m6TW35oIefE","00:25:28","00:25:31","And on Friday, watch the Kill Count on Dead Meat.","and on friday watch the kill count on dead meat"
"m6TW35oIefE","00:25:32","00:25:37","","don't"
"m6TW35oIefE","00:25:38","00:25:40","Don't Breathe can currently be watched on the pictured streaming platforms.","breathe can currently be watched on the pictured streaming platforms yeah you'd always recommend you"
"m6TW35oIefE","00:25:40","00:25:41","Dead Meat always recommends you watch the movie for yourself before it's Kill Count.","watch the movie for yourself"
"m6TW35oIefE","00:25:42","00:25:43","It's the only way to have your own properly informed opinion.","before it's kill count it's the only way to have your own properly informed opinion kill"
"m6TW35oIefE","00:25:44","00:25:45","Kill Counts are never meant to replace the experience of watching a film.","counts are never meant to replace the experience of watching a film"
"m6TW35oIefE","00:25:46","00:25:46","","thanks a lot for watching this"
"m6TW35oIefE","00:25:46","00:25:48","Thanks a lot for watching this Kill Count! I wanna thank some Patrons, like","kill count i want to thank some patrons like"
"m6TW35oIefE","00:25:48","00:25:50","Jonathon Beese, Camilla Jensen,","jonathan beast camilla jensen"
"m6TW35oIefE","00:25:51","00:25:52","Jacob Kostiv,  Sam Delve,","jacob costan sam delve ryan"
"m6TW35oIefE","00:25:53","00:25:53","ryancbarclay,","c barclay"
"m6TW35oIefE","00:25:54","00:25:55","Matthew Miller, and Darth Joker","matthew miller and darth joker"
"m6TW35oIefE","00:25:55","00:26:00","Once again, thank you for being understanding this month about the reduced Kill Count release schedule.","once again thank you for being understanding this month about the reduced kill count release schedule i"
"m6TW35oIefE","00:26:01","00:26:05","I have been working hard on those Friday the 13th Re-Count scripts, so I can't wait to show you them. ","have been working hard on those friday the 13th recount scripts so i can't wait to show you them but first don't"
"m6TW35oIefE","00:26:05","00:26:07","But first, Don't Breathe, which we'll see next week. ","breathe which we'll see you next week be"
"m6TW35oIefE","00:26:08","00:26:08","",""
"m6TW35oIefE","00:26:08","00:26:08","Be good people.","good people"
