"video_id","min_timecode","max_timecode","text.user","text.auto"
"YkmlPaGui5k","00:09:48","00:09:52","because his skin was also red,  rough, and super leathery.","was because his skin was also red rough and super leathery it was apparent"
"YkmlPaGui5k","00:09:52","00:09:56","It was apparent that this victim had  been dead for at least a couple of weeks,","that this victim had been dead for at least a couple of weeks"
"YkmlPaGui5k","00:09:56","00:10:02","whereas the first victim that they found  nearby, it seemed like his was more newer.","whereas the first victim that they found nearby it seemed like his was more newer"
"YkmlPaGui5k","00:10:03","00:10:05","It was like, it wasn't sitting there for as long.","it was like it wasn't sitting there for as long"
"YkmlPaGui5k","00:10:05","00:10:10","Sadly though, they were unable to identify  who this victim was, the second one.","sadly though they were unable to identify who this victim was the second one so"
"YkmlPaGui5k","00:10:11","00:10:12","So that's when police start, you know,","that's when police start"
"YkmlPaGui5k","00:10:13","00:10:16","figuring that they're probably  dealing with a serial killer,","you know figuring that they're probably dealing with a serial killer a really"
"YkmlPaGui5k","00:10:16","00:10:18","a really sick one at that.","sick one at that so"
"YkmlPaGui5k","00:10:18","00:10:24","So then in January of 1936,  a lady's out doing her thing,","then in january of 1936 a lady's out doing her thing minding her own business"
"YkmlPaGui5k","00:10:24","00:10:25","minding her own business, okay?","okay"
"YkmlPaGui5k","00:10:26","00:10:29","She comes across two baskets  that are sitting alongside","she comes across two baskets that are sitting alongside"
"YkmlPaGui5k","00:10:29","00:10:32","this manufacturing building  she's walking in front of.","this manufacturing building she's walking in front of"
"YkmlPaGui5k","00:10:32","00:10:35","So she sees these two baskets, and  they seem to be filled with like","so she sees these two baskets and they seem to be filled with"
"YkmlPaGui5k","00:10:36","00:10:38","newspaper or something, like  something's wrapped in them, right?","like newspaper or something like something's wrapped in them right"
"YkmlPaGui5k","00:10:39","00:10:41","So she kind of goes and takes a look inside,","so she kind of goes and takes a look inside maybe"
"YkmlPaGui5k","00:10:41","00:10:43","maybe it's money ,that's  what I would think, you know?","it's money that's what i would think you know"
"YkmlPaGui5k","00:10:44","00:10:47","And she sees something that's like  wrapped in a bunch of newspapers.","and she sees something that's like wrapped in a bunch of newspapers"
"YkmlPaGui5k","00:10:48","00:10:51","So she's feeling a little curious,  she opens it up, what does she see?","so she's feeling a little curious she opens it up what does she see"
"YkmlPaGui5k","00:10:52","00:10:52","","she"
"YkmlPaGui5k","00:10:52","00:10:57","She sees that wrapped inside the newspaper  seemed to be like human body parts.","sees that wrapped inside the newspaper seemed to be like human body parts she wasn't sure"
"YkmlPaGui5k","00:10:57","00:10:59","She wasn't sure as to like  what she was looking at,","as to like what she was looking at"
"YkmlPaGui5k","00:10:59","00:11:05","but it was clear that it was  like skin and just parts, oh yes.","but it was clear that it was it was like skin and and and just parts oh yes"
"YkmlPaGui5k","00:11:06","00:11:07","""Why'd I look in there?"".","why did i look in there so"
"YkmlPaGui5k","00:11:07","00:11:08","So authorities come out to the area,","authorities come out to the"
"YkmlPaGui5k","00:11:09","00:11:09","","area and"
"YkmlPaGui5k","00:11:10","00:11:12","and they see that it is indeed-- (slight laugh)","they see that it is indeed i'm"
"YkmlPaGui5k","00:11:13","00:11:15","I'm not laughing because of that,  I’m laughing because of how like","not laughing because of that i'm laughing because of how like awkward"
"YkmlPaGui5k","00:11:16","00:11:16","awkward I am sometimes.","i am sometimes"
"YkmlPaGui5k","00:11:17","00:11:21","They see that it's a woman's body parts  wrapped up in these baskets, it's a woman.","they see that it's a woman's body parts wrapped up in these in these baskets it's a woman so"
"YkmlPaGui5k","00:11:21","00:11:24","So they search the area,  they're not finding anything.","they search the area and they're not finding anything"
"YkmlPaGui5k","00:11:25","00:11:28","Now they have um like people  going out and searching the area","now they have um like people going out and searching the area"
"YkmlPaGui5k","00:11:28","00:11:33","over the next couple of days, in hopes  to just find something, anything right?","over the next couple of days in hopes to just over the next couple of days in hopes to just find something anything right and about"
"YkmlPaGui5k","00:11:33","00:11:38","And about 10 days after finding the victim's body,","10 days after finding the victim's body that's"
"YkmlPaGui5k","00:11:39","00:11:42","that's when they were able  to recover most of her body","when they were able to recover most of her body that was"
"YkmlPaGui5k","00:11:43","00:11:44","that was cut up and scattered around.","cut up and scattered around her body that was cut up and scattered around"
"YkmlPaGui5k","00:11:44","00:11:46","It was scattered around just in different areas,","it was scattered around just in different areas hidden"
"YkmlPaGui5k","00:11:47","00:11:49","hidden in like some bushes over here,","in like some bushes over here and then in the baskets"
"YkmlPaGui5k","00:11:49","00:11:53","and then in the baskets over  here, like it was very strange.","over here like it was very strange baskets over here like it was very strange but they"
"YkmlPaGui5k","00:11:53","00:11:56","But they were unable to locate her head.","were unable to locate her"
"YkmlPaGui5k","00:11:57","00:11:57","","head missing"
"YkmlPaGui5k","00:11:57","00:11:58","Missing, yeah.","yeah where"
"YkmlPaGui5k","00:11:59","00:11:59","Where the hell is that?","the hell"
"YkmlPaGui5k","00:12:00","00:12:00","I don't know.","is that i don't know"
"YkmlPaGui5k","00:12:01","00:12:04","So similar to the other victim  we had talked about, Edward,","so similar to the other victim we had talked about edward"
"YkmlPaGui5k","00:12:05","00:12:11","the coroner also determined that this  victim had died from decapitation.","the coroner also determined that this victim had died from decapitation"
"YkmlPaGui5k","00:12:12","00:12:13","The cause of death had been decapitation.","the cause of death had been decapitation"
"YkmlPaGui5k","00:12:14","00:12:16","With this victim though, it was a  little different, it was a little odd","with this victim though it was a little different it was a little"
"YkmlPaGui5k","00:12:17","00:12:20","because the killer, whoever it was, they waited.","odd because um the killer whoever it was they waited"
"YkmlPaGui5k","00:12:21","00:12:21","",""
"YkmlPaGui5k","00:12:22","00:12:23","They waited for the rigor mortis to set in","they waited for the rigor mortis to"
"YkmlPaGui5k","00:12:24","00:12:26","before dismembering the rest of the body,","set in before dismembering the rest of the body whereas"
"YkmlPaGui5k","00:12:27","00:12:32","whereas the previous victims, whoever  was responsible, didn't do this.","the previous victims um whoever was responsible didn't do this they're thinking"
"YkmlPaGui5k","00:12:32","00:12:33","They're thinking like--","like this"
"YkmlPaGui5k","00:12:34","00:12:36","This is gonna sound inappropriate, but  it's kind of what they're thinking.","is gonna sound inappropriate but it's kind of what they're thinking"
"YkmlPaGui5k","00:12:37","00:12:39","It's almost like a little science  project going on or something,","it's almost like a little science project going on"
"YkmlPaGui5k","00:12:40","00:12:43","like maybe the killer wanted to see what  happened, like trying something new.","or something like maybe the killer wanted to see what happened like trying something"
"YkmlPaGui5k","00:12:44","00:12:45","","new"
"YkmlPaGui5k","00:12:46","00:12:46","Who freaking knows.","who freaking"
"YkmlPaGui5k","00:12:47","00:12:47","","knows um so"
"YkmlPaGui5k","00:12:48","00:12:50","So fingerprints were taken  from this victim as well,","fingerprints were taken from this victim as well and they were"
"YkmlPaGui5k","00:12:51","00:12:55","and they were able to ID her as a  woman named ""Florence"" or ""Flo"".","able to id her as a woman named florence or flo"
"YkmlPaGui5k","00:12:56","00:12:59","She worked in the area as a waitress, a barmaid,","she worked in the area as a waitress a barmaid and"
"YkmlPaGui5k","00:13:00","00:13:01","and she also worked as a sex worker,","she also worked as a sex worker"
"YkmlPaGui5k","00:13:02","00:13:05","and she lived right on the  edge of the Roaring Third,","and she lived right on the edge of the roaring third um so"
"YkmlPaGui5k","00:13:06","00:13:08","so right where a lot of  people were coming and going.","right where a lot of people were coming and going so"
"YkmlPaGui5k","00:13:09","00:13:10","So it's like ""Oh s--t"".","it's like well [ __ ] could have"
"YkmlPaGui5k","00:13:10","00:13:12","Could have been someone who just left town.","been someone who just left town investigators"
"YkmlPaGui5k","00:13:12","00:13:15","Investigators were feeling like  they had to kind of like work fast,","were feeling like they had to kind of like work fast"
"YkmlPaGui5k","00:13:16","00:13:19","because the person in the area could easily flee.","because the person in the area could easily flee so"
"YkmlPaGui5k","00:13:19","00:13:22","So I mean, investigators are doing their thing,","i mean investigators are doing their thing they're questioning"
"YkmlPaGui5k","00:13:22","00:13:23","they're questioning as many people as they can,","as many people as they"
"YkmlPaGui5k","00:13:24","00:13:29","but nothing is coming from it,  no leads, no clues, nothing.","can but nothing is coming from it no leads no clues nothing"
"YkmlPaGui5k","00:13:29","00:13:36","So then in June 1936, early in  the morning in Kingsbury Run,","so then in june 1936 early in the morning in kingsbury run two"
"YkmlPaGui5k","00:13:37","00:13:39","two boys, they decided that they  were gonna skip school, you know?","boys they decided that they were gonna skip school you know let's"
"YkmlPaGui5k","00:13:40","00:13:43","""Let's go hang out and walk around.”  because they don't know what else to do.","go hang out and walk around because they don't know what else to do"
"YkmlPaGui5k","00:13:43","00:13:46","So they're walking around the  area, and then they come across","so they're walking around the area and then they come across"
"YkmlPaGui5k","00:13:46","00:13:48","what seems to be, you guessed it--","what seems to be you guessed it"
"YkmlPaGui5k","00:13:49","00:13:53","No, they come across a pair of  trousers, there's trousers on the floor,","no they come across a pair of trousers there's trousers on the floor"
"YkmlPaGui5k","00:13:54","00:13:56","but that they see that there's  something wrapped in it, okay?","but they see that there's something wrapped in it okay"
"YkmlPaGui5k","00:13:57","00:13:57","","so being"
"YkmlPaGui5k","00:13:57","00:14:01","So being the little curious  cats that they were, they go up","the little curious wrapped in it okay so being the little curious cats that they they were they"
"YkmlPaGui5k","00:14:02","00:14:07","and they kind of open up the trousers,  and they see that it was a head of a male.","go up and they kind of open up the trousers and they see that it was a head of a"
"YkmlPaGui5k","00:14:08","00:14:12","So okay these boys find the  head, they report it to police,","male so okay these boys find the head they report it to police and"
"YkmlPaGui5k","00:14:12","00:14:17","and they take it in, they take the  victim's head, and hopefully find an ID.","they take it in they take the victim's head and hopefully find an id"
"YkmlPaGui5k","00:14:18","00:14:22","But the very next day, police,  they find the body of a man,","but the very next day police they they find the body of a man"
"YkmlPaGui5k","00:14:23","00:14:26","another man, who seemed to be in his 20s,","another man who seemed to be in his 20s"
"YkmlPaGui5k","00:14:27","00:14:29","and he was dumped in front of the police building.","and he was dumped in front of the police building"
"YkmlPaGui5k","00:14:30","00:14:34","Again the body was super clean,  it was drained of all blood,","again the body was super clean it was drained of all blood"
"YkmlPaGui5k","00:14:34","00:14:37","but this time the body was fully intact,","but this time the body was fully intact fully intact"
"YkmlPaGui5k","00:14:37","00:14:40","like not cut up like the previous victims,","like not cut up like the previous victims"
"YkmlPaGui5k","00:14:41","00:14:43","but once again he was decapitated.","but once again he was decapitated"
"YkmlPaGui5k","00:14:43","00:14:45","The victim's fingerprints were taken,","the victim's fingerprints were taken"
"YkmlPaGui5k","00:14:46","00:14:48","but sadly they were unable to identify who he was.","but sadly they were unable to identify who he was"
"YkmlPaGui5k","00:14:49","00:14:49","",""
"YkmlPaGui5k","00:14:49","00:14:56","With this victim, he had six very distinct  tattoos on various parts of his body,","with this victim he had six very distinct tattoos on various parts of his body now"
"YkmlPaGui5k","00:14:57","00:15:01","now hoping, police were hoping that this  would help identify who he was, right?","hoping police were hoping that this would help identify who he was"
"YkmlPaGui5k","00:15:02","00:15:04","So they put out there in the  newspapers and stuff like","right so they put out there in the newspapers and"
"YkmlPaGui5k","00:15:05","00:15:09","""Hey, if you know someone with  this tattoo let me know."".","stuff like hey if you know someone with this tattoo let me know so"
"YkmlPaGui5k","00:15:10","00:15:12","So they put his tattoos out there","they put his tattoos out there in hopes that"
"YkmlPaGui5k","00:15:12","00:15:16","in hopes that somebody will come  forward and say, ""That's so and so"",","somebody will come forward and say that's so-and-so"
"YkmlPaGui5k","00:15:17","00:15:20","but again sadly this victim would just be known as","but again sadly this victim would just be known as"
"YkmlPaGui5k","00:15:21","00:15:24","""The Tattooed Man"", and he was never identified.","the tattooed man and he was never identified nobody"
"YkmlPaGui5k","00:15:24","00:15:25","Nobody knew who this man was.","knew who this man was"
"YkmlPaGui5k","00:15:25","00:15:26","","oh"
"YkmlPaGui5k","00:15:27","00:15:28","Oh my gosh, I’m just having  like a light bulb moment.","my gosh i'm just having like a light bulb moment"
"YkmlPaGui5k","00:15:29","00:15:32","Because the train station was so close by,","because the train station was so close by do"
"YkmlPaGui5k","00:15:33","00:15:36","do you think maybe the killer  was bringing in people?","you think maybe the killer was bringing in people no"
"YkmlPaGui5k","00:15:36","00:15:37","No, that'd be silly.","that'd be silly it's probably"
"YkmlPaGui5k","00:15:37","00:15:39","It's probably just people from out of town.","just people from out of town i feel"
"YkmlPaGui5k","00:15:40","00:15:41","I feel like that would be too much work.","like that would be too much work okay"
"YkmlPaGui5k","00:15:42","00:15:43","Okay, not a lightbulb moment, but it's a thought.","not a light bulb moment but it's"
"YkmlPaGui5k","00:15:44","00:15:49","So then July 1936, a teenage girl  was walking through the woods","a thought so then july 1936 a teenage girl was walking through the woods"
"YkmlPaGui5k","00:15:50","00:15:52","and came across a decapitated man.","and came across a decapitated man"
"YkmlPaGui5k","00:15:53","00:15:55","First of all, I’m not sure  why all these kids are just","first of all i'm not sure why all these kids are just walking around"
"YkmlPaGui5k","00:15:55","00:15:56","walking around alone in the woods and stuff.","alone in the woods"
"YkmlPaGui5k","00:15:57","00:15:59","So this victim seemed to be in his 40s,","and stuff so this victim seemed to be in his 40s and"
"YkmlPaGui5k","00:15:59","00:16:01","and appeared to be dead for about two months.","appeared to be dead for about two months"
"YkmlPaGui5k","00:16:02","00:16:02","","the"
"YkmlPaGui5k","00:16:02","00:16:05","The previous victims that had been found,","previous victims that had been found"
"YkmlPaGui5k","00:16:06","00:16:08","they seemed to be killed in different locations,","they seemed to be killed in different locations"
"YkmlPaGui5k","00:16:09","00:16:11","and then they were dropped around the town,","and then they were dropped around the town"
"YkmlPaGui5k","00:16:12","00:16:14","or in the area that the killer left them at.","or in the area that the killer left them at"
"YkmlPaGui5k","00:16:15","00:16:16","But with this victim it was different.","but with this victim it was different"
"YkmlPaGui5k","00:16:17","00:16:20","It was believed that this  victim was killed on the spot,","it was believed that this victim was killed on the spot maybe"
"YkmlPaGui5k","00:16:20","00:16:24","maybe this person saw something  he wasn't supposed to see,","killed on the spot maybe this person saw something he wasn't supposed to see because"
"YkmlPaGui5k","00:16:24","00:16:27","because nearby was a pile of bloody clothing,","nearby was a pile of bloody clothing because nearby was a pile of bloody clothing"
"YkmlPaGui5k","00:16:28","00:16:31","and there was a large amount of blood  that had seeped into the ground,","and there was a large amount of blood that had seeped into the ground"
"YkmlPaGui5k","00:16:31","00:16:34","which led authorities to believe  that he was killed on the spot,","which led authorities to believe that he was killed on the spot i mean"
"YkmlPaGui5k","00:16:34","00:16:35","I mean it was clear as day.","it was clear as day his"
"YkmlPaGui5k","00:16:36","00:16:38","His head and the bloody clothing was found nearby,","head and the bloody clothing was found nearby"
"YkmlPaGui5k","00:16:39","00:16:42","like it was right next to the body  pretty much, but it was just different.","like it was right next to the body pretty much but it was just different i personally"
"YkmlPaGui5k","00:16:42","00:16:44","I personally am leaning towards like,","am leaning towards like"
"YkmlPaGui5k","00:16:45","00:16:47","maybe they witnessed something,  and the killer had to--","maybe they witnessed something and the killer had"
"YkmlPaGui5k","00:16:48","00:16:48","","to didn't"
"YkmlPaGui5k","00:16:49","00:16:52","Didn't have to, but you know, he felt  like ""Well I gotta get rid of you now."".","have to but you know he felt like well i gotta get rid of you now"
"YkmlPaGui5k","00:16:52","00:16:57","So then in September 1936, a  man is walking to the train,","so then in september 1936 a man is walking to the train"
"YkmlPaGui5k","00:16:58","00:17:00","he's gonna catch a train so  he can get out of town, right?","he's gonna catch a train so he can get out of town right so he's"
"YkmlPaGui5k","00:17:00","00:17:04","So he's walking and then he trips,  and he looks back to see like","walking and then he trips and he looks back to see like what the"
"YkmlPaGui5k","00:17:04","00:17:06","""What the hell did I just trip over?"", right?","hell did i just trip over right"
"YkmlPaGui5k","00:17:07","00:17:10","And he's looking, and he sees like  what seems to be a man's torso.","and he's looking he sees like what seems to be a man's torso"
"YkmlPaGui5k","00:17:11","00:17:12","He tripped over a man's torso.","he tripped over a man's"
"YkmlPaGui5k","00:17:13","00:17:16","Yeah, that sounds really weird,  but based off of what I was reading","torso yeah that sounds really weird but based off of what i was reading"
"YkmlPaGui5k","00:17:17","00:17:19","and some of the pictures I  saw, there seemed to be--","and some of the pictures i saw there seemed"
"YkmlPaGui5k","00:17:20","00:17:24","Or like the area was really bad, and they  were just like piles of trash everywhere.","to be or like the area was really bad and they were just like piles of trash everywhere"
"YkmlPaGui5k","00:17:25","00:17:28","And the torso wasn't just like laying out  in the open with like nothing around it,","and the torso wasn't just like laying out in the open with like nothing around"
"YkmlPaGui5k","00:17:29","00:17:30","where you couldn't miss it, you know?","it where you couldn't miss it you know"
"YkmlPaGui5k","00:17:31","00:17:33","It was just kind of like  buried, or kind of mixed in","it was just kind of like buried or kind of mixed in"
"YkmlPaGui5k","00:17:34","00:17:38","with all the mess that was  going on in the area, so yeah.","with all the mess that was going on in the area so yeah because"
"YkmlPaGui5k","00:17:39","00:17:41","'Cause when I was reading that, I was  like ""He tripped over a man's torso?"".","i when i was reading that i was like he tripped over a man's torso"
"YkmlPaGui5k","00:17:42","00:17:42","",""
"YkmlPaGui5k","00:17:43","00:17:47","So this man, he was just trying  to get out of town and is walking,","so this man he was just trying to get out of town and is walking trips"
"YkmlPaGui5k","00:17:48","00:17:50","trips, look back, ""What is that?"", man's torso.","look back what is that man's torso police"
"YkmlPaGui5k","00:17:51","00:17:54","Police went out there, they  searched the area, right?","went out there they searched the area right and nearby"
"YkmlPaGui5k","00:17:54","00:17:57","And nearby is like this large pool.","is like this large pool so it's"
"YkmlPaGui5k","00:17:57","00:18:00","So it's like, when you're walking  there's a lot of the trash,","like when you're walking there's a lot of the trash and debris"
"YkmlPaGui5k","00:18:00","00:18:01","and debris, and everything, right?","and everything right"
"YkmlPaGui5k","00:18:02","00:18:04","And then nearby is like this huge pool,","and then nearby is like this huge pool"
"YkmlPaGui5k","00:18:04","00:18:08","which was said to be nothing  more than just a big open sewer.","which was said to be nothing more than just a big open sewer someone's"
"YkmlPaGui5k","00:18:09","00:18:11","""Someone's gotta check that, who's gonna  check that?"", police are thinking this.","gotta check that who's gonna check that police are thinking this"
"YkmlPaGui5k","00:18:12","00:18:15","""I'm not checking that, you're checking  that. You're going in there. Mhm."",","i'm not checking that you're checking that you're going in there like that's"
"YkmlPaGui5k","00:18:15","00:18:16","they’re like ""That's your job"".","your job"
"YkmlPaGui5k","00:18:17","00:18:21","But eventually, they got a  diver to come out to the area","uh but eventually they got a diver to come out to the area"
"YkmlPaGui5k","00:18:22","00:18:27","and dive into this large pool that was  pretty much a sewer, like it was rough.","and dive into this large pool that was pretty much a sewer like it's it was"
"YkmlPaGui5k","00:18:28","00:18:28","And they're searching this area","rough and they're searching"
"YkmlPaGui5k","00:18:29","00:18:30","because they're thinking that maybe, you know,","this area because they're thinking that maybe"
"YkmlPaGui5k","00:18:31","00:18:33","the rest of this man's body  parts could be in there, right?","you know the rest of this man's body parts could be in there"
"YkmlPaGui5k","00:18:34","00:18:36","Now this brought on a lot of onlookers,","right now this brought on a lot of onlookers people want"
"YkmlPaGui5k","00:18:36","00:18:37","people want to know what the heck's going on.","to know what the heck's going"
"YkmlPaGui5k","00:18:38","00:18:42","Now the media was reporting about  the bodies being found and whatnot,","on now the media was reporting about the bodies being found and whatnot"
"YkmlPaGui5k","00:18:42","00:18:45","and kind of keeping everyone up  to date about what was going on.","and kind of keeping keeping everyone up to date about what was going"
"YkmlPaGui5k","00:18:46","00:18:49","So a lot of the people knew like,  nobody knew who this killer was,","on so a lot of the people knew like nobody knew who this killer was"
"YkmlPaGui5k","00:18:50","00:18:53","and these bodies are being  found, you get it, okay.","and these bodies are being found you get it okay"
"YkmlPaGui5k","00:18:54","00:18:58","When they see people in the area,  they see police searching the pool,","when they see people in the area they see police searching the pool they're like oh"
"YkmlPaGui5k","00:18:58","00:18:59","they're like ""Oh jeez"".","geez so everyone's"
"YkmlPaGui5k","00:18:59","00:19:02","So everyone's like huddling  around this pool thing,","like huddling around this"
"YkmlPaGui5k","00:19:02","00:19:05","not even huddling because it  was a lot of people who came.","pool thing not even huddling because it was a lot of people who came it was said that"
"YkmlPaGui5k","00:19:05","00:19:08","It was said that up to like 600 people  showed up to see what police found.","up to like 600 people showed up to see what police found"
"YkmlPaGui5k","00:19:09","00:19:10","So they're all just like watching.","so they're all just like watching now"
"YkmlPaGui5k","00:19:11","00:19:13","Now in this pool, they were able to recover","in this pool they were able to recover the lower"
"YkmlPaGui5k","00:19:13","00:19:18","the lower half of the torso  and parts of both legs.","half of the torso and parts of both legs now"
"YkmlPaGui5k","00:19:18","00:19:21","Now at this point they were  on to victim number six,","at this point they were on to victim number six"
"YkmlPaGui5k","00:19:21","00:19:26","who was believed to be in his late  20s, who again was decapitated.","who was believed to be in his late 20s who again was decapitated who again was decapitated the coroner"
