"video_id","min_timecode","max_timecode","text.user","text.auto"
"yqqaW8DCc-I","00:11:22","00:11:27","Oxygen is going to be a vital resource for any  future human missions. And , this is actually  ","oxygen is going to be a vital resource for any future mission and this is actually"
"yqqaW8DCc-I","00:11:27","00:11:33","a scaled down prototype of the full sized version  NASA eventually wants to send to mars, along with  ","a scaled-down prototype of the full-sized version nasa eventually wants to send to mars along with"
"yqqaW8DCc-I","00:11:33","00:11:38","an empty rocket. The full scale version will  produce about 2 kilograms per hour, which will  ","an empty rocket the full-scale version will produce about 2 kilograms per hour which will"
"yqqaW8DCc-I","00:11:39","00:11:44","gradually be stored inside the awaiting rocket  over the course of a year and a half, providing  ","gradually be stored inside the awaiting rocket over the course of a year and a half providing"
"yqqaW8DCc-I","00:11:44","00:11:50","life sustaining air for any future human missions  and the oxidizer needed for the ride home. [12]","life-sustaining air for any future human missions and the oxidizer needed for the ride home"
"yqqaW8DCc-I","00:11:51","00:11:56","The next device, which is also depending on a  future Mars mission to complete its purpose,  ","and the oxidizer needed for the ride home the next device which is also depending on a future mars mission to complete its purpose"
"yqqaW8DCc-I","00:11:57","00:12:02","is the core sampling drill. The curiosity rover  sampling system drilled and scooped soil into this  ","is the core sampling drill the curiosity rover sampling system drilled and scooped soil"
"yqqaW8DCc-I","00:12:03","00:12:09","instrument, the SAM, standing for Sample Analysis  at Mars. The SAM is located here on the rover.","into this instrument the sam standing for the sample analysis at mars the sam is located here on the rover"
"yqqaW8DCc-I","00:12:10","00:12:12","It contained multiple tools  that would be commonplace  ","it contained multiple tools that would be commonplace in"
"yqqaW8DCc-I","00:12:12","00:12:16","in many earth bound labs. A mass  spectrometer, a gas chromatograph  ","many earthbound labs a mass spectrometer a gas chromatograph"
"yqqaW8DCc-I","00:12:17","00:12:21","and a tunable laser spectrometer. Each  looking for different signs of life on Mars.","and a tunable laser spectrometer each looking for different signs of life"
"yqqaW8DCc-I","00:12:22","00:12:22","","on mars"
"yqqaW8DCc-I","00:12:23","00:12:27","Perseverance has replaced the space this  unit took up with a totally new system.  ","perseverance has replaced the space this unit took up with a totally new system"
"yqqaW8DCc-I","00:12:28","00:12:34","The Sample Caching System. The robotic arm of  the rover features a coring drill which will  ","the sample caching system the robotic arm of the rover features a coring drill which will cut out cylindrical"
"yqqaW8DCc-I","00:12:34","00:12:39","cut out cylindrical core samples from the Martian  surface. Once collected the robot head mates with  ","core samples from the martian surface once collected the robot head"
"yqqaW8DCc-I","00:12:40","00:12:45","the drill bit carousel where it transfers the  bit and the sample tube into a rotating carousel  ","mates with the drill bit carousel the robot head mates with the drill bit carousel where it transfers the bit and the sample tube into a rotating carousel"
"yqqaW8DCc-I","00:12:46","00:12:50","that takes it to the belly of the rover  where another robotic arm resides.","that takes it to the belly of the rover where another robotic arm resides"
"yqqaW8DCc-I","00:12:51","00:12:56","Here a number of operations takes place.  First the arm pulls the sample tube out of  ","here a number of operations takes place first the arm pulls the sample tube out"
"yqqaW8DCc-I","00:12:57","00:13:02","the drill bit and takes multiple images of it  before and after calculating the volume of the  ","of the drill bit and takes multiple images of it before and after calculating the volume of the sample"
"yqqaW8DCc-I","00:13:02","00:13:08","sample. [13] Then it stores it in one of the 42  slots under the belly of the rover, where they  ","then it stores it in one of the 42 slots under the belly of the rover where they will remain"
"yqqaW8DCc-I","00:13:08","00:13:13","will remain until the rover deposits them in these sample tubes at a designated caching  ","until the rover deposits them in these sample tubes at a designated caching"
"yqqaW8DCc-I","00:13:14","00:13:18","spot on the surface of Mars. This is  where things get really interesting.","spot on the surface of mars this is where things get really interesting"
"yqqaW8DCc-I","00:13:19","00:13:25","There are plans to send another rover, designed  by the ESA, to Mars in 2026. [14] This rover will  ","there are plans to send another rover designed by the esa to mars in 2026 this rover will"
"yqqaW8DCc-I","00:13:26","00:13:31","deliver the samples back to it’s NASA designed  lander which will load them into a mars ascent  ","deliver the samples back to its nasa designed lander which will load them into a mars ascent"
"yqqaW8DCc-I","00:13:32","00:13:37","vehicle. Blasting the samples into orbit, where an  ESA Earth Return Vehicle will be waiting for it.","vehicle blasting the samples into orbit where an esa blasting the samples into orbit where an esa earth returned vehicle will be waiting for us"
"yqqaW8DCc-I","00:13:38","00:13:40","We are attempting to bring soil back  ","we are attempting to bring soil back from mars"
"yqqaW8DCc-I","00:13:40","00:13:45","from Mars….with robots. If that isn’t  insane engineering I don’t know what is,  ","with robots if that isn't insane engineering i don't know what is"
"yqqaW8DCc-I","00:13:46","00:13:49","and we have barely scratched the surface  of what this rover is capable of.","and we have barely scratched the surface of what this rover is capable"
"yqqaW8DCc-I","00:13:50","00:13:56","There is a whole host of new sensors on board  that do not require Perseverance to collect soil.  ","of there is a whole host of new sensors on board that do not require perseverance to collect soil each using"
"yqqaW8DCc-I","00:13:56","00:14:01","Each using different forms of electromagnetic  radiation to investigate the ground below them.  ","different forms of electromagnetic each using different forms of electromagnetic radiation to investigate the ground below them"
"yqqaW8DCc-I","00:14:02","00:14:07","The SHERLOC instrument on the robotic head will  look for signs of biosignatures using Raman and  ","the sherlock instrument on the robotic head will look for signs of biosignatures using roman and luminescence"
"yqqaW8DCc-I","00:14:08","00:14:13","Luminescence spectroscopy, which both detect  molecules based on how they interact with UV  ","spectroscopy which both detect molecules based on how they interact with uv light"
"yqqaW8DCc-I","00:14:13","00:14:18","light. [15] It will sit about 5 centimetres off  the ground where it will focus it’s UV laser  ","it will sit about five centimeters off the ground where it will focus its uv"
"yqqaW8DCc-I","00:14:19","00:14:25","onto the soil and be able to detect chemicals  that would indicate the presence of past life.","laser onto the soil and be able to detect chemicals that would indicate the presence of past life the rover"
"yqqaW8DCc-I","00:14:25","00:14:30","The Rover also has an x-ray imager can PIXL that  will be able to visualise the texture of the  ","also has an x-ray imager called pixel that will be able to visualize the"
"yqqaW8DCc-I","00:14:31","00:14:36","ground below it looking for tiny variations in  geology that would indicate that microbial life  ","texture of the ground below it looking for tiny variations in geology that would indicate that microbial"
"yqqaW8DCc-I","00:14:37","00:14:42","has altered the environment, [16] while also  being able to detect chemical compositions by  ","life has altered its environment while also being able to detect chemical compositions by observing"
"yqqaW8DCc-I","00:14:43","00:14:47","observing the fluorescence of the target  under x-ray electromagnetic radiation.","the fluorescence chemical compositions by observing the fluorescence of the target under x-ray electromagnetic radiation"
"yqqaW8DCc-I","00:14:48","00:14:51","There are several other sensors, like  the ground penetrating Radar imager  ","there are several other sensors like the ground penetrating radar imager"
"yqqaW8DCc-I","00:14:52","00:14:56","located at the rear of the rover, which will give  us visualizations of the composition of geology  ","located at the rear of the rover which will give us visualizations of the composition of geology"
"yqqaW8DCc-I","00:14:57","00:15:01","up to 10 metres under the surface,  and possibly even identify water  ","up to 10 meters under the surface and possibly even identify water"
"yqqaW8DCc-I","00:15:02","00:15:06","resources buried below. [17] A vital  resource for future human missions.","resources buried below a vital resource for human missions"
"yqqaW8DCc-I","00:15:07","00:15:12","These are just some of the sensors aboard and  of course there are the usual high definition  ","these are just some of the sensors on board and of course there are the usual high definition"
"yqqaW8DCc-I","00:15:12","00:15:16","colour cameras that are going to  send back amazing images to earth  ","color cameras that are going to send back amazing images to earth"
"yqqaW8DCc-I","00:15:17","00:15:22","and we included a microphone, so we will be  able to hear what our future life on Mars  ","and this time we included a microphone so we'll be able to hear what our future life on mars may"
"yqqaW8DCc-I","00:15:23","00:15:28","may sound like.It may even catch the whirring  of helicopter blades off in the distance.","sound like it may even catch the whirring of helicopter blades off in the distance because"
"yqqaW8DCc-I","00:15:28","00:15:31","Because, by far the most  exciting part of this mission,  ","by far the most exciting part of this mission"
"yqqaW8DCc-I","00:15:31","00:15:36","to me, is the ingenuity helicopter.  After all, if successful, this will be  ","to me is the ingenuity helicopter after all if successful"
"yqqaW8DCc-I","00:15:37","00:15:42","the first time humans will have demonstrated  controlled powered flight on another planet.","this will be the first time humans have demonstrated controlled powered flight on another planet"
"yqqaW8DCc-I","00:15:43","00:15:43","",""
"yqqaW8DCc-I","00:15:43","00:15:49","Powered flight on Mars presents many challenges.  The atmosphere is about 1% the density of Earth’s,  ","powered flight on mars presents many challenges the atmosphere is about one percent the density of earth's"
"yqqaW8DCc-I","00:15:50","00:15:54","meaning there is less air to push down to  achieve lift. To combat this the propellor  ","meaning there is less air to push down to achieve lift to combat this"
"yqqaW8DCc-I","00:15:55","00:15:59","blades, which are counter rotating to  eliminate the need for a tail rotor,  ","the propeller blades which are counter rotating to eliminate the need for a tail rotor"
"yqqaW8DCc-I","00:15:59","00:15:59","",""
"yqqaW8DCc-I","00:16:00","00:16:06","spin much faster than a traditional helicopter  blade at about 2400 RPM. [18] That’s about 5  ","have to spin much faster than a traditional have to spin much faster than a traditional helicopter blade at about 2400 rpm that's about"
"yqqaW8DCc-I","00:16:07","00:16:13","times faster than an equal sized RC helicopter  here on earth. To deal with the centrifugal  ","five times faster than an equal sized rc helicopter here on earth to deal with the centrifugal forces"
"yqqaW8DCc-I","00:16:13","00:16:18","forces that come with that the blades need to  be made of high strength carbon composites.  ","that come with that the blades need to be made of high strength carbon composites"
"yqqaW8DCc-I","00:16:19","00:16:22","These blades also have a much larger angle  of attack than your run of the mill blade,  ","these blades also have a much larger angle of attack than your run-of-the-mill blade"
"yqqaW8DCc-I","00:16:23","00:16:23","",""
"yqqaW8DCc-I","00:16:24","00:16:26","allowing them to push a larger  volume of air downwards.","allowing them to push a larger volume of air downwards"
"yqqaW8DCc-I","00:16:27","00:16:27","",""
"yqqaW8DCc-I","00:16:27","00:16:32","Since this helicopter will detach from the  Perseverance rover, it needs its own power  ","since this helicopter will detach from the perseverance rover it needs its own power"
"yqqaW8DCc-I","00:16:32","00:16:37","source too. Unlike the planned Dragonfly mission  to Titan, this helicopter will not have it’s own  ","source unlike the planned dragonfly mission to tighten this helicopter will not"
"yqqaW8DCc-I","00:16:38","00:16:45","RTG. Creating an RTG capable of fitting into  this tiny 2 kilogram helicopter is unfeasible.","have its own rtg creating an rtg capable of fitting into this tiny two kilogram helicopter is unfeasible"
"yqqaW8DCc-I","00:16:45","00:16:51","Instead it features these solar panels, which  will charge 6 lithium ion batteries on board  ","instead it features these solar panels which will charge six lithium ion batteries on board"
"yqqaW8DCc-I","00:16:51","00:16:55","and these in turn will power  the motors and cameras aboard.  ","and these in turn will power the motors and cameras on board for a"
"yqqaW8DCc-I","00:16:56","00:17:01","For a max flight time of about 90 seconds. This  is simply a technology demonstration that will  ","max flight time of about 90 seconds this is simply a technology demonstration"
"yqqaW8DCc-I","00:17:02","00:17:07","hopefully give NASA and JPL the information they  need to approve and design a future flying rover.","that will hopefully give nasa and jpl the information they need to approve and design a future flying"
"yqqaW8DCc-I","00:17:08","00:17:08","","rover today"
"yqqaW8DCc-I","00:17:09","00:17:14","Today, the 18th of February  is a historic day that I  ","the 18th of february 2021 is a historic day that i and"
"yqqaW8DCc-I","00:17:14","00:17:17","and many others will remember  fondly for years to come.","many others will remember fondly for years to come"
"yqqaW8DCc-I","00:17:18","00:17:23","I remember exactly where I was and what I was  doing when the Curiosity Rover landed and I  ","i remember exactly where i was and what i was doing when the curiosity rover landed"
"yqqaW8DCc-I","00:17:23","00:17:29","remember seeing this man on my screen. A man who  subverted my vision of what an engineer working  ","and i remember seeing this man on my screen a man who subverted my vision of what an engineer working"
"yqqaW8DCc-I","00:17:30","00:17:35","on something this advanced was supposed to look  like. Bobak Ferdowsi. I could see myself being in  ","on something this advanced was supposed to look like babak ferdowsi i could see myself being in his"
"yqqaW8DCc-I","00:17:35","00:17:41","his seat. He was relatable, not the white shirt,  black tie, nerdy figure I had grown up expecting.  ","seat he was relatable not the white shirt black tie nerdy figure i had grown up expecting i"
"yqqaW8DCc-I","00:17:42","00:17:47","I remember because I was a fresh college graduate,  struggling to find a job, at a music festival  ","remember because i was a fresh college graduate struggling to find a job at a music festival"
"yqqaW8DCc-I","00:17:48","00:17:52","begging the organisers to put the landing on  the big screens, but just ended up watching the  ","begging the organizers to put the landing on the big screens but just ended up watching"
"yqqaW8DCc-I","00:17:53","00:17:58","livestream on my phone in a tent that was falling  apart. I didn’t fit the stereotype either. Today,  ","the live stream on my phone in a tent that was falling apart i didn't fit the stereotype either today"
"yqqaW8DCc-I","00:17:59","00:18:04","on the historic landing of Curiosity’s younger  brother, I released an interview on Nebula with  ","on the historic landing of curiosity's younger brother i released an interview on nebula with that"
"yqqaW8DCc-I","00:18:04","00:18:10","that man that I now somehow call a friend. Talking  about his career path into JPL and what it was  ","man that i now somehow call a friend talking about his career into jpl and what"
"yqqaW8DCc-I","00:18:11","00:18:17","like becoming famous literally overnight. That  interview is now available ad free on Nebula.","it was like becoming famous literally overnight that interview is now available ad free on nebula along with"
"yqqaW8DCc-I","00:18:17","00:18:21","Along with a whole host of new  original content not available  ","a whole host of new original content not available anywhere"
"yqqaW8DCc-I","00:18:21","00:18:26","anywhere else. Mustard’s new original called  “The Origins of Stealth”, which details the  ","else mustard's new original called the origins of stealth which details the fascinating"
"yqqaW8DCc-I","00:18:26","00:18:32","fascinating history of the F-117 Nighthawk. A 3  part trivia game show made by Sam from Wendover,  ","history of the f-117 nighthawk a three-part trivia game show made by sam from"
"yqqaW8DCc-I","00:18:33","00:18:34","","wendover productions and featuring yours"
"yqqaW8DCc-I","00:18:34","00:18:39","and featuring yours truly, that really shows how  distractible and unserious I am in person. These  ","truly that really shows how distractible and unserious i am in person"
"yqqaW8DCc-I","00:18:40","00:18:46","videos don’t get my personality across at all.  And ofcourse my 9 part logistics of d-day series.","these videos don't get my personality across at all and of course my 9 part logistics of d-day series"
"yqqaW8DCc-I","00:18:47","00:18:52","We are constantly adding more original content  and ad free versions of our YouTube videos,  ","we are constantly adding more original content and ad-free versions of our youtube videos"
"yqqaW8DCc-I","00:18:53","00:18:58","and all of that comes bundled with CuriosityStream  for the low price of just 14.79 a year.  ","and all of that comes bundled with curiosity stream for the low price of just 1479 a year"
"yqqaW8DCc-I","00:18:59","00:19:03","A little over 1 dollar a month. This is by  far the best way to support this channel  ","a little over one dollar a month this is by far the best way to support this channel"
"yqqaW8DCc-I","00:19:04","00:19:09","and get something in return with all the  amazing award documentaries on CuriosityStream,  ","and get something in return with all of the amazing award-winning documentaries on curiosity stream like this"
"yqqaW8DCc-I","00:19:10","00:19:12","like this fascinating biography  of Neil Armstrong’s life,  ","fascinating biography of neil armstrong's life"
"yqqaW8DCc-I","00:19:13","00:19:18","narrated by Harrison Ford. And you get  access to all our Original content on Nebula.","narrated by harrison ford and you get access to all of our original content on nebula"
"yqqaW8DCc-I","00:19:19","00:19:21","If you are looking for something  else to watch right now,  ","if you are looking for something else to watch right now why"
"yqqaW8DCc-I","00:19:21","00:19:25","why not watch my previous video  about NASA’s weird and wonderful  ","not watch my previous video about nasa's weird and wonderful"
"yqqaW8DCc-I","00:19:26","00:19:37","oblique wing plane,, or Real Science’s latest  video about the insane biology of ant colonies.","oblique wing plane or real sciences latest video about the insane biology of ant colonies"
"yqqaW8DCc-I","00:19:37","00:19:41","",""
