"video_id","min_timecode","max_timecode","text.user","text.auto"
"7uybRvy2sj0","00:19:32","00:19:39","them look at this material mama we look great when  they do a clueless reboot they won't be calling us  ","at this material mama we look great when they do a clueless reboot they won't be calling us"
"7uybRvy2sj0","00:19:39","00:19:41","","but they might"
"7uybRvy2sj0","00:19:41","00:19:44","but they might but they should they  might contact us to post about it on  ","but they should they might contact us to post about it on"
"7uybRvy2sj0","00:19:45","00:19:48","our instagram yes congratulations to all the  makeup brands we used today we love you all  ","our instagram yes congratulations to all the makeup brands we used today we love you all"
"7uybRvy2sj0","00:19:49","00:19:52","love you very much and congratulations to you  for winning thank you so much it's really cool  ","love you very much and congratulations to you for winning thank you so much it's really cool"
"7uybRvy2sj0","00:19:53","00:19:53","",""
"7uybRvy2sj0","00:19:53","00:19:57","you have to think like a teeny amount of people to  drag a teeny amount of people get to do drag race  ","you have to think like a teeny amount of people to drag a teeny amount of people get to do drag"
"7uybRvy2sj0","00:19:58","00:20:03","and the tiniest sliver of people win win i'm one  of three i keep thinking about like i'm one of 13  ","race and the tiniest sliver of people win win i'm one of three i keep thinking about like i'm one of 13"
"7uybRvy2sj0","00:20:04","00:20:07","like seriously queens that have won that  show and i've watched the show since season  ","like seriously queens that have won that show and i've watched the show since"
"7uybRvy2sj0","00:20:08","00:20:11","one and now i'm like on someone's mantle  that's [ __ ] crazy now you're a husband","season one and now i'm like on someone's mantle that's crazy now"
"7uybRvy2sj0","00:20:12","00:20:14","","you're a husband"
"7uybRvy2sj0","00:20:14","00:20:17","if you guys want to follow symone  let them know where to find you i am  ","if you guys want to follow simone let them know where to find you i am"
"7uybRvy2sj0","00:20:18","00:20:24","at these some the underscore symone on instagram  and the underscore symone with extra e on the end  ","at these some the underscore simone on instagram and the underscore simone with extra e on the end on twitter"
"7uybRvy2sj0","00:20:24","00:20:31","on twitter confusing confusing us someone took my  name and gave it back to me i do have a tick tock  ","confusing confusing us someone took my name and gave it back to me i do have a tick tock the"
"7uybRvy2sj0","00:20:31","00:20:35","the underscore symone i wish i should start  using it yes get in to give to give the  ","underscore simone i wish i should start using it yes get in to give to give the"
"7uybRvy2sj0","00:20:35","00:20:39","children the kids i should start using it kick  the shoe do all the you know they do y'all do  ","children the kids i should start using it kick the shoe do all the you know they"
"7uybRvy2sj0","00:20:40","00:20:44","love that [ __ ] okay i'll think about it thank  you guys for joining us today thank you and um  ","do y'all do love that okay i'll think about it thank you guys for joining us today thank you and"
"7uybRvy2sj0","00:20:45","00:20:45","","um don't"
"7uybRvy2sj0","00:20:45","00:20:48","don't let the smooth taste for you don't let  the sweet taste fool you baby [ __ ] don't  ","let the smooth taste for you don't let the sweet taste fool you baby"
"7uybRvy2sj0","00:20:49","00:20:52","ever forget honey if i never taught you  none of this drag race don't ever let it","don't ever forget honey if i never taught you none of this drag race don't ever let"
"7uybRvy2sj0","00:20:53","00:20:55","","it goodbye"
"7uybRvy2sj0","00:20:56","00:21:03","","this"
"7uybRvy2sj0","00:21:03","00:21:05","this is great we look great stunning oh my god","is great we look great stunning oh my god"
"7uybRvy2sj0","00:21:06","00:21:06","",""
