"video_id","min_timecode","max_timecode","text.user","text.auto"
"7uybRvy2sj0","00:00:00","00:00:03","oh you got white claws [ __ ] yeah we do  you want me oh let's go with mango and  ","oh you got white claws yeah we do you want me oh let's go with mango"
"7uybRvy2sj0","00:00:04","00:00:04","","and"
"7uybRvy2sj0","00:00:05","00:00:08","you went for being like i'll just have  a water like did you say white cloth  ","you went for being like i'll just have a water like did you say white cloth"
"7uybRvy2sj0","00:00:09","00:00:15","hey y'all this is symone and  trixie and we getting ready to go","hey y'all this is simone and trixie and we getting ready to go"
"7uybRvy2sj0","00:00:16","00:00:21","","hi it's"
"7uybRvy2sj0","00:00:21","00:00:25","hi it's me trixie mattel welcome back to my channel if you're new here i'm a world  ","matrix intel welcome back to my channel if you're new here i'm a world famous drag queen"
"7uybRvy2sj0","00:00:25","00:00:30","famous drag queen with a passion for makeup  artistry and this is did you like in the  ","with a passion for makeup artistry and this is did you"
"7uybRvy2sj0","00:00:30","00:00:33","final pit stop when we called you symone i  loved it and then we called you love simon","like in the final pit stop when we called you simone i loved it and then we called you"
"7uybRvy2sj0","00:00:34","00:00:36","","love simon"
"7uybRvy2sj0","00:00:37","00:00:40","i can't believe you took time at your schedule  because you just won drag race well no darling  ","i can't believe you took time at your schedule because you just won drag race"
"7uybRvy2sj0","00:00:41","00:00:44","i was like miss trixie didn't call me so i gotta  go you cancelled the gigs i cancelled the game  ","well no darling i was like miss trixie didn't call me so i gotta go you cancelled the gigs i cancelled"
"7uybRvy2sj0","00:00:45","00:00:49","i canceled the game today we're gonna  play with the clueless collection  ","the game i canceled the game today we're gonna play with the clueless collection from hip dot we're"
"7uybRvy2sj0","00:00:49","00:00:52","from hip dot we're gonna play with the  spongebob squarepants collection from  ","gonna play with the spongebob squarepants collection from wet"
"7uybRvy2sj0","00:00:53","00:00:56","wet and wild and then i like to creep  on other people's yeah stash because  ","and wild and then i like to creep on other people's yeah stash because i'm already seeing"
"7uybRvy2sj0","00:00:56","00:01:03","i'm already seeing some sister mom she turns me  good look at me no she just won drag race 100  ","some sister mom she turns me good look at me no she just won drag race 100"
"7uybRvy2sj0","00:01:03","00:01:04","",""
"7uybRvy2sj0","00:01:05","00:01:09","listen you can take the girl out the country but  you can't just click her you do something i love  ","listen you can take the girl out the country but you can't just click her you do something i love"
"7uybRvy2sj0","00:01:10","00:01:15","what do you put makeup on your body oh yeah and  i'm the body makeup police when i saw you in the  ","what do you put makeup on your body oh yeah and i'm the body makeup police the body makeup police when i saw you in the"
"7uybRvy2sj0","00:01:15","00:01:20","finale in your white outfit i saw your skin was  painted i was like that outfit is ruined on the  ","finale in your white outfit i saw your skin was painted i was like that outfit is ruined on the"
"7uybRvy2sj0","00:01:21","00:01:25","outside completely brown when you open it up so  she has no eyebrows i'm going to cover my eyebrows  ","outside completely brown when you open it up so she has no eyebrows i'm going to cover my eyebrows"
"7uybRvy2sj0","00:01:26","00:01:32","and we're going to be right back spongebob is here  oh i went to buy this and it was sold out and they  ","and we're going to be right back spongebob is here oh i went to buy this and it was sold out and they sent"
"7uybRvy2sj0","00:01:32","00:01:37","sent it to me anyway oh my god this clueless  fantasy i mean could you just could you just i  ","it to me anyway oh my god this clueless fantasy i mean could you just could you just i"
"7uybRvy2sj0","00:01:38","00:01:43","mean that is for the gays babe for the game this  is for the gays you want a new sponge i'll do a  ","mean that is for the gays babe for the game this is for the gays you want a new sponge"
"7uybRvy2sj0","00:01:44","00:01:49","new sponge okay do you want squidward or do you  want patrick hmm let's do squidward okay grab it  ","i'll do a new sponge okay want squidward or do you want patrick hmm let's do squidward okay grab it"
"7uybRvy2sj0","00:01:49","00:01:50","","david"
"7uybRvy2sj0","00:01:51","00:01:56","david can you wet this one too thanks david oh  uh this is the holy hydration face cream from elf  ","can you wet this one too thanks david oh uh this is the holy hydration face cream from elf love"
"7uybRvy2sj0","00:01:56","00:02:01","love it love it this is the rare beauty pore  diffusing primer let's see what the tea is oh  ","it love it this is the rare beauty pore diffusing primer let's see what the tea is oh"
"7uybRvy2sj0","00:02:02","00:02:06","did you forget proper i forgot primer who does  that i'm gonna try rare beauty let's try rare  ","did you forget proper i forgot primer who does that i'm gonna try rare beauty let's try rare"
"7uybRvy2sj0","00:02:07","00:02:12","have you had a rare beauty product i'm not they're  really good rare if you will wait a minute this  ","have you had a rare beauty product i'm not they're really good rare if you will wait a minute this can't"
"7uybRvy2sj0","00:02:12","00:02:16","can't stop won't stop oh it is and it's 400  degrees in here we're just gonna go with it your  ","stop won't stop oh it is and it's 400 degrees in here we're just gonna go"
"7uybRvy2sj0","00:02:17","00:02:22","macro and this is mac full coverage i used it one  time you didn't live yeah i did not live i used it  ","with it your macro and this is mac full coverage i used it one time you didn't live yeah i did not live i used"
"7uybRvy2sj0","00:02:23","00:02:27","because i bought it and i was poor i think one day  i just wilded out and bought every shade did you  ","it because i bought it and i was poor i think one day i just wilded out and bought every shade did you"
"7uybRvy2sj0","00:02:28","00:02:32","yeah i've had this since i was doing makeup what  you got there this is shiseido because we love to  ","yeah i've had this since i was doing makeup what you got there this is shiseido because we love to be lifted"
"7uybRvy2sj0","00:02:32","00:02:37","be lifted baby you can never be too young to live  so you walked into drag race everybody there's  ","baby you can never be too young to live so you walked into drag race everybody there's"
"7uybRvy2sj0","00:02:38","00:02:43","incredible yes most of them yeah did you think i'm  going to win right away um i didn't necessarily  ","incredible yes most of them yeah did you think i'm going to win right away um i didn't necessarily"
"7uybRvy2sj0","00:02:44","00:02:47","think i'm going to win but i did say i'm going  to make it to the end of this competition  ","think i'm going to win but i did say i'm going to make it to the end of this competition"
"7uybRvy2sj0","00:02:47","00:02:51","1 000 i love that i there was no doubt in my mind  even when we were lip thinking or when i was like  ","1 000 i love that i there was no doubt in my mind even when we were lip thinking or when i"
"7uybRvy2sj0","00:02:52","00:02:56","having my infamous emotional breakdown it was  emotional but i also saw you cheating out to  ","was like having my infamous emotional breakdown it was emotional but i also saw you cheating"
"7uybRvy2sj0","00:02:57","00:03:02","camera i saw you finding your light you were like  i was like these tears i would like to be seen  ","out to camera i saw you finding your light you were like i was like these tears i would like to"
"7uybRvy2sj0","00:03:03","00:03:06","yeah people don't know that drag race girls when  we get together we have like instant bonds because  ","be seen yeah people don't know that drag race girls when we get together we have like instant bonds"
"7uybRvy2sj0","00:03:07","00:03:13","we all have gone through something so horrible  and we've all experienced the same drama oh [ __ ]","because we all have gone through something so horrible and we've all experienced the same drama oh"
"7uybRvy2sj0","00:03:14","00:03:17","are you already living a living and this is  actually how much i would wear when i first  ","are you already living a living and this is actually how much i would wear when i first"
"7uybRvy2sj0","00:03:18","00:03:22","started you were a woman i was like who didn't  have makeup on no you need to wear makeup and i  ","started you were a woman i was like who didn't have makeup on no you need to wear"
"7uybRvy2sj0","00:03:23","00:03:26","was like no i don't i was wondering if they  were your height man like you don't need it  ","makeup and i was like no i don't i was wondering if they were your height man like you don't"
"7uybRvy2sj0","00:03:27","00:03:31","no it was completely the opposite on a  little bit of concealer and look at this  ","need it no it was completely the opposite on a little bit of concealer and look at this it's an anastasia"
"7uybRvy2sj0","00:03:31","00:03:36","it's an anastasia mm-hmm gorgeous banana that's  banana do they know what a banana looks like  ","mm-hmm gorgeous banana that's banana do they know what a banana looks like"
"7uybRvy2sj0","00:03:37","00:03:37","","you look"
"7uybRvy2sj0","00:03:37","00:03:41","you look like people in your family and drag it  all uh my mom yeah i feel like i look like my mom  ","like people in your family and drag it all uh my mom yeah i feel like i look like my mom a lot when you"
"7uybRvy2sj0","00:03:41","00:03:45","a lot when you were going out on the tv was your  family like they were like you like a woman they  ","were going out on the tv was your family like they were like you like a woman"
"7uybRvy2sj0","00:03:45","00:03:48","weren't like will you put some clothes on oh all  right how did you blend with this what's going  ","they weren't like will you put some clothes on oh all right how did you blend with this what's going on"
"7uybRvy2sj0","00:03:49","00:03:52","on here my favorite thing is to completely mess up  my own makeup my own accordion and then go wet and  ","here my favorite thing is to completely mess up my own makeup my own accordion"
"7uybRvy2sj0","00:03:53","00:03:58","wild got the girls what is my own when was your  own fun fault are you a spongebob diva um i am i  ","and then go wet and wild got the girls what is my own when was your own fun fault are you a spongebob diva um i am i"
"7uybRvy2sj0","00:03:59","00:04:02","watched it through college which is a little late  to keep watching it a little bit but that's okay i  ","watched it through college which is a little late to keep watching it a little bit but that's okay"
"7uybRvy2sj0","00:04:02","00:04:05","had a friend in high school who was i don't even  know if obsessed is the worst can we talk about  ","i had a friend in high school who was i don't even know if obsessed is the worst"
"7uybRvy2sj0","00:04:06","00:04:09","some high points of your season let's talk about  all the points we have to talk about lala rie bag  ","can we talk about some high points of your season let's talk about all the points we have to talk about la la"
"7uybRvy2sj0","00:04:10","00:04:11","","reese bag"
"7uybRvy2sj0","00:04:12","00:04:15","what were you thinking in real time i thought  she's going to turn it okay and so i was excited  ","what were you thinking in real time i thought she's going to turn it okay and so i was excited"
"7uybRvy2sj0","00:04:15","00:04:16","",""
"7uybRvy2sj0","00:04:16","00:04:20","someone lied to her several times  someone liked her several times yeah  ","someone lied to her several times someone liked her several times yeah i remember"
"7uybRvy2sj0","00:04:21","00:04:25","i remember all of us looking at it and i think she  kind of knew but at this point she was like i can  ","all of us looking at it and i think she kind of knew but at this point she was like i"
"7uybRvy2sj0","00:04:26","00:04:32","lip sync so she was like it is what it is it is  what it is oh violet was the guest that episode oh  ","can lip sync so she was like it is what it is it is what it is oh violet was the guest that episode oh"
"7uybRvy2sj0","00:04:33","00:04:39","yes she sure was that was the nice edit there  was something worse i don't want to tell the  ","yes she sure was that was the nice edit there was something worse i don't want to"
"7uybRvy2sj0","00:04:40","00:04:44","tales out of school i'll know let's sell the  sales in school no she literally let every  ","tell the tales out of school i'll know let's sell the sales in school no she literally let"
"7uybRvy2sj0","00:04:45","00:04:49","[ __ ] on your season have it to the point where  vh1 was like we can't have her hating the show  ","every on your season have it to the point where vh1 was like we can't have her hating the show oh"
"7uybRvy2sj0","00:04:49","00:04:55","oh my god let me just say if i edited the pit  stop we live in a different world but oh yes  ","have her hating the show oh my god let me just say if i edited the pit stop we live in a different world but oh yes"
"7uybRvy2sj0","00:04:56","00:05:01","the drag name first name delilah alamein not  feeling it erica not feeling it then i wrote  ","the drag name first name delilah alamein not feeling it erica not feeling it then i wrote a play in"
"7uybRvy2sj0","00:05:01","00:05:05","a play in high school i think it was my senior  year and i just needed a name really quickly i  ","high school i think it was my senior year and i just needed a name really quickly i just"
"7uybRvy2sj0","00:05:05","00:05:09","just popped my head and it stuck there you go and  there you go and then it was symone more coffee  ","popped my head and it stuck there you go and there you go and then it was simone more coffee"
"7uybRvy2sj0","00:05:09","00:05:10","",""
"7uybRvy2sj0","00:05:11","00:05:13","you were getting real hoey i  was a horny little teenager  ","you were getting real hoey i was a horny little teenager"
"7uybRvy2sj0","00:05:14","00:05:15","","this is the"
"7uybRvy2sj0","00:05:15","00:05:19","this is the scott barnes contour palette i just  i've had this forever and haven't really used it  ","scott barnes contour palette i just i've had this forever and haven't really"
"7uybRvy2sj0","00:05:20","00:05:23","so i want to try this spongebob flat kabuki  brush i think this is good for my cheeks  ","used it so i want to try this spongebob flat kabuki brush i think this is good for my"
"7uybRvy2sj0","00:05:24","00:05:25","","cheeks"
"7uybRvy2sj0","00:05:26","00:05:30","don't let the smooth taste don't let the smooth  face fool you baby what does that mean it was  ","don't let the smooth taste don't let the smooth face fool you baby what does that mean it was a um"
"7uybRvy2sj0","00:05:31","00:05:38","a um malt liquor ad and i was like that is  drunk [ __ ] i'm a drunk [ __ ] i'm really  ","malt liquor ad and i was like that is drunk i'm a drunk"
"7uybRvy2sj0","00:05:39","00:05:45","liking this contour you really do wear makeup  don't you oh [ __ ] oh [ __ ] wow hold on girl  ","i'm really liking this contour you really do wear makeup don't you oh oh wow hold on girl"
"7uybRvy2sj0","00:05:45","00:05:46","","the blurring"
"7uybRvy2sj0","00:05:46","00:05:51","the blurring effect is wow damn if you meet a  drag queen and they have a clean makeup kit run  ","effect is wow damn if you meet a drag queen and they have a clean makeup kit"
"7uybRvy2sj0","00:05:52","00:05:56","run that's a that's a psychopath yeah i heard  you like paramore i love paramore you do i do  ","run run that's a that's a psychopath yeah i heard you like paramore i love paramore you do i do i"
"7uybRvy2sj0","00:05:56","00:06:01","i genuinely do and that was my scene phase in  high school and so obviously i was listening to  ","genuinely do and that was my scene phase in high school and so obviously i was listening"
"7uybRvy2sj0","00:06:02","00:06:05","the music they're listening to and i love paramore  you know i remember being kind of like into that  ","to the music they're listening to and i love paramore you know i remember being kind of like into that"
"7uybRvy2sj0","00:06:05","00:06:10","kind of music but not being able to afford the  look the look yes all my friends were that look  ","kind of music but not being able to afford the look the look yes all my friends were that look and"
"7uybRvy2sj0","00:06:10","00:06:15","and i just look you know it's my brother's  hand-me-downs being like i like music too  ","i just look you know it's my brother's hand-me-downs being like i like music too hand-me-downs being like i like music too"
"7uybRvy2sj0","00:06:15","00:06:16","",""
"7uybRvy2sj0","00:06:17","00:06:20","are you how many siblings do you have my brother's  five-year-old me okay i'm so he's figuring  ","are you how many siblings do you have my brother's five-year-old me okay i'm so he's figuring"
"7uybRvy2sj0","00:06:20","00:06:22","","i'm"
"7uybRvy2sj0","00:06:22","00:06:25","i'm right in the middle i'm the least least  cool least important they think you have it  ","right in the middle i'm the least least cool least important they think"
"7uybRvy2sj0","00:06:26","00:06:31","oh bob is calling bobothy hello i'm here with  symone you know you don't miss symone what's  ","you have it oh bob is calling bobothy hello i'm here with simone you know you don't miss"
"7uybRvy2sj0","00:06:32","00:06:37","up mr drag queen how are you i'm doing  lovely how are you doing congratulations  ","simone what's up mr drag queen how are you i'm doing lovely how are you doing congratulations"
"7uybRvy2sj0","00:06:38","00:06:43","thank you you can still catch your episodes  of drag race on tv land you know what you're  ","thank you you can still catch your episodes of drag race on tv land you know what you're doing yeah can we"
"7uybRvy2sj0","00:06:43","00:06:46","doing yeah can we call you in like an hour  when we're done yeah video me on facebook","call you in like an hour when we're done yeah video me on facebook"
"7uybRvy2sj0","00:06:47","00:06:53","","[Music]"
"7uybRvy2sj0","00:06:54","00:06:56","okay we will video you on facebook bob all right  ","okay we will video you on facebook bob all right"
"7uybRvy2sj0","00:06:57","00:06:57","",""
"7uybRvy2sj0","00:06:58","00:07:03","bob's in queueing on what's your favorite look on  yourself i'm giving you the newest of the nudist  ","bob's in queueing on what's your favorite look on yourself i'm giving you the newest of the nudist lip"
"7uybRvy2sj0","00:07:03","00:07:09","lip a cute blush that's orange toned and a lovely  bronzed eye with a gold because i want your eye  ","a cute blush that's orange toned and a lovely bronzed eye with a gold because i want your"
"7uybRvy2sj0","00:07:10","00:07:15","like i love my eyes so i want them to go like  right here that's mine what about you honestly  ","eye like i love my eyes so i want them to go like right here that's mine what about you honestly"
"7uybRvy2sj0","00:07:15","00:07:16","",""
"7uybRvy2sj0","00:07:17","00:07:21","black and white graphic like 60s cut  tricksy eye a nude lip i'm gonna use this","black and white graphic like 60s cut tricksy eye a nude lip i'm gonna use this"
"7uybRvy2sj0","00:07:22","00:07:24","","what's here"
"7uybRvy2sj0","00:07:24","00:07:29","what's here oh a new palette palette smaller this  palette this is pretty i like this palette let's  ","oh a new palette palette smaller this palette this is pretty i like this"
"7uybRvy2sj0","00:07:30","00:07:36","see what we got this color fat p-h-a-t ooh they  caught themselves do you like the film clueless  ","palette let's see what we got this color fat p-h-a-t ooh they caught themselves do you like the film clueless"
"7uybRvy2sj0","00:07:37","00:07:41","i do like to film schools i have not seen it in  a very long time but i do remember living oh god  ","i do like to film schools i have not seen it in a very long time but i do remember living oh god this"
"7uybRvy2sj0","00:07:41","00:07:45","this is the danessa myrick's color fix i haven't  used what is that a color fix it's like a body  ","is the nessa myrick's color fix i haven't used what is that a color fix it's like a body paint"
"7uybRvy2sj0","00:07:45","00:07:49","paint but for your face you can use it anywhere  on your face i think it's sort of like a p louise  ","but for your face you can use it anywhere on your face i think it's sort of like a p louise"
"7uybRvy2sj0","00:07:50","00:07:54","again i'm just trying to use more new makeup in  the morning makeup so you moved to la how long  ","again i'm just trying to use more new makeup in the morning makeup so you moved to la how long ago two"
"7uybRvy2sj0","00:07:54","00:08:00","ago two years and four months i think now look how  different these eyebrows are right now oh you came  ","years and four months i think now look how different these eyebrows are right now oh you came to"
"7uybRvy2sj0","00:08:01","00:08:07","to the right channel oh my eyebrows nevermind  mother they say sisters not twins my brows have  ","the right channel oh my eyebrows oh you came to the right channel oh my eyebrows nevermind eyebrows nevermind mother they say sisters not twins my brows have never met my"
"7uybRvy2sj0","00:08:07","00:08:09","never met my brows might have bumped into each  other in an elevator once they have two different  ","brows might have bumped into each other in an elevator once"
"7uybRvy2sj0","00:08:10","00:08:15","faucets oh completely different fathers different  zip codes my brows are twins but it's like the  ","they have two different faucets oh completely different fathers different zip codes my brows are twins but it's like"
"7uybRvy2sj0","00:08:15","00:08:20","parent trap like one lives in london yeah so you  love the movie hocus pocus i love the movie hocus  ","the parent trap like one lives in london yeah so you love the movie hocus pocus i love the movie hocus pocus"
"7uybRvy2sj0","00:08:20","00:08:24","pocus that's my favorite movie of all time i love  witches in general like i love anything that has  ","that's my favorite movie of all time i love witches in general like i love anything"
"7uybRvy2sj0","00:08:24","00:08:28","like magic or fantasy in it uh-huh there's just  something about that movie that just gets me good  ","that has like magic or fantasy in it uh-huh there's just something about that movie that just gets me good"
"7uybRvy2sj0","00:08:29","00:08:32","i'm not a disney game whatsoever but every year i  look forward to watching that october that's same  ","i'm not a disney game whatsoever but every year i look forward to watching that october that's same"
"7uybRvy2sj0","00:08:33","00:08:33","","with halloweentown"
"7uybRvy2sj0","00:08:33","00:08:37","with halloweentown i swear halloween i was a  disney person girl i was like you were nickelodeon  ","i swear halloween i was a disney person girl i was like you were nickelodeon"
"7uybRvy2sj0","00:08:38","00:08:44","i'm assuming i was disney i was at all when you  won mm-hmm because you know i've also won did you  ","i'm assuming i was disney i was at all when you won mm-hmm because you know i've also won did you cry"
"7uybRvy2sj0","00:08:44","00:08:50","cry in the moment i i broke down yeah i saw the  video of uh you guys at your house all watching it  ","in the moment i i broke down yeah i saw the video of uh you guys at your house all watching it"
"7uybRvy2sj0","00:08:51","00:08:55","and the jumping the shirt the shirt grabbing and  stretching and stretching and like everyone losing  ","and the jumping the shirt the shirt grabbing and stretching and stretching and like everyone losing"
"7uybRvy2sj0","00:08:55","00:09:03","their [ __ ] mind oh my god this color fix is  fierce what is this it's a matte liquid pigment  ","their mind oh my god this color fix is fierce what is this it's a matte liquid pigment"
"7uybRvy2sj0","00:09:04","00:09:08","and these are all nude shades interesting i just  love them i'm cutting my crease to do my brow with  ","and these are all nude shades interesting i just love them i'm cutting my crease to do my brow with"
"7uybRvy2sj0","00:09:09","00:09:12","it i've had the color fix of white and black  and i didn't know that they made skin colors  ","it i've had the color fix of white and black and i didn't know that they made skin colors my ex-boyfriend"
"7uybRvy2sj0","00:09:12","00:09:17","my ex-boyfriend kyle works at alcone new york and  he sent these to me oh so you're still friends oh  ","kyle works at alcone new york and he sent these to me oh so you're still friends oh yes"
"7uybRvy2sj0","00:09:18","00:09:22","yes i will sleep with him for the rest of his  life in exchange for the rest of his life yep","i will sleep with him for the rest of his life in exchange for the rest of his life yep"
"7uybRvy2sj0","00:09:22","00:09:24","","and no"
"7uybRvy2sj0","00:09:24","00:09:26","and no actually i think danessa  merrick sent me this do you know just  ","actually i think vanessa merrick sent me this do you know"
"7uybRvy2sj0","00:09:27","00:09:27","","just"
"7uybRvy2sj0","00:09:28","00:09:35","oh i'm new to all of this i'm sorry she's this  incredible maker artist you worked the mac didn't  ","oh i'm new to all of this i'm sorry she's this incredible maker artist you worked the mac"
