channelTitle,channelId,videoTitle,videoTitleLoc,videoId,videoSearchCategoryId,videoCategoryId,videoViews,videoQueryTime,videoTrendingRank,captionLang,captionType,id,videoCategory,assignable
Forge Labs,UCiSVf-UpLC9rRjAT1qRTW0g,Whoever Can Survive The Most Days On A Deserted Island In Minecraft Wins,Whoever Can Survive The Most Days On A Deserted Island In Minecraft Wins,o27JxueWodw,0,20,2888709,2021-02-26 01:00:03,1,en,asr,20,Gaming,True
Netflix,UCWOA1ZGywLbqmigxE4Qlvuw,Army of the Dead | Official Teaser | Netflix,Army of the Dead | Official Teaser | Netflix,H83kjG5RCT8,0,24,1451495,2021-02-26 01:00:03,2,en-US,standard,24,Entertainment,True
Pixar,UC_IRYSp4auq7hKLvziWVH6w,Disney and Pixar's Luca | Teaser Trailer,Disney and Pixar's Luca | Teaser Trailer,YdAIBlPVe9s,0,1,2110739,2021-02-26 01:00:03,3,en,asr,1,Film & Animation,True
Pixar,UC_IRYSp4auq7hKLvziWVH6w,Disney and Pixar's Luca | Teaser Trailer,Disney and Pixar's Luca | Teaser Trailer,YdAIBlPVe9s,0,1,2110739,2021-02-26 01:00:03,3,en,standard,1,Film & Animation,True
VIEWS,UCJ94IBNmj9bBGHgqV1EXCBw,CHARLI AND DIXIE ON BEING FAMOUS SISTERS!!,CHARLI AND DIXIE ON BEING FAMOUS SISTERS!!,9YQ19x66U6E,0,24,2404642,2021-02-26 01:00:03,4,en,asr,24,Entertainment,True
ZHC Crafts,UCPAk4rqVIwg1NCXh61VJxbg,"Best Food Art Wins $5,000 Challenge! | ZHC Crafts","Best Food Art Wins $5,000 Challenge! | ZHC Crafts",qaXMnT9CfIk,0,26,1919524,2021-02-26 01:00:03,5,en,asr,26,Howto & Style,True
NPR Music,UC4eYXhJI4-7wSWc8UNRwD4A,Kirk Franklin: Tiny Desk (Home) Concert,Kirk Franklin: Tiny Desk (Home) Concert,wRwId2RfmfA,0,10,410962,2021-02-26 01:00:03,6,en,asr,10,Music,True
Yes Theory,UCvK4bOhULCpmLabd2pDMtnA,I'm Leaving YouTube,I'm Leaving YouTube,TRjISzJPsuk,0,24,853634,2021-02-26 01:00:03,7,en,asr,24,Entertainment,True
Dream Shorts,UCZWBGXa6kiaWo9-pE8CX6Dg,Dream Team Reality TV Show...,Dream Team Reality TV Show...,i54eOei2ESk,0,22,1889181,2021-02-26 01:00:03,8,en,asr,22,People & Blogs,True
KQ ENTERTAINMENT,UCQdq-lqPEq_yZ_wP_kuVB9Q,ATEEZ(에이티즈) – ‘불놀이야 (I'm The One)’ Performance Preview,ATEEZ(에이티즈) – ‘불놀이야 (I'm The One)’ Performance Preview,CeP3XYwoOcs,0,10,1568750,2021-02-26 01:00:03,9,,,10,Music,True
JGOD,UCG0yjoHan7kXjROe0JgvhzQ,Season 2 Ruined Cold War Guns in Warzone | Huge Changes in 1.32 Update,Season 2 Ruined Cold War Guns in Warzone | Huge Changes in 1.32 Update,mXE52ABrx0k,0,20,454197,2021-02-26 01:00:03,10,en,asr,20,Gaming,True
Casually Explained,UCr3cBLTYmIK9kY0F_OdFWFQ,Casually Explained: High School,Casually Explained: High School,mY6c1N4WG5w,0,23,516507,2021-02-26 01:00:03,11,en,asr,23,Comedy,True
MTV UK,UCuwUfM8E79h2sqp34Fut6kw,BTS Performs 'Fix You' (Coldplay Cover) | MTV Unplugged Presents: BTS,BTS Performs 'Fix You' (Coldplay Cover) | MTV Unplugged Presents: BTS,60g72d4Nqss,0,24,10822578,2021-02-26 01:00:03,12,,,24,Entertainment,True
ChloexHalleVEVO,UCFhhbIItPkfh4pckWIeOraA,Chloe x Halle - Ungodly Hour (Official Video),Chloe x Halle - Ungodly Hour (Official Video),OPS8WTYqxeM,0,10,917924,2021-02-26 01:00:03,13,en,asr,10,Music,True
Swagg,UCW1CGYCjfKhNLGp_Os1g_Pg,THIS is COLD WAR WARZONE Season 2...(NEW Map Update!),THIS is COLD WAR WARZONE Season 2...(NEW Map Update!),WTyyNifsjnc,0,20,703309,2021-02-26 01:00:03,14,en,asr,20,Gaming,True
Sony Pictures Entertainment,UCz97F7dMxBNOfGYu3rx8aCw,The New Spider-Man Title is…,The New Spider-Man Title is…,iqyPvdsOWKk,0,24,2002723,2021-02-26 01:00:03,15,en,asr,24,Entertainment,True
Post Malone - Topic,UCyD3XWRK9ko-izf2nBSFitw,Only Wanna Be With You (Pokémon 25 Version),Only Wanna Be With You (Pokémon 25 Version),0MF7LgQ-NWg,0,10,465441,2021-02-26 01:00:03,16,,,10,Music,True
colinfurze,UCp68_FLety0O-n9QU6phsgw,Stayed up all night and converted my plastic shark head to have a 10 TON Bite,Stayed up all night and converted my plastic shark head to have a 10 TON Bite,OaDZ3uCflhI,0,24,403538,2021-02-26 01:00:03,17,en,asr,24,Entertainment,True
colinfurze,UCp68_FLety0O-n9QU6phsgw,Stayed up all night and converted my plastic shark head to have a 10 TON Bite,Stayed up all night and converted my plastic shark head to have a 10 TON Bite,OaDZ3uCflhI,0,24,403538,2021-02-26 01:00:03,17,en,standard,24,Entertainment,True
Paramount Plus,UCrRttZIypNTA1Mrfwo745Sg,Who's Ready For Rugrats 2021? | First Look | Paramount+,Who's Ready For Rugrats 2021? | First Look | Paramount+,sNky0GJG1x0,0,24,435947,2021-02-26 01:00:03,18,en,asr,24,Entertainment,True
First We Feast,UCPD_bxCRGpmmeQcbe2kpPaA,Kenan Thompson Becomes a Card-Carrying Spiceman While Eating Spicy Wings | Hot Ones,Kenan Thompson Becomes a Card-Carrying Spiceman While Eating Spicy Wings | Hot Ones,Nk1P_VTENFo,0,24,469787,2021-02-26 01:00:03,19,en,asr,24,Entertainment,True
Teenenggr,UCNolGmzBR60IZfS9z7LlNEw,"Controller Rumble is not enough to feel the game, Just Rumble Everything!","Controller Rumble is not enough to feel the game, Just Rumble Everything!",fxmLD8y0RNQ,0,28,1071281,2021-02-26 01:00:03,20,,,28,Science & Technology,True
Keeping Up With The Kardashians,UC8oimTPVHKiC7oL3QgdKbgg,"Scott Disick Ready To Marry Kourtney ""Right Here, Right Now"" | KUWTK Exclusive Look | E!","Scott Disick Ready To Marry Kourtney ""Right Here, Right Now"" | KUWTK Exclusive Look | E!",vgJHi0vQ4AY,0,24,478641,2021-02-26 01:00:03,21,en,asr,24,Entertainment,True
Bradley Martyn,UC7aE5B-ZFEAoumyj6FaJ7lg,NOAH BROUGHT DIXIE TO ZOO CULTURE,NOAH BROUGHT DIXIE TO ZOO CULTURE,j9DOrwNX6BM,0,22,574625,2021-02-26 01:00:03,22,en,asr,22,People & Blogs,True
Dude Perfect,UCRijo3ddMTht_IHyNSNXpNQ,Dude Wars | OT 24,Dude Wars | OT 24,n1dEqq2hepw,0,17,9807848,2021-02-26 01:00:03,23,de,standard,17,Sports,True
Dude Perfect,UCRijo3ddMTht_IHyNSNXpNQ,Dude Wars | OT 24,Dude Wars | OT 24,n1dEqq2hepw,0,17,9807848,2021-02-26 01:00:03,23,en,standard,17,Sports,True
Dude Perfect,UCRijo3ddMTht_IHyNSNXpNQ,Dude Wars | OT 24,Dude Wars | OT 24,n1dEqq2hepw,0,17,9807848,2021-02-26 01:00:03,23,es,standard,17,Sports,True
Dude Perfect,UCRijo3ddMTht_IHyNSNXpNQ,Dude Wars | OT 24,Dude Wars | OT 24,n1dEqq2hepw,0,17,9807848,2021-02-26 01:00:03,23,fr,standard,17,Sports,True
Dude Perfect,UCRijo3ddMTht_IHyNSNXpNQ,Dude Wars | OT 24,Dude Wars | OT 24,n1dEqq2hepw,0,17,9807848,2021-02-26 01:00:03,23,hi,standard,17,Sports,True
Dude Perfect,UCRijo3ddMTht_IHyNSNXpNQ,Dude Wars | OT 24,Dude Wars | OT 24,n1dEqq2hepw,0,17,9807848,2021-02-26 01:00:03,23,ru,standard,17,Sports,True
RDCworld1,UC4G10tk3AHFuyMIuD3rHOBA,How Bobby Shmurda finna be when he Gets Back in the Studio,How Bobby Shmurda finna be when he Gets Back in the Studio,N-tPnYG5u-s,0,22,2105078,2021-02-26 01:00:03,24,en,asr,22,People & Blogs,True
IMPAULSIVE Clips,UCE9ZKI1b_PhVm3gejYuilhw,MIKE MAJLAK SPEAKS ON BREAKUP WITH LANA RHOADES,MIKE MAJLAK SPEAKS ON BREAKUP WITH LANA RHOADES,L0Lki9k_OMM,0,24,920826,2021-02-26 01:00:03,25,en,asr,24,Entertainment,True
MTV UK,UCuwUfM8E79h2sqp34Fut6kw,BTS Performs 'Dynamite' | MTV Unplugged Presents: BTS,BTS Performs 'Dynamite' | MTV Unplugged Presents: BTS,PCZYPgprwFk,0,24,4761279,2021-02-26 01:00:03,26,en,asr,24,Entertainment,True
NikkieTutorials,UCzTKskwIc_-a0cGvCXA848Q,Guess The GURU Challenge! OMG! | NikkieTutorials,Guess The GURU Challenge! OMG! | NikkieTutorials,XvbWC79HbL0,0,24,609887,2021-02-26 01:00:03,27,en,asr,24,Entertainment,True
The Try Guys,UCpi8TJfiA4lKGkaXs__YdBA,Keith Eats Everything At In-N-Out *SECRET MENU*,Keith Eats Everything At In-N-Out *SECRET MENU*,Xngfshnwm9s,0,23,1127005,2021-02-26 01:00:03,28,en,asr,23,Comedy,True
The Try Guys,UCpi8TJfiA4lKGkaXs__YdBA,Keith Eats Everything At In-N-Out *SECRET MENU*,Keith Eats Everything At In-N-Out *SECRET MENU*,Xngfshnwm9s,0,23,1127005,2021-02-26 01:00:03,28,en,standard,23,Comedy,True
beIN SPORTS USA,UC0YatYmg5JRYzXJPxIdRd8g,Barcelona vs Elche | LALIGA HIGHLIGHTS | 2/24/2021 | beIN SPORTS USA,Barcelona vs Elche | LALIGA HIGHLIGHTS | 2/24/2021 | beIN SPORTS USA,2zNKaUHXlpI,0,17,653604,2021-02-26 01:00:03,29,en,asr,17,Sports,True
Zhong,UCyagEfIN1okQ-s996XAqCFQ,I Caught Him Do This With My Drink.. #Shorts,I Caught Him Do This With My Drink.. #Shorts,KR_Ib9qyRuM,0,24,1665504,2021-02-26 01:00:03,30,en,asr,24,Entertainment,True
The Cosmonaut Variety Hour,UCqTYHSnBUXZamsVcOlQf-fg,Transformers - Cosmonaut Picture Show,Transformers - Cosmonaut Picture Show,Tfaggvf21NQ,0,1,315278,2021-02-26 01:00:03,31,en,asr,1,Film & Animation,True
Liza Koshy,UCxSz6JVYmzVhtkraHWZC7HQ,"crisis on wheels • DRIVING WITH LIZA, PART 5, Pandemic Edition","crisis on wheels • DRIVING WITH LIZA, PART 5, Pandemic Edition",92hwMmb0Nq4,0,23,537663,2021-02-26 01:00:03,32,en,asr,23,Comedy,True
Bretman Rock,UC3EFKdXAU99j3ppGgvTz7XQ,Who Knows Me More - WINNER gets $$$,Who Knows Me More - WINNER gets $$$,m3za1N-6kCU,0,22,1277009,2021-02-26 01:00:03,33,en,asr,22,People & Blogs,True
MrBeast Gaming,UCIPPMRA040LQr5QPyJEbmXA,Minecraft But Everything is 10x Bigger!,Minecraft But Everything is 10x Bigger!,ork4qET7pV0,0,20,6466739,2021-02-26 01:00:03,34,en,asr,20,Gaming,True
xisumavoid,UCU9pX8hKcrx06XfOB-VQLdw,Minecraft 1.17 Snapshot 21w08a Deepslate Ores & Enhanced Cave Generation,Minecraft 1.17 Snapshot 21w08a Deepslate Ores & Enhanced Cave Generation,sW6uZM2u3Nk,0,20,765801,2021-02-26 01:00:03,35,en,asr,20,Gaming,True
NASA,UCLA_DiR1FfKNvjuUpBHmylQ,Perseverance Rover’s Descent and Touchdown on Mars (Official NASA Video),Perseverance Rover’s Descent and Touchdown on Mars (Official NASA Video),4czjS9h4Fpg,0,28,12790331,2021-02-26 01:00:03,36,en,asr,28,Science & Technology,True
NASA,UCLA_DiR1FfKNvjuUpBHmylQ,Perseverance Rover’s Descent and Touchdown on Mars (Official NASA Video),Perseverance Rover’s Descent and Touchdown on Mars (Official NASA Video),4czjS9h4Fpg,0,28,12790331,2021-02-26 01:00:03,36,en,standard,28,Science & Technology,True
Noel Miller,UCuTQDPUE12sy7g1xf1LAdTA,Temptation Island is mental,Temptation Island is mental,HdIX_DUop1A,0,23,467064,2021-02-26 01:00:03,37,en,asr,23,Comedy,True
Daft Punk,UC_kRDKYrUlrbtrSiyu5Tflg,Daft Punk - Epilogue,Daft Punk - Epilogue,DuDX6wNfjqc,0,10,21768175,2021-02-26 01:00:03,38,,,10,Music,True
PBS Space Time,UC7_gcs09iThXybpVgjHZ_7g,Does Time Cause Gravity?,Does Time Cause Gravity?,UKxQTvqcpSg,0,27,330197,2021-02-26 01:00:03,39,en,asr,27,Education,True
PBS Space Time,UC7_gcs09iThXybpVgjHZ_7g,Does Time Cause Gravity?,Does Time Cause Gravity?,UKxQTvqcpSg,0,27,330197,2021-02-26 01:00:03,39,en,standard,27,Education,True
SelenaGomezVEVO,UCjK8ORC71kwyj1DWFwril_A,"Selena Gomez, Rauw Alejandro - Baila Conmigo (Alternate Video)","Selena Gomez, Rauw Alejandro - Baila Conmigo (Alternate Video)",a6gWOdE5y3I,0,10,2101129,2021-02-26 01:00:03,40,en,standard,10,Music,True
Nique & King,UCHLqAp-tfotbXc-hdJOlOmg,SEAFOOD MUKBANG WE'RE BACK...,SEAFOOD MUKBANG WE'RE BACK...,b5lC_Img5DY,0,22,1779450,2021-02-26 01:00:03,41,en,asr,22,People & Blogs,True
STUDIO CHOOM [스튜디오 춤],UCEIi7zFR_wE23jFncVtd6-A,[BE ORIGINAL] SUNMI(선미) '꼬리(TAIL)' (4K),[BE ORIGINAL] SUNMI(선미) '꼬리(TAIL)' (4K),VsrAitj4fZA,0,24,1189308,2021-02-26 01:00:03,42,en,asr,24,Entertainment,True
Andrei Terbea,UC3iNdSV_RQU7DHTGpqEW96w,How Reddit almost CRASHED the Economy with a meme.,How Reddit almost CRASHED the Economy with a meme.,5HFehFpU_8M,0,24,373093,2021-02-26 01:00:03,43,en,asr,24,Entertainment,True
MTV,UCxAICW_LdkfFYwTqTHHE0vg,Bretman Rock Faces His Biggest Fear | Episode 3 | MTV’s Following: Bretman Rock,Bretman Rock Faces His Biggest Fear | Episode 3 | MTV’s Following: Bretman Rock,WejtDWffrDY,0,10,3115245,2021-02-26 01:00:03,44,en,asr,10,Music,True
MTV,UCxAICW_LdkfFYwTqTHHE0vg,Bretman Rock Faces His Biggest Fear | Episode 3 | MTV’s Following: Bretman Rock,Bretman Rock Faces His Biggest Fear | Episode 3 | MTV’s Following: Bretman Rock,WejtDWffrDY,0,10,3115245,2021-02-26 01:00:03,44,en,standard,10,Music,True
Wendover Productions,UC9RM-iSvTu1uPJb8X5yp3EQ,How to Start an Airline,How to Start an Airline,VjiH3mpxyrQ,0,27,424957,2021-02-26 01:00:03,45,en,asr,27,Education,True
Wendover Productions,UC9RM-iSvTu1uPJb8X5yp3EQ,How to Start an Airline,How to Start an Airline,VjiH3mpxyrQ,0,27,424957,2021-02-26 01:00:03,45,en,standard,27,Education,True
Lance Stewart,UC6-NBhOCP8DJqnpZE4TNE-A,Wedding Gift Had Them SPEECHLESS!!,Wedding Gift Had Them SPEECHLESS!!,yZXUCMR3jZw,0,24,456667,2021-02-26 01:00:03,46,en,asr,24,Entertainment,True
Dude Perfect Plus,UCmo9ZEJ3ipgaZdkiRRYtLAg,Ty's Worst Night Ever! (OT 24 Behind the Scenes),Ty's Worst Night Ever! (OT 24 Behind the Scenes),Nu5VQC6qUQw,0,22,1663044,2021-02-26 01:00:03,47,en,asr,22,People & Blogs,True
Young Don The Sauce God,UCRfg0SWjIHm_h95e4V8X5og,He Stole the ONLY THING I LOVED,He Stole the ONLY THING I LOVED,gGg72qkHnrM,0,1,487710,2021-02-26 01:00:03,48,en,asr,1,Film & Animation,True
Kyle Exum,UCR9NuNwCUIhMOLUQnLN7_WA,If Apple Made a Restaurant,If Apple Made a Restaurant,6hYLOfy6KP8,0,23,3215769,2021-02-26 01:00:03,49,en,asr,23,Comedy,True
I AM ATHLETE,UC4qMMCxdNfU6cwpaXZOyUSg,"Cam Newton: I Can't Go Out Like That | I AM ATHLETE with Brandon Marshall, Chad Johnson & More","Cam Newton: I Can't Go Out Like That | I AM ATHLETE with Brandon Marshall, Chad Johnson & More",TahNMeU3AsQ,0,22,1273432,2021-02-26 01:00:03,50,en,asr,22,People & Blogs,True
Damn Seconds,UCtWIUAvZuWaNorJImG2Riqg,Mini Crewmate Kills 8 Friday Night Funkin' Characters | Among Us,Mini Crewmate Kills 8 Friday Night Funkin' Characters | Among Us,Td6VN0qmfbc,0,1,3147468,2021-02-26 01:00:03,51,en,asr,1,Film & Animation,True
NASA,UCLA_DiR1FfKNvjuUpBHmylQ,See Mars Like Never Before! NASA's Perseverance Rover Sends New Video and Images of the Red Planet,See Mars Like Never Before! NASA's Perseverance Rover Sends New Video and Images of the Red Planet,gYQwuYZbA6o,0,28,4412398,2021-02-26 01:00:03,52,en,asr,28,Science & Technology,True
Guardian Sport,UCwD9E_QNwFwrQC7OnPnrg2Q,Tiger Woods badly hurt in car crash but 'awake and responsive',Tiger Woods badly hurt in car crash but 'awake and responsive',71GAtahs79I,0,17,176402,2021-02-26 01:00:03,53,en,asr,17,Sports,True
AlondraDessy,UC0psAD-M4X6O0yC_hFRK4hw,*EMOTIONAL* FIRST TIME SEEING OUR BABY'S FACE,*EMOTIONAL* FIRST TIME SEEING OUR BABY'S FACE,vzgPVkr_SYk,0,22,1040698,2021-02-26 01:00:03,54,en,asr,22,People & Blogs,True
LastWeekTonight,UC3XTzVzaHQEd30rQbuvCtTQ,Meatpacking: Last Week Tonight with John Oliver (HBO),Meatpacking: Last Week Tonight with John Oliver (HBO),IhO1FcjDMV4,0,24,4838798,2021-02-26 01:00:03,55,en,asr,24,Entertainment,True
LastWeekTonight,UC3XTzVzaHQEd30rQbuvCtTQ,Meatpacking: Last Week Tonight with John Oliver (HBO),Meatpacking: Last Week Tonight with John Oliver (HBO),IhO1FcjDMV4,0,24,4838798,2021-02-26 01:00:03,55,en-US,standard,24,Entertainment,True
Wil Dasovich Vlogs,UCL37zehWPCorHttTwOsSEhA,"NEW Condo Tour (SA WAKAS, sakto ito!)","NEW Condo Tour (SA WAKAS, sakto ito!)",Z9kRyMe_D7g,0,22,692469,2021-02-26 01:00:03,56,en,asr,22,People & Blogs,True
NASA Jet Propulsion Laboratory,UCryGec9PdUCLjpJW2mgCuLw,NASA’S Perseverance Rover’s First 360 View of Mars (Official),NASA’S Perseverance Rover’s First 360 View of Mars (Official),wE-aQO9XD1g,0,28,4772267,2021-02-26 01:00:03,57,,,28,Science & Technology,True
William Osman,UCfMJ2MchTSW2kWaT0kK94Yw,This One Is For The Haters,This One Is For The Haters,jovBrSSxxxc,0,28,815609,2021-02-26 01:00:03,58,en,asr,28,Science & Technology,True
Wild 'N Out,UCrkzfc2yf-7q6pd7EtzgNaQ,Cortez Loses His Cool On Conceited 😱  ft. Lost Boyz & Fat Boy SSE 🔥  Wildstyle Battle | Wild 'N Out,Cortez Loses His Cool On Conceited 😱  ft. Lost Boyz & Fat Boy SSE 🔥  Wildstyle Battle | Wild 'N Out,Hx7n6FChZHU,0,24,401921,2021-02-26 01:00:03,59,en,asr,24,Entertainment,True
Juice WRLD,UC0BletW9phE4xHFM44q4qKA,Juice WRLD-  Conversations (Official Music Video),Juice WRLD-  Conversations (Official Music Video),OcQ71ubUXAE,0,10,3429751,2021-02-26 01:00:03,60,en,asr,10,Music,True
JID,UC3WIRbOw46MsbycRc1N5x4g,J.I.D - Skegee (Official Video),J.I.D - Skegee (Official Video),z6RlzkWY2o4,0,22,404402,2021-02-26 01:00:03,61,,,22,People & Blogs,True
Bionic,UCETZ7OiW7-wqwb-6hsz3C4w,Testing 1.17 Minecraft Glitches to see if they work,Testing 1.17 Minecraft Glitches to see if they work,dbakWZAmBsU,0,20,897937,2021-02-26 01:00:03,62,en,asr,20,Gaming,True
The Voice,UCpdK1NLHxEUGXc1gq2NxkTw,You Won't Believe How Much Fun They Have! - The Voice Coaches' New Music Video,You Won't Believe How Much Fun They Have! - The Voice Coaches' New Music Video,dLb08-U_ldA,0,24,4632087,2021-02-26 01:00:03,63,en,asr,24,Entertainment,True
The Voice,UCpdK1NLHxEUGXc1gq2NxkTw,You Won't Believe How Much Fun They Have! - The Voice Coaches' New Music Video,You Won't Believe How Much Fun They Have! - The Voice Coaches' New Music Video,dLb08-U_ldA,0,24,4632087,2021-02-26 01:00:03,63,en-US,standard,24,Entertainment,True
Cinema Summary,UCfcQPMZg4tNk6tKUTHbAr0g,"How To Beat The DEATH GOD'S Game In ""Death Note""","How To Beat The DEATH GOD'S Game In ""Death Note""",Q12QqMhLa-Y,0,1,1802849,2021-02-26 01:00:03,64,en,asr,1,Film & Animation,True
jacksepticeye,UCYzPXprvl5Y-Sf0g4vX-m6g,I HAVE RETURNED STRONGER THAN EVER,I HAVE RETURNED STRONGER THAN EVER,GQdIPx3XR7c,0,23,2905357,2021-02-26 01:00:03,65,en,asr,23,Comedy,True
The Dodo,UCINb0wqPz-A0dV9nARjJlOQ,Tiny Baby Stoat Has The Best Reaction When She Meets Someone Like Her | The Dodo Little But Fierce,Tiny Baby Stoat Has The Best Reaction When She Meets Someone Like Her | The Dodo Little But Fierce,2HFSaxIsJCE,0,15,3386845,2021-02-26 01:00:03,66,en,asr,15,Pets & Animals,True
ConcernedApe,UClLilfnwQ_8LoGVpjo4SP3g,Stardew Valley: The Board Game,Stardew Valley: The Board Game,31Sz4vMWYes,0,20,227140,2021-02-26 01:00:03,67,,,20,Gaming,True
IlluminaHD,UCYsOW2PkoNjdYol4ej8OYLw,MINECRAFT WORLD RECORD SPEEDRUN IN UNDER 14 MINUTES [13:53],MINECRAFT WORLD RECORD SPEEDRUN IN UNDER 14 MINUTES [13:53],P7sYuRAiAbg,0,20,1013165,2021-02-26 01:00:03,68,en,asr,20,Gaming,True
Dream Shorts,UCZWBGXa6kiaWo9-pE8CX6Dg,Minecraft Pizza Delivery,Minecraft Pizza Delivery,yoaO8__FwS4,0,22,1605251,2021-02-26 01:00:03,69,en,asr,22,People & Blogs,True
Stokes Twins,UCbp9MyKCTEww4CxEzc_Tp0Q,PRANKING MY FRIENDS WITH MY NEW HAIR!!,PRANKING MY FRIENDS WITH MY NEW HAIR!!,SVshRi2tCtk,0,22,3155540,2021-02-26 01:00:03,70,en,asr,22,People & Blogs,True
선미 SUNMI,UCsVpgRB8YHLWA0ZrkhtHvTA,선미(SUNMI) - 꼬리(TAIL) MUSIC VIDEO,선미(SUNMI) - 꼬리(TAIL) MUSIC VIDEO,Aui0ZKIaXVc,0,10,5686560,2021-02-26 01:00:03,71,en,standard,10,Music,True
JxmyHighroller,UC3L9XPe0_FGfRG-CMGtBvFg,NBA Players Are Scoring More Points Than Ever and The Reason Why is Right in Front of Our Eyes,NBA Players Are Scoring More Points Than Ever and The Reason Why is Right in Front of Our Eyes,32l4gIoxfY8,0,17,750172,2021-02-26 01:00:03,72,en,asr,17,Sports,True
MTV,UCxAICW_LdkfFYwTqTHHE0vg,BTS Performs “Telepathy” | MTV Unplugged Presents: BTS,BTS Performs “Telepathy” | MTV Unplugged Presents: BTS,OC29BN3R8dM,0,10,7269266,2021-02-26 01:00:03,73,en,asr,10,Music,True
Champions League on CBS Sports,UCET00YnetHT7tOpu12v8jxg,Atlético de Madrid vs. Chelsea: Extended Highlights | UCL on CBS Sports,Atlético de Madrid vs. Chelsea: Extended Highlights | UCL on CBS Sports,9DWKcRA9oTI,0,17,894180,2021-02-26 01:00:03,74,en,asr,17,Sports,True
Serie A,UCBJeMCIeLQos7wacox4hmLQ,Juventus 3-0 Crotone | Ronaldo Hits a Brace as Juve Too Strong for Crotone! | Serie A TIM,Juventus 3-0 Crotone | Ronaldo Hits a Brace as Juve Too Strong for Crotone! | Serie A TIM,JOYWl4_NOlk,0,17,6733149,2021-02-26 01:00:03,75,en,asr,17,Sports,True
Jarvis Johnson! GOLD,UCR1PVwrPjpz0U_Fbju-BAzQ,Please Hate These Things,Please Hate These Things,APKBvIOInKs,0,24,195443,2021-02-26 01:00:03,76,en,asr,24,Entertainment,True
ZHC Crafts,UCPAk4rqVIwg1NCXh61VJxbg,"Best 3D Pen Art Wins $5,000 Challenge! | ZHC Crafts","Best 3D Pen Art Wins $5,000 Challenge! | ZHC Crafts",p4Wy84AOzj0,0,26,3755666,2021-02-26 01:00:03,77,en,asr,26,Howto & Style,True
American Idol,UCAMPco9PqjBbI_MLsDOO4Jw,Amazing! Luke Bryan Calls 15-Year-Old Casey Bishop A Massive Star! - American Idol 2021,Amazing! Luke Bryan Calls 15-Year-Old Casey Bishop A Massive Star! - American Idol 2021,XHR5mt2gBjo,0,24,2632909,2021-02-26 01:00:03,78,en,asr,24,Entertainment,True
Dream Shorts,UCZWBGXa6kiaWo9-pE8CX6Dg,"Dream, I Am Your Father...","Dream, I Am Your Father...",qGfiAA9Dlio,0,22,1678189,2021-02-26 01:00:03,79,,,22,People & Blogs,True
SMTOWN,UCEf_Bc-KVd7onSeifS3py9g,SHINee 샤이니 'Don't Call Me' MV,SHINee 샤이니 'Don't Call Me' MV,p6OoY6xneI0,0,10,17234660,2021-02-26 01:00:03,80,ko,asr,10,Music,True
SMTOWN,UCEf_Bc-KVd7onSeifS3py9g,SHINee 샤이니 'Don't Call Me' MV,SHINee 샤이니 'Don't Call Me' MV,p6OoY6xneI0,0,10,17234660,2021-02-26 01:00:03,80,en,standard,10,Music,True
SMTOWN,UCEf_Bc-KVd7onSeifS3py9g,SHINee 샤이니 'Don't Call Me' MV,SHINee 샤이니 'Don't Call Me' MV,p6OoY6xneI0,0,10,17234660,2021-02-26 01:00:03,80,id,standard,10,Music,True
SMTOWN,UCEf_Bc-KVd7onSeifS3py9g,SHINee 샤이니 'Don't Call Me' MV,SHINee 샤이니 'Don't Call Me' MV,p6OoY6xneI0,0,10,17234660,2021-02-26 01:00:03,80,ja,standard,10,Music,True
SMTOWN,UCEf_Bc-KVd7onSeifS3py9g,SHINee 샤이니 'Don't Call Me' MV,SHINee 샤이니 'Don't Call Me' MV,p6OoY6xneI0,0,10,17234660,2021-02-26 01:00:03,80,th,standard,10,Music,True
SMTOWN,UCEf_Bc-KVd7onSeifS3py9g,SHINee 샤이니 'Don't Call Me' MV,SHINee 샤이니 'Don't Call Me' MV,p6OoY6xneI0,0,10,17234660,2021-02-26 01:00:03,80,vi,standard,10,Music,True
876TV,UCqly9F4Fr_jf2Y1Cy5hacRg,"DRAGON BALL LEGENDS ""Video and Stuff #12""","DRAGON BALL LEGENDS ""Video and Stuff #12""",_qKgj_mIvmE,0,20,140775,2021-02-26 01:00:03,81,en,asr,20,Gaming,True
Liza Koshy Too,UChoTvF02Cv74FF72OaJtTMA,STORY TIME • Why I wasn't into him...,STORY TIME • Why I wasn't into him...,7F37t6zdJ4k,0,23,731226,2021-02-26 01:00:03,82,en,asr,23,Comedy,True
SHINee,UCyPwRgc3gQGqhk6RoGS50Ug,SHINee 샤이니 'Don't Call Me' The Performance Stage,SHINee 샤이니 'Don't Call Me' The Performance Stage,N3103Su_-cM,0,10,1681555,2021-02-26 01:00:03,83,ko,asr,10,Music,True
Captain Joe,UC88tlMjiS7kf8uhPWyBTn_A,UNITED 328 Engine Failure! WHAT CHECKLISTS did the pilots use? Explained by CAPTAIN JOE,UNITED 328 Engine Failure! WHAT CHECKLISTS did the pilots use? Explained by CAPTAIN JOE,q5Wler87pwY,0,28,1788973,2021-02-26 01:00:03,84,en,asr,28,Science & Technology,True
Vstar,UC6dM99DofLDsfodmxHsIh5w,SUNMI(선미) 'TAIL(꼬리)' LIVE (Media showcase),SUNMI(선미) 'TAIL(꼬리)' LIVE (Media showcase),-_attUbB6pw,0,24,906857,2021-02-26 01:00:03,85,,,24,Entertainment,True
TheEllenShow,UCp0hYYBW6IMayGgR-WeoCvQ,Demi Lovato on Revealing Her Darkest Struggles in Hopes of Helping Others,Demi Lovato on Revealing Her Darkest Struggles in Hopes of Helping Others,Uw2pu29Nve0,0,24,618024,2021-02-26 01:00:03,86,en,asr,24,Entertainment,True
TheEllenShow,UCp0hYYBW6IMayGgR-WeoCvQ,Demi Lovato on Revealing Her Darkest Struggles in Hopes of Helping Others,Demi Lovato on Revealing Her Darkest Struggles in Hopes of Helping Others,Uw2pu29Nve0,0,24,618024,2021-02-26 01:00:03,86,en,standard,24,Entertainment,True
JadenSmithVEVO,UCvIl8gBxIiMd5pN8G8Bl_XQ,Jaden - Photograph,Jaden - Photograph,jzaay2ZvHG8,0,10,1458101,2021-02-26 01:00:03,87,en,asr,10,Music,True
JadenSmithVEVO,UCvIl8gBxIiMd5pN8G8Bl_XQ,Jaden - Photograph,Jaden - Photograph,jzaay2ZvHG8,0,10,1458101,2021-02-26 01:00:03,87,en,standard,10,Music,True
Alexa Rivera,UCPpATKqmMV-CNRNWYaDUwiA,WHO IS THE BEST COUPLE?!,WHO IS THE BEST COUPLE?!,PYLqcf6SelQ,0,26,4865686,2021-02-26 01:00:03,88,en,asr,26,Howto & Style,True
SmarterEveryDay,UC6107grRI4m0o2-emgoDnAA,How Do Nuclear Submarines Make Oxygen?- Smarter Every Day 251,How Do Nuclear Submarines Make Oxygen?- Smarter Every Day 251,g3Ud6mHdhlQ,0,28,2240102,2021-02-26 01:00:03,89,en,asr,28,Science & Technology,True
SmarterEveryDay,UC6107grRI4m0o2-emgoDnAA,How Do Nuclear Submarines Make Oxygen?- Smarter Every Day 251,How Do Nuclear Submarines Make Oxygen?- Smarter Every Day 251,g3Ud6mHdhlQ,0,28,2240102,2021-02-26 01:00:03,89,en-US,standard,28,Science & Technology,True
Spotify,UCRMqQWxCWE0VMvtUElm-rEA,Stream On: Justin Bieber - Full Performance,Stream On: Justin Bieber - Full Performance,K8fZNnpy4j4,0,10,421580,2021-02-26 01:00:03,90,en,asr,10,Music,True
Luke TheNotable,UC9FkeEFIGd9FXRfxpTltXYA,100 Days - [Minecraft Superflat],100 Days - [Minecraft Superflat],4eKXwKDdXYA,0,20,9821750,2021-02-26 01:00:03,91,en,asr,20,Gaming,True
Screen Junkies,UCOpcACMWblDls9Z6GERVi1A,Honest Trailers | The Simpsons Movie,Honest Trailers | The Simpsons Movie,FCeetoU7LYE,0,1,905395,2021-02-26 01:00:03,92,en,asr,1,Film & Animation,True
ESPN College Football,UCzRWWsFjqHk1an4OnVPsl9g,Deion Sanders wins first game as Jackson State head coach [HIGHLIGHTS] | ESPN College Football,Deion Sanders wins first game as Jackson State head coach [HIGHLIGHTS] | ESPN College Football,gzHFj2DBFe4,0,17,743404,2021-02-26 01:00:03,93,en,asr,17,Sports,True
ConanGrayVEVO,UCeJmCJLZWX3L9D47vuWcE8A,Conan Gray - Overdrive,Conan Gray - Overdrive,NDpwh0pCXDw,0,10,1976261,2021-02-26 01:00:03,94,nl,asr,10,Music,True
ConanGrayVEVO,UCeJmCJLZWX3L9D47vuWcE8A,Conan Gray - Overdrive,Conan Gray - Overdrive,NDpwh0pCXDw,0,10,1976261,2021-02-26 01:00:03,94,en,standard,10,Music,True
Sipover,UCIDQSqdVuNwtfRMKqfX-o7g,Ranking Minecraft's Rarest Occurrences...,Ranking Minecraft's Rarest Occurrences...,HpGiXdNrQ6k,0,22,1362183,2021-02-26 01:00:03,95,en,asr,22,People & Blogs,True
Babish Culinary Universe,UCJHA_jMfCvEnv-3kRjTCQXw,Binging with Babish: Sugar Chicken from Rick & Morty,Binging with Babish: Sugar Chicken from Rick & Morty,8iCWUvHMPxQ,0,24,1751936,2021-02-26 01:00:03,96,nl,asr,24,Entertainment,True
Tom Scott,UCBa659QWEk1AI4Tg--mrJ2A,"I asked an AI for video ideas, and they were actually good","I asked an AI for video ideas, and they were actually good",TfVYxnhuEdU,0,27,1140644,2021-02-26 01:00:03,97,en,standard,27,Education,True
