channelTitle,channelId,videoTitle,videoTitleLoc,videoId,videoSearchCategoryId,videoCategoryId,videoViews,videoQueryTime,videoTrendingRank,captionLang,captionType,id,videoCategory,assignable
BillieEilishVEVO,UCDGmojLIoWpXok597xYo8cg,Billie Eilish - ilomilo (Live From The Film – Billie Eilish: The World’s A Little Blurry),Billie Eilish - ilomilo (Live From The Film – Billie Eilish: The World’s A Little Blurry),ZTwu9CRnAO0,0,10,2504130,2021-02-26 01:00:03,98,,,10,Music,True
Navs Garage,UCUZdSiU-RnkdUnnyIQY5t9w,Honda Made A Real Truck?,Honda Made A Real Truck?,pNTAL3tIPr8,0,2,832794,2021-02-26 01:00:03,99,en,asr,2,Autos & Vehicles,True
The Game Theorists,UCo_IB5145EVNcf8hw1Kku7w,Game Theory: Did Reddit Just SOLVE FNAF?,Game Theory: Did Reddit Just SOLVE FNAF?,C-icyHEb7W4,0,20,4168893,2021-02-26 01:00:03,100,en,asr,20,Gaming,True
Ubisoft North America,UCBMvc6jvuTxH6TNo9ThpYjg,Rainbow Six Siege: Crimson Heist Operator Gameplay Gadget and Starter Tips | Ubisoft [NA],Rainbow Six Siege: Crimson Heist Operator Gameplay Gadget and Starter Tips | Ubisoft [NA],xJO1SZmAghE,0,20,553828,2021-02-26 01:00:03,101,en,standard,20,Gaming,True
AmazingPhil,UCHUE4ypXKp7ZkmdWbGJNgJg,Cards Against Humanity PHAN EDITION!,Cards Against Humanity PHAN EDITION!,vMcB2TcqD-A,0,22,886111,2021-02-26 01:00:03,102,de,standard,22,People & Blogs,True
AmazingPhil,UCHUE4ypXKp7ZkmdWbGJNgJg,Cards Against Humanity PHAN EDITION!,Cards Against Humanity PHAN EDITION!,vMcB2TcqD-A,0,22,886111,2021-02-26 01:00:03,102,en-GB,standard,22,People & Blogs,True
AmazingPhil,UCHUE4ypXKp7ZkmdWbGJNgJg,Cards Against Humanity PHAN EDITION!,Cards Against Humanity PHAN EDITION!,vMcB2TcqD-A,0,22,886111,2021-02-26 01:00:03,102,es-419,standard,22,People & Blogs,True
AmazingPhil,UCHUE4ypXKp7ZkmdWbGJNgJg,Cards Against Humanity PHAN EDITION!,Cards Against Humanity PHAN EDITION!,vMcB2TcqD-A,0,22,886111,2021-02-26 01:00:03,102,es,standard,22,People & Blogs,True
AmazingPhil,UCHUE4ypXKp7ZkmdWbGJNgJg,Cards Against Humanity PHAN EDITION!,Cards Against Humanity PHAN EDITION!,vMcB2TcqD-A,0,22,886111,2021-02-26 01:00:03,102,fr,standard,22,People & Blogs,True
AmazingPhil,UCHUE4ypXKp7ZkmdWbGJNgJg,Cards Against Humanity PHAN EDITION!,Cards Against Humanity PHAN EDITION!,vMcB2TcqD-A,0,22,886111,2021-02-26 01:00:03,102,id,standard,22,People & Blogs,True
AmazingPhil,UCHUE4ypXKp7ZkmdWbGJNgJg,Cards Against Humanity PHAN EDITION!,Cards Against Humanity PHAN EDITION!,vMcB2TcqD-A,0,22,886111,2021-02-26 01:00:03,102,iw,standard,22,People & Blogs,True
AmazingPhil,UCHUE4ypXKp7ZkmdWbGJNgJg,Cards Against Humanity PHAN EDITION!,Cards Against Humanity PHAN EDITION!,vMcB2TcqD-A,0,22,886111,2021-02-26 01:00:03,102,ko,standard,22,People & Blogs,True
AmazingPhil,UCHUE4ypXKp7ZkmdWbGJNgJg,Cards Against Humanity PHAN EDITION!,Cards Against Humanity PHAN EDITION!,vMcB2TcqD-A,0,22,886111,2021-02-26 01:00:03,102,pt-BR,standard,22,People & Blogs,True
AmazingPhil,UCHUE4ypXKp7ZkmdWbGJNgJg,Cards Against Humanity PHAN EDITION!,Cards Against Humanity PHAN EDITION!,vMcB2TcqD-A,0,22,886111,2021-02-26 01:00:03,102,pt,standard,22,People & Blogs,True
AmazingPhil,UCHUE4ypXKp7ZkmdWbGJNgJg,Cards Against Humanity PHAN EDITION!,Cards Against Humanity PHAN EDITION!,vMcB2TcqD-A,0,22,886111,2021-02-26 01:00:03,102,ru,standard,22,People & Blogs,True
AmazingPhil,UCHUE4ypXKp7ZkmdWbGJNgJg,Cards Against Humanity PHAN EDITION!,Cards Against Humanity PHAN EDITION!,vMcB2TcqD-A,0,22,886111,2021-02-26 01:00:03,102,tr,standard,22,People & Blogs,True
Premier Boxing Champions,UCWXYAGB9SadlL6p5Bb66wWw,"Broner vs Santiago HIGHLIGHTS: February 20, 2021 | PBC on SHOWTIME","Broner vs Santiago HIGHLIGHTS: February 20, 2021 | PBC on SHOWTIME",8hx9vBHgkrg,0,17,1450330,2021-02-26 01:00:03,103,en,asr,17,Sports,True
Clayton Bush,UCCpeNlYK_xG594eJdBP35OA,my valentine :),my valentine :),uCdoMBzrtns,0,22,364541,2021-02-26 01:00:03,104,en,asr,22,People & Blogs,True
Ubisoft North America,UCBMvc6jvuTxH6TNo9ThpYjg,Rainbow Six Siege: The Playbook Story Trailer | Ubisoft [NA],Rainbow Six Siege: The Playbook Story Trailer | Ubisoft [NA],kqDwcjF5gW8,0,20,588992,2021-02-26 01:00:03,105,en,asr,20,Gaming,True
Ubisoft North America,UCBMvc6jvuTxH6TNo9ThpYjg,Rainbow Six Siege: The Playbook Story Trailer | Ubisoft [NA],Rainbow Six Siege: The Playbook Story Trailer | Ubisoft [NA],kqDwcjF5gW8,0,20,588992,2021-02-26 01:00:03,105,en,standard,20,Gaming,True
Robby and Penny,UCb0Vz-YNWQEVctt7-U_Yj_A,WE LOST OUR PUPPY,WE LOST OUR PUPPY,wB0nsdQp9Do,0,22,340398,2021-02-26 01:00:03,106,en,asr,22,People & Blogs,True
FunnyMike,UC3xWCpnWd8l7HaiqfvtzIhQ,JAY GOT A CRUSH ON TYLER SISTER & WE WENT SHOPPING FOR WAREHOUSE!,JAY GOT A CRUSH ON TYLER SISTER & WE WENT SHOPPING FOR WAREHOUSE!,uFSNZeWW91o,0,24,1159181,2021-02-26 01:00:03,107,en,asr,24,Entertainment,True
CBell,UCD922LlbSe1BF_ddDBYm80Q,Smart Rocket League Players vs Mechanical Players (who's better?),Smart Rocket League Players vs Mechanical Players (who's better?),IXZ-wtU8c0I,0,20,517903,2021-02-26 01:00:03,108,en,asr,20,Gaming,True
Unspeakable 2.0,UCet_y01v87pE7MPGikjTQQw,We Put A BOAT In The ISLAND HOUSE,We Put A BOAT In The ISLAND HOUSE,35zrhtL6wbs,0,22,542939,2021-02-26 01:00:03,109,en,asr,22,People & Blogs,True
DURTYMAX JACK,UCAkCE4TCErywDySDpwqlYnQ,Got My Repossessed F450 Back. The Full Story.,Got My Repossessed F450 Back. The Full Story.,Dih7dgno7oE,0,2,187010,2021-02-26 01:00:03,110,en,asr,2,Autos & Vehicles,True
SSSniperWolf,UCpB959t8iPrxQWj7G6n0ctQ,Try Not To Say Wow Challenge (Impossible),Try Not To Say Wow Challenge (Impossible),CEDIaGEOuEg,0,24,5667458,2021-02-26 01:00:03,111,en,asr,24,Entertainment,True
Top Rank Boxing,UCbzRzJNHx7ZLlJML9BjZQVQ,"Oscar Valdez with the Knockout of the Year Over Miguel Berchelt, Wins Belt","Oscar Valdez with the Knockout of the Year Over Miguel Berchelt, Wins Belt",AkUCINYpVkM,0,17,1365882,2021-02-26 01:00:03,112,,,17,Sports,True
Ph1LzA,UCvsdQrg8SkOvS2WiVXA5S4A,Schlatt Makes Minecraft 1000% Funnier,Schlatt Makes Minecraft 1000% Funnier,gt3QV8uTfl4,0,20,2429900,2021-02-26 01:00:03,113,en,asr,20,Gaming,True
mrnigelng,UCVjlpEjEY9GpksqbEesJnNA,Uncle Roger Think Cowboy Fried Rice SO WEIRD (Kent Rollins),Uncle Roger Think Cowboy Fried Rice SO WEIRD (Kent Rollins),pWgJI_Q5gC8,0,23,1389700,2021-02-26 01:00:03,114,en,asr,23,Comedy,True
mrnigelng,UCVjlpEjEY9GpksqbEesJnNA,Uncle Roger Think Cowboy Fried Rice SO WEIRD (Kent Rollins),Uncle Roger Think Cowboy Fried Rice SO WEIRD (Kent Rollins),pWgJI_Q5gC8,0,23,1389700,2021-02-26 01:00:03,114,en,standard,23,Comedy,True
mrnigelng,UCVjlpEjEY9GpksqbEesJnNA,Uncle Roger Think Cowboy Fried Rice SO WEIRD (Kent Rollins),Uncle Roger Think Cowboy Fried Rice SO WEIRD (Kent Rollins),pWgJI_Q5gC8,0,23,1389700,2021-02-26 01:00:03,114,zh-Hans,standard,23,Comedy,True
Mumbo Jumbo,UChFur_NwVSbUozOcF_F2kMg,Hermitcraft 7: Episode 73 - CHEST MONSTER 2.0,Hermitcraft 7: Episode 73 - CHEST MONSTER 2.0,vxo5TmLgJMY,0,20,1781400,2021-02-26 01:00:03,115,en,asr,20,Gaming,True
This Old Tony,UC5NO8MgTQKHAWXp6z8Xl7yQ,Using a TAP as Thread Boring Tool,Using a TAP as Thread Boring Tool,f-YWsgAHR6A,0,28,504322,2021-02-26 01:00:03,116,en,asr,28,Science & Technology,True
insuperable69,UCN04t6U_UvDxTb2RcFh27mg,La Insuperable ft La Materialista (Voy a Beber) prod by Big trueno (video Oficial),La Insuperable ft La Materialista (Voy a Beber) prod by Big trueno (video Oficial),elY5rk-W87U,0,25,1763534,2021-02-26 01:00:03,117,es,asr,25,News & Politics,True
MrBeast Shorts,UC4-79UOlP48-QNGgCko5p2g,Prank Calling Dream,Prank Calling Dream,LexiKXhmu54,0,22,11220873,2021-02-26 01:00:03,118,en,asr,22,People & Blogs,True
Coca-Cola,UCosXctaTYxN4YPIvI5Fpcrw,"Open That Coca-Cola (Music by Tyler, The Creator)","Open That Coca-Cola (Music by Tyler, The Creator)",eOMhOjgNd7Q,0,24,498536,2021-02-26 01:00:03,119,en,asr,24,Entertainment,True
Saturday Night Live,UCqFzWxSCi39LnW1JKFR3efg,Britney Spears Cold Open - SNL,Britney Spears Cold Open - SNL,kuaJ6J9iTb4,0,24,3924189,2021-02-26 01:00:03,120,en,asr,24,Entertainment,True
Saturday Night Live,UCqFzWxSCi39LnW1JKFR3efg,Britney Spears Cold Open - SNL,Britney Spears Cold Open - SNL,kuaJ6J9iTb4,0,24,3924189,2021-02-26 01:00:03,120,en,standard,24,Entertainment,True
2HYPE,UCY4AlDv6wL2qhrX29iwdqAg,2HYPE Hide And Seek In A Hollywood Movie Set,2HYPE Hide And Seek In A Hollywood Movie Set,ohhjtC0ulDA,0,17,665099,2021-02-26 01:00:03,121,en,asr,17,Sports,True
Markiplier,UC7_YxT-KID8kRbqZo7MyscQ,i broke my foot...,i broke my foot...,uVCnysL6paM,0,22,2457067,2021-02-26 01:00:03,122,,,22,People & Blogs,True
Ligue 1 Uber Eats Official,UC58LMAlfwtGRNR6Xpd4DlSA,PARIS SAINT-GERMAIN - AS MONACO (0 - 2) - Highlights - (PSG - ASM) / 2020-2021,PARIS SAINT-GERMAIN - AS MONACO (0 - 2) - Highlights - (PSG - ASM) / 2020-2021,5nfQZHRSCW4,0,17,761502,2021-02-26 01:00:03,123,en,asr,17,Sports,True
Call of Duty,UC9YydG57epLqxA9cTzZXSeQ,OUTBREAK Trailer | Season Two | Call of Duty®: Black Ops Cold War,OUTBREAK Trailer | Season Two | Call of Duty®: Black Ops Cold War,oHBzHS87w6k,0,20,1390364,2021-02-26 01:00:03,124,en,standard,20,Gaming,True
New Rockstars,UC7yRILFFJ2QZCykymr8LPwA,"WANDAVISION EPISODE 7 BREAKDOWN! Easter Eggs & Details You Missed! (1x07 ""Breaking the Fourth Wall"")","WANDAVISION EPISODE 7 BREAKDOWN! Easter Eggs & Details You Missed! (1x07 ""Breaking the Fourth Wall"")",7_qsV3wUKiU,0,24,1944145,2021-02-26 01:00:03,125,en,asr,24,Entertainment,True
Dollightful,UCitKV0ebZVbtU2nIPihDGMQ,How to make a Doll Wheelchair: Advanced Version! PDF included,How to make a Doll Wheelchair: Advanced Version! PDF included,wEtqd-HmSGc,0,26,274938,2021-02-26 01:00:03,126,en,asr,26,Howto & Style,True
VASAviation -,UCuedf_fJVrOppky5gl3U6QQ,United B777 has ENGINE FAILURE+FIRE on departure | Cowling Separates,United B777 has ENGINE FAILURE+FIRE on departure | Cowling Separates,G7-zh7Sebr8,0,19,797573,2021-02-26 01:00:03,127,en,asr,19,Travel & Events,True
Saturday Night Live,UCqFzWxSCi39LnW1JKFR3efg,Drivers License - SNL,Drivers License - SNL,OPjvCFa8LuE,0,24,2783406,2021-02-26 01:00:03,128,en,asr,24,Entertainment,True
Saturday Night Live,UCqFzWxSCi39LnW1JKFR3efg,Drivers License - SNL,Drivers License - SNL,OPjvCFa8LuE,0,24,2783406,2021-02-26 01:00:03,128,en,standard,24,Entertainment,True
9NEWS,UC72nbKQLSDyiSARhg0Ywj4w,RAW: United Flight 328 engine catches fire,RAW: United Flight 328 engine catches fire,sBxe4cQzUIY,0,25,1240873,2021-02-26 01:00:03,129,,,25,News & Politics,True
Gus Johnson,UCpIafFPGutTAKOBHMtGen7g,i want to live in a skyrim house,i want to live in a skyrim house,z_h8NNQ842I,0,23,1095458,2021-02-26 01:00:03,130,fr,asr,23,Comedy,True
Overtime,UCPHKMJbis1c0R7d7WJQ35tA,"""I Wasn't Expecting A CORVETTE!"" Mikey Williams Gets SURPRISE For 16th Birthday! Does WILD WORKOUT 😱","""I Wasn't Expecting A CORVETTE!"" Mikey Williams Gets SURPRISE For 16th Birthday! Does WILD WORKOUT 😱",voaUodnKppo,0,17,794405,2021-02-26 01:00:03,131,en,asr,17,Sports,True
Saturday Night Live,UCqFzWxSCi39LnW1JKFR3efg,Weekend Update: Vaccine Fraud and Mars Rover - SNL,Weekend Update: Vaccine Fraud and Mars Rover - SNL,9X_HgJ3KMvY,0,24,1979371,2021-02-26 01:00:03,132,en,asr,24,Entertainment,True
Saturday Night Live,UCqFzWxSCi39LnW1JKFR3efg,Weekend Update: Vaccine Fraud and Mars Rover - SNL,Weekend Update: Vaccine Fraud and Mars Rover - SNL,9X_HgJ3KMvY,0,24,1979371,2021-02-26 01:00:03,132,en,standard,24,Entertainment,True
FOUSEY,UC9NYKlf0sEhjmLnIGzSEtfQ,MASHALLAH (Official Music Video) - fousey x Adam Saleh,MASHALLAH (Official Music Video) - fousey x Adam Saleh,ArncdwDE040,0,10,212625,2021-02-26 01:00:03,133,,,10,Music,True
Little Giant Boxing,UCzp5-dEdqKOS9tCF8S-UErg,TEOFIMO LOPEZ REACTS TO VALDEZ BRUTAL KO OVER MIGUEL BERCHELT “WOW WHAT A KO!” GIVES OSCAR PROPS,TEOFIMO LOPEZ REACTS TO VALDEZ BRUTAL KO OVER MIGUEL BERCHELT “WOW WHAT A KO!” GIVES OSCAR PROPS,Vw7byfmnUvI,0,17,209822,2021-02-26 01:00:03,134,en,asr,17,Sports,True
Saucy Santana,UC3KsJZpjtpPAoEVc5_-pHmg,Saucy Santana - It's a Vibe (Ft. DreamDoll & LightSkinKeisha) [Official Music Video],Saucy Santana - It's a Vibe (Ft. DreamDoll & LightSkinKeisha) [Official Music Video],fGRQGxwMhoE,0,10,291689,2021-02-26 01:00:03,135,en,asr,10,Music,True
Serie A,UCBJeMCIeLQos7wacox4hmLQ,Milan 0-3 Inter | Inter Go Four Points Clear with HUGE Derby Win! | Serie A TIM,Milan 0-3 Inter | Inter Go Four Points Clear with HUGE Derby Win! | Serie A TIM,aHzKJOC19SU,0,17,5115121,2021-02-26 01:00:03,136,en,asr,17,Sports,True
ElAlfaElJefeTV,UCEU5ZK7DwN9ppqPFJiGah3A,"El Alfa ""El Jefe"" - Caso Bugatti (Video Oficial)","El Alfa ""El Jefe"" - Caso Bugatti (Video Oficial)",fpXUuOlwYLc,0,10,8585483,2021-02-26 01:00:03,137,es,asr,10,Music,True
SSJ9K,UC7LnJAhfmQBqKWIYQ7WBpkQ,BLACK GOKU's speech hit different!,BLACK GOKU's speech hit different!,MTUZoxO7ewg,0,1,542604,2021-02-26 01:00:03,138,en,asr,1,Film & Animation,True
Vat19,UCDRbNGFusqlXX4a5vwi9ouQ,$1000 if You Can Break This Ball in 1 Minute,$1000 if You Can Break This Ball in 1 Minute,muhKU3LeluQ,0,24,995465,2021-02-26 01:00:03,139,,,24,Entertainment,True
The Canadian Lad,UCRI00CwLZdLRCWg5BdDOsNw,I Watched WandaVision Ep. 7 in 0.25x Speed and Here's What I Found,I Watched WandaVision Ep. 7 in 0.25x Speed and Here's What I Found,Lb2Yw637vcg,0,22,1606957,2021-02-26 01:00:03,140,en,asr,22,People & Blogs,True
House of Highlights,UCqQo7ewe87aYAe7ub5UqXMw,"JJ Redick Ejected For Passing the Ball to Referee - Celtics vs Pelicans | February 21, 2021","JJ Redick Ejected For Passing the Ball to Referee - Celtics vs Pelicans | February 21, 2021",V6XxES5VVFQ,0,17,660308,2021-02-26 01:00:03,141,en,asr,17,Sports,True
9NEWS,UC72nbKQLSDyiSARhg0Ywj4w,RAW: Family at dog park sees airplane pieces falling around them,RAW: Family at dog park sees airplane pieces falling around them,_FH8nIKmOVs,0,25,288979,2021-02-26 01:00:03,142,es,asr,25,News & Politics,True
Tory Lanez,UCbfUA3UGxAWL3muD004g0WQ,Tory Lanez - Feels (feat. Chris Brown) [Official Music Video],Tory Lanez - Feels (feat. Chris Brown) [Official Music Video],AhWyTSYuXHM,0,10,9010975,2021-02-26 01:00:03,143,pt,asr,10,Music,True
I Talk,UCIZP6nCTyU9VV0zIhY7q1Aw,"Fortnite Item Shop *NEW* STREET FIGHTER BUNDLES! [February 20th, 2021] (Fortnite Battle Royale)","Fortnite Item Shop *NEW* STREET FIGHTER BUNDLES! [February 20th, 2021] (Fortnite Battle Royale)",CSPqM9BszG4,0,20,414495,2021-02-26 01:00:03,144,en,asr,20,Gaming,True
Simply Nailogical,UCGCVyTWogzQ4D170BLy2Arw,How Many Bottles of Nail Polish Can I Lift?,How Many Bottles of Nail Polish Can I Lift?,BRR2cSBWWLw,0,24,915546,2021-02-26 01:00:03,145,en,asr,24,Entertainment,True
NASA,UCLA_DiR1FfKNvjuUpBHmylQ,Watch NASA’s Perseverance Rover Land on Mars!,Watch NASA’s Perseverance Rover Land on Mars!,gm0b_ijaYMQ,0,28,20801517,2021-02-26 01:00:03,146,en,asr,28,Science & Technology,True
LDShadowLady,UCzTlXb7ivVzuFlugVCv3Kvg,Chaos and Creatures | Ep. 22 | Minecraft X Life SMP,Chaos and Creatures | Ep. 22 | Minecraft X Life SMP,WfZ8509nW5k,0,20,1364721,2021-02-26 01:00:03,147,en,asr,20,Gaming,True
How Ridiculous,UC5f5IV0Bf79YLp_p9nfInRA,We Popped The WORLD’S LARGEST BALLOON! (40ft+),We Popped The WORLD’S LARGEST BALLOON! (40ft+),4_wOiublGjs,0,17,1777025,2021-02-26 01:00:03,148,en,asr,17,Sports,True
GOT7,UCNtZPzvkjjB3EuPMNY71cmA,"GOT7 ""ENCORE"" OFFICIAL M/V","GOT7 ""ENCORE"" OFFICIAL M/V",tAe0yUEzAaI,0,10,8001866,2021-02-26 01:00:03,149,ar,standard,10,Music,True
GOT7,UCNtZPzvkjjB3EuPMNY71cmA,"GOT7 ""ENCORE"" OFFICIAL M/V","GOT7 ""ENCORE"" OFFICIAL M/V",tAe0yUEzAaI,0,10,8001866,2021-02-26 01:00:03,149,ko,asr,10,Music,True
GOT7,UCNtZPzvkjjB3EuPMNY71cmA,"GOT7 ""ENCORE"" OFFICIAL M/V","GOT7 ""ENCORE"" OFFICIAL M/V",tAe0yUEzAaI,0,10,8001866,2021-02-26 01:00:03,149,en-US,standard,10,Music,True
GOT7,UCNtZPzvkjjB3EuPMNY71cmA,"GOT7 ""ENCORE"" OFFICIAL M/V","GOT7 ""ENCORE"" OFFICIAL M/V",tAe0yUEzAaI,0,10,8001866,2021-02-26 01:00:03,149,es-419,standard,10,Music,True
GOT7,UCNtZPzvkjjB3EuPMNY71cmA,"GOT7 ""ENCORE"" OFFICIAL M/V","GOT7 ""ENCORE"" OFFICIAL M/V",tAe0yUEzAaI,0,10,8001866,2021-02-26 01:00:03,149,fr,standard,10,Music,True
GOT7,UCNtZPzvkjjB3EuPMNY71cmA,"GOT7 ""ENCORE"" OFFICIAL M/V","GOT7 ""ENCORE"" OFFICIAL M/V",tAe0yUEzAaI,0,10,8001866,2021-02-26 01:00:03,149,id,standard,10,Music,True
GOT7,UCNtZPzvkjjB3EuPMNY71cmA,"GOT7 ""ENCORE"" OFFICIAL M/V","GOT7 ""ENCORE"" OFFICIAL M/V",tAe0yUEzAaI,0,10,8001866,2021-02-26 01:00:03,149,ja,standard,10,Music,True
GOT7,UCNtZPzvkjjB3EuPMNY71cmA,"GOT7 ""ENCORE"" OFFICIAL M/V","GOT7 ""ENCORE"" OFFICIAL M/V",tAe0yUEzAaI,0,10,8001866,2021-02-26 01:00:03,149,ko,standard,10,Music,True
GOT7,UCNtZPzvkjjB3EuPMNY71cmA,"GOT7 ""ENCORE"" OFFICIAL M/V","GOT7 ""ENCORE"" OFFICIAL M/V",tAe0yUEzAaI,0,10,8001866,2021-02-26 01:00:03,149,pt-BR,standard,10,Music,True
GOT7,UCNtZPzvkjjB3EuPMNY71cmA,"GOT7 ""ENCORE"" OFFICIAL M/V","GOT7 ""ENCORE"" OFFICIAL M/V",tAe0yUEzAaI,0,10,8001866,2021-02-26 01:00:03,149,ru,standard,10,Music,True
GOT7,UCNtZPzvkjjB3EuPMNY71cmA,"GOT7 ""ENCORE"" OFFICIAL M/V","GOT7 ""ENCORE"" OFFICIAL M/V",tAe0yUEzAaI,0,10,8001866,2021-02-26 01:00:03,149,th,standard,10,Music,True
GOT7,UCNtZPzvkjjB3EuPMNY71cmA,"GOT7 ""ENCORE"" OFFICIAL M/V","GOT7 ""ENCORE"" OFFICIAL M/V",tAe0yUEzAaI,0,10,8001866,2021-02-26 01:00:03,149,tr,standard,10,Music,True
GOT7,UCNtZPzvkjjB3EuPMNY71cmA,"GOT7 ""ENCORE"" OFFICIAL M/V","GOT7 ""ENCORE"" OFFICIAL M/V",tAe0yUEzAaI,0,10,8001866,2021-02-26 01:00:03,149,zh-Hans,standard,10,Music,True
Alpharad,UCBODyKF0JMbUd6D9Bklyzbw,Pyra & Mythra in Smash :),Pyra & Mythra in Smash :),Jm10z_o8v_s,0,20,802919,2021-02-26 01:00:03,150,en,asr,20,Gaming,True
